17:30:44.943570 IP 10.0.0.1.40768 > 10.0.0.2.5001: Flags [.], seq 311894727:311897623, ack 3867670594, win 58, options [nop,nop,TS val 27571250 ecr 27571248], length 2896
17:30:44.945992 IP 10.0.0.1.40768 > 10.0.0.2.5001: Flags [.], seq 2896:5792, ack 1, win 58, options [nop,nop,TS val 27571250 ecr 27571248], length 2896
17:30:44.948414 IP 10.0.0.1.40768 > 10.0.0.2.5001: Flags [.], seq 5792:8688, ack 1, win 58, options [nop,nop,TS val 27571251 ecr 27571250], length 2896
17:30:44.950837 IP 10.0.0.1.40768 > 10.0.0.2.5001: Flags [.], seq 8688:11584, ack 1, win 58, options [nop,nop,TS val 27571251 ecr 27571251], length 2896
17:30:44.953259 IP 10.0.0.1.40768 > 10.0.0.2.5001: Flags [.], seq 11584:14480, ack 1, win 58, options [nop,nop,TS val 27571252 ecr 27571251], length 2896
17:30:44.955682 IP 10.0.0.1.40768 > 10.0.0.2.5001: Flags [.], seq 14480:17376, ack 1, win 58, options [nop,nop,TS val 27571253 ecr 27571252], length 2896
17:30:44.958104 IP 10.0.0.1.40768 > 10.0.0.2.5001: Flags [.], seq 17376:20272, ack 1, win 58, options [nop,nop,TS val 27571253 ecr 27571253], length 2896
17:30:44.960526 IP 10.0.0.1.40768 > 10.0.0.2.5001: Flags [.], seq 20272:23168, ack 1, win 58, options [nop,nop,TS val 27571254 ecr 27571253], length 2896
17:30:44.962949 IP 10.0.0.1.40768 > 10.0.0.2.5001: Flags [.], seq 23168:26064, ack 1, win 58, options [nop,nop,TS val 27571254 ecr 27571254], length 2896
17:30:44.965371 IP 10.0.0.1.40768 > 10.0.0.2.5001: Flags [.], seq 26064:28960, ack 1, win 58, options [nop,nop,TS val 27571255 ecr 27571255], length 2896
17:30:44.967793 IP 10.0.0.1.40768 > 10.0.0.2.5001: Flags [.], seq 28960:31856, ack 1, win 58, options [nop,nop,TS val 27571256 ecr 27571255], length 2896
17:30:44.970216 IP 10.0.0.1.40768 > 10.0.0.2.5001: Flags [.], seq 31856:34752, ack 1, win 58, options [nop,nop,TS val 27571256 ecr 27571256], length 2896
17:30:44.972638 IP 10.0.0.1.40768 > 10.0.0.2.5001: Flags [.], seq 34752:37648, ack 1, win 58, options [nop,nop,TS val 27571257 ecr 27571256], length 2896
17:30:44.975061 IP 10.0.0.1.40768 > 10.0.0.2.5001: Flags [.], seq 37648:40544, ack 1, win 58, options [nop,nop,TS val 27571258 ecr 27571257], length 2896
17:30:44.977483 IP 10.0.0.1.40768 > 10.0.0.2.5001: Flags [.], seq 40544:43440, ack 1, win 58, options [nop,nop,TS val 27571258 ecr 27571258], length 2896
17:30:44.979905 IP 10.0.0.1.40768 > 10.0.0.2.5001: Flags [.], seq 43440:46336, ack 1, win 58, options [nop,nop,TS val 27571259 ecr 27571258], length 2896
17:30:44.982328 IP 10.0.0.1.40768 > 10.0.0.2.5001: Flags [.], seq 46336:49232, ack 1, win 58, options [nop,nop,TS val 27571259 ecr 27571259], length 2896
17:30:44.984750 IP 10.0.0.1.40768 > 10.0.0.2.5001: Flags [.], seq 49232:52128, ack 1, win 58, options [nop,nop,TS val 27571260 ecr 27571259], length 2896
17:30:44.987173 IP 10.0.0.1.40768 > 10.0.0.2.5001: Flags [.], seq 52128:55024, ack 1, win 58, options [nop,nop,TS val 27571261 ecr 27571260], length 2896
17:30:44.989595 IP 10.0.0.1.40768 > 10.0.0.2.5001: Flags [.], seq 55024:57920, ack 1, win 58, options [nop,nop,TS val 27571261 ecr 27571261], length 2896
17:30:44.992018 IP 10.0.0.1.40768 > 10.0.0.2.5001: Flags [.], seq 57920:60816, ack 1, win 58, options [nop,nop,TS val 27571262 ecr 27571261], length 2896
17:30:44.994440 IP 10.0.0.1.40768 > 10.0.0.2.5001: Flags [.], seq 60816:63712, ack 1, win 58, options [nop,nop,TS val 27571262 ecr 27571262], length 2896
17:30:44.996862 IP 10.0.0.1.40768 > 10.0.0.2.5001: Flags [.], seq 63712:66608, ack 1, win 58, options [nop,nop,TS val 27571263 ecr 27571262], length 2896
17:30:44.999285 IP 10.0.0.1.40768 > 10.0.0.2.5001: Flags [.], seq 66608:69504, ack 1, win 58, options [nop,nop,TS val 27571264 ecr 27571263], length 2896
17:30:45.001707 IP 10.0.0.1.40768 > 10.0.0.2.5001: Flags [.], seq 69504:72400, ack 1, win 58, options [nop,nop,TS val 27571264 ecr 27571264], length 2896
17:30:45.004129 IP 10.0.0.1.40768 > 10.0.0.2.5001: Flags [.], seq 72400:75296, ack 1, win 58, options [nop,nop,TS val 27571265 ecr 27571264], length 2896
17:30:45.006552 IP 10.0.0.1.40768 > 10.0.0.2.5001: Flags [.], seq 75296:78192, ack 1, win 58, options [nop,nop,TS val 27571265 ecr 27571265], length 2896
17:30:45.008974 IP 10.0.0.1.40768 > 10.0.0.2.5001: Flags [.], seq 78192:81088, ack 1, win 58, options [nop,nop,TS val 27571266 ecr 27571265], length 2896
17:30:45.011397 IP 10.0.0.1.40768 > 10.0.0.2.5001: Flags [P.], seq 81088:83984, ack 1, win 58, options [nop,nop,TS val 27571267 ecr 27571266], length 2896
17:30:45.013819 IP 10.0.0.1.40768 > 10.0.0.2.5001: Flags [.], seq 83984:86880, ack 1, win 58, options [nop,nop,TS val 27571267 ecr 27571267], length 2896
17:30:45.016241 IP 10.0.0.1.40768 > 10.0.0.2.5001: Flags [.], seq 86880:89776, ack 1, win 58, options [nop,nop,TS val 27571268 ecr 27571267], length 2896
17:30:45.018664 IP 10.0.0.1.40768 > 10.0.0.2.5001: Flags [.], seq 89776:92672, ack 1, win 58, options [nop,nop,TS val 27571268 ecr 27571268], length 2896
17:30:45.021086 IP 10.0.0.1.40768 > 10.0.0.2.5001: Flags [.], seq 92672:95568, ack 1, win 58, options [nop,nop,TS val 27571269 ecr 27571268], length 2896
17:30:45.023508 IP 10.0.0.1.40768 > 10.0.0.2.5001: Flags [.], seq 95568:98464, ack 1, win 58, options [nop,nop,TS val 27571270 ecr 27571269], length 2896
17:30:45.025936 IP 10.0.0.1.40768 > 10.0.0.2.5001: Flags [.], seq 98464:101360, ack 1, win 58, options [nop,nop,TS val 27571270 ecr 27571270], length 2896
17:30:45.028359 IP 10.0.0.1.40768 > 10.0.0.2.5001: Flags [.], seq 101360:104256, ack 1, win 58, options [nop,nop,TS val 27571271 ecr 27571270], length 2896
17:30:45.030780 IP 10.0.0.1.40768 > 10.0.0.2.5001: Flags [.], seq 104256:107152, ack 1, win 58, options [nop,nop,TS val 27571271 ecr 27571271], length 2896
17:30:45.033200 IP 10.0.0.1.40768 > 10.0.0.2.5001: Flags [.], seq 107152:110048, ack 1, win 58, options [nop,nop,TS val 27571272 ecr 27571271], length 2896
17:30:45.035622 IP 10.0.0.1.40768 > 10.0.0.2.5001: Flags [.], seq 110048:112944, ack 1, win 58, options [nop,nop,TS val 27571273 ecr 27571272], length 2896
17:30:45.038064 IP 10.0.0.1.40768 > 10.0.0.2.5001: Flags [.], seq 112944:115840, ack 1, win 58, options [nop,nop,TS val 27571273 ecr 27571273], length 2896
17:30:45.040466 IP 10.0.0.1.40768 > 10.0.0.2.5001: Flags [.], seq 115840:118736, ack 1, win 58, options [nop,nop,TS val 27571274 ecr 27571273], length 2896
17:30:45.042889 IP 10.0.0.1.40768 > 10.0.0.2.5001: Flags [.], seq 118736:121632, ack 1, win 58, options [nop,nop,TS val 27571274 ecr 27571274], length 2896
17:30:45.045312 IP 10.0.0.1.40768 > 10.0.0.2.5001: Flags [.], seq 121632:124528, ack 1, win 58, options [nop,nop,TS val 27571275 ecr 27571274], length 2896
17:30:45.047733 IP 10.0.0.1.40768 > 10.0.0.2.5001: Flags [.], seq 124528:127424, ack 1, win 58, options [nop,nop,TS val 27571276 ecr 27571275], length 2896
17:30:45.050157 IP 10.0.0.1.40768 > 10.0.0.2.5001: Flags [.], seq 127424:130320, ack 1, win 58, options [nop,nop,TS val 27571276 ecr 27571276], length 2896
17:30:45.052578 IP 10.0.0.1.40768 > 10.0.0.2.5001: Flags [.], seq 130320:133216, ack 1, win 58, options [nop,nop,TS val 27571277 ecr 27571276], length 2896
17:30:45.055001 IP 10.0.0.1.40768 > 10.0.0.2.5001: Flags [.], seq 133216:136112, ack 1, win 58, options [nop,nop,TS val 27571278 ecr 27571277], length 2896
17:30:45.057423 IP 10.0.0.1.40768 > 10.0.0.2.5001: Flags [.], seq 136112:139008, ack 1, win 58, options [nop,nop,TS val 27571278 ecr 27571278], length 2896
17:30:45.059845 IP 10.0.0.1.40768 > 10.0.0.2.5001: Flags [P.], seq 139008:141904, ack 1, win 58, options [nop,nop,TS val 27571279 ecr 27571278], length 2896
17:30:45.062271 IP 10.0.0.1.40768 > 10.0.0.2.5001: Flags [.], seq 141904:144800, ack 1, win 58, options [nop,nop,TS val 27571279 ecr 27571279], length 2896
17:30:45.064692 IP 10.0.0.1.40768 > 10.0.0.2.5001: Flags [.], seq 144800:147696, ack 1, win 58, options [nop,nop,TS val 27571280 ecr 27571279], length 2896
17:30:45.067113 IP 10.0.0.1.40768 > 10.0.0.2.5001: Flags [.], seq 147696:150592, ack 1, win 58, options [nop,nop,TS val 27571281 ecr 27571280], length 2896
17:30:45.069537 IP 10.0.0.1.40768 > 10.0.0.2.5001: Flags [.], seq 150592:153488, ack 1, win 58, options [nop,nop,TS val 27571281 ecr 27571281], length 2896
17:30:45.071960 IP 10.0.0.1.40768 > 10.0.0.2.5001: Flags [.], seq 153488:156384, ack 1, win 58, options [nop,nop,TS val 27571282 ecr 27571281], length 2896
17:30:45.074382 IP 10.0.0.1.40768 > 10.0.0.2.5001: Flags [.], seq 156384:159280, ack 1, win 58, options [nop,nop,TS val 27571282 ecr 27571282], length 2896
17:30:45.076804 IP 10.0.0.1.40768 > 10.0.0.2.5001: Flags [.], seq 159280:162176, ack 1, win 58, options [nop,nop,TS val 27571283 ecr 27571282], length 2896
17:30:45.079224 IP 10.0.0.1.40768 > 10.0.0.2.5001: Flags [.], seq 162176:165072, ack 1, win 58, options [nop,nop,TS val 27571284 ecr 27571283], length 2896
17:30:45.081647 IP 10.0.0.1.40768 > 10.0.0.2.5001: Flags [.], seq 165072:167968, ack 1, win 58, options [nop,nop,TS val 27571284 ecr 27571284], length 2896
17:30:45.084069 IP 10.0.0.1.40768 > 10.0.0.2.5001: Flags [.], seq 167968:170864, ack 1, win 58, options [nop,nop,TS val 27571285 ecr 27571284], length 2896
17:30:45.086513 IP 10.0.0.1.40768 > 10.0.0.2.5001: Flags [.], seq 170864:173760, ack 1, win 58, options [nop,nop,TS val 27571285 ecr 27571285], length 2896
17:30:45.088915 IP 10.0.0.1.40768 > 10.0.0.2.5001: Flags [.], seq 173760:176656, ack 1, win 58, options [nop,nop,TS val 27571286 ecr 27571285], length 2896
17:30:45.091336 IP 10.0.0.1.40768 > 10.0.0.2.5001: Flags [.], seq 176656:179552, ack 1, win 58, options [nop,nop,TS val 27571287 ecr 27571286], length 2896
17:30:45.093759 IP 10.0.0.1.40768 > 10.0.0.2.5001: Flags [.], seq 179552:182448, ack 1, win 58, options [nop,nop,TS val 27571287 ecr 27571287], length 2896
17:30:45.096181 IP 10.0.0.1.40768 > 10.0.0.2.5001: Flags [.], seq 182448:185344, ack 1, win 58, options [nop,nop,TS val 27571288 ecr 27571287], length 2896
17:30:45.098603 IP 10.0.0.1.40768 > 10.0.0.2.5001: Flags [.], seq 185344:188240, ack 1, win 58, options [nop,nop,TS val 27571288 ecr 27571288], length 2896
17:30:45.101025 IP 10.0.0.1.40768 > 10.0.0.2.5001: Flags [.], seq 188240:191136, ack 1, win 58, options [nop,nop,TS val 27571289 ecr 27571288], length 2896
17:30:45.103448 IP 10.0.0.1.40768 > 10.0.0.2.5001: Flags [.], seq 191136:194032, ack 1, win 58, options [nop,nop,TS val 27571290 ecr 27571289], length 2896
17:30:45.105870 IP 10.0.0.1.40768 > 10.0.0.2.5001: Flags [.], seq 194032:196928, ack 1, win 58, options [nop,nop,TS val 27571290 ecr 27571290], length 2896
17:30:45.108293 IP 10.0.0.1.40768 > 10.0.0.2.5001: Flags [.], seq 196928:199824, ack 1, win 58, options [nop,nop,TS val 27571291 ecr 27571290], length 2896
17:30:45.110715 IP 10.0.0.1.40768 > 10.0.0.2.5001: Flags [.], seq 199824:202720, ack 1, win 58, options [nop,nop,TS val 27571291 ecr 27571291], length 2896
17:30:45.113138 IP 10.0.0.1.40768 > 10.0.0.2.5001: Flags [.], seq 202720:205616, ack 1, win 58, options [nop,nop,TS val 27571292 ecr 27571291], length 2896
17:30:45.115562 IP 10.0.0.1.40768 > 10.0.0.2.5001: Flags [.], seq 205616:208512, ack 1, win 58, options [nop,nop,TS val 27571293 ecr 27571292], length 2896
17:30:45.117983 IP 10.0.0.1.40768 > 10.0.0.2.5001: Flags [.], seq 208512:211408, ack 1, win 58, options [nop,nop,TS val 27571293 ecr 27571292], length 2896
17:30:45.120405 IP 10.0.0.1.40768 > 10.0.0.2.5001: Flags [.], seq 211408:214304, ack 1, win 58, options [nop,nop,TS val 27571294 ecr 27571292], length 2896
17:30:45.122827 IP 10.0.0.1.40768 > 10.0.0.2.5001: Flags [.], seq 214304:217200, ack 1, win 58, options [nop,nop,TS val 27571294 ecr 27571294], length 2896
17:30:45.125249 IP 10.0.0.1.40768 > 10.0.0.2.5001: Flags [.], seq 217200:220096, ack 1, win 58, options [nop,nop,TS val 27571295 ecr 27571294], length 2896
17:30:45.127672 IP 10.0.0.1.40768 > 10.0.0.2.5001: Flags [.], seq 220096:222992, ack 1, win 58, options [nop,nop,TS val 27571296 ecr 27571295], length 2896
17:30:45.130094 IP 10.0.0.1.40768 > 10.0.0.2.5001: Flags [.], seq 222992:225888, ack 1, win 58, options [nop,nop,TS val 27571296 ecr 27571296], length 2896
17:30:45.132517 IP 10.0.0.1.40768 > 10.0.0.2.5001: Flags [.], seq 225888:228784, ack 1, win 58, options [nop,nop,TS val 27571297 ecr 27571297], length 2896
17:30:45.134939 IP 10.0.0.1.40768 > 10.0.0.2.5001: Flags [.], seq 228784:231680, ack 1, win 58, options [nop,nop,TS val 27571297 ecr 27571297], length 2896
17:30:45.137362 IP 10.0.0.1.40768 > 10.0.0.2.5001: Flags [.], seq 231680:234576, ack 1, win 58, options [nop,nop,TS val 27571298 ecr 27571298], length 2896
17:30:45.139784 IP 10.0.0.1.40768 > 10.0.0.2.5001: Flags [.], seq 234576:237472, ack 1, win 58, options [nop,nop,TS val 27571299 ecr 27571298], length 2896
17:30:45.142207 IP 10.0.0.1.40768 > 10.0.0.2.5001: Flags [.], seq 237472:240368, ack 1, win 58, options [nop,nop,TS val 27571299 ecr 27571299], length 2896
17:30:45.144629 IP 10.0.0.1.40768 > 10.0.0.2.5001: Flags [.], seq 240368:243264, ack 1, win 58, options [nop,nop,TS val 27571300 ecr 27571299], length 2896
17:30:45.147051 IP 10.0.0.1.40768 > 10.0.0.2.5001: Flags [.], seq 243264:246160, ack 1, win 58, options [nop,nop,TS val 27571301 ecr 27571300], length 2896
17:30:45.149473 IP 10.0.0.1.40768 > 10.0.0.2.5001: Flags [.], seq 246160:249056, ack 1, win 58, options [nop,nop,TS val 27571301 ecr 27571301], length 2896
17:30:45.151896 IP 10.0.0.1.40768 > 10.0.0.2.5001: Flags [.], seq 249056:251952, ack 1, win 58, options [nop,nop,TS val 27571302 ecr 27571301], length 2896
17:30:45.154318 IP 10.0.0.1.40768 > 10.0.0.2.5001: Flags [.], seq 251952:254848, ack 1, win 58, options [nop,nop,TS val 27571302 ecr 27571302], length 2896
17:30:45.156741 IP 10.0.0.1.40768 > 10.0.0.2.5001: Flags [.], seq 254848:257744, ack 1, win 58, options [nop,nop,TS val 27571303 ecr 27571302], length 2896
17:30:45.159164 IP 10.0.0.1.40768 > 10.0.0.2.5001: Flags [.], seq 257744:260640, ack 1, win 58, options [nop,nop,TS val 27571304 ecr 27571303], length 2896
17:30:45.161585 IP 10.0.0.1.40768 > 10.0.0.2.5001: Flags [.], seq 260640:263536, ack 1, win 58, options [nop,nop,TS val 27571304 ecr 27571304], length 2896
17:30:45.164008 IP 10.0.0.1.40768 > 10.0.0.2.5001: Flags [.], seq 263536:266432, ack 1, win 58, options [nop,nop,TS val 27571305 ecr 27571304], length 2896
17:30:45.166431 IP 10.0.0.1.40768 > 10.0.0.2.5001: Flags [.], seq 266432:269328, ack 1, win 58, options [nop,nop,TS val 27571305 ecr 27571305], length 2896
17:30:45.168853 IP 10.0.0.1.40768 > 10.0.0.2.5001: Flags [.], seq 269328:272224, ack 1, win 58, options [nop,nop,TS val 27571306 ecr 27571305], length 2896
17:30:45.171275 IP 10.0.0.1.40768 > 10.0.0.2.5001: Flags [.], seq 272224:275120, ack 1, win 58, options [nop,nop,TS val 27571307 ecr 27571306], length 2896
17:30:45.173697 IP 10.0.0.1.40768 > 10.0.0.2.5001: Flags [.], seq 275120:278016, ack 1, win 58, options [nop,nop,TS val 27571307 ecr 27571307], length 2896
17:30:45.176182 IP 10.0.0.1.40768 > 10.0.0.2.5001: Flags [.], seq 278016:280912, ack 1, win 58, options [nop,nop,TS val 27571308 ecr 27571307], length 2896
17:30:45.178611 IP 10.0.0.1.40768 > 10.0.0.2.5001: Flags [.], seq 280912:283808, ack 1, win 58, options [nop,nop,TS val 27571308 ecr 27571308], length 2896
17:30:45.181032 IP 10.0.0.1.40768 > 10.0.0.2.5001: Flags [.], seq 283808:286704, ack 1, win 58, options [nop,nop,TS val 27571309 ecr 27571308], length 2896
17:30:45.183455 IP 10.0.0.1.40768 > 10.0.0.2.5001: Flags [.], seq 286704:289600, ack 1, win 58, options [nop,nop,TS val 27571310 ecr 27571309], length 2896
17:30:45.185875 IP 10.0.0.1.40768 > 10.0.0.2.5001: Flags [.], seq 289600:292496, ack 1, win 58, options [nop,nop,TS val 27571310 ecr 27571310], length 2896
17:30:45.188294 IP 10.0.0.1.40768 > 10.0.0.2.5001: Flags [.], seq 292496:295392, ack 1, win 58, options [nop,nop,TS val 27571311 ecr 27571310], length 2896
17:30:45.190717 IP 10.0.0.1.40768 > 10.0.0.2.5001: Flags [.], seq 295392:298288, ack 1, win 58, options [nop,nop,TS val 27571311 ecr 27571311], length 2896
17:30:45.193139 IP 10.0.0.1.40768 > 10.0.0.2.5001: Flags [.], seq 298288:301184, ack 1, win 58, options [nop,nop,TS val 27571312 ecr 27571311], length 2896
17:30:45.195562 IP 10.0.0.1.40768 > 10.0.0.2.5001: Flags [P.], seq 301184:304080, ack 1, win 58, options [nop,nop,TS val 27571313 ecr 27571312], length 2896
17:30:45.197984 IP 10.0.0.1.40768 > 10.0.0.2.5001: Flags [.], seq 304080:306976, ack 1, win 58, options [nop,nop,TS val 27571313 ecr 27571313], length 2896
17:30:45.200409 IP 10.0.0.1.40768 > 10.0.0.2.5001: Flags [.], seq 306976:309872, ack 1, win 58, options [nop,nop,TS val 27571314 ecr 27571313], length 2896
17:30:45.202831 IP 10.0.0.1.40768 > 10.0.0.2.5001: Flags [.], seq 309872:312768, ack 1, win 58, options [nop,nop,TS val 27571314 ecr 27571314], length 2896
17:30:45.205252 IP 10.0.0.1.40768 > 10.0.0.2.5001: Flags [.], seq 312768:315664, ack 1, win 58, options [nop,nop,TS val 27571315 ecr 27571315], length 2896
17:30:45.207674 IP 10.0.0.1.40768 > 10.0.0.2.5001: Flags [.], seq 315664:318560, ack 1, win 58, options [nop,nop,TS val 27571316 ecr 27571315], length 2896
17:30:45.210096 IP 10.0.0.1.40768 > 10.0.0.2.5001: Flags [.], seq 318560:321456, ack 1, win 58, options [nop,nop,TS val 27571316 ecr 27571316], length 2896
17:30:45.212518 IP 10.0.0.1.40768 > 10.0.0.2.5001: Flags [.], seq 321456:324352, ack 1, win 58, options [nop,nop,TS val 27571317 ecr 27571316], length 2896
17:30:45.214941 IP 10.0.0.1.40768 > 10.0.0.2.5001: Flags [.], seq 324352:327248, ack 1, win 58, options [nop,nop,TS val 27571317 ecr 27571317], length 2896
17:30:45.217363 IP 10.0.0.1.40768 > 10.0.0.2.5001: Flags [.], seq 327248:330144, ack 1, win 58, options [nop,nop,TS val 27571318 ecr 27571318], length 2896
17:30:45.219786 IP 10.0.0.1.40768 > 10.0.0.2.5001: Flags [.], seq 330144:333040, ack 1, win 58, options [nop,nop,TS val 27571319 ecr 27571318], length 2896
17:30:45.222208 IP 10.0.0.1.40768 > 10.0.0.2.5001: Flags [.], seq 333040:335936, ack 1, win 58, options [nop,nop,TS val 27571319 ecr 27571319], length 2896
17:30:45.224630 IP 10.0.0.1.40768 > 10.0.0.2.5001: Flags [.], seq 335936:338832, ack 1, win 58, options [nop,nop,TS val 27571320 ecr 27571319], length 2896
17:30:45.227053 IP 10.0.0.1.40768 > 10.0.0.2.5001: Flags [.], seq 338832:341728, ack 1, win 58, options [nop,nop,TS val 27571321 ecr 27571320], length 2896
17:30:45.229475 IP 10.0.0.1.40768 > 10.0.0.2.5001: Flags [.], seq 341728:344624, ack 1, win 58, options [nop,nop,TS val 27571321 ecr 27571321], length 2896
17:30:45.231897 IP 10.0.0.1.40768 > 10.0.0.2.5001: Flags [.], seq 344624:347520, ack 1, win 58, options [nop,nop,TS val 27571322 ecr 27571321], length 2896
17:30:45.234320 IP 10.0.0.1.40768 > 10.0.0.2.5001: Flags [.], seq 347520:350416, ack 1, win 58, options [nop,nop,TS val 27571322 ecr 27571322], length 2896
17:30:45.236743 IP 10.0.0.1.40768 > 10.0.0.2.5001: Flags [.], seq 350416:353312, ack 1, win 58, options [nop,nop,TS val 27571323 ecr 27571322], length 2896
17:30:45.239165 IP 10.0.0.1.40768 > 10.0.0.2.5001: Flags [.], seq 353312:356208, ack 1, win 58, options [nop,nop,TS val 27571324 ecr 27571323], length 2896
17:30:45.241587 IP 10.0.0.1.40768 > 10.0.0.2.5001: Flags [.], seq 356208:359104, ack 1, win 58, options [nop,nop,TS val 27571324 ecr 27571324], length 2896
17:30:45.244009 IP 10.0.0.1.40768 > 10.0.0.2.5001: Flags [.], seq 359104:362000, ack 1, win 58, options [nop,nop,TS val 27571325 ecr 27571324], length 2896
17:30:45.246432 IP 10.0.0.1.40768 > 10.0.0.2.5001: Flags [.], seq 362000:364896, ack 1, win 58, options [nop,nop,TS val 27571325 ecr 27571325], length 2896
17:30:45.248854 IP 10.0.0.1.40768 > 10.0.0.2.5001: Flags [.], seq 364896:367792, ack 1, win 58, options [nop,nop,TS val 27571326 ecr 27571325], length 2896
17:30:45.251277 IP 10.0.0.1.40768 > 10.0.0.2.5001: Flags [.], seq 367792:370688, ack 1, win 58, options [nop,nop,TS val 27571327 ecr 27571326], length 2896
17:30:45.253699 IP 10.0.0.1.40768 > 10.0.0.2.5001: Flags [.], seq 370688:373584, ack 1, win 58, options [nop,nop,TS val 27571327 ecr 27571327], length 2896
17:30:45.256121 IP 10.0.0.1.40768 > 10.0.0.2.5001: Flags [.], seq 373584:376480, ack 1, win 58, options [nop,nop,TS val 27571328 ecr 27571327], length 2896
17:30:45.258544 IP 10.0.0.1.40768 > 10.0.0.2.5001: Flags [.], seq 376480:379376, ack 1, win 58, options [nop,nop,TS val 27571328 ecr 27571328], length 2896
17:30:45.260967 IP 10.0.0.1.40768 > 10.0.0.2.5001: Flags [.], seq 379376:382272, ack 1, win 58, options [nop,nop,TS val 27571329 ecr 27571328], length 2896
17:30:45.263389 IP 10.0.0.1.40768 > 10.0.0.2.5001: Flags [.], seq 382272:385168, ack 1, win 58, options [nop,nop,TS val 27571330 ecr 27571329], length 2896
17:30:45.265811 IP 10.0.0.1.40768 > 10.0.0.2.5001: Flags [.], seq 385168:388064, ack 1, win 58, options [nop,nop,TS val 27571330 ecr 27571330], length 2896
17:30:45.268233 IP 10.0.0.1.40768 > 10.0.0.2.5001: Flags [.], seq 388064:390960, ack 1, win 58, options [nop,nop,TS val 27571331 ecr 27571330], length 2896
17:30:45.270656 IP 10.0.0.1.40768 > 10.0.0.2.5001: Flags [.], seq 390960:393856, ack 1, win 58, options [nop,nop,TS val 27571331 ecr 27571331], length 2896
17:30:45.273078 IP 10.0.0.1.40768 > 10.0.0.2.5001: Flags [.], seq 393856:396752, ack 1, win 58, options [nop,nop,TS val 27571332 ecr 27571332], length 2896
17:30:45.275501 IP 10.0.0.1.40768 > 10.0.0.2.5001: Flags [.], seq 396752:399648, ack 1, win 58, options [nop,nop,TS val 27571333 ecr 27571332], length 2896
17:30:45.277923 IP 10.0.0.1.40768 > 10.0.0.2.5001: Flags [.], seq 399648:402544, ack 1, win 58, options [nop,nop,TS val 27571333 ecr 27571333], length 2896
17:30:45.280345 IP 10.0.0.1.40768 > 10.0.0.2.5001: Flags [.], seq 402544:405440, ack 1, win 58, options [nop,nop,TS val 27571334 ecr 27571333], length 2896
17:30:45.282768 IP 10.0.0.1.40768 > 10.0.0.2.5001: Flags [.], seq 405440:408336, ack 1, win 58, options [nop,nop,TS val 27571334 ecr 27571334], length 2896
17:30:45.285190 IP 10.0.0.1.40768 > 10.0.0.2.5001: Flags [.], seq 408336:411232, ack 1, win 58, options [nop,nop,TS val 27571335 ecr 27571334], length 2896
17:30:45.287613 IP 10.0.0.1.40768 > 10.0.0.2.5001: Flags [.], seq 411232:414128, ack 1, win 58, options [nop,nop,TS val 27571336 ecr 27571335], length 2896
17:30:45.290035 IP 10.0.0.1.40768 > 10.0.0.2.5001: Flags [.], seq 414128:417024, ack 1, win 58, options [nop,nop,TS val 27571336 ecr 27571336], length 2896
17:30:45.292457 IP 10.0.0.1.40768 > 10.0.0.2.5001: Flags [.], seq 417024:419920, ack 1, win 58, options [nop,nop,TS val 27571337 ecr 27571336], length 2896
17:30:45.294880 IP 10.0.0.1.40768 > 10.0.0.2.5001: Flags [.], seq 419920:422816, ack 1, win 58, options [nop,nop,TS val 27571337 ecr 27571337], length 2896
17:30:45.297302 IP 10.0.0.1.40768 > 10.0.0.2.5001: Flags [.], seq 422816:425712, ack 1, win 58, options [nop,nop,TS val 27571338 ecr 27571337], length 2896
17:30:45.299725 IP 10.0.0.1.40768 > 10.0.0.2.5001: Flags [.], seq 425712:428608, ack 1, win 58, options [nop,nop,TS val 27571339 ecr 27571338], length 2896
17:30:45.302147 IP 10.0.0.1.40768 > 10.0.0.2.5001: Flags [.], seq 428608:431504, ack 1, win 58, options [nop,nop,TS val 27571339 ecr 27571339], length 2896
17:30:45.304569 IP 10.0.0.1.40768 > 10.0.0.2.5001: Flags [.], seq 431504:434400, ack 1, win 58, options [nop,nop,TS val 27571340 ecr 27571339], length 2896
17:30:45.306992 IP 10.0.0.1.40768 > 10.0.0.2.5001: Flags [.], seq 434400:437296, ack 1, win 58, options [nop,nop,TS val 27571341 ecr 27571340], length 2896
17:30:45.309414 IP 10.0.0.1.40768 > 10.0.0.2.5001: Flags [.], seq 437296:440192, ack 1, win 58, options [nop,nop,TS val 27571341 ecr 27571341], length 2896
17:30:45.311837 IP 10.0.0.1.40768 > 10.0.0.2.5001: Flags [.], seq 440192:443088, ack 1, win 58, options [nop,nop,TS val 27571342 ecr 27571341], length 2896
17:30:45.314259 IP 10.0.0.1.40768 > 10.0.0.2.5001: Flags [.], seq 443088:445984, ack 1, win 58, options [nop,nop,TS val 27571342 ecr 27571342], length 2896
17:30:45.316681 IP 10.0.0.1.40768 > 10.0.0.2.5001: Flags [.], seq 445984:448880, ack 1, win 58, options [nop,nop,TS val 27571343 ecr 27571342], length 2896
17:30:45.319104 IP 10.0.0.1.40768 > 10.0.0.2.5001: Flags [.], seq 448880:451776, ack 1, win 58, options [nop,nop,TS val 27571344 ecr 27571343], length 2896
17:30:45.321526 IP 10.0.0.1.40768 > 10.0.0.2.5001: Flags [.], seq 451776:454672, ack 1, win 58, options [nop,nop,TS val 27571344 ecr 27571344], length 2896
17:30:45.323949 IP 10.0.0.1.40768 > 10.0.0.2.5001: Flags [.], seq 454672:457568, ack 1, win 58, options [nop,nop,TS val 27571345 ecr 27571344], length 2896
17:30:45.326371 IP 10.0.0.1.40768 > 10.0.0.2.5001: Flags [.], seq 457568:460464, ack 1, win 58, options [nop,nop,TS val 27571345 ecr 27571345], length 2896
17:30:45.328793 IP 10.0.0.1.40768 > 10.0.0.2.5001: Flags [P.], seq 460464:463360, ack 1, win 58, options [nop,nop,TS val 27571346 ecr 27571345], length 2896
17:30:45.331216 IP 10.0.0.1.40768 > 10.0.0.2.5001: Flags [.], seq 463360:466256, ack 1, win 58, options [nop,nop,TS val 27571347 ecr 27571346], length 2896
17:30:45.333638 IP 10.0.0.1.40768 > 10.0.0.2.5001: Flags [.], seq 466256:469152, ack 1, win 58, options [nop,nop,TS val 27571347 ecr 27571347], length 2896
17:30:45.336061 IP 10.0.0.1.40768 > 10.0.0.2.5001: Flags [.], seq 469152:472048, ack 1, win 58, options [nop,nop,TS val 27571348 ecr 27571347], length 2896
17:30:45.338483 IP 10.0.0.1.40768 > 10.0.0.2.5001: Flags [.], seq 472048:474944, ack 1, win 58, options [nop,nop,TS val 27571348 ecr 27571348], length 2896
17:30:45.340905 IP 10.0.0.1.40768 > 10.0.0.2.5001: Flags [.], seq 474944:477840, ack 1, win 58, options [nop,nop,TS val 27571349 ecr 27571348], length 2896
17:30:45.343328 IP 10.0.0.1.40768 > 10.0.0.2.5001: Flags [.], seq 477840:480736, ack 1, win 58, options [nop,nop,TS val 27571350 ecr 27571349], length 2896
17:30:45.345750 IP 10.0.0.1.40768 > 10.0.0.2.5001: Flags [.], seq 480736:483632, ack 1, win 58, options [nop,nop,TS val 27571350 ecr 27571350], length 2896
17:30:45.348173 IP 10.0.0.1.40768 > 10.0.0.2.5001: Flags [.], seq 483632:486528, ack 1, win 58, options [nop,nop,TS val 27571351 ecr 27571350], length 2896
17:30:45.350595 IP 10.0.0.1.40768 > 10.0.0.2.5001: Flags [.], seq 486528:489424, ack 1, win 58, options [nop,nop,TS val 27571351 ecr 27571351], length 2896
17:30:45.353017 IP 10.0.0.1.40768 > 10.0.0.2.5001: Flags [.], seq 489424:492320, ack 1, win 58, options [nop,nop,TS val 27571352 ecr 27571351], length 2896
17:30:45.355440 IP 10.0.0.1.40768 > 10.0.0.2.5001: Flags [.], seq 492320:495216, ack 1, win 58, options [nop,nop,TS val 27571353 ecr 27571352], length 2896
17:30:45.357862 IP 10.0.0.1.40768 > 10.0.0.2.5001: Flags [.], seq 495216:498112, ack 1, win 58, options [nop,nop,TS val 27571353 ecr 27571353], length 2896
17:30:45.360285 IP 10.0.0.1.40768 > 10.0.0.2.5001: Flags [.], seq 498112:501008, ack 1, win 58, options [nop,nop,TS val 27571354 ecr 27571353], length 2896
17:30:45.362707 IP 10.0.0.1.40768 > 10.0.0.2.5001: Flags [.], seq 501008:503904, ack 1, win 58, options [nop,nop,TS val 27571354 ecr 27571354], length 2896
17:30:45.365129 IP 10.0.0.1.40768 > 10.0.0.2.5001: Flags [.], seq 503904:506800, ack 1, win 58, options [nop,nop,TS val 27571355 ecr 27571354], length 2896
17:30:45.367552 IP 10.0.0.1.40768 > 10.0.0.2.5001: Flags [.], seq 506800:509696, ack 1, win 58, options [nop,nop,TS val 27571356 ecr 27571355], length 2896
17:30:45.369974 IP 10.0.0.1.40768 > 10.0.0.2.5001: Flags [.], seq 509696:512592, ack 1, win 58, options [nop,nop,TS val 27571356 ecr 27571356], length 2896
17:30:45.372397 IP 10.0.0.1.40768 > 10.0.0.2.5001: Flags [.], seq 512592:515488, ack 1, win 58, options [nop,nop,TS val 27571357 ecr 27571356], length 2896
17:30:45.374819 IP 10.0.0.1.40768 > 10.0.0.2.5001: Flags [.], seq 515488:518384, ack 1, win 58, options [nop,nop,TS val 27571357 ecr 27571357], length 2896
17:30:45.377241 IP 10.0.0.1.40768 > 10.0.0.2.5001: Flags [.], seq 518384:521280, ack 1, win 58, options [nop,nop,TS val 27571358 ecr 27571357], length 2896
17:30:45.379664 IP 10.0.0.1.40768 > 10.0.0.2.5001: Flags [.], seq 521280:524176, ack 1, win 58, options [nop,nop,TS val 27571359 ecr 27571358], length 2896
17:30:45.382086 IP 10.0.0.1.40768 > 10.0.0.2.5001: Flags [.], seq 524176:527072, ack 1, win 58, options [nop,nop,TS val 27571359 ecr 27571359], length 2896
17:30:45.384509 IP 10.0.0.1.40768 > 10.0.0.2.5001: Flags [.], seq 527072:529968, ack 1, win 58, options [nop,nop,TS val 27571360 ecr 27571359], length 2896
17:30:45.386931 IP 10.0.0.1.40768 > 10.0.0.2.5001: Flags [.], seq 529968:532864, ack 1, win 58, options [nop,nop,TS val 27571360 ecr 27571360], length 2896
17:30:45.389353 IP 10.0.0.1.40768 > 10.0.0.2.5001: Flags [.], seq 532864:535760, ack 1, win 58, options [nop,nop,TS val 27571361 ecr 27571360], length 2896
17:30:45.391776 IP 10.0.0.1.40768 > 10.0.0.2.5001: Flags [.], seq 535760:538656, ack 1, win 58, options [nop,nop,TS val 27571362 ecr 27571361], length 2896
17:30:45.394198 IP 10.0.0.1.40768 > 10.0.0.2.5001: Flags [.], seq 538656:541552, ack 1, win 58, options [nop,nop,TS val 27571362 ecr 27571362], length 2896
17:30:45.396621 IP 10.0.0.1.40768 > 10.0.0.2.5001: Flags [.], seq 541552:544448, ack 1, win 58, options [nop,nop,TS val 27571363 ecr 27571362], length 2896
17:30:45.399043 IP 10.0.0.1.40768 > 10.0.0.2.5001: Flags [.], seq 544448:547344, ack 1, win 58, options [nop,nop,TS val 27571364 ecr 27571363], length 2896
17:30:45.401465 IP 10.0.0.1.40768 > 10.0.0.2.5001: Flags [.], seq 547344:550240, ack 1, win 58, options [nop,nop,TS val 27571364 ecr 27571364], length 2896
17:30:45.403888 IP 10.0.0.1.40768 > 10.0.0.2.5001: Flags [.], seq 550240:553136, ack 1, win 58, options [nop,nop,TS val 27571365 ecr 27571364], length 2896
17:30:45.406310 IP 10.0.0.1.40768 > 10.0.0.2.5001: Flags [.], seq 553136:556032, ack 1, win 58, options [nop,nop,TS val 27571365 ecr 27571365], length 2896
17:30:45.408733 IP 10.0.0.1.40768 > 10.0.0.2.5001: Flags [.], seq 556032:558928, ack 1, win 58, options [nop,nop,TS val 27571366 ecr 27571365], length 2896
17:30:45.411155 IP 10.0.0.1.40768 > 10.0.0.2.5001: Flags [.], seq 558928:561824, ack 1, win 58, options [nop,nop,TS val 27571367 ecr 27571366], length 2896
17:30:45.413577 IP 10.0.0.1.40768 > 10.0.0.2.5001: Flags [.], seq 561824:564720, ack 1, win 58, options [nop,nop,TS val 27571367 ecr 27571367], length 2896
17:30:45.416000 IP 10.0.0.1.40768 > 10.0.0.2.5001: Flags [.], seq 564720:567616, ack 1, win 58, options [nop,nop,TS val 27571368 ecr 27571367], length 2896
17:30:45.418422 IP 10.0.0.1.40768 > 10.0.0.2.5001: Flags [.], seq 567616:570512, ack 1, win 58, options [nop,nop,TS val 27571368 ecr 27571368], length 2896
17:30:45.420845 IP 10.0.0.1.40768 > 10.0.0.2.5001: Flags [.], seq 570512:573408, ack 1, win 58, options [nop,nop,TS val 27571369 ecr 27571368], length 2896
17:30:45.423267 IP 10.0.0.1.40768 > 10.0.0.2.5001: Flags [.], seq 573408:576304, ack 1, win 58, options [nop,nop,TS val 27571370 ecr 27571369], length 2896
17:30:45.425689 IP 10.0.0.1.40768 > 10.0.0.2.5001: Flags [.], seq 576304:579200, ack 1, win 58, options [nop,nop,TS val 27571370 ecr 27571370], length 2896
17:30:45.428112 IP 10.0.0.1.40768 > 10.0.0.2.5001: Flags [.], seq 579200:582096, ack 1, win 58, options [nop,nop,TS val 27571371 ecr 27571370], length 2896
17:30:45.430534 IP 10.0.0.1.40768 > 10.0.0.2.5001: Flags [.], seq 582096:584992, ack 1, win 58, options [nop,nop,TS val 27571371 ecr 27571371], length 2896
17:30:45.432957 IP 10.0.0.1.40768 > 10.0.0.2.5001: Flags [.], seq 584992:587888, ack 1, win 58, options [nop,nop,TS val 27571372 ecr 27571371], length 2896
17:30:45.435379 IP 10.0.0.1.40768 > 10.0.0.2.5001: Flags [.], seq 587888:590784, ack 1, win 58, options [nop,nop,TS val 27571373 ecr 27571372], length 2896
17:30:45.437801 IP 10.0.0.1.40768 > 10.0.0.2.5001: Flags [.], seq 590784:593680, ack 1, win 58, options [nop,nop,TS val 27571373 ecr 27571373], length 2896
17:30:45.440224 IP 10.0.0.1.40768 > 10.0.0.2.5001: Flags [.], seq 593680:596576, ack 1, win 58, options [nop,nop,TS val 27571374 ecr 27571373], length 2896
17:30:45.442646 IP 10.0.0.1.40768 > 10.0.0.2.5001: Flags [.], seq 596576:599472, ack 1, win 58, options [nop,nop,TS val 27571374 ecr 27571374], length 2896
17:30:45.445069 IP 10.0.0.1.40768 > 10.0.0.2.5001: Flags [.], seq 599472:602368, ack 1, win 58, options [nop,nop,TS val 27571375 ecr 27571374], length 2896
17:30:45.447491 IP 10.0.0.1.40768 > 10.0.0.2.5001: Flags [.], seq 602368:605264, ack 1, win 58, options [nop,nop,TS val 27571376 ecr 27571375], length 2896
17:30:45.449913 IP 10.0.0.1.40768 > 10.0.0.2.5001: Flags [.], seq 605264:608160, ack 1, win 58, options [nop,nop,TS val 27571376 ecr 27571376], length 2896
17:30:45.452336 IP 10.0.0.1.40768 > 10.0.0.2.5001: Flags [.], seq 608160:611056, ack 1, win 58, options [nop,nop,TS val 27571377 ecr 27571376], length 2896
17:30:45.454758 IP 10.0.0.1.40768 > 10.0.0.2.5001: Flags [.], seq 611056:613952, ack 1, win 58, options [nop,nop,TS val 27571377 ecr 27571377], length 2896
17:30:45.457181 IP 10.0.0.1.40768 > 10.0.0.2.5001: Flags [.], seq 613952:616848, ack 1, win 58, options [nop,nop,TS val 27571378 ecr 27571377], length 2896
17:30:45.459603 IP 10.0.0.1.40768 > 10.0.0.2.5001: Flags [.], seq 616848:619744, ack 1, win 58, options [nop,nop,TS val 27571379 ecr 27571378], length 2896
17:30:45.462025 IP 10.0.0.1.40768 > 10.0.0.2.5001: Flags [P.], seq 619744:622640, ack 1, win 58, options [nop,nop,TS val 27571379 ecr 27571379], length 2896
17:30:45.464448 IP 10.0.0.1.40768 > 10.0.0.2.5001: Flags [.], seq 622640:625536, ack 1, win 58, options [nop,nop,TS val 27571380 ecr 27571379], length 2896
17:30:45.466870 IP 10.0.0.1.40768 > 10.0.0.2.5001: Flags [.], seq 625536:628432, ack 1, win 58, options [nop,nop,TS val 27571380 ecr 27571380], length 2896
17:30:45.469293 IP 10.0.0.1.40768 > 10.0.0.2.5001: Flags [.], seq 628432:631328, ack 1, win 58, options [nop,nop,TS val 27571381 ecr 27571380], length 2896
17:30:45.471715 IP 10.0.0.1.40768 > 10.0.0.2.5001: Flags [.], seq 631328:634224, ack 1, win 58, options [nop,nop,TS val 27571382 ecr 27571381], length 2896
17:30:45.474137 IP 10.0.0.1.40768 > 10.0.0.2.5001: Flags [.], seq 634224:637120, ack 1, win 58, options [nop,nop,TS val 27571382 ecr 27571382], length 2896
17:30:45.476560 IP 10.0.0.1.40768 > 10.0.0.2.5001: Flags [.], seq 637120:640016, ack 1, win 58, options [nop,nop,TS val 27571383 ecr 27571382], length 2896
17:30:45.478982 IP 10.0.0.1.40768 > 10.0.0.2.5001: Flags [.], seq 640016:642912, ack 1, win 58, options [nop,nop,TS val 27571384 ecr 27571383], length 2896
17:30:45.481405 IP 10.0.0.1.40768 > 10.0.0.2.5001: Flags [.], seq 642912:645808, ack 1, win 58, options [nop,nop,TS val 27571384 ecr 27571384], length 2896
17:30:45.483827 IP 10.0.0.1.40768 > 10.0.0.2.5001: Flags [.], seq 645808:648704, ack 1, win 58, options [nop,nop,TS val 27571385 ecr 27571384], length 2896
17:30:45.486249 IP 10.0.0.1.40768 > 10.0.0.2.5001: Flags [.], seq 648704:651600, ack 1, win 58, options [nop,nop,TS val 27571385 ecr 27571385], length 2896
17:30:45.488672 IP 10.0.0.1.40768 > 10.0.0.2.5001: Flags [.], seq 651600:654496, ack 1, win 58, options [nop,nop,TS val 27571386 ecr 27571385], length 2896
17:30:45.491098 IP 10.0.0.1.40768 > 10.0.0.2.5001: Flags [.], seq 654496:657392, ack 1, win 58, options [nop,nop,TS val 27571387 ecr 27571386], length 2896
17:30:45.493517 IP 10.0.0.1.40768 > 10.0.0.2.5001: Flags [.], seq 657392:660288, ack 1, win 58, options [nop,nop,TS val 27571387 ecr 27571387], length 2896
17:30:45.495939 IP 10.0.0.1.40768 > 10.0.0.2.5001: Flags [.], seq 660288:663184, ack 1, win 58, options [nop,nop,TS val 27571388 ecr 27571387], length 2896
17:30:45.498361 IP 10.0.0.1.40768 > 10.0.0.2.5001: Flags [.], seq 663184:666080, ack 1, win 58, options [nop,nop,TS val 27571388 ecr 27571388], length 2896
17:30:45.500784 IP 10.0.0.1.40768 > 10.0.0.2.5001: Flags [.], seq 666080:668976, ack 1, win 58, options [nop,nop,TS val 27571389 ecr 27571388], length 2896
17:30:45.503206 IP 10.0.0.1.40768 > 10.0.0.2.5001: Flags [.], seq 668976:671872, ack 1, win 58, options [nop,nop,TS val 27571390 ecr 27571389], length 2896
17:30:45.505629 IP 10.0.0.1.40768 > 10.0.0.2.5001: Flags [.], seq 671872:674768, ack 1, win 58, options [nop,nop,TS val 27571390 ecr 27571390], length 2896
17:30:45.508051 IP 10.0.0.1.40768 > 10.0.0.2.5001: Flags [.], seq 674768:677664, ack 1, win 58, options [nop,nop,TS val 27571391 ecr 27571390], length 2896
17:30:45.510473 IP 10.0.0.1.40768 > 10.0.0.2.5001: Flags [.], seq 677664:680560, ack 1, win 58, options [nop,nop,TS val 27571391 ecr 27571391], length 2896
17:30:45.512896 IP 10.0.0.1.40768 > 10.0.0.2.5001: Flags [.], seq 680560:683456, ack 1, win 58, options [nop,nop,TS val 27571392 ecr 27571391], length 2896
17:30:45.515318 IP 10.0.0.1.40768 > 10.0.0.2.5001: Flags [.], seq 683456:686352, ack 1, win 58, options [nop,nop,TS val 27571393 ecr 27571392], length 2896
17:30:45.517741 IP 10.0.0.1.40768 > 10.0.0.2.5001: Flags [.], seq 686352:689248, ack 1, win 58, options [nop,nop,TS val 27571393 ecr 27571393], length 2896
17:30:45.520164 IP 10.0.0.1.40768 > 10.0.0.2.5001: Flags [.], seq 689248:692144, ack 1, win 58, options [nop,nop,TS val 27571394 ecr 27571393], length 2896
17:30:45.522586 IP 10.0.0.1.40768 > 10.0.0.2.5001: Flags [.], seq 692144:695040, ack 1, win 58, options [nop,nop,TS val 27571394 ecr 27571394], length 2896
17:30:45.525008 IP 10.0.0.1.40768 > 10.0.0.2.5001: Flags [.], seq 695040:697936, ack 1, win 58, options [nop,nop,TS val 27571395 ecr 27571394], length 2896
17:30:45.527433 IP 10.0.0.1.40768 > 10.0.0.2.5001: Flags [.], seq 697936:700832, ack 1, win 58, options [nop,nop,TS val 27571396 ecr 27571395], length 2896
17:30:45.529854 IP 10.0.0.1.40768 > 10.0.0.2.5001: Flags [.], seq 700832:703728, ack 1, win 58, options [nop,nop,TS val 27571396 ecr 27571396], length 2896
17:30:45.532275 IP 10.0.0.1.40768 > 10.0.0.2.5001: Flags [.], seq 703728:706624, ack 1, win 58, options [nop,nop,TS val 27571397 ecr 27571396], length 2896
17:30:45.534697 IP 10.0.0.1.40768 > 10.0.0.2.5001: Flags [.], seq 706624:709520, ack 1, win 58, options [nop,nop,TS val 27571397 ecr 27571397], length 2896
17:30:45.537120 IP 10.0.0.1.40768 > 10.0.0.2.5001: Flags [.], seq 709520:712416, ack 1, win 58, options [nop,nop,TS val 27571398 ecr 27571397], length 2896
17:30:45.539542 IP 10.0.0.1.40768 > 10.0.0.2.5001: Flags [.], seq 712416:715312, ack 1, win 58, options [nop,nop,TS val 27571399 ecr 27571398], length 2896
17:30:45.541965 IP 10.0.0.1.40768 > 10.0.0.2.5001: Flags [.], seq 715312:718208, ack 1, win 58, options [nop,nop,TS val 27571399 ecr 27571399], length 2896
17:30:45.544387 IP 10.0.0.1.40768 > 10.0.0.2.5001: Flags [.], seq 718208:721104, ack 1, win 58, options [nop,nop,TS val 27571400 ecr 27571399], length 2896
17:30:45.546809 IP 10.0.0.1.40768 > 10.0.0.2.5001: Flags [.], seq 721104:724000, ack 1, win 58, options [nop,nop,TS val 27571400 ecr 27571400], length 2896
17:30:45.549232 IP 10.0.0.1.40768 > 10.0.0.2.5001: Flags [.], seq 724000:726896, ack 1, win 58, options [nop,nop,TS val 27571401 ecr 27571400], length 2896
17:30:45.551654 IP 10.0.0.1.40768 > 10.0.0.2.5001: Flags [.], seq 726896:729792, ack 1, win 58, options [nop,nop,TS val 27571402 ecr 27571401], length 2896
17:30:45.554077 IP 10.0.0.1.40768 > 10.0.0.2.5001: Flags [.], seq 729792:732688, ack 1, win 58, options [nop,nop,TS val 27571402 ecr 27571402], length 2896
17:30:45.556499 IP 10.0.0.1.40768 > 10.0.0.2.5001: Flags [.], seq 732688:735584, ack 1, win 58, options [nop,nop,TS val 27571403 ecr 27571402], length 2896
17:30:45.558922 IP 10.0.0.1.40768 > 10.0.0.2.5001: Flags [.], seq 735584:738480, ack 1, win 58, options [nop,nop,TS val 27571403 ecr 27571403], length 2896
17:30:45.561344 IP 10.0.0.1.40768 > 10.0.0.2.5001: Flags [.], seq 738480:741376, ack 1, win 58, options [nop,nop,TS val 27571404 ecr 27571403], length 2896
