tcpdump: verbose output suppressed, use -v or -vv for full protocol decode
listening on h1-eth0, link-type EN10MB (Ethernet), capture size 65535 bytes
17:30:44.943570 IP 10.0.0.1.40768 > 10.0.0.2.5001: Flags [.], seq 311894727:311897623, ack 3867670594, win 58, options [nop,nop,TS val 27571250 ecr 27571248], length 2896
17:30:44.943596 IP 10.0.0.2.5001 > 10.0.0.1.40768: Flags [.], ack 2896, win 973, options [nop,nop,TS val 27571272 ecr 27571250], length 0
17:30:44.945992 IP 10.0.0.1.40768 > 10.0.0.2.5001: Flags [.], seq 2896:5792, ack 1, win 58, options [nop,nop,TS val 27571250 ecr 27571248], length 2896
17:30:44.946013 IP 10.0.0.2.5001 > 10.0.0.1.40768: Flags [.], ack 5792, win 973, options [nop,nop,TS val 27571273 ecr 27571250], length 0
17:30:44.948414 IP 10.0.0.1.40768 > 10.0.0.2.5001: Flags [.], seq 5792:8688, ack 1, win 58, options [nop,nop,TS val 27571251 ecr 27571250], length 2896
17:30:44.948434 IP 10.0.0.2.5001 > 10.0.0.1.40768: Flags [.], ack 8688, win 973, options [nop,nop,TS val 27571273 ecr 27571251], length 0
17:30:44.950837 IP 10.0.0.1.40768 > 10.0.0.2.5001: Flags [.], seq 8688:11584, ack 1, win 58, options [nop,nop,TS val 27571251 ecr 27571251], length 2896
17:30:44.950857 IP 10.0.0.2.5001 > 10.0.0.1.40768: Flags [.], ack 11584, win 973, options [nop,nop,TS val 27571274 ecr 27571251], length 0
17:30:44.953259 IP 10.0.0.1.40768 > 10.0.0.2.5001: Flags [.], seq 11584:14480, ack 1, win 58, options [nop,nop,TS val 27571252 ecr 27571251], length 2896
17:30:44.953280 IP 10.0.0.2.5001 > 10.0.0.1.40768: Flags [.], ack 14480, win 973, options [nop,nop,TS val 27571274 ecr 27571252], length 0
17:30:44.955682 IP 10.0.0.1.40768 > 10.0.0.2.5001: Flags [.], seq 14480:17376, ack 1, win 58, options [nop,nop,TS val 27571253 ecr 27571252], length 2896
17:30:44.955702 IP 10.0.0.2.5001 > 10.0.0.1.40768: Flags [.], ack 17376, win 973, options [nop,nop,TS val 27571275 ecr 27571253], length 0
17:30:44.958104 IP 10.0.0.1.40768 > 10.0.0.2.5001: Flags [.], seq 17376:20272, ack 1, win 58, options [nop,nop,TS val 27571253 ecr 27571253], length 2896
17:30:44.958124 IP 10.0.0.2.5001 > 10.0.0.1.40768: Flags [.], ack 20272, win 973, options [nop,nop,TS val 27571276 ecr 27571253], length 0
17:30:44.960526 IP 10.0.0.1.40768 > 10.0.0.2.5001: Flags [.], seq 20272:23168, ack 1, win 58, options [nop,nop,TS val 27571254 ecr 27571253], length 2896
17:30:44.960546 IP 10.0.0.2.5001 > 10.0.0.1.40768: Flags [.], ack 23168, win 973, options [nop,nop,TS val 27571276 ecr 27571254], length 0
17:30:44.962949 IP 10.0.0.1.40768 > 10.0.0.2.5001: Flags [.], seq 23168:26064, ack 1, win 58, options [nop,nop,TS val 27571254 ecr 27571254], length 2896
17:30:44.962965 IP 10.0.0.2.5001 > 10.0.0.1.40768: Flags [.], ack 26064, win 973, options [nop,nop,TS val 27571277 ecr 27571254], length 0
17:30:44.965371 IP 10.0.0.1.40768 > 10.0.0.2.5001: Flags [.], seq 26064:28960, ack 1, win 58, options [nop,nop,TS val 27571255 ecr 27571255], length 2896
17:30:44.965392 IP 10.0.0.2.5001 > 10.0.0.1.40768: Flags [.], ack 28960, win 973, options [nop,nop,TS val 27571278 ecr 27571255], length 0
17:30:44.967793 IP 10.0.0.1.40768 > 10.0.0.2.5001: Flags [.], seq 28960:31856, ack 1, win 58, options [nop,nop,TS val 27571256 ecr 27571255], length 2896
17:30:44.967813 IP 10.0.0.2.5001 > 10.0.0.1.40768: Flags [.], ack 31856, win 973, options [nop,nop,TS val 27571278 ecr 27571256], length 0
17:30:44.970216 IP 10.0.0.1.40768 > 10.0.0.2.5001: Flags [.], seq 31856:34752, ack 1, win 58, options [nop,nop,TS val 27571256 ecr 27571256], length 2896
17:30:44.970235 IP 10.0.0.2.5001 > 10.0.0.1.40768: Flags [.], ack 34752, win 973, options [nop,nop,TS val 27571279 ecr 27571256], length 0
17:30:44.972638 IP 10.0.0.1.40768 > 10.0.0.2.5001: Flags [.], seq 34752:37648, ack 1, win 58, options [nop,nop,TS val 27571257 ecr 27571256], length 2896
17:30:44.972654 IP 10.0.0.2.5001 > 10.0.0.1.40768: Flags [.], ack 37648, win 973, options [nop,nop,TS val 27571279 ecr 27571257], length 0
17:30:44.975061 IP 10.0.0.1.40768 > 10.0.0.2.5001: Flags [.], seq 37648:40544, ack 1, win 58, options [nop,nop,TS val 27571258 ecr 27571257], length 2896
17:30:44.975076 IP 10.0.0.2.5001 > 10.0.0.1.40768: Flags [.], ack 40544, win 973, options [nop,nop,TS val 27571280 ecr 27571258], length 0
17:30:44.977483 IP 10.0.0.1.40768 > 10.0.0.2.5001: Flags [.], seq 40544:43440, ack 1, win 58, options [nop,nop,TS val 27571258 ecr 27571258], length 2896
17:30:44.977498 IP 10.0.0.2.5001 > 10.0.0.1.40768: Flags [.], ack 43440, win 973, options [nop,nop,TS val 27571281 ecr 27571258], length 0
17:30:44.979905 IP 10.0.0.1.40768 > 10.0.0.2.5001: Flags [.], seq 43440:46336, ack 1, win 58, options [nop,nop,TS val 27571259 ecr 27571258], length 2896
17:30:44.979921 IP 10.0.0.2.5001 > 10.0.0.1.40768: Flags [.], ack 46336, win 973, options [nop,nop,TS val 27571281 ecr 27571259], length 0
17:30:44.982328 IP 10.0.0.1.40768 > 10.0.0.2.5001: Flags [.], seq 46336:49232, ack 1, win 58, options [nop,nop,TS val 27571259 ecr 27571259], length 2896
17:30:44.982343 IP 10.0.0.2.5001 > 10.0.0.1.40768: Flags [.], ack 49232, win 973, options [nop,nop,TS val 27571282 ecr 27571259], length 0
17:30:44.984750 IP 10.0.0.1.40768 > 10.0.0.2.5001: Flags [.], seq 49232:52128, ack 1, win 58, options [nop,nop,TS val 27571260 ecr 27571259], length 2896
17:30:44.984765 IP 10.0.0.2.5001 > 10.0.0.1.40768: Flags [.], ack 52128, win 973, options [nop,nop,TS val 27571282 ecr 27571260], length 0
17:30:44.987173 IP 10.0.0.1.40768 > 10.0.0.2.5001: Flags [.], seq 52128:55024, ack 1, win 58, options [nop,nop,TS val 27571261 ecr 27571260], length 2896
17:30:44.987195 IP 10.0.0.2.5001 > 10.0.0.1.40768: Flags [.], ack 55024, win 973, options [nop,nop,TS val 27571283 ecr 27571261], length 0
17:30:44.989595 IP 10.0.0.1.40768 > 10.0.0.2.5001: Flags [.], seq 55024:57920, ack 1, win 58, options [nop,nop,TS val 27571261 ecr 27571261], length 2896
17:30:44.989611 IP 10.0.0.2.5001 > 10.0.0.1.40768: Flags [.], ack 57920, win 973, options [nop,nop,TS val 27571284 ecr 27571261], length 0
17:30:44.992018 IP 10.0.0.1.40768 > 10.0.0.2.5001: Flags [.], seq 57920:60816, ack 1, win 58, options [nop,nop,TS val 27571262 ecr 27571261], length 2896
17:30:44.992032 IP 10.0.0.2.5001 > 10.0.0.1.40768: Flags [.], ack 60816, win 973, options [nop,nop,TS val 27571284 ecr 27571262], length 0
17:30:44.994440 IP 10.0.0.1.40768 > 10.0.0.2.5001: Flags [.], seq 60816:63712, ack 1, win 58, options [nop,nop,TS val 27571262 ecr 27571262], length 2896
17:30:44.994457 IP 10.0.0.2.5001 > 10.0.0.1.40768: Flags [.], ack 63712, win 973, options [nop,nop,TS val 27571285 ecr 27571262], length 0
17:30:44.996862 IP 10.0.0.1.40768 > 10.0.0.2.5001: Flags [.], seq 63712:66608, ack 1, win 58, options [nop,nop,TS val 27571263 ecr 27571262], length 2896
17:30:44.996878 IP 10.0.0.2.5001 > 10.0.0.1.40768: Flags [.], ack 66608, win 973, options [nop,nop,TS val 27571285 ecr 27571263], length 0
17:30:44.999285 IP 10.0.0.1.40768 > 10.0.0.2.5001: Flags [.], seq 66608:69504, ack 1, win 58, options [nop,nop,TS val 27571264 ecr 27571263], length 2896
17:30:44.999300 IP 10.0.0.2.5001 > 10.0.0.1.40768: Flags [.], ack 69504, win 973, options [nop,nop,TS val 27571286 ecr 27571264], length 0
17:30:45.001707 IP 10.0.0.1.40768 > 10.0.0.2.5001: Flags [.], seq 69504:72400, ack 1, win 58, options [nop,nop,TS val 27571264 ecr 27571264], length 2896
17:30:45.001724 IP 10.0.0.2.5001 > 10.0.0.1.40768: Flags [.], ack 72400, win 973, options [nop,nop,TS val 27571287 ecr 27571264], length 0
17:30:45.004129 IP 10.0.0.1.40768 > 10.0.0.2.5001: Flags [.], seq 72400:75296, ack 1, win 58, options [nop,nop,TS val 27571265 ecr 27571264], length 2896
17:30:45.004145 IP 10.0.0.2.5001 > 10.0.0.1.40768: Flags [.], ack 75296, win 973, options [nop,nop,TS val 27571287 ecr 27571265], length 0
17:30:45.006552 IP 10.0.0.1.40768 > 10.0.0.2.5001: Flags [.], seq 75296:78192, ack 1, win 58, options [nop,nop,TS val 27571265 ecr 27571265], length 2896
17:30:45.006568 IP 10.0.0.2.5001 > 10.0.0.1.40768: Flags [.], ack 78192, win 973, options [nop,nop,TS val 27571288 ecr 27571265], length 0
17:30:45.008974 IP 10.0.0.1.40768 > 10.0.0.2.5001: Flags [.], seq 78192:81088, ack 1, win 58, options [nop,nop,TS val 27571266 ecr 27571265], length 2896
17:30:45.008989 IP 10.0.0.2.5001 > 10.0.0.1.40768: Flags [.], ack 81088, win 973, options [nop,nop,TS val 27571288 ecr 27571266], length 0
17:30:45.011397 IP 10.0.0.1.40768 > 10.0.0.2.5001: Flags [P.], seq 81088:83984, ack 1, win 58, options [nop,nop,TS val 27571267 ecr 27571266], length 2896
17:30:45.011413 IP 10.0.0.2.5001 > 10.0.0.1.40768: Flags [.], ack 83984, win 973, options [nop,nop,TS val 27571289 ecr 27571267], length 0
17:30:45.013819 IP 10.0.0.1.40768 > 10.0.0.2.5001: Flags [.], seq 83984:86880, ack 1, win 58, options [nop,nop,TS val 27571267 ecr 27571267], length 2896
17:30:45.013835 IP 10.0.0.2.5001 > 10.0.0.1.40768: Flags [.], ack 86880, win 973, options [nop,nop,TS val 27571290 ecr 27571267], length 0
17:30:45.016241 IP 10.0.0.1.40768 > 10.0.0.2.5001: Flags [.], seq 86880:89776, ack 1, win 58, options [nop,nop,TS val 27571268 ecr 27571267], length 2896
17:30:45.016256 IP 10.0.0.2.5001 > 10.0.0.1.40768: Flags [.], ack 89776, win 973, options [nop,nop,TS val 27571290 ecr 27571268], length 0
17:30:45.018664 IP 10.0.0.1.40768 > 10.0.0.2.5001: Flags [.], seq 89776:92672, ack 1, win 58, options [nop,nop,TS val 27571268 ecr 27571268], length 2896
17:30:45.018679 IP 10.0.0.2.5001 > 10.0.0.1.40768: Flags [.], ack 92672, win 973, options [nop,nop,TS val 27571291 ecr 27571268], length 0
17:30:45.021086 IP 10.0.0.1.40768 > 10.0.0.2.5001: Flags [.], seq 92672:95568, ack 1, win 58, options [nop,nop,TS val 27571269 ecr 27571268], length 2896
17:30:45.021101 IP 10.0.0.2.5001 > 10.0.0.1.40768: Flags [.], ack 95568, win 973, options [nop,nop,TS val 27571291 ecr 27571269], length 0
17:30:45.023508 IP 10.0.0.1.40768 > 10.0.0.2.5001: Flags [.], seq 95568:98464, ack 1, win 58, options [nop,nop,TS val 27571270 ecr 27571269], length 2896
17:30:45.023524 IP 10.0.0.2.5001 > 10.0.0.1.40768: Flags [.], ack 98464, win 973, options [nop,nop,TS val 27571292 ecr 27571270], length 0
17:30:45.025936 IP 10.0.0.1.40768 > 10.0.0.2.5001: Flags [.], seq 98464:101360, ack 1, win 58, options [nop,nop,TS val 27571270 ecr 27571270], length 2896
17:30:45.028359 IP 10.0.0.1.40768 > 10.0.0.2.5001: Flags [.], seq 101360:104256, ack 1, win 58, options [nop,nop,TS val 27571271 ecr 27571270], length 2896
17:30:45.030780 IP 10.0.0.1.40768 > 10.0.0.2.5001: Flags [.], seq 104256:107152, ack 1, win 58, options [nop,nop,TS val 27571271 ecr 27571271], length 2896
17:30:45.030814 IP 10.0.0.2.5001 > 10.0.0.1.40768: Flags [.], ack 101360, win 973, options [nop,nop,TS val 27571294 ecr 27571270], length 0
17:30:45.030832 IP 10.0.0.2.5001 > 10.0.0.1.40768: Flags [.], ack 104256, win 973, options [nop,nop,TS val 27571294 ecr 27571271], length 0
17:30:45.030843 IP 10.0.0.2.5001 > 10.0.0.1.40768: Flags [.], ack 107152, win 973, options [nop,nop,TS val 27571294 ecr 27571271], length 0
17:30:45.033200 IP 10.0.0.1.40768 > 10.0.0.2.5001: Flags [.], seq 107152:110048, ack 1, win 58, options [nop,nop,TS val 27571272 ecr 27571271], length 2896
17:30:45.033271 IP 10.0.0.2.5001 > 10.0.0.1.40768: Flags [.], ack 110048, win 973, options [nop,nop,TS val 27571294 ecr 27571272], length 0
17:30:45.035622 IP 10.0.0.1.40768 > 10.0.0.2.5001: Flags [.], seq 110048:112944, ack 1, win 58, options [nop,nop,TS val 27571273 ecr 27571272], length 2896
17:30:45.035641 IP 10.0.0.2.5001 > 10.0.0.1.40768: Flags [.], ack 112944, win 973, options [nop,nop,TS val 27571295 ecr 27571273], length 0
17:30:45.038064 IP 10.0.0.1.40768 > 10.0.0.2.5001: Flags [.], seq 112944:115840, ack 1, win 58, options [nop,nop,TS val 27571273 ecr 27571273], length 2896
17:30:45.038083 IP 10.0.0.2.5001 > 10.0.0.1.40768: Flags [.], ack 115840, win 973, options [nop,nop,TS val 27571296 ecr 27571273], length 0
17:30:45.040466 IP 10.0.0.1.40768 > 10.0.0.2.5001: Flags [.], seq 115840:118736, ack 1, win 58, options [nop,nop,TS val 27571274 ecr 27571273], length 2896
17:30:45.041579 IP 10.0.0.2.5001 > 10.0.0.1.40768: Flags [.], ack 118736, win 973, options [nop,nop,TS val 27571297 ecr 27571274], length 0
17:30:45.042889 IP 10.0.0.1.40768 > 10.0.0.2.5001: Flags [.], seq 118736:121632, ack 1, win 58, options [nop,nop,TS val 27571274 ecr 27571274], length 2896
17:30:45.042911 IP 10.0.0.2.5001 > 10.0.0.1.40768: Flags [.], ack 121632, win 973, options [nop,nop,TS val 27571297 ecr 27571274], length 0
17:30:45.045312 IP 10.0.0.1.40768 > 10.0.0.2.5001: Flags [.], seq 121632:124528, ack 1, win 58, options [nop,nop,TS val 27571275 ecr 27571274], length 2896
17:30:45.045337 IP 10.0.0.2.5001 > 10.0.0.1.40768: Flags [.], ack 124528, win 973, options [nop,nop,TS val 27571298 ecr 27571275], length 0
17:30:45.047733 IP 10.0.0.1.40768 > 10.0.0.2.5001: Flags [.], seq 124528:127424, ack 1, win 58, options [nop,nop,TS val 27571276 ecr 27571275], length 2896
17:30:45.047750 IP 10.0.0.2.5001 > 10.0.0.1.40768: Flags [.], ack 127424, win 973, options [nop,nop,TS val 27571298 ecr 27571276], length 0
17:30:45.050157 IP 10.0.0.1.40768 > 10.0.0.2.5001: Flags [.], seq 127424:130320, ack 1, win 58, options [nop,nop,TS val 27571276 ecr 27571276], length 2896
17:30:45.050179 IP 10.0.0.2.5001 > 10.0.0.1.40768: Flags [.], ack 130320, win 973, options [nop,nop,TS val 27571299 ecr 27571276], length 0
17:30:45.052578 IP 10.0.0.1.40768 > 10.0.0.2.5001: Flags [.], seq 130320:133216, ack 1, win 58, options [nop,nop,TS val 27571277 ecr 27571276], length 2896
17:30:45.052595 IP 10.0.0.2.5001 > 10.0.0.1.40768: Flags [.], ack 133216, win 973, options [nop,nop,TS val 27571299 ecr 27571277], length 0
17:30:45.055001 IP 10.0.0.1.40768 > 10.0.0.2.5001: Flags [.], seq 133216:136112, ack 1, win 58, options [nop,nop,TS val 27571278 ecr 27571277], length 2896
17:30:45.055018 IP 10.0.0.2.5001 > 10.0.0.1.40768: Flags [.], ack 136112, win 973, options [nop,nop,TS val 27571300 ecr 27571278], length 0
17:30:45.057423 IP 10.0.0.1.40768 > 10.0.0.2.5001: Flags [.], seq 136112:139008, ack 1, win 58, options [nop,nop,TS val 27571278 ecr 27571278], length 2896
17:30:45.057440 IP 10.0.0.2.5001 > 10.0.0.1.40768: Flags [.], ack 139008, win 973, options [nop,nop,TS val 27571301 ecr 27571278], length 0
17:30:45.059845 IP 10.0.0.1.40768 > 10.0.0.2.5001: Flags [P.], seq 139008:141904, ack 1, win 58, options [nop,nop,TS val 27571279 ecr 27571278], length 2896
17:30:45.059861 IP 10.0.0.2.5001 > 10.0.0.1.40768: Flags [.], ack 141904, win 973, options [nop,nop,TS val 27571301 ecr 27571279], length 0
17:30:45.062271 IP 10.0.0.1.40768 > 10.0.0.2.5001: Flags [.], seq 141904:144800, ack 1, win 58, options [nop,nop,TS val 27571279 ecr 27571279], length 2896
17:30:45.062296 IP 10.0.0.2.5001 > 10.0.0.1.40768: Flags [.], ack 144800, win 973, options [nop,nop,TS val 27571302 ecr 27571279], length 0
17:30:45.064692 IP 10.0.0.1.40768 > 10.0.0.2.5001: Flags [.], seq 144800:147696, ack 1, win 58, options [nop,nop,TS val 27571280 ecr 27571279], length 2896
17:30:45.064715 IP 10.0.0.2.5001 > 10.0.0.1.40768: Flags [.], ack 147696, win 973, options [nop,nop,TS val 27571302 ecr 27571280], length 0
17:30:45.067113 IP 10.0.0.1.40768 > 10.0.0.2.5001: Flags [.], seq 147696:150592, ack 1, win 58, options [nop,nop,TS val 27571281 ecr 27571280], length 2896
17:30:45.067135 IP 10.0.0.2.5001 > 10.0.0.1.40768: Flags [.], ack 150592, win 973, options [nop,nop,TS val 27571303 ecr 27571281], length 0
17:30:45.069537 IP 10.0.0.1.40768 > 10.0.0.2.5001: Flags [.], seq 150592:153488, ack 1, win 58, options [nop,nop,TS val 27571281 ecr 27571281], length 2896
17:30:45.069817 IP 10.0.0.2.5001 > 10.0.0.1.40768: Flags [.], ack 153488, win 973, options [nop,nop,TS val 27571304 ecr 27571281], length 0
17:30:45.071960 IP 10.0.0.1.40768 > 10.0.0.2.5001: Flags [.], seq 153488:156384, ack 1, win 58, options [nop,nop,TS val 27571282 ecr 27571281], length 2896
17:30:45.071989 IP 10.0.0.2.5001 > 10.0.0.1.40768: Flags [.], ack 156384, win 973, options [nop,nop,TS val 27571304 ecr 27571282], length 0
17:30:45.074382 IP 10.0.0.1.40768 > 10.0.0.2.5001: Flags [.], seq 156384:159280, ack 1, win 58, options [nop,nop,TS val 27571282 ecr 27571282], length 2896
17:30:45.074412 IP 10.0.0.2.5001 > 10.0.0.1.40768: Flags [.], ack 159280, win 973, options [nop,nop,TS val 27571305 ecr 27571282], length 0
17:30:45.076804 IP 10.0.0.1.40768 > 10.0.0.2.5001: Flags [.], seq 159280:162176, ack 1, win 58, options [nop,nop,TS val 27571283 ecr 27571282], length 2896
17:30:45.076828 IP 10.0.0.2.5001 > 10.0.0.1.40768: Flags [.], ack 162176, win 973, options [nop,nop,TS val 27571305 ecr 27571283], length 0
17:30:45.079224 IP 10.0.0.1.40768 > 10.0.0.2.5001: Flags [.], seq 162176:165072, ack 1, win 58, options [nop,nop,TS val 27571284 ecr 27571283], length 2896
17:30:45.079242 IP 10.0.0.2.5001 > 10.0.0.1.40768: Flags [.], ack 165072, win 973, options [nop,nop,TS val 27571306 ecr 27571284], length 0
17:30:45.081647 IP 10.0.0.1.40768 > 10.0.0.2.5001: Flags [.], seq 165072:167968, ack 1, win 58, options [nop,nop,TS val 27571284 ecr 27571284], length 2896
17:30:45.081669 IP 10.0.0.2.5001 > 10.0.0.1.40768: Flags [.], ack 167968, win 973, options [nop,nop,TS val 27571307 ecr 27571284], length 0
17:30:45.084069 IP 10.0.0.1.40768 > 10.0.0.2.5001: Flags [.], seq 167968:170864, ack 1, win 58, options [nop,nop,TS val 27571285 ecr 27571284], length 2896
17:30:45.084086 IP 10.0.0.2.5001 > 10.0.0.1.40768: Flags [.], ack 170864, win 973, options [nop,nop,TS val 27571307 ecr 27571285], length 0
17:30:45.086513 IP 10.0.0.1.40768 > 10.0.0.2.5001: Flags [.], seq 170864:173760, ack 1, win 58, options [nop,nop,TS val 27571285 ecr 27571285], length 2896
17:30:45.086535 IP 10.0.0.2.5001 > 10.0.0.1.40768: Flags [.], ack 173760, win 973, options [nop,nop,TS val 27571308 ecr 27571285], length 0
17:30:45.088915 IP 10.0.0.1.40768 > 10.0.0.2.5001: Flags [.], seq 173760:176656, ack 1, win 58, options [nop,nop,TS val 27571286 ecr 27571285], length 2896
17:30:45.088933 IP 10.0.0.2.5001 > 10.0.0.1.40768: Flags [.], ack 176656, win 973, options [nop,nop,TS val 27571308 ecr 27571286], length 0
17:30:45.091336 IP 10.0.0.1.40768 > 10.0.0.2.5001: Flags [.], seq 176656:179552, ack 1, win 58, options [nop,nop,TS val 27571287 ecr 27571286], length 2896
17:30:45.091353 IP 10.0.0.2.5001 > 10.0.0.1.40768: Flags [.], ack 179552, win 973, options [nop,nop,TS val 27571309 ecr 27571287], length 0
17:30:45.093759 IP 10.0.0.1.40768 > 10.0.0.2.5001: Flags [.], seq 179552:182448, ack 1, win 58, options [nop,nop,TS val 27571287 ecr 27571287], length 2896
17:30:45.093775 IP 10.0.0.2.5001 > 10.0.0.1.40768: Flags [.], ack 182448, win 973, options [nop,nop,TS val 27571310 ecr 27571287], length 0
17:30:45.096181 IP 10.0.0.1.40768 > 10.0.0.2.5001: Flags [.], seq 182448:185344, ack 1, win 58, options [nop,nop,TS val 27571288 ecr 27571287], length 2896
17:30:45.096198 IP 10.0.0.2.5001 > 10.0.0.1.40768: Flags [.], ack 185344, win 973, options [nop,nop,TS val 27571310 ecr 27571288], length 0
17:30:45.098603 IP 10.0.0.1.40768 > 10.0.0.2.5001: Flags [.], seq 185344:188240, ack 1, win 58, options [nop,nop,TS val 27571288 ecr 27571288], length 2896
17:30:45.098620 IP 10.0.0.2.5001 > 10.0.0.1.40768: Flags [.], ack 188240, win 973, options [nop,nop,TS val 27571311 ecr 27571288], length 0
17:30:45.101025 IP 10.0.0.1.40768 > 10.0.0.2.5001: Flags [.], seq 188240:191136, ack 1, win 58, options [nop,nop,TS val 27571289 ecr 27571288], length 2896
17:30:45.101041 IP 10.0.0.2.5001 > 10.0.0.1.40768: Flags [.], ack 191136, win 973, options [nop,nop,TS val 27571311 ecr 27571289], length 0
17:30:45.103448 IP 10.0.0.1.40768 > 10.0.0.2.5001: Flags [.], seq 191136:194032, ack 1, win 58, options [nop,nop,TS val 27571290 ecr 27571289], length 2896
17:30:45.103470 IP 10.0.0.2.5001 > 10.0.0.1.40768: Flags [.], ack 194032, win 973, options [nop,nop,TS val 27571312 ecr 27571290], length 0
17:30:45.105870 IP 10.0.0.1.40768 > 10.0.0.2.5001: Flags [.], seq 194032:196928, ack 1, win 58, options [nop,nop,TS val 27571290 ecr 27571290], length 2896
17:30:45.105887 IP 10.0.0.2.5001 > 10.0.0.1.40768: Flags [.], ack 196928, win 973, options [nop,nop,TS val 27571313 ecr 27571290], length 0
17:30:45.108293 IP 10.0.0.1.40768 > 10.0.0.2.5001: Flags [.], seq 196928:199824, ack 1, win 58, options [nop,nop,TS val 27571291 ecr 27571290], length 2896
17:30:45.108307 IP 10.0.0.2.5001 > 10.0.0.1.40768: Flags [.], ack 199824, win 973, options [nop,nop,TS val 27571313 ecr 27571291], length 0
17:30:45.110715 IP 10.0.0.1.40768 > 10.0.0.2.5001: Flags [.], seq 199824:202720, ack 1, win 58, options [nop,nop,TS val 27571291 ecr 27571291], length 2896
17:30:45.110731 IP 10.0.0.2.5001 > 10.0.0.1.40768: Flags [.], ack 202720, win 973, options [nop,nop,TS val 27571314 ecr 27571291], length 0
17:30:45.113138 IP 10.0.0.1.40768 > 10.0.0.2.5001: Flags [.], seq 202720:205616, ack 1, win 58, options [nop,nop,TS val 27571292 ecr 27571291], length 2896
17:30:45.113356 IP 10.0.0.2.5001 > 10.0.0.1.40768: Flags [.], ack 205616, win 973, options [nop,nop,TS val 27571315 ecr 27571292], length 0
17:30:45.115562 IP 10.0.0.1.40768 > 10.0.0.2.5001: Flags [.], seq 205616:208512, ack 1, win 58, options [nop,nop,TS val 27571293 ecr 27571292], length 2896
17:30:45.115585 IP 10.0.0.2.5001 > 10.0.0.1.40768: Flags [.], ack 208512, win 973, options [nop,nop,TS val 27571315 ecr 27571293], length 0
17:30:45.117983 IP 10.0.0.1.40768 > 10.0.0.2.5001: Flags [.], seq 208512:211408, ack 1, win 58, options [nop,nop,TS val 27571293 ecr 27571292], length 2896
17:30:45.118008 IP 10.0.0.2.5001 > 10.0.0.1.40768: Flags [.], ack 211408, win 973, options [nop,nop,TS val 27571316 ecr 27571293], length 0
17:30:45.120405 IP 10.0.0.1.40768 > 10.0.0.2.5001: Flags [.], seq 211408:214304, ack 1, win 58, options [nop,nop,TS val 27571294 ecr 27571292], length 2896
17:30:45.120422 IP 10.0.0.2.5001 > 10.0.0.1.40768: Flags [.], ack 214304, win 973, options [nop,nop,TS val 27571316 ecr 27571294], length 0
17:30:45.122827 IP 10.0.0.1.40768 > 10.0.0.2.5001: Flags [.], seq 214304:217200, ack 1, win 58, options [nop,nop,TS val 27571294 ecr 27571294], length 2896
17:30:45.122844 IP 10.0.0.2.5001 > 10.0.0.1.40768: Flags [.], ack 217200, win 973, options [nop,nop,TS val 27571317 ecr 27571294], length 0
17:30:45.125249 IP 10.0.0.1.40768 > 10.0.0.2.5001: Flags [.], seq 217200:220096, ack 1, win 58, options [nop,nop,TS val 27571295 ecr 27571294], length 2896
17:30:45.125346 IP 10.0.0.2.5001 > 10.0.0.1.40768: Flags [.], ack 220096, win 973, options [nop,nop,TS val 27571318 ecr 27571295], length 0
17:30:45.127672 IP 10.0.0.1.40768 > 10.0.0.2.5001: Flags [.], seq 220096:222992, ack 1, win 58, options [nop,nop,TS val 27571296 ecr 27571295], length 2896
17:30:45.127688 IP 10.0.0.2.5001 > 10.0.0.1.40768: Flags [.], ack 222992, win 973, options [nop,nop,TS val 27571318 ecr 27571296], length 0
17:30:45.130094 IP 10.0.0.1.40768 > 10.0.0.2.5001: Flags [.], seq 222992:225888, ack 1, win 58, options [nop,nop,TS val 27571296 ecr 27571296], length 2896
17:30:45.130110 IP 10.0.0.2.5001 > 10.0.0.1.40768: Flags [.], ack 225888, win 973, options [nop,nop,TS val 27571319 ecr 27571296], length 0
17:30:45.132517 IP 10.0.0.1.40768 > 10.0.0.2.5001: Flags [.], seq 225888:228784, ack 1, win 58, options [nop,nop,TS val 27571297 ecr 27571297], length 2896
17:30:45.132532 IP 10.0.0.2.5001 > 10.0.0.1.40768: Flags [.], ack 228784, win 973, options [nop,nop,TS val 27571319 ecr 27571297], length 0
17:30:45.134939 IP 10.0.0.1.40768 > 10.0.0.2.5001: Flags [.], seq 228784:231680, ack 1, win 58, options [nop,nop,TS val 27571297 ecr 27571297], length 2896
17:30:45.134960 IP 10.0.0.2.5001 > 10.0.0.1.40768: Flags [.], ack 231680, win 973, options [nop,nop,TS val 27571320 ecr 27571297], length 0
17:30:45.137362 IP 10.0.0.1.40768 > 10.0.0.2.5001: Flags [.], seq 231680:234576, ack 1, win 58, options [nop,nop,TS val 27571298 ecr 27571298], length 2896
17:30:45.137836 IP 10.0.0.2.5001 > 10.0.0.1.40768: Flags [.], ack 234576, win 973, options [nop,nop,TS val 27571321 ecr 27571298], length 0
17:30:45.139784 IP 10.0.0.1.40768 > 10.0.0.2.5001: Flags [.], seq 234576:237472, ack 1, win 58, options [nop,nop,TS val 27571299 ecr 27571298], length 2896
17:30:45.139800 IP 10.0.0.2.5001 > 10.0.0.1.40768: Flags [.], ack 237472, win 973, options [nop,nop,TS val 27571321 ecr 27571299], length 0
17:30:45.142207 IP 10.0.0.1.40768 > 10.0.0.2.5001: Flags [.], seq 237472:240368, ack 1, win 58, options [nop,nop,TS val 27571299 ecr 27571299], length 2896
17:30:45.142223 IP 10.0.0.2.5001 > 10.0.0.1.40768: Flags [.], ack 240368, win 973, options [nop,nop,TS val 27571322 ecr 27571299], length 0
17:30:45.144629 IP 10.0.0.1.40768 > 10.0.0.2.5001: Flags [.], seq 240368:243264, ack 1, win 58, options [nop,nop,TS val 27571300 ecr 27571299], length 2896
17:30:45.144644 IP 10.0.0.2.5001 > 10.0.0.1.40768: Flags [.], ack 243264, win 973, options [nop,nop,TS val 27571322 ecr 27571300], length 0
17:30:45.147051 IP 10.0.0.1.40768 > 10.0.0.2.5001: Flags [.], seq 243264:246160, ack 1, win 58, options [nop,nop,TS val 27571301 ecr 27571300], length 2896
17:30:45.147067 IP 10.0.0.2.5001 > 10.0.0.1.40768: Flags [.], ack 246160, win 973, options [nop,nop,TS val 27571323 ecr 27571301], length 0
17:30:45.149473 IP 10.0.0.1.40768 > 10.0.0.2.5001: Flags [.], seq 246160:249056, ack 1, win 58, options [nop,nop,TS val 27571301 ecr 27571301], length 2896
17:30:45.149490 IP 10.0.0.2.5001 > 10.0.0.1.40768: Flags [.], ack 249056, win 973, options [nop,nop,TS val 27571324 ecr 27571301], length 0
17:30:45.151896 IP 10.0.0.1.40768 > 10.0.0.2.5001: Flags [.], seq 249056:251952, ack 1, win 58, options [nop,nop,TS val 27571302 ecr 27571301], length 2896
17:30:45.151911 IP 10.0.0.2.5001 > 10.0.0.1.40768: Flags [.], ack 251952, win 973, options [nop,nop,TS val 27571324 ecr 27571302], length 0
17:30:45.154318 IP 10.0.0.1.40768 > 10.0.0.2.5001: Flags [.], seq 251952:254848, ack 1, win 58, options [nop,nop,TS val 27571302 ecr 27571302], length 2896
17:30:45.154334 IP 10.0.0.2.5001 > 10.0.0.1.40768: Flags [.], ack 254848, win 973, options [nop,nop,TS val 27571325 ecr 27571302], length 0
17:30:45.156741 IP 10.0.0.1.40768 > 10.0.0.2.5001: Flags [.], seq 254848:257744, ack 1, win 58, options [nop,nop,TS val 27571303 ecr 27571302], length 2896
17:30:45.156756 IP 10.0.0.2.5001 > 10.0.0.1.40768: Flags [.], ack 257744, win 973, options [nop,nop,TS val 27571325 ecr 27571303], length 0
17:30:45.159164 IP 10.0.0.1.40768 > 10.0.0.2.5001: Flags [.], seq 257744:260640, ack 1, win 58, options [nop,nop,TS val 27571304 ecr 27571303], length 2896
17:30:45.159183 IP 10.0.0.2.5001 > 10.0.0.1.40768: Flags [.], ack 260640, win 973, options [nop,nop,TS val 27571326 ecr 27571304], length 0
17:30:45.161585 IP 10.0.0.1.40768 > 10.0.0.2.5001: Flags [.], seq 260640:263536, ack 1, win 58, options [nop,nop,TS val 27571304 ecr 27571304], length 2896
17:30:45.161602 IP 10.0.0.2.5001 > 10.0.0.1.40768: Flags [.], ack 263536, win 973, options [nop,nop,TS val 27571327 ecr 27571304], length 0
17:30:45.164008 IP 10.0.0.1.40768 > 10.0.0.2.5001: Flags [.], seq 263536:266432, ack 1, win 58, options [nop,nop,TS val 27571305 ecr 27571304], length 2896
17:30:45.164160 IP 10.0.0.2.5001 > 10.0.0.1.40768: Flags [.], ack 266432, win 973, options [nop,nop,TS val 27571327 ecr 27571305], length 0
17:30:45.166431 IP 10.0.0.1.40768 > 10.0.0.2.5001: Flags [.], seq 266432:269328, ack 1, win 58, options [nop,nop,TS val 27571305 ecr 27571305], length 2896
17:30:45.166479 IP 10.0.0.2.5001 > 10.0.0.1.40768: Flags [.], ack 269328, win 973, options [nop,nop,TS val 27571328 ecr 27571305], length 0
17:30:45.168853 IP 10.0.0.1.40768 > 10.0.0.2.5001: Flags [.], seq 269328:272224, ack 1, win 58, options [nop,nop,TS val 27571306 ecr 27571305], length 2896
17:30:45.168869 IP 10.0.0.2.5001 > 10.0.0.1.40768: Flags [.], ack 272224, win 973, options [nop,nop,TS val 27571328 ecr 27571306], length 0
17:30:45.171275 IP 10.0.0.1.40768 > 10.0.0.2.5001: Flags [.], seq 272224:275120, ack 1, win 58, options [nop,nop,TS val 27571307 ecr 27571306], length 2896
17:30:45.171291 IP 10.0.0.2.5001 > 10.0.0.1.40768: Flags [.], ack 275120, win 973, options [nop,nop,TS val 27571329 ecr 27571307], length 0
17:30:45.173697 IP 10.0.0.1.40768 > 10.0.0.2.5001: Flags [.], seq 275120:278016, ack 1, win 58, options [nop,nop,TS val 27571307 ecr 27571307], length 2896
17:30:45.173713 IP 10.0.0.2.5001 > 10.0.0.1.40768: Flags [.], ack 278016, win 973, options [nop,nop,TS val 27571330 ecr 27571307], length 0
17:30:45.176120 IP6 :: > ff02::1:ff03:65ac: ICMP6, neighbor solicitation, who has fe80::5c5b:70ff:fe03:65ac, length 24
17:30:45.176182 IP 10.0.0.1.40768 > 10.0.0.2.5001: Flags [.], seq 278016:280912, ack 1, win 58, options [nop,nop,TS val 27571308 ecr 27571307], length 2896
17:30:45.176198 IP 10.0.0.2.5001 > 10.0.0.1.40768: Flags [.], ack 280912, win 973, options [nop,nop,TS val 27571330 ecr 27571308], length 0
17:30:45.178611 IP 10.0.0.1.40768 > 10.0.0.2.5001: Flags [.], seq 280912:283808, ack 1, win 58, options [nop,nop,TS val 27571308 ecr 27571308], length 2896
17:30:45.178932 IP 10.0.0.2.5001 > 10.0.0.1.40768: Flags [.], ack 283808, win 973, options [nop,nop,TS val 27571331 ecr 27571308], length 0
17:30:45.181032 IP 10.0.0.1.40768 > 10.0.0.2.5001: Flags [.], seq 283808:286704, ack 1, win 58, options [nop,nop,TS val 27571309 ecr 27571308], length 2896
17:30:45.181367 IP 10.0.0.2.5001 > 10.0.0.1.40768: Flags [.], ack 286704, win 973, options [nop,nop,TS val 27571332 ecr 27571309], length 0
17:30:45.183455 IP 10.0.0.1.40768 > 10.0.0.2.5001: Flags [.], seq 286704:289600, ack 1, win 58, options [nop,nop,TS val 27571310 ecr 27571309], length 2896
17:30:45.183484 IP 10.0.0.2.5001 > 10.0.0.1.40768: Flags [.], ack 289600, win 973, options [nop,nop,TS val 27571332 ecr 27571310], length 0
17:30:45.185875 IP 10.0.0.1.40768 > 10.0.0.2.5001: Flags [.], seq 289600:292496, ack 1, win 58, options [nop,nop,TS val 27571310 ecr 27571310], length 2896
17:30:45.185903 IP 10.0.0.2.5001 > 10.0.0.1.40768: Flags [.], ack 292496, win 973, options [nop,nop,TS val 27571333 ecr 27571310], length 0
17:30:45.188294 IP 10.0.0.1.40768 > 10.0.0.2.5001: Flags [.], seq 292496:295392, ack 1, win 58, options [nop,nop,TS val 27571311 ecr 27571310], length 2896
17:30:45.188311 IP 10.0.0.2.5001 > 10.0.0.1.40768: Flags [.], ack 295392, win 973, options [nop,nop,TS val 27571333 ecr 27571311], length 0
17:30:45.190717 IP 10.0.0.1.40768 > 10.0.0.2.5001: Flags [.], seq 295392:298288, ack 1, win 58, options [nop,nop,TS val 27571311 ecr 27571311], length 2896
17:30:45.190734 IP 10.0.0.2.5001 > 10.0.0.1.40768: Flags [.], ack 298288, win 973, options [nop,nop,TS val 27571334 ecr 27571311], length 0
17:30:45.193139 IP 10.0.0.1.40768 > 10.0.0.2.5001: Flags [.], seq 298288:301184, ack 1, win 58, options [nop,nop,TS val 27571312 ecr 27571311], length 2896
17:30:45.193154 IP 10.0.0.2.5001 > 10.0.0.1.40768: Flags [.], ack 301184, win 973, options [nop,nop,TS val 27571334 ecr 27571312], length 0
17:30:45.195562 IP 10.0.0.1.40768 > 10.0.0.2.5001: Flags [P.], seq 301184:304080, ack 1, win 58, options [nop,nop,TS val 27571313 ecr 27571312], length 2896
17:30:45.195579 IP 10.0.0.2.5001 > 10.0.0.1.40768: Flags [.], ack 304080, win 973, options [nop,nop,TS val 27571335 ecr 27571313], length 0
17:30:45.197984 IP 10.0.0.1.40768 > 10.0.0.2.5001: Flags [.], seq 304080:306976, ack 1, win 58, options [nop,nop,TS val 27571313 ecr 27571313], length 2896
17:30:45.198000 IP 10.0.0.2.5001 > 10.0.0.1.40768: Flags [.], ack 306976, win 973, options [nop,nop,TS val 27571336 ecr 27571313], length 0
17:30:45.200409 IP 10.0.0.1.40768 > 10.0.0.2.5001: Flags [.], seq 306976:309872, ack 1, win 58, options [nop,nop,TS val 27571314 ecr 27571313], length 2896
17:30:45.200433 IP 10.0.0.2.5001 > 10.0.0.1.40768: Flags [.], ack 309872, win 973, options [nop,nop,TS val 27571336 ecr 27571314], length 0
17:30:45.202831 IP 10.0.0.1.40768 > 10.0.0.2.5001: Flags [.], seq 309872:312768, ack 1, win 58, options [nop,nop,TS val 27571314 ecr 27571314], length 2896
17:30:45.202855 IP 10.0.0.2.5001 > 10.0.0.1.40768: Flags [.], ack 312768, win 973, options [nop,nop,TS val 27571337 ecr 27571314], length 0
17:30:45.205252 IP 10.0.0.1.40768 > 10.0.0.2.5001: Flags [.], seq 312768:315664, ack 1, win 58, options [nop,nop,TS val 27571315 ecr 27571315], length 2896
17:30:45.205270 IP 10.0.0.2.5001 > 10.0.0.1.40768: Flags [.], ack 315664, win 973, options [nop,nop,TS val 27571337 ecr 27571315], length 0
17:30:45.207674 IP 10.0.0.1.40768 > 10.0.0.2.5001: Flags [.], seq 315664:318560, ack 1, win 58, options [nop,nop,TS val 27571316 ecr 27571315], length 2896
17:30:45.207691 IP 10.0.0.2.5001 > 10.0.0.1.40768: Flags [.], ack 318560, win 973, options [nop,nop,TS val 27571338 ecr 27571316], length 0
17:30:45.210096 IP 10.0.0.1.40768 > 10.0.0.2.5001: Flags [.], seq 318560:321456, ack 1, win 58, options [nop,nop,TS val 27571316 ecr 27571316], length 2896
17:30:45.210116 IP 10.0.0.2.5001 > 10.0.0.1.40768: Flags [.], ack 321456, win 973, options [nop,nop,TS val 27571339 ecr 27571316], length 0
17:30:45.212518 IP 10.0.0.1.40768 > 10.0.0.2.5001: Flags [.], seq 321456:324352, ack 1, win 58, options [nop,nop,TS val 27571317 ecr 27571316], length 2896
17:30:45.212533 IP 10.0.0.2.5001 > 10.0.0.1.40768: Flags [.], ack 324352, win 973, options [nop,nop,TS val 27571339 ecr 27571317], length 0
17:30:45.214941 IP 10.0.0.1.40768 > 10.0.0.2.5001: Flags [.], seq 324352:327248, ack 1, win 58, options [nop,nop,TS val 27571317 ecr 27571317], length 2896
17:30:45.214957 IP 10.0.0.2.5001 > 10.0.0.1.40768: Flags [.], ack 327248, win 973, options [nop,nop,TS val 27571340 ecr 27571317], length 0
17:30:45.217363 IP 10.0.0.1.40768 > 10.0.0.2.5001: Flags [.], seq 327248:330144, ack 1, win 58, options [nop,nop,TS val 27571318 ecr 27571318], length 2896
17:30:45.217379 IP 10.0.0.2.5001 > 10.0.0.1.40768: Flags [.], ack 330144, win 973, options [nop,nop,TS val 27571341 ecr 27571318], length 0
17:30:45.219786 IP 10.0.0.1.40768 > 10.0.0.2.5001: Flags [.], seq 330144:333040, ack 1, win 58, options [nop,nop,TS val 27571319 ecr 27571318], length 2896
17:30:45.219801 IP 10.0.0.2.5001 > 10.0.0.1.40768: Flags [.], ack 333040, win 973, options [nop,nop,TS val 27571341 ecr 27571319], length 0
17:30:45.222208 IP 10.0.0.1.40768 > 10.0.0.2.5001: Flags [.], seq 333040:335936, ack 1, win 58, options [nop,nop,TS val 27571319 ecr 27571319], length 2896
17:30:45.222224 IP 10.0.0.2.5001 > 10.0.0.1.40768: Flags [.], ack 335936, win 973, options [nop,nop,TS val 27571342 ecr 27571319], length 0
17:30:45.224630 IP 10.0.0.1.40768 > 10.0.0.2.5001: Flags [.], seq 335936:338832, ack 1, win 58, options [nop,nop,TS val 27571320 ecr 27571319], length 2896
17:30:45.224646 IP 10.0.0.2.5001 > 10.0.0.1.40768: Flags [.], ack 338832, win 973, options [nop,nop,TS val 27571342 ecr 27571320], length 0
17:30:45.227053 IP 10.0.0.1.40768 > 10.0.0.2.5001: Flags [.], seq 338832:341728, ack 1, win 58, options [nop,nop,TS val 27571321 ecr 27571320], length 2896
17:30:45.227069 IP 10.0.0.2.5001 > 10.0.0.1.40768: Flags [.], ack 341728, win 973, options [nop,nop,TS val 27571343 ecr 27571321], length 0
17:30:45.229475 IP 10.0.0.1.40768 > 10.0.0.2.5001: Flags [.], seq 341728:344624, ack 1, win 58, options [nop,nop,TS val 27571321 ecr 27571321], length 2896
17:30:45.229491 IP 10.0.0.2.5001 > 10.0.0.1.40768: Flags [.], ack 344624, win 973, options [nop,nop,TS val 27571344 ecr 27571321], length 0
17:30:45.231897 IP 10.0.0.1.40768 > 10.0.0.2.5001: Flags [.], seq 344624:347520, ack 1, win 58, options [nop,nop,TS val 27571322 ecr 27571321], length 2896
17:30:45.231913 IP 10.0.0.2.5001 > 10.0.0.1.40768: Flags [.], ack 347520, win 973, options [nop,nop,TS val 27571344 ecr 27571322], length 0
17:30:45.234320 IP 10.0.0.1.40768 > 10.0.0.2.5001: Flags [.], seq 347520:350416, ack 1, win 58, options [nop,nop,TS val 27571322 ecr 27571322], length 2896
17:30:45.235166 IP 10.0.0.2.5001 > 10.0.0.1.40768: Flags [.], ack 350416, win 973, options [nop,nop,TS val 27571345 ecr 27571322], length 0
17:30:45.236743 IP 10.0.0.1.40768 > 10.0.0.2.5001: Flags [.], seq 350416:353312, ack 1, win 58, options [nop,nop,TS val 27571323 ecr 27571322], length 2896
17:30:45.236759 IP 10.0.0.2.5001 > 10.0.0.1.40768: Flags [.], ack 353312, win 973, options [nop,nop,TS val 27571345 ecr 27571323], length 0
17:30:45.239165 IP 10.0.0.1.40768 > 10.0.0.2.5001: Flags [.], seq 353312:356208, ack 1, win 58, options [nop,nop,TS val 27571324 ecr 27571323], length 2896
17:30:45.239181 IP 10.0.0.2.5001 > 10.0.0.1.40768: Flags [.], ack 356208, win 973, options [nop,nop,TS val 27571346 ecr 27571324], length 0
17:30:45.241587 IP 10.0.0.1.40768 > 10.0.0.2.5001: Flags [.], seq 356208:359104, ack 1, win 58, options [nop,nop,TS val 27571324 ecr 27571324], length 2896
17:30:45.241603 IP 10.0.0.2.5001 > 10.0.0.1.40768: Flags [.], ack 359104, win 973, options [nop,nop,TS val 27571347 ecr 27571324], length 0
17:30:45.244009 IP 10.0.0.1.40768 > 10.0.0.2.5001: Flags [.], seq 359104:362000, ack 1, win 58, options [nop,nop,TS val 27571325 ecr 27571324], length 2896
17:30:45.244025 IP 10.0.0.2.5001 > 10.0.0.1.40768: Flags [.], ack 362000, win 973, options [nop,nop,TS val 27571347 ecr 27571325], length 0
17:30:45.246432 IP 10.0.0.1.40768 > 10.0.0.2.5001: Flags [.], seq 362000:364896, ack 1, win 58, options [nop,nop,TS val 27571325 ecr 27571325], length 2896
17:30:45.246448 IP 10.0.0.2.5001 > 10.0.0.1.40768: Flags [.], ack 364896, win 973, options [nop,nop,TS val 27571348 ecr 27571325], length 0
17:30:45.248854 IP 10.0.0.1.40768 > 10.0.0.2.5001: Flags [.], seq 364896:367792, ack 1, win 58, options [nop,nop,TS val 27571326 ecr 27571325], length 2896
17:30:45.248869 IP 10.0.0.2.5001 > 10.0.0.1.40768: Flags [.], ack 367792, win 973, options [nop,nop,TS val 27571348 ecr 27571326], length 0
17:30:45.251277 IP 10.0.0.1.40768 > 10.0.0.2.5001: Flags [.], seq 367792:370688, ack 1, win 58, options [nop,nop,TS val 27571327 ecr 27571326], length 2896
17:30:45.251293 IP 10.0.0.2.5001 > 10.0.0.1.40768: Flags [.], ack 370688, win 973, options [nop,nop,TS val 27571349 ecr 27571327], length 0
17:30:45.253699 IP 10.0.0.1.40768 > 10.0.0.2.5001: Flags [.], seq 370688:373584, ack 1, win 58, options [nop,nop,TS val 27571327 ecr 27571327], length 2896
17:30:45.253716 IP 10.0.0.2.5001 > 10.0.0.1.40768: Flags [.], ack 373584, win 973, options [nop,nop,TS val 27571350 ecr 27571327], length 0
17:30:45.256121 IP 10.0.0.1.40768 > 10.0.0.2.5001: Flags [.], seq 373584:376480, ack 1, win 58, options [nop,nop,TS val 27571328 ecr 27571327], length 2896
17:30:45.256137 IP 10.0.0.2.5001 > 10.0.0.1.40768: Flags [.], ack 376480, win 973, options [nop,nop,TS val 27571350 ecr 27571328], length 0
17:30:45.258544 IP 10.0.0.1.40768 > 10.0.0.2.5001: Flags [.], seq 376480:379376, ack 1, win 58, options [nop,nop,TS val 27571328 ecr 27571328], length 2896
17:30:45.258562 IP 10.0.0.2.5001 > 10.0.0.1.40768: Flags [.], ack 379376, win 973, options [nop,nop,TS val 27571351 ecr 27571328], length 0
17:30:45.260967 IP 10.0.0.1.40768 > 10.0.0.2.5001: Flags [.], seq 379376:382272, ack 1, win 58, options [nop,nop,TS val 27571329 ecr 27571328], length 2896
17:30:45.260982 IP 10.0.0.2.5001 > 10.0.0.1.40768: Flags [.], ack 382272, win 973, options [nop,nop,TS val 27571351 ecr 27571329], length 0
17:30:45.263389 IP 10.0.0.1.40768 > 10.0.0.2.5001: Flags [.], seq 382272:385168, ack 1, win 58, options [nop,nop,TS val 27571330 ecr 27571329], length 2896
17:30:45.263404 IP 10.0.0.2.5001 > 10.0.0.1.40768: Flags [.], ack 385168, win 973, options [nop,nop,TS val 27571352 ecr 27571330], length 0
17:30:45.265811 IP 10.0.0.1.40768 > 10.0.0.2.5001: Flags [.], seq 385168:388064, ack 1, win 58, options [nop,nop,TS val 27571330 ecr 27571330], length 2896
17:30:45.265827 IP 10.0.0.2.5001 > 10.0.0.1.40768: Flags [.], ack 388064, win 973, options [nop,nop,TS val 27571353 ecr 27571330], length 0
17:30:45.268233 IP 10.0.0.1.40768 > 10.0.0.2.5001: Flags [.], seq 388064:390960, ack 1, win 58, options [nop,nop,TS val 27571331 ecr 27571330], length 2896
