17:41:19.440842 IP 10.0.0.1.41414 > 10.0.0.2.5001: Flags [.], seq 664984305:664987201, ack 2191209970, win 58, options [nop,nop,TS val 27729874 ecr 27729873], length 2896
17:41:19.443263 IP 10.0.0.1.41414 > 10.0.0.2.5001: Flags [.], seq 2896:5792, ack 1, win 58, options [nop,nop,TS val 27729875 ecr 27729874], length 2896
17:41:19.445685 IP 10.0.0.1.41414 > 10.0.0.2.5001: Flags [.], seq 5792:8688, ack 1, win 58, options [nop,nop,TS val 27729875 ecr 27729875], length 2896
17:41:19.448108 IP 10.0.0.1.41414 > 10.0.0.2.5001: Flags [.], seq 8688:11584, ack 1, win 58, options [nop,nop,TS val 27729876 ecr 27729875], length 2896
17:41:19.450530 IP 10.0.0.1.41414 > 10.0.0.2.5001: Flags [.], seq 11584:14480, ack 1, win 58, options [nop,nop,TS val 27729876 ecr 27729876], length 2896
17:41:19.452952 IP 10.0.0.1.41414 > 10.0.0.2.5001: Flags [.], seq 14480:17376, ack 1, win 58, options [nop,nop,TS val 27729877 ecr 27729876], length 2896
17:41:19.455375 IP 10.0.0.1.41414 > 10.0.0.2.5001: Flags [.], seq 17376:20272, ack 1, win 58, options [nop,nop,TS val 27729878 ecr 27729877], length 2896
17:41:19.457797 IP 10.0.0.1.41414 > 10.0.0.2.5001: Flags [.], seq 20272:23168, ack 1, win 58, options [nop,nop,TS val 27729878 ecr 27729878], length 2896
17:41:19.460220 IP 10.0.0.1.41414 > 10.0.0.2.5001: Flags [.], seq 23168:26064, ack 1, win 58, options [nop,nop,TS val 27729879 ecr 27729878], length 2896
17:41:19.462642 IP 10.0.0.1.41414 > 10.0.0.2.5001: Flags [.], seq 26064:28960, ack 1, win 58, options [nop,nop,TS val 27729879 ecr 27729879], length 2896
17:41:19.465065 IP 10.0.0.1.41414 > 10.0.0.2.5001: Flags [.], seq 28960:31856, ack 1, win 58, options [nop,nop,TS val 27729880 ecr 27729879], length 2896
17:41:19.467487 IP 10.0.0.1.41414 > 10.0.0.2.5001: Flags [.], seq 31856:34752, ack 1, win 58, options [nop,nop,TS val 27729881 ecr 27729880], length 2896
17:41:19.469909 IP 10.0.0.1.41414 > 10.0.0.2.5001: Flags [.], seq 34752:37648, ack 1, win 58, options [nop,nop,TS val 27729881 ecr 27729881], length 2896
17:41:19.472332 IP 10.0.0.1.41414 > 10.0.0.2.5001: Flags [.], seq 37648:40544, ack 1, win 58, options [nop,nop,TS val 27729882 ecr 27729881], length 2896
17:41:19.474758 IP 10.0.0.1.41414 > 10.0.0.2.5001: Flags [P.], seq 40544:43440, ack 1, win 58, options [nop,nop,TS val 27729882 ecr 27729882], length 2896
17:41:19.477181 IP 10.0.0.1.41414 > 10.0.0.2.5001: Flags [.], seq 43440:46336, ack 1, win 58, options [nop,nop,TS val 27729883 ecr 27729882], length 2896
17:41:19.479602 IP 10.0.0.1.41414 > 10.0.0.2.5001: Flags [.], seq 46336:49232, ack 1, win 58, options [nop,nop,TS val 27729884 ecr 27729883], length 2896
17:41:19.482023 IP 10.0.0.1.41414 > 10.0.0.2.5001: Flags [.], seq 49232:52128, ack 1, win 58, options [nop,nop,TS val 27729884 ecr 27729884], length 2896
17:41:19.484444 IP 10.0.0.1.41414 > 10.0.0.2.5001: Flags [.], seq 52128:55024, ack 1, win 58, options [nop,nop,TS val 27729885 ecr 27729884], length 2896
17:41:19.486866 IP 10.0.0.1.41414 > 10.0.0.2.5001: Flags [.], seq 55024:57920, ack 1, win 58, options [nop,nop,TS val 27729885 ecr 27729885], length 2896
17:41:19.489288 IP 10.0.0.1.41414 > 10.0.0.2.5001: Flags [.], seq 57920:60816, ack 1, win 58, options [nop,nop,TS val 27729886 ecr 27729885], length 2896
17:41:19.491711 IP 10.0.0.1.41414 > 10.0.0.2.5001: Flags [.], seq 60816:63712, ack 1, win 58, options [nop,nop,TS val 27729887 ecr 27729886], length 2896
17:41:19.494133 IP 10.0.0.1.41414 > 10.0.0.2.5001: Flags [.], seq 63712:66608, ack 1, win 58, options [nop,nop,TS val 27729887 ecr 27729887], length 2896
17:41:19.496556 IP 10.0.0.1.41414 > 10.0.0.2.5001: Flags [.], seq 66608:69504, ack 1, win 58, options [nop,nop,TS val 27729888 ecr 27729887], length 2896
17:41:19.498978 IP 10.0.0.1.41414 > 10.0.0.2.5001: Flags [.], seq 69504:72400, ack 1, win 58, options [nop,nop,TS val 27729889 ecr 27729888], length 2896
17:41:19.501401 IP 10.0.0.1.41414 > 10.0.0.2.5001: Flags [.], seq 72400:75296, ack 1, win 58, options [nop,nop,TS val 27729889 ecr 27729889], length 2896
17:41:19.503895 IP 10.0.0.1.41414 > 10.0.0.2.5001: Flags [.], seq 75296:78192, ack 1, win 58, options [nop,nop,TS val 27729890 ecr 27729889], length 2896
17:41:19.506317 IP 10.0.0.1.41414 > 10.0.0.2.5001: Flags [.], seq 78192:81088, ack 1, win 58, options [nop,nop,TS val 27729890 ecr 27729890], length 2896
17:41:19.508740 IP 10.0.0.1.41414 > 10.0.0.2.5001: Flags [.], seq 81088:83984, ack 1, win 58, options [nop,nop,TS val 27729891 ecr 27729890], length 2896
17:41:19.511162 IP 10.0.0.1.41414 > 10.0.0.2.5001: Flags [.], seq 83984:86880, ack 1, win 58, options [nop,nop,TS val 27729892 ecr 27729891], length 2896
17:41:19.513585 IP 10.0.0.1.41414 > 10.0.0.2.5001: Flags [.], seq 86880:89776, ack 1, win 58, options [nop,nop,TS val 27729892 ecr 27729892], length 2896
17:41:19.516009 IP 10.0.0.1.41414 > 10.0.0.2.5001: Flags [.], seq 89776:92672, ack 1, win 58, options [nop,nop,TS val 27729893 ecr 27729892], length 2896
17:41:19.518430 IP 10.0.0.1.41414 > 10.0.0.2.5001: Flags [.], seq 92672:95568, ack 1, win 58, options [nop,nop,TS val 27729893 ecr 27729893], length 2896
17:41:19.520852 IP 10.0.0.1.41414 > 10.0.0.2.5001: Flags [.], seq 95568:98464, ack 1, win 58, options [nop,nop,TS val 27729894 ecr 27729893], length 2896
17:41:19.523274 IP 10.0.0.1.41414 > 10.0.0.2.5001: Flags [P.], seq 98464:101360, ack 1, win 58, options [nop,nop,TS val 27729895 ecr 27729894], length 2896
17:41:19.525697 IP 10.0.0.1.41414 > 10.0.0.2.5001: Flags [.], seq 101360:104256, ack 1, win 58, options [nop,nop,TS val 27729895 ecr 27729895], length 2896
17:41:19.528119 IP 10.0.0.1.41414 > 10.0.0.2.5001: Flags [.], seq 104256:107152, ack 1, win 58, options [nop,nop,TS val 27729896 ecr 27729895], length 2896
17:41:19.530541 IP 10.0.0.1.41414 > 10.0.0.2.5001: Flags [.], seq 107152:110048, ack 1, win 58, options [nop,nop,TS val 27729896 ecr 27729896], length 2896
17:41:19.532964 IP 10.0.0.1.41414 > 10.0.0.2.5001: Flags [.], seq 110048:112944, ack 1, win 58, options [nop,nop,TS val 27729897 ecr 27729896], length 2896
17:41:19.535386 IP 10.0.0.1.41414 > 10.0.0.2.5001: Flags [.], seq 112944:115840, ack 1, win 58, options [nop,nop,TS val 27729898 ecr 27729897], length 2896
17:41:19.537809 IP 10.0.0.1.41414 > 10.0.0.2.5001: Flags [.], seq 115840:118736, ack 1, win 58, options [nop,nop,TS val 27729898 ecr 27729898], length 2896
17:41:19.540232 IP 10.0.0.1.41414 > 10.0.0.2.5001: Flags [.], seq 118736:121632, ack 1, win 58, options [nop,nop,TS val 27729899 ecr 27729898], length 2896
17:41:19.542653 IP 10.0.0.1.41414 > 10.0.0.2.5001: Flags [.], seq 121632:124528, ack 1, win 58, options [nop,nop,TS val 27729899 ecr 27729899], length 2896
17:41:19.545076 IP 10.0.0.1.41414 > 10.0.0.2.5001: Flags [.], seq 124528:127424, ack 1, win 58, options [nop,nop,TS val 27729900 ecr 27729899], length 2896
17:41:19.547498 IP 10.0.0.1.41414 > 10.0.0.2.5001: Flags [.], seq 127424:130320, ack 1, win 58, options [nop,nop,TS val 27729901 ecr 27729900], length 2896
17:41:19.549921 IP 10.0.0.1.41414 > 10.0.0.2.5001: Flags [.], seq 130320:133216, ack 1, win 58, options [nop,nop,TS val 27729901 ecr 27729901], length 2896
17:41:19.552343 IP 10.0.0.1.41414 > 10.0.0.2.5001: Flags [.], seq 133216:136112, ack 1, win 58, options [nop,nop,TS val 27729902 ecr 27729901], length 2896
17:41:19.554766 IP 10.0.0.1.41414 > 10.0.0.2.5001: Flags [.], seq 136112:139008, ack 1, win 58, options [nop,nop,TS val 27729902 ecr 27729902], length 2896
17:41:19.557188 IP 10.0.0.1.41414 > 10.0.0.2.5001: Flags [.], seq 139008:141904, ack 1, win 58, options [nop,nop,TS val 27729903 ecr 27729902], length 2896
17:41:19.559610 IP 10.0.0.1.41414 > 10.0.0.2.5001: Flags [.], seq 141904:144800, ack 1, win 58, options [nop,nop,TS val 27729904 ecr 27729903], length 2896
17:41:19.562033 IP 10.0.0.1.41414 > 10.0.0.2.5001: Flags [.], seq 144800:147696, ack 1, win 58, options [nop,nop,TS val 27729904 ecr 27729904], length 2896
17:41:19.564455 IP 10.0.0.1.41414 > 10.0.0.2.5001: Flags [.], seq 147696:150592, ack 1, win 58, options [nop,nop,TS val 27729905 ecr 27729904], length 2896
17:41:19.566877 IP 10.0.0.1.41414 > 10.0.0.2.5001: Flags [.], seq 150592:153488, ack 1, win 58, options [nop,nop,TS val 27729905 ecr 27729904], length 2896
17:41:19.569300 IP 10.0.0.1.41414 > 10.0.0.2.5001: Flags [.], seq 153488:156384, ack 1, win 58, options [nop,nop,TS val 27729906 ecr 27729906], length 2896
17:41:19.571722 IP 10.0.0.1.41414 > 10.0.0.2.5001: Flags [.], seq 156384:159280, ack 1, win 58, options [nop,nop,TS val 27729907 ecr 27729906], length 2896
17:41:19.574145 IP 10.0.0.1.41414 > 10.0.0.2.5001: Flags [.], seq 159280:162176, ack 1, win 58, options [nop,nop,TS val 27729907 ecr 27729907], length 2896
17:41:19.576567 IP 10.0.0.1.41414 > 10.0.0.2.5001: Flags [.], seq 162176:165072, ack 1, win 58, options [nop,nop,TS val 27729908 ecr 27729907], length 2896
17:41:19.578989 IP 10.0.0.1.41414 > 10.0.0.2.5001: Flags [.], seq 165072:167968, ack 1, win 58, options [nop,nop,TS val 27729908 ecr 27729908], length 2896
17:41:19.581412 IP 10.0.0.1.41414 > 10.0.0.2.5001: Flags [.], seq 167968:170864, ack 1, win 58, options [nop,nop,TS val 27729909 ecr 27729908], length 2896
17:41:19.583834 IP 10.0.0.1.41414 > 10.0.0.2.5001: Flags [.], seq 170864:173760, ack 1, win 58, options [nop,nop,TS val 27729910 ecr 27729909], length 2896
17:41:19.586257 IP 10.0.0.1.41414 > 10.0.0.2.5001: Flags [.], seq 173760:176656, ack 1, win 58, options [nop,nop,TS val 27729910 ecr 27729910], length 2896
17:41:19.588679 IP 10.0.0.1.41414 > 10.0.0.2.5001: Flags [.], seq 176656:179552, ack 1, win 58, options [nop,nop,TS val 27729911 ecr 27729910], length 2896
17:41:19.591101 IP 10.0.0.1.41414 > 10.0.0.2.5001: Flags [.], seq 179552:182448, ack 1, win 58, options [nop,nop,TS val 27729912 ecr 27729911], length 2896
17:41:19.593524 IP 10.0.0.1.41414 > 10.0.0.2.5001: Flags [.], seq 182448:185344, ack 1, win 58, options [nop,nop,TS val 27729912 ecr 27729912], length 2896
17:41:19.595946 IP 10.0.0.1.41414 > 10.0.0.2.5001: Flags [.], seq 185344:188240, ack 1, win 58, options [nop,nop,TS val 27729913 ecr 27729912], length 2896
17:41:19.598369 IP 10.0.0.1.41414 > 10.0.0.2.5001: Flags [.], seq 188240:191136, ack 1, win 58, options [nop,nop,TS val 27729913 ecr 27729913], length 2896
17:41:19.600791 IP 10.0.0.1.41414 > 10.0.0.2.5001: Flags [.], seq 191136:194032, ack 1, win 58, options [nop,nop,TS val 27729914 ecr 27729913], length 2896
17:41:19.603213 IP 10.0.0.1.41414 > 10.0.0.2.5001: Flags [.], seq 194032:196928, ack 1, win 58, options [nop,nop,TS val 27729915 ecr 27729914], length 2896
17:41:19.605636 IP 10.0.0.1.41414 > 10.0.0.2.5001: Flags [.], seq 196928:199824, ack 1, win 58, options [nop,nop,TS val 27729915 ecr 27729915], length 2896
17:41:19.608060 IP 10.0.0.1.41414 > 10.0.0.2.5001: Flags [.], seq 199824:202720, ack 1, win 58, options [nop,nop,TS val 27729916 ecr 27729915], length 2896
17:41:19.610484 IP 10.0.0.1.41414 > 10.0.0.2.5001: Flags [.], seq 202720:205616, ack 1, win 58, options [nop,nop,TS val 27729916 ecr 27729916], length 2896
17:41:19.612905 IP 10.0.0.1.41414 > 10.0.0.2.5001: Flags [.], seq 205616:208512, ack 1, win 58, options [nop,nop,TS val 27729917 ecr 27729916], length 2896
17:41:19.615325 IP 10.0.0.1.41414 > 10.0.0.2.5001: Flags [.], seq 208512:211408, ack 1, win 58, options [nop,nop,TS val 27729918 ecr 27729917], length 2896
17:41:19.617748 IP 10.0.0.1.41414 > 10.0.0.2.5001: Flags [.], seq 211408:214304, ack 1, win 58, options [nop,nop,TS val 27729918 ecr 27729918], length 2896
17:41:19.620170 IP 10.0.0.1.41414 > 10.0.0.2.5001: Flags [.], seq 214304:217200, ack 1, win 58, options [nop,nop,TS val 27729919 ecr 27729918], length 2896
17:41:19.622593 IP 10.0.0.1.41414 > 10.0.0.2.5001: Flags [.], seq 217200:220096, ack 1, win 58, options [nop,nop,TS val 27729919 ecr 27729919], length 2896
17:41:19.625015 IP 10.0.0.1.41414 > 10.0.0.2.5001: Flags [.], seq 220096:222992, ack 1, win 58, options [nop,nop,TS val 27729920 ecr 27729919], length 2896
17:41:19.627437 IP 10.0.0.1.41414 > 10.0.0.2.5001: Flags [.], seq 222992:225888, ack 1, win 58, options [nop,nop,TS val 27729921 ecr 27729920], length 2896
17:41:19.629860 IP 10.0.0.1.41414 > 10.0.0.2.5001: Flags [.], seq 225888:228784, ack 1, win 58, options [nop,nop,TS val 27729921 ecr 27729921], length 2896
17:41:19.632282 IP 10.0.0.1.41414 > 10.0.0.2.5001: Flags [.], seq 228784:231680, ack 1, win 58, options [nop,nop,TS val 27729922 ecr 27729921], length 2896
17:41:19.634705 IP 10.0.0.1.41414 > 10.0.0.2.5001: Flags [.], seq 231680:234576, ack 1, win 58, options [nop,nop,TS val 27729922 ecr 27729922], length 2896
17:41:19.637127 IP 10.0.0.1.41414 > 10.0.0.2.5001: Flags [.], seq 234576:237472, ack 1, win 58, options [nop,nop,TS val 27729923 ecr 27729922], length 2896
17:41:19.639549 IP 10.0.0.1.41414 > 10.0.0.2.5001: Flags [.], seq 237472:240368, ack 1, win 58, options [nop,nop,TS val 27729924 ecr 27729923], length 2896
17:41:19.641972 IP 10.0.0.1.41414 > 10.0.0.2.5001: Flags [.], seq 240368:243264, ack 1, win 58, options [nop,nop,TS val 27729924 ecr 27729924], length 2896
17:41:19.644394 IP 10.0.0.1.41414 > 10.0.0.2.5001: Flags [.], seq 243264:246160, ack 1, win 58, options [nop,nop,TS val 27729925 ecr 27729924], length 2896
17:41:19.646817 IP 10.0.0.1.41414 > 10.0.0.2.5001: Flags [.], seq 246160:249056, ack 1, win 58, options [nop,nop,TS val 27729925 ecr 27729925], length 2896
17:41:19.649239 IP 10.0.0.1.41414 > 10.0.0.2.5001: Flags [.], seq 249056:251952, ack 1, win 58, options [nop,nop,TS val 27729926 ecr 27729925], length 2896
17:41:19.651661 IP 10.0.0.1.41414 > 10.0.0.2.5001: Flags [.], seq 251952:254848, ack 1, win 58, options [nop,nop,TS val 27729927 ecr 27729926], length 2896
17:41:19.654084 IP 10.0.0.1.41414 > 10.0.0.2.5001: Flags [.], seq 254848:257744, ack 1, win 58, options [nop,nop,TS val 27729927 ecr 27729927], length 2896
17:41:19.656506 IP 10.0.0.1.41414 > 10.0.0.2.5001: Flags [.], seq 257744:260640, ack 1, win 58, options [nop,nop,TS val 27729928 ecr 27729927], length 2896
17:41:19.658929 IP 10.0.0.1.41414 > 10.0.0.2.5001: Flags [P.], seq 260640:263536, ack 1, win 58, options [nop,nop,TS val 27729928 ecr 27729928], length 2896
17:41:19.661351 IP 10.0.0.1.41414 > 10.0.0.2.5001: Flags [.], seq 263536:266432, ack 1, win 58, options [nop,nop,TS val 27729929 ecr 27729928], length 2896
17:41:19.663773 IP 10.0.0.1.41414 > 10.0.0.2.5001: Flags [.], seq 266432:269328, ack 1, win 58, options [nop,nop,TS val 27729930 ecr 27729929], length 2896
17:41:19.666196 IP 10.0.0.1.41414 > 10.0.0.2.5001: Flags [.], seq 269328:272224, ack 1, win 58, options [nop,nop,TS val 27729930 ecr 27729930], length 2896
17:41:19.668618 IP 10.0.0.1.41414 > 10.0.0.2.5001: Flags [.], seq 272224:275120, ack 1, win 58, options [nop,nop,TS val 27729931 ecr 27729930], length 2896
17:41:19.671041 IP 10.0.0.1.41414 > 10.0.0.2.5001: Flags [.], seq 275120:278016, ack 1, win 58, options [nop,nop,TS val 27729932 ecr 27729931], length 2896
17:41:19.673463 IP 10.0.0.1.41414 > 10.0.0.2.5001: Flags [.], seq 278016:280912, ack 1, win 58, options [nop,nop,TS val 27729932 ecr 27729932], length 2896
17:41:19.675885 IP 10.0.0.1.41414 > 10.0.0.2.5001: Flags [.], seq 280912:283808, ack 1, win 58, options [nop,nop,TS val 27729933 ecr 27729932], length 2896
17:41:19.678307 IP 10.0.0.1.41414 > 10.0.0.2.5001: Flags [.], seq 283808:286704, ack 1, win 58, options [nop,nop,TS val 27729933 ecr 27729933], length 2896
17:41:19.680730 IP 10.0.0.1.41414 > 10.0.0.2.5001: Flags [.], seq 286704:289600, ack 1, win 58, options [nop,nop,TS val 27729934 ecr 27729933], length 2896
17:41:19.683152 IP 10.0.0.1.41414 > 10.0.0.2.5001: Flags [.], seq 289600:292496, ack 1, win 58, options [nop,nop,TS val 27729935 ecr 27729934], length 2896
17:41:19.685575 IP 10.0.0.1.41414 > 10.0.0.2.5001: Flags [.], seq 292496:295392, ack 1, win 58, options [nop,nop,TS val 27729935 ecr 27729935], length 2896
17:41:19.687997 IP 10.0.0.1.41414 > 10.0.0.2.5001: Flags [.], seq 295392:298288, ack 1, win 58, options [nop,nop,TS val 27729936 ecr 27729935], length 2896
17:41:19.690420 IP 10.0.0.1.41414 > 10.0.0.2.5001: Flags [.], seq 298288:301184, ack 1, win 58, options [nop,nop,TS val 27729936 ecr 27729936], length 2896
17:41:19.692842 IP 10.0.0.1.41414 > 10.0.0.2.5001: Flags [.], seq 301184:304080, ack 1, win 58, options [nop,nop,TS val 27729937 ecr 27729936], length 2896
17:41:19.695265 IP 10.0.0.1.41414 > 10.0.0.2.5001: Flags [.], seq 304080:306976, ack 1, win 58, options [nop,nop,TS val 27729938 ecr 27729937], length 2896
17:41:19.697687 IP 10.0.0.1.41414 > 10.0.0.2.5001: Flags [.], seq 306976:309872, ack 1, win 58, options [nop,nop,TS val 27729938 ecr 27729938], length 2896
17:41:19.700109 IP 10.0.0.1.41414 > 10.0.0.2.5001: Flags [.], seq 309872:312768, ack 1, win 58, options [nop,nop,TS val 27729939 ecr 27729938], length 2896
17:41:19.702532 IP 10.0.0.1.41414 > 10.0.0.2.5001: Flags [.], seq 312768:315664, ack 1, win 58, options [nop,nop,TS val 27729939 ecr 27729939], length 2896
17:41:19.704954 IP 10.0.0.1.41414 > 10.0.0.2.5001: Flags [.], seq 315664:318560, ack 1, win 58, options [nop,nop,TS val 27729940 ecr 27729939], length 2896
17:41:19.707377 IP 10.0.0.1.41414 > 10.0.0.2.5001: Flags [.], seq 318560:321456, ack 1, win 58, options [nop,nop,TS val 27729941 ecr 27729940], length 2896
17:41:19.709799 IP 10.0.0.1.41414 > 10.0.0.2.5001: Flags [.], seq 321456:324352, ack 1, win 58, options [nop,nop,TS val 27729941 ecr 27729941], length 2896
17:41:19.712221 IP 10.0.0.1.41414 > 10.0.0.2.5001: Flags [.], seq 324352:327248, ack 1, win 58, options [nop,nop,TS val 27729942 ecr 27729941], length 2896
17:41:19.714644 IP 10.0.0.1.41414 > 10.0.0.2.5001: Flags [.], seq 327248:330144, ack 1, win 58, options [nop,nop,TS val 27729942 ecr 27729942], length 2896
17:41:19.717066 IP 10.0.0.1.41414 > 10.0.0.2.5001: Flags [.], seq 330144:333040, ack 1, win 58, options [nop,nop,TS val 27729943 ecr 27729942], length 2896
17:41:19.719488 IP 10.0.0.1.41414 > 10.0.0.2.5001: Flags [.], seq 333040:335936, ack 1, win 58, options [nop,nop,TS val 27729944 ecr 27729943], length 2896
17:41:19.721911 IP 10.0.0.1.41414 > 10.0.0.2.5001: Flags [.], seq 335936:338832, ack 1, win 58, options [nop,nop,TS val 27729944 ecr 27729944], length 2896
17:41:19.724333 IP 10.0.0.1.41414 > 10.0.0.2.5001: Flags [.], seq 338832:341728, ack 1, win 58, options [nop,nop,TS val 27729945 ecr 27729944], length 2896
17:41:19.726756 IP 10.0.0.1.41414 > 10.0.0.2.5001: Flags [.], seq 341728:344624, ack 1, win 58, options [nop,nop,TS val 27729945 ecr 27729945], length 2896
17:41:19.729178 IP 10.0.0.1.41414 > 10.0.0.2.5001: Flags [.], seq 344624:347520, ack 1, win 58, options [nop,nop,TS val 27729946 ecr 27729945], length 2896
17:41:19.731600 IP 10.0.0.1.41414 > 10.0.0.2.5001: Flags [.], seq 347520:350416, ack 1, win 58, options [nop,nop,TS val 27729947 ecr 27729946], length 2896
17:41:19.734023 IP 10.0.0.1.41414 > 10.0.0.2.5001: Flags [.], seq 350416:353312, ack 1, win 58, options [nop,nop,TS val 27729947 ecr 27729947], length 2896
17:41:19.736445 IP 10.0.0.1.41414 > 10.0.0.2.5001: Flags [.], seq 353312:356208, ack 1, win 58, options [nop,nop,TS val 27729948 ecr 27729947], length 2896
17:41:19.738867 IP 10.0.0.1.41414 > 10.0.0.2.5001: Flags [.], seq 356208:359104, ack 1, win 58, options [nop,nop,TS val 27729948 ecr 27729948], length 2896
17:41:19.741290 IP 10.0.0.1.41414 > 10.0.0.2.5001: Flags [.], seq 359104:362000, ack 1, win 58, options [nop,nop,TS val 27729949 ecr 27729948], length 2896
17:41:19.743713 IP 10.0.0.1.41414 > 10.0.0.2.5001: Flags [.], seq 362000:364896, ack 1, win 58, options [nop,nop,TS val 27729950 ecr 27729949], length 2896
17:41:19.746135 IP 10.0.0.1.41414 > 10.0.0.2.5001: Flags [.], seq 364896:367792, ack 1, win 58, options [nop,nop,TS val 27729950 ecr 27729950], length 2896
17:41:19.748557 IP 10.0.0.1.41414 > 10.0.0.2.5001: Flags [.], seq 367792:370688, ack 1, win 58, options [nop,nop,TS val 27729951 ecr 27729950], length 2896
17:41:19.750980 IP 10.0.0.1.41414 > 10.0.0.2.5001: Flags [.], seq 370688:373584, ack 1, win 58, options [nop,nop,TS val 27729952 ecr 27729951], length 2896
17:41:19.753402 IP 10.0.0.1.41414 > 10.0.0.2.5001: Flags [.], seq 373584:376480, ack 1, win 58, options [nop,nop,TS val 27729952 ecr 27729952], length 2896
17:41:19.755825 IP 10.0.0.1.41414 > 10.0.0.2.5001: Flags [.], seq 376480:379376, ack 1, win 58, options [nop,nop,TS val 27729953 ecr 27729952], length 2896
17:41:19.758247 IP 10.0.0.1.41414 > 10.0.0.2.5001: Flags [.], seq 379376:382272, ack 1, win 58, options [nop,nop,TS val 27729953 ecr 27729953], length 2896
17:41:19.760669 IP 10.0.0.1.41414 > 10.0.0.2.5001: Flags [.], seq 382272:385168, ack 1, win 58, options [nop,nop,TS val 27729954 ecr 27729953], length 2896
17:41:19.763092 IP 10.0.0.1.41414 > 10.0.0.2.5001: Flags [.], seq 385168:388064, ack 1, win 58, options [nop,nop,TS val 27729955 ecr 27729954], length 2896
17:41:19.765514 IP 10.0.0.1.41414 > 10.0.0.2.5001: Flags [.], seq 388064:390960, ack 1, win 58, options [nop,nop,TS val 27729955 ecr 27729955], length 2896
17:41:19.767936 IP 10.0.0.1.41414 > 10.0.0.2.5001: Flags [.], seq 390960:393856, ack 1, win 58, options [nop,nop,TS val 27729956 ecr 27729955], length 2896
17:41:19.770359 IP 10.0.0.1.41414 > 10.0.0.2.5001: Flags [.], seq 393856:396752, ack 1, win 58, options [nop,nop,TS val 27729956 ecr 27729956], length 2896
17:41:19.772781 IP 10.0.0.1.41414 > 10.0.0.2.5001: Flags [.], seq 396752:399648, ack 1, win 58, options [nop,nop,TS val 27729957 ecr 27729956], length 2896
17:41:19.775204 IP 10.0.0.1.41414 > 10.0.0.2.5001: Flags [.], seq 399648:402544, ack 1, win 58, options [nop,nop,TS val 27729958 ecr 27729957], length 2896
17:41:19.777626 IP 10.0.0.1.41414 > 10.0.0.2.5001: Flags [.], seq 402544:405440, ack 1, win 58, options [nop,nop,TS val 27729958 ecr 27729958], length 2896
17:41:19.780048 IP 10.0.0.1.41414 > 10.0.0.2.5001: Flags [.], seq 405440:408336, ack 1, win 58, options [nop,nop,TS val 27729959 ecr 27729958], length 2896
17:41:19.782471 IP 10.0.0.1.41414 > 10.0.0.2.5001: Flags [.], seq 408336:411232, ack 1, win 58, options [nop,nop,TS val 27729959 ecr 27729959], length 2896
17:41:19.784893 IP 10.0.0.1.41414 > 10.0.0.2.5001: Flags [.], seq 411232:414128, ack 1, win 58, options [nop,nop,TS val 27729960 ecr 27729959], length 2896
17:41:19.787316 IP 10.0.0.1.41414 > 10.0.0.2.5001: Flags [.], seq 414128:417024, ack 1, win 58, options [nop,nop,TS val 27729961 ecr 27729960], length 2896
17:41:19.789738 IP 10.0.0.1.41414 > 10.0.0.2.5001: Flags [.], seq 417024:419920, ack 1, win 58, options [nop,nop,TS val 27729961 ecr 27729961], length 2896
17:41:19.792161 IP 10.0.0.1.41414 > 10.0.0.2.5001: Flags [P.], seq 419920:422816, ack 1, win 58, options [nop,nop,TS val 27729962 ecr 27729961], length 2896
17:41:19.794583 IP 10.0.0.1.41414 > 10.0.0.2.5001: Flags [.], seq 422816:425712, ack 1, win 58, options [nop,nop,TS val 27729962 ecr 27729962], length 2896
17:41:19.797005 IP 10.0.0.1.41414 > 10.0.0.2.5001: Flags [.], seq 425712:428608, ack 1, win 58, options [nop,nop,TS val 27729963 ecr 27729962], length 2896
17:41:19.799428 IP 10.0.0.1.41414 > 10.0.0.2.5001: Flags [.], seq 428608:431504, ack 1, win 58, options [nop,nop,TS val 27729964 ecr 27729963], length 2896
17:41:19.801850 IP 10.0.0.1.41414 > 10.0.0.2.5001: Flags [.], seq 431504:434400, ack 1, win 58, options [nop,nop,TS val 27729964 ecr 27729964], length 2896
17:41:19.804273 IP 10.0.0.1.41414 > 10.0.0.2.5001: Flags [.], seq 434400:437296, ack 1, win 58, options [nop,nop,TS val 27729965 ecr 27729964], length 2896
17:41:19.806695 IP 10.0.0.1.41414 > 10.0.0.2.5001: Flags [.], seq 437296:440192, ack 1, win 58, options [nop,nop,TS val 27729965 ecr 27729965], length 2896
17:41:19.809117 IP 10.0.0.1.41414 > 10.0.0.2.5001: Flags [.], seq 440192:443088, ack 1, win 58, options [nop,nop,TS val 27729966 ecr 27729965], length 2896
17:41:19.811540 IP 10.0.0.1.41414 > 10.0.0.2.5001: Flags [.], seq 443088:445984, ack 1, win 58, options [nop,nop,TS val 27729967 ecr 27729966], length 2896
17:41:19.813962 IP 10.0.0.1.41414 > 10.0.0.2.5001: Flags [.], seq 445984:448880, ack 1, win 58, options [nop,nop,TS val 27729967 ecr 27729967], length 2896
17:41:19.816384 IP 10.0.0.1.41414 > 10.0.0.2.5001: Flags [.], seq 448880:451776, ack 1, win 58, options [nop,nop,TS val 27729968 ecr 27729967], length 2896
17:41:19.818807 IP 10.0.0.1.41414 > 10.0.0.2.5001: Flags [.], seq 451776:454672, ack 1, win 58, options [nop,nop,TS val 27729968 ecr 27729968], length 2896
17:41:19.821229 IP 10.0.0.1.41414 > 10.0.0.2.5001: Flags [.], seq 454672:457568, ack 1, win 58, options [nop,nop,TS val 27729969 ecr 27729968], length 2896
17:41:19.823652 IP 10.0.0.1.41414 > 10.0.0.2.5001: Flags [.], seq 457568:460464, ack 1, win 58, options [nop,nop,TS val 27729970 ecr 27729969], length 2896
17:41:19.826074 IP 10.0.0.1.41414 > 10.0.0.2.5001: Flags [.], seq 460464:463360, ack 1, win 58, options [nop,nop,TS val 27729970 ecr 27729970], length 2896
17:41:19.828497 IP 10.0.0.1.41414 > 10.0.0.2.5001: Flags [.], seq 463360:466256, ack 1, win 58, options [nop,nop,TS val 27729971 ecr 27729970], length 2896
17:41:19.830919 IP 10.0.0.1.41414 > 10.0.0.2.5001: Flags [.], seq 466256:469152, ack 1, win 58, options [nop,nop,TS val 27729971 ecr 27729971], length 2896
17:41:19.833341 IP 10.0.0.1.41414 > 10.0.0.2.5001: Flags [.], seq 469152:472048, ack 1, win 58, options [nop,nop,TS val 27729972 ecr 27729971], length 2896
17:41:19.835764 IP 10.0.0.1.41414 > 10.0.0.2.5001: Flags [.], seq 472048:474944, ack 1, win 58, options [nop,nop,TS val 27729973 ecr 27729972], length 2896
17:41:19.838186 IP 10.0.0.1.41414 > 10.0.0.2.5001: Flags [.], seq 474944:477840, ack 1, win 58, options [nop,nop,TS val 27729973 ecr 27729973], length 2896
17:41:19.840609 IP 10.0.0.1.41414 > 10.0.0.2.5001: Flags [.], seq 477840:480736, ack 1, win 58, options [nop,nop,TS val 27729974 ecr 27729973], length 2896
17:41:19.843031 IP 10.0.0.1.41414 > 10.0.0.2.5001: Flags [.], seq 480736:483632, ack 1, win 58, options [nop,nop,TS val 27729975 ecr 27729974], length 2896
17:41:19.845453 IP 10.0.0.1.41414 > 10.0.0.2.5001: Flags [.], seq 483632:486528, ack 1, win 58, options [nop,nop,TS val 27729975 ecr 27729975], length 2896
17:41:19.847876 IP 10.0.0.1.41414 > 10.0.0.2.5001: Flags [.], seq 486528:489424, ack 1, win 58, options [nop,nop,TS val 27729976 ecr 27729975], length 2896
17:41:19.850298 IP 10.0.0.1.41414 > 10.0.0.2.5001: Flags [.], seq 489424:492320, ack 1, win 58, options [nop,nop,TS val 27729976 ecr 27729976], length 2896
17:41:19.852720 IP 10.0.0.1.41414 > 10.0.0.2.5001: Flags [.], seq 492320:495216, ack 1, win 58, options [nop,nop,TS val 27729977 ecr 27729976], length 2896
17:41:19.855143 IP 10.0.0.1.41414 > 10.0.0.2.5001: Flags [.], seq 495216:498112, ack 1, win 58, options [nop,nop,TS val 27729978 ecr 27729977], length 2896
17:41:19.857565 IP 10.0.0.1.41414 > 10.0.0.2.5001: Flags [.], seq 498112:501008, ack 1, win 58, options [nop,nop,TS val 27729978 ecr 27729978], length 2896
17:41:19.859988 IP 10.0.0.1.41414 > 10.0.0.2.5001: Flags [.], seq 501008:503904, ack 1, win 58, options [nop,nop,TS val 27729979 ecr 27729978], length 2896
17:41:19.862410 IP 10.0.0.1.41414 > 10.0.0.2.5001: Flags [.], seq 503904:506800, ack 1, win 58, options [nop,nop,TS val 27729979 ecr 27729979], length 2896
17:41:19.864832 IP 10.0.0.1.41414 > 10.0.0.2.5001: Flags [.], seq 506800:509696, ack 1, win 58, options [nop,nop,TS val 27729980 ecr 27729979], length 2896
17:41:19.867255 IP 10.0.0.1.41414 > 10.0.0.2.5001: Flags [.], seq 509696:512592, ack 1, win 58, options [nop,nop,TS val 27729981 ecr 27729980], length 2896
17:41:19.869677 IP 10.0.0.1.41414 > 10.0.0.2.5001: Flags [.], seq 512592:515488, ack 1, win 58, options [nop,nop,TS val 27729981 ecr 27729981], length 2896
17:41:19.872100 IP 10.0.0.1.41414 > 10.0.0.2.5001: Flags [.], seq 515488:518384, ack 1, win 58, options [nop,nop,TS val 27729982 ecr 27729981], length 2896
17:41:19.874522 IP 10.0.0.1.41414 > 10.0.0.2.5001: Flags [.], seq 518384:521280, ack 1, win 58, options [nop,nop,TS val 27729982 ecr 27729982], length 2896
17:41:19.876944 IP 10.0.0.1.41414 > 10.0.0.2.5001: Flags [.], seq 521280:524176, ack 1, win 58, options [nop,nop,TS val 27729983 ecr 27729982], length 2896
17:41:19.879367 IP 10.0.0.1.41414 > 10.0.0.2.5001: Flags [.], seq 524176:527072, ack 1, win 58, options [nop,nop,TS val 27729984 ecr 27729983], length 2896
17:41:19.881789 IP 10.0.0.1.41414 > 10.0.0.2.5001: Flags [.], seq 527072:529968, ack 1, win 58, options [nop,nop,TS val 27729984 ecr 27729984], length 2896
17:41:19.884212 IP 10.0.0.1.41414 > 10.0.0.2.5001: Flags [.], seq 529968:532864, ack 1, win 58, options [nop,nop,TS val 27729985 ecr 27729984], length 2896
17:41:19.886634 IP 10.0.0.1.41414 > 10.0.0.2.5001: Flags [.], seq 532864:535760, ack 1, win 58, options [nop,nop,TS val 27729985 ecr 27729985], length 2896
17:41:19.889057 IP 10.0.0.1.41414 > 10.0.0.2.5001: Flags [.], seq 535760:538656, ack 1, win 58, options [nop,nop,TS val 27729986 ecr 27729985], length 2896
17:41:19.891479 IP 10.0.0.1.41414 > 10.0.0.2.5001: Flags [.], seq 538656:541552, ack 1, win 58, options [nop,nop,TS val 27729987 ecr 27729986], length 2896
17:41:19.893901 IP 10.0.0.1.41414 > 10.0.0.2.5001: Flags [.], seq 541552:544448, ack 1, win 58, options [nop,nop,TS val 27729987 ecr 27729987], length 2896
17:41:19.896324 IP 10.0.0.1.41414 > 10.0.0.2.5001: Flags [.], seq 544448:547344, ack 1, win 58, options [nop,nop,TS val 27729988 ecr 27729987], length 2896
17:41:19.898746 IP 10.0.0.1.41414 > 10.0.0.2.5001: Flags [.], seq 547344:550240, ack 1, win 58, options [nop,nop,TS val 27729988 ecr 27729988], length 2896
17:41:19.901168 IP 10.0.0.1.41414 > 10.0.0.2.5001: Flags [.], seq 550240:553136, ack 1, win 58, options [nop,nop,TS val 27729989 ecr 27729988], length 2896
17:41:19.903591 IP 10.0.0.1.41414 > 10.0.0.2.5001: Flags [.], seq 553136:556032, ack 1, win 58, options [nop,nop,TS val 27729990 ecr 27729989], length 2896
17:41:19.906013 IP 10.0.0.1.41414 > 10.0.0.2.5001: Flags [.], seq 556032:558928, ack 1, win 58, options [nop,nop,TS val 27729990 ecr 27729990], length 2896
17:41:19.908436 IP 10.0.0.1.41414 > 10.0.0.2.5001: Flags [.], seq 558928:561824, ack 1, win 58, options [nop,nop,TS val 27729991 ecr 27729990], length 2896
17:41:19.910858 IP 10.0.0.1.41414 > 10.0.0.2.5001: Flags [.], seq 561824:564720, ack 1, win 58, options [nop,nop,TS val 27729991 ecr 27729991], length 2896
17:41:19.913281 IP 10.0.0.1.41414 > 10.0.0.2.5001: Flags [.], seq 564720:567616, ack 1, win 58, options [nop,nop,TS val 27729992 ecr 27729991], length 2896
17:41:19.915703 IP 10.0.0.1.41414 > 10.0.0.2.5001: Flags [.], seq 567616:570512, ack 1, win 58, options [nop,nop,TS val 27729993 ecr 27729992], length 2896
17:41:19.918125 IP 10.0.0.1.41414 > 10.0.0.2.5001: Flags [.], seq 570512:573408, ack 1, win 58, options [nop,nop,TS val 27729993 ecr 27729993], length 2896
17:41:19.920548 IP 10.0.0.1.41414 > 10.0.0.2.5001: Flags [.], seq 573408:576304, ack 1, win 58, options [nop,nop,TS val 27729994 ecr 27729993], length 2896
17:41:19.922970 IP 10.0.0.1.41414 > 10.0.0.2.5001: Flags [.], seq 576304:579200, ack 1, win 58, options [nop,nop,TS val 27729995 ecr 27729994], length 2896
17:41:19.925392 IP 10.0.0.1.41414 > 10.0.0.2.5001: Flags [P.], seq 579200:582096, ack 1, win 58, options [nop,nop,TS val 27729995 ecr 27729995], length 2896
17:41:19.927815 IP 10.0.0.1.41414 > 10.0.0.2.5001: Flags [.], seq 582096:584992, ack 1, win 58, options [nop,nop,TS val 27729996 ecr 27729995], length 2896
17:41:19.930237 IP 10.0.0.1.41414 > 10.0.0.2.5001: Flags [.], seq 584992:587888, ack 1, win 58, options [nop,nop,TS val 27729996 ecr 27729996], length 2896
17:41:19.932660 IP 10.0.0.1.41414 > 10.0.0.2.5001: Flags [.], seq 587888:590784, ack 1, win 58, options [nop,nop,TS val 27729997 ecr 27729996], length 2896
17:41:19.935082 IP 10.0.0.1.41414 > 10.0.0.2.5001: Flags [.], seq 590784:593680, ack 1, win 58, options [nop,nop,TS val 27729998 ecr 27729997], length 2896
17:41:19.937504 IP 10.0.0.1.41414 > 10.0.0.2.5001: Flags [.], seq 593680:596576, ack 1, win 58, options [nop,nop,TS val 27729998 ecr 27729998], length 2896
17:41:19.939927 IP 10.0.0.1.41414 > 10.0.0.2.5001: Flags [.], seq 596576:599472, ack 1, win 58, options [nop,nop,TS val 27729999 ecr 27729998], length 2896
17:41:19.942349 IP 10.0.0.1.41414 > 10.0.0.2.5001: Flags [.], seq 599472:602368, ack 1, win 58, options [nop,nop,TS val 27729999 ecr 27729999], length 2896
17:41:19.944772 IP 10.0.0.1.41414 > 10.0.0.2.5001: Flags [.], seq 602368:605264, ack 1, win 58, options [nop,nop,TS val 27730000 ecr 27729999], length 2896
17:41:19.947194 IP 10.0.0.1.41414 > 10.0.0.2.5001: Flags [.], seq 605264:608160, ack 1, win 58, options [nop,nop,TS val 27730001 ecr 27730000], length 2896
17:41:19.949616 IP 10.0.0.1.41414 > 10.0.0.2.5001: Flags [.], seq 608160:611056, ack 1, win 58, options [nop,nop,TS val 27730001 ecr 27730001], length 2896
17:41:19.952039 IP 10.0.0.1.41414 > 10.0.0.2.5001: Flags [.], seq 611056:613952, ack 1, win 58, options [nop,nop,TS val 27730002 ecr 27730001], length 2896
17:41:19.954461 IP 10.0.0.1.41414 > 10.0.0.2.5001: Flags [.], seq 613952:616848, ack 1, win 58, options [nop,nop,TS val 27730002 ecr 27730002], length 2896
17:41:19.956884 IP 10.0.0.1.41414 > 10.0.0.2.5001: Flags [.], seq 616848:619744, ack 1, win 58, options [nop,nop,TS val 27730003 ecr 27730002], length 2896
17:41:19.959306 IP 10.0.0.1.41414 > 10.0.0.2.5001: Flags [.], seq 619744:622640, ack 1, win 58, options [nop,nop,TS val 27730004 ecr 27730003], length 2896
17:41:19.961728 IP 10.0.0.1.41414 > 10.0.0.2.5001: Flags [.], seq 622640:625536, ack 1, win 58, options [nop,nop,TS val 27730004 ecr 27730004], length 2896
17:41:19.964151 IP 10.0.0.1.41414 > 10.0.0.2.5001: Flags [.], seq 625536:628432, ack 1, win 58, options [nop,nop,TS val 27730005 ecr 27730004], length 2896
17:41:19.966573 IP 10.0.0.1.41414 > 10.0.0.2.5001: Flags [.], seq 628432:631328, ack 1, win 58, options [nop,nop,TS val 27730005 ecr 27730005], length 2896
17:41:19.968996 IP 10.0.0.1.41414 > 10.0.0.2.5001: Flags [.], seq 631328:634224, ack 1, win 58, options [nop,nop,TS val 27730006 ecr 27730005], length 2896
17:41:19.971418 IP 10.0.0.1.41414 > 10.0.0.2.5001: Flags [.], seq 634224:637120, ack 1, win 58, options [nop,nop,TS val 27730007 ecr 27730006], length 2896
17:41:19.973840 IP 10.0.0.1.41414 > 10.0.0.2.5001: Flags [.], seq 637120:640016, ack 1, win 58, options [nop,nop,TS val 27730007 ecr 27730007], length 2896
17:41:19.976264 IP 10.0.0.1.41414 > 10.0.0.2.5001: Flags [.], seq 640016:642912, ack 1, win 58, options [nop,nop,TS val 27730008 ecr 27730007], length 2896
17:41:19.978686 IP 10.0.0.1.41414 > 10.0.0.2.5001: Flags [.], seq 642912:645808, ack 1, win 58, options [nop,nop,TS val 27730008 ecr 27730008], length 2896
17:41:19.981108 IP 10.0.0.1.41414 > 10.0.0.2.5001: Flags [.], seq 645808:648704, ack 1, win 58, options [nop,nop,TS val 27730009 ecr 27730008], length 2896
17:41:19.983530 IP 10.0.0.1.41414 > 10.0.0.2.5001: Flags [.], seq 648704:651600, ack 1, win 58, options [nop,nop,TS val 27730010 ecr 27730009], length 2896
17:41:19.985952 IP 10.0.0.1.41414 > 10.0.0.2.5001: Flags [.], seq 651600:654496, ack 1, win 58, options [nop,nop,TS val 27730010 ecr 27730010], length 2896
17:41:19.988375 IP 10.0.0.1.41414 > 10.0.0.2.5001: Flags [.], seq 654496:657392, ack 1, win 58, options [nop,nop,TS val 27730011 ecr 27730010], length 2896
17:41:19.990797 IP 10.0.0.1.41414 > 10.0.0.2.5001: Flags [.], seq 657392:660288, ack 1, win 58, options [nop,nop,TS val 27730011 ecr 27730011], length 2896
17:41:19.993221 IP 10.0.0.1.41414 > 10.0.0.2.5001: Flags [.], seq 660288:663184, ack 1, win 58, options [nop,nop,TS val 27730012 ecr 27730011], length 2896
17:41:19.995642 IP 10.0.0.1.41414 > 10.0.0.2.5001: Flags [.], seq 663184:666080, ack 1, win 58, options [nop,nop,TS val 27730013 ecr 27730012], length 2896
17:41:19.998064 IP 10.0.0.1.41414 > 10.0.0.2.5001: Flags [.], seq 666080:668976, ack 1, win 58, options [nop,nop,TS val 27730013 ecr 27730013], length 2896
17:41:20.000487 IP 10.0.0.1.41414 > 10.0.0.2.5001: Flags [.], seq 668976:671872, ack 1, win 58, options [nop,nop,TS val 27730014 ecr 27730013], length 2896
17:41:20.002910 IP 10.0.0.1.41414 > 10.0.0.2.5001: Flags [.], seq 671872:674768, ack 1, win 58, options [nop,nop,TS val 27730014 ecr 27730014], length 2896
17:41:20.005336 IP 10.0.0.1.41414 > 10.0.0.2.5001: Flags [.], seq 674768:677664, ack 1, win 58, options [nop,nop,TS val 27730015 ecr 27730014], length 2896
17:41:20.007754 IP 10.0.0.1.41414 > 10.0.0.2.5001: Flags [.], seq 677664:680560, ack 1, win 58, options [nop,nop,TS val 27730016 ecr 27730015], length 2896
17:41:20.010176 IP 10.0.0.1.41414 > 10.0.0.2.5001: Flags [.], seq 680560:683456, ack 1, win 58, options [nop,nop,TS val 27730016 ecr 27730016], length 2896
17:41:20.012599 IP 10.0.0.1.41414 > 10.0.0.2.5001: Flags [.], seq 683456:686352, ack 1, win 58, options [nop,nop,TS val 27730017 ecr 27730016], length 2896
17:41:20.015021 IP 10.0.0.1.41414 > 10.0.0.2.5001: Flags [.], seq 686352:689248, ack 1, win 58, options [nop,nop,TS val 27730018 ecr 27730017], length 2896
17:41:20.017444 IP 10.0.0.1.41414 > 10.0.0.2.5001: Flags [.], seq 689248:692144, ack 1, win 58, options [nop,nop,TS val 27730018 ecr 27730018], length 2896
17:41:20.019866 IP 10.0.0.1.41414 > 10.0.0.2.5001: Flags [.], seq 692144:695040, ack 1, win 58, options [nop,nop,TS val 27730019 ecr 27730018], length 2896
17:41:20.022288 IP 10.0.0.1.41414 > 10.0.0.2.5001: Flags [.], seq 695040:697936, ack 1, win 58, options [nop,nop,TS val 27730019 ecr 27730019], length 2896
17:41:20.024711 IP 10.0.0.1.41414 > 10.0.0.2.5001: Flags [.], seq 697936:700832, ack 1, win 58, options [nop,nop,TS val 27730020 ecr 27730019], length 2896
17:41:20.027134 IP 10.0.0.1.41414 > 10.0.0.2.5001: Flags [.], seq 700832:703728, ack 1, win 58, options [nop,nop,TS val 27730021 ecr 27730020], length 2896
17:41:20.029556 IP 10.0.0.1.41414 > 10.0.0.2.5001: Flags [.], seq 703728:706624, ack 1, win 58, options [nop,nop,TS val 27730021 ecr 27730021], length 2896
17:41:20.031979 IP 10.0.0.1.41414 > 10.0.0.2.5001: Flags [.], seq 706624:709520, ack 1, win 58, options [nop,nop,TS val 27730022 ecr 27730021], length 2896
17:41:20.034402 IP 10.0.0.1.41414 > 10.0.0.2.5001: Flags [.], seq 709520:712416, ack 1, win 58, options [nop,nop,TS val 27730022 ecr 27730022], length 2896
17:41:20.036823 IP 10.0.0.1.41414 > 10.0.0.2.5001: Flags [.], seq 712416:715312, ack 1, win 58, options [nop,nop,TS val 27730023 ecr 27730022], length 2896
17:41:20.039245 IP 10.0.0.1.41414 > 10.0.0.2.5001: Flags [.], seq 715312:718208, ack 1, win 58, options [nop,nop,TS val 27730024 ecr 27730023], length 2896
17:41:20.041668 IP 10.0.0.1.41414 > 10.0.0.2.5001: Flags [.], seq 718208:721104, ack 1, win 58, options [nop,nop,TS val 27730024 ecr 27730024], length 2896
17:41:20.044090 IP 10.0.0.1.41414 > 10.0.0.2.5001: Flags [.], seq 721104:724000, ack 1, win 58, options [nop,nop,TS val 27730025 ecr 27730024], length 2896
17:41:20.046513 IP 10.0.0.1.41414 > 10.0.0.2.5001: Flags [.], seq 724000:726896, ack 1, win 58, options [nop,nop,TS val 27730025 ecr 27730025], length 2896
17:41:20.048939 IP 10.0.0.1.41414 > 10.0.0.2.5001: Flags [.], seq 726896:729792, ack 1, win 58, options [nop,nop,TS val 27730026 ecr 27730025], length 2896
17:41:20.051362 IP 10.0.0.1.41414 > 10.0.0.2.5001: Flags [.], seq 729792:732688, ack 1, win 58, options [nop,nop,TS val 27730027 ecr 27730026], length 2896
17:41:20.053782 IP 10.0.0.1.41414 > 10.0.0.2.5001: Flags [.], seq 732688:735584, ack 1, win 58, options [nop,nop,TS val 27730027 ecr 27730027], length 2896
17:41:20.056203 IP 10.0.0.1.41414 > 10.0.0.2.5001: Flags [.], seq 735584:738480, ack 1, win 58, options [nop,nop,TS val 27730028 ecr 27730027], length 2896
17:41:20.058627 IP 10.0.0.1.41414 > 10.0.0.2.5001: Flags [P.], seq 738480:741376, ack 1, win 58, options [nop,nop,TS val 27730028 ecr 27730028], length 2896
