tcpdump: verbose output suppressed, use -v or -vv for full protocol decode
listening on h1-eth0, link-type EN10MB (Ethernet), capture size 65535 bytes
17:53:34.666334 IP 10.0.0.1.42166 > 10.0.0.2.5001: Flags [.], seq 102474683:102477579, ack 729078006, win 58, options [nop,nop,TS val 27913680 ecr 27913679], length 2896
17:53:34.666813 IP 10.0.0.2.5001 > 10.0.0.1.42166: Flags [.], ack 2896, win 1030, options [nop,nop,TS val 27913703 ecr 27913680], length 0
17:53:34.668756 IP 10.0.0.1.42166 > 10.0.0.2.5001: Flags [.], seq 2896:5792, ack 1, win 58, options [nop,nop,TS val 27913681 ecr 27913680], length 2896
17:53:34.668781 IP 10.0.0.2.5001 > 10.0.0.1.42166: Flags [.], ack 5792, win 1030, options [nop,nop,TS val 27913703 ecr 27913681], length 0
17:53:34.671175 IP 10.0.0.1.42166 > 10.0.0.2.5001: Flags [.], seq 5792:8688, ack 1, win 58, options [nop,nop,TS val 27913682 ecr 27913681], length 2896
17:53:34.671193 IP 10.0.0.2.5001 > 10.0.0.1.42166: Flags [.], ack 8688, win 1030, options [nop,nop,TS val 27913704 ecr 27913682], length 0
17:53:34.673597 IP 10.0.0.1.42166 > 10.0.0.2.5001: Flags [.], seq 8688:11584, ack 1, win 58, options [nop,nop,TS val 27913682 ecr 27913681], length 2896
17:53:34.673614 IP 10.0.0.2.5001 > 10.0.0.1.42166: Flags [.], ack 11584, win 1030, options [nop,nop,TS val 27913705 ecr 27913682], length 0
17:53:34.676019 IP 10.0.0.1.42166 > 10.0.0.2.5001: Flags [.], seq 11584:14480, ack 1, win 58, options [nop,nop,TS val 27913682 ecr 27913682], length 2896
17:53:34.676034 IP 10.0.0.2.5001 > 10.0.0.1.42166: Flags [.], ack 14480, win 1030, options [nop,nop,TS val 27913705 ecr 27913682], length 0
17:53:34.678442 IP 10.0.0.1.42166 > 10.0.0.2.5001: Flags [.], seq 14480:17376, ack 1, win 58, options [nop,nop,TS val 27913683 ecr 27913682], length 2896
17:53:34.678456 IP 10.0.0.2.5001 > 10.0.0.1.42166: Flags [.], ack 17376, win 1030, options [nop,nop,TS val 27913706 ecr 27913683], length 0
17:53:34.680865 IP 10.0.0.1.42166 > 10.0.0.2.5001: Flags [.], seq 17376:20272, ack 1, win 58, options [nop,nop,TS val 27913684 ecr 27913683], length 2896
17:53:34.680879 IP 10.0.0.2.5001 > 10.0.0.1.42166: Flags [.], ack 20272, win 1030, options [nop,nop,TS val 27913706 ecr 27913684], length 0
17:53:34.683289 IP 10.0.0.1.42166 > 10.0.0.2.5001: Flags [.], seq 20272:23168, ack 1, win 58, options [nop,nop,TS val 27913685 ecr 27913684], length 2896
17:53:34.683314 IP 10.0.0.2.5001 > 10.0.0.1.42166: Flags [.], ack 23168, win 1030, options [nop,nop,TS val 27913707 ecr 27913685], length 0
17:53:34.685711 IP 10.0.0.1.42166 > 10.0.0.2.5001: Flags [.], seq 23168:26064, ack 1, win 58, options [nop,nop,TS val 27913685 ecr 27913685], length 2896
17:53:34.685744 IP 10.0.0.2.5001 > 10.0.0.1.42166: Flags [.], ack 26064, win 1030, options [nop,nop,TS val 27913708 ecr 27913685], length 0
17:53:34.688133 IP 10.0.0.1.42166 > 10.0.0.2.5001: Flags [.], seq 26064:28960, ack 1, win 58, options [nop,nop,TS val 27913686 ecr 27913685], length 2896
17:53:34.688157 IP 10.0.0.2.5001 > 10.0.0.1.42166: Flags [.], ack 28960, win 1030, options [nop,nop,TS val 27913708 ecr 27913686], length 0
17:53:34.690558 IP 10.0.0.1.42166 > 10.0.0.2.5001: Flags [.], seq 28960:31856, ack 1, win 58, options [nop,nop,TS val 27913686 ecr 27913686], length 2896
17:53:34.690595 IP 10.0.0.2.5001 > 10.0.0.1.42166: Flags [.], ack 31856, win 1030, options [nop,nop,TS val 27913709 ecr 27913686], length 0
17:53:34.692979 IP 10.0.0.1.42166 > 10.0.0.2.5001: Flags [.], seq 31856:34752, ack 1, win 58, options [nop,nop,TS val 27913687 ecr 27913686], length 2896
17:53:34.693288 IP 10.0.0.2.5001 > 10.0.0.1.42166: Flags [.], ack 34752, win 1030, options [nop,nop,TS val 27913709 ecr 27913687], length 0
17:53:34.695399 IP 10.0.0.1.42166 > 10.0.0.2.5001: Flags [.], seq 34752:37648, ack 1, win 58, options [nop,nop,TS val 27913688 ecr 27913687], length 2896
17:53:34.695418 IP 10.0.0.2.5001 > 10.0.0.1.42166: Flags [.], ack 37648, win 1030, options [nop,nop,TS val 27913710 ecr 27913688], length 0
17:53:34.697821 IP 10.0.0.1.42166 > 10.0.0.2.5001: Flags [P.], seq 37648:40544, ack 1, win 58, options [nop,nop,TS val 27913688 ecr 27913688], length 2896
17:53:34.697838 IP 10.0.0.2.5001 > 10.0.0.1.42166: Flags [.], ack 40544, win 1030, options [nop,nop,TS val 27913711 ecr 27913688], length 0
17:53:34.700243 IP 10.0.0.1.42166 > 10.0.0.2.5001: Flags [.], seq 40544:43440, ack 1, win 58, options [nop,nop,TS val 27913689 ecr 27913688], length 2896
17:53:34.700260 IP 10.0.0.2.5001 > 10.0.0.1.42166: Flags [.], ack 43440, win 1030, options [nop,nop,TS val 27913711 ecr 27913689], length 0
17:53:34.702666 IP 10.0.0.1.42166 > 10.0.0.2.5001: Flags [.], seq 43440:46336, ack 1, win 58, options [nop,nop,TS val 27913689 ecr 27913689], length 2896
17:53:34.702683 IP 10.0.0.2.5001 > 10.0.0.1.42166: Flags [.], ack 46336, win 1030, options [nop,nop,TS val 27913712 ecr 27913689], length 0
17:53:34.705089 IP 10.0.0.1.42166 > 10.0.0.2.5001: Flags [.], seq 46336:49232, ack 1, win 58, options [nop,nop,TS val 27913690 ecr 27913689], length 2896
17:53:34.705110 IP 10.0.0.2.5001 > 10.0.0.1.42166: Flags [.], ack 49232, win 1030, options [nop,nop,TS val 27913712 ecr 27913690], length 0
17:53:34.707511 IP 10.0.0.1.42166 > 10.0.0.2.5001: Flags [.], seq 49232:52128, ack 1, win 58, options [nop,nop,TS val 27913691 ecr 27913690], length 2896
17:53:34.707528 IP 10.0.0.2.5001 > 10.0.0.1.42166: Flags [.], ack 52128, win 1030, options [nop,nop,TS val 27913713 ecr 27913691], length 0
17:53:34.709933 IP 10.0.0.1.42166 > 10.0.0.2.5001: Flags [.], seq 52128:55024, ack 1, win 58, options [nop,nop,TS val 27913691 ecr 27913691], length 2896
17:53:34.709956 IP 10.0.0.2.5001 > 10.0.0.1.42166: Flags [.], ack 55024, win 1030, options [nop,nop,TS val 27913714 ecr 27913691], length 0
17:53:34.712355 IP 10.0.0.1.42166 > 10.0.0.2.5001: Flags [.], seq 55024:57920, ack 1, win 58, options [nop,nop,TS val 27913692 ecr 27913691], length 2896
17:53:34.712372 IP 10.0.0.2.5001 > 10.0.0.1.42166: Flags [.], ack 57920, win 1030, options [nop,nop,TS val 27913714 ecr 27913692], length 0
17:53:34.714778 IP 10.0.0.1.42166 > 10.0.0.2.5001: Flags [.], seq 57920:60816, ack 1, win 58, options [nop,nop,TS val 27913692 ecr 27913691], length 2896
17:53:34.714798 IP 10.0.0.2.5001 > 10.0.0.1.42166: Flags [.], ack 60816, win 1030, options [nop,nop,TS val 27913715 ecr 27913692], length 0
17:53:34.717200 IP 10.0.0.1.42166 > 10.0.0.2.5001: Flags [.], seq 60816:63712, ack 1, win 58, options [nop,nop,TS val 27913693 ecr 27913693], length 2896
17:53:34.717217 IP 10.0.0.2.5001 > 10.0.0.1.42166: Flags [.], ack 63712, win 1030, options [nop,nop,TS val 27913715 ecr 27913693], length 0
17:53:34.719622 IP 10.0.0.1.42166 > 10.0.0.2.5001: Flags [.], seq 63712:66608, ack 1, win 58, options [nop,nop,TS val 27913694 ecr 27913693], length 2896
17:53:34.719639 IP 10.0.0.2.5001 > 10.0.0.1.42166: Flags [.], ack 66608, win 1030, options [nop,nop,TS val 27913716 ecr 27913694], length 0
17:53:34.722045 IP 10.0.0.1.42166 > 10.0.0.2.5001: Flags [.], seq 66608:69504, ack 1, win 58, options [nop,nop,TS val 27913694 ecr 27913694], length 2896
17:53:34.722063 IP 10.0.0.2.5001 > 10.0.0.1.42166: Flags [.], ack 69504, win 1030, options [nop,nop,TS val 27913717 ecr 27913694], length 0
17:53:34.724467 IP 10.0.0.1.42166 > 10.0.0.2.5001: Flags [.], seq 69504:72400, ack 1, win 58, options [nop,nop,TS val 27913695 ecr 27913694], length 2896
17:53:34.724485 IP 10.0.0.2.5001 > 10.0.0.1.42166: Flags [.], ack 72400, win 1030, options [nop,nop,TS val 27913717 ecr 27913695], length 0
17:53:34.726893 IP 10.0.0.1.42166 > 10.0.0.2.5001: Flags [P.], seq 72400:75296, ack 1, win 58, options [nop,nop,TS val 27913695 ecr 27913695], length 2896
17:53:34.728596 IP 10.0.0.2.5001 > 10.0.0.1.42166: Flags [.], ack 75296, win 1030, options [nop,nop,TS val 27913718 ecr 27913695], length 0
17:53:34.729313 IP 10.0.0.1.42166 > 10.0.0.2.5001: Flags [.], seq 75296:78192, ack 1, win 58, options [nop,nop,TS val 27913696 ecr 27913695], length 2896
17:53:34.729352 IP 10.0.0.2.5001 > 10.0.0.1.42166: Flags [.], ack 78192, win 1030, options [nop,nop,TS val 27913719 ecr 27913696], length 0
17:53:34.731735 IP 10.0.0.1.42166 > 10.0.0.2.5001: Flags [.], seq 78192:81088, ack 1, win 58, options [nop,nop,TS val 27913697 ecr 27913696], length 2896
17:53:34.731760 IP 10.0.0.2.5001 > 10.0.0.1.42166: Flags [.], ack 81088, win 1030, options [nop,nop,TS val 27913719 ecr 27913697], length 0
17:53:34.734159 IP 10.0.0.1.42166 > 10.0.0.2.5001: Flags [.], seq 81088:83984, ack 1, win 58, options [nop,nop,TS val 27913697 ecr 27913697], length 2896
17:53:34.734260 IP 10.0.0.2.5001 > 10.0.0.1.42166: Flags [.], ack 83984, win 1030, options [nop,nop,TS val 27913720 ecr 27913697], length 0
17:53:34.736582 IP 10.0.0.1.42166 > 10.0.0.2.5001: Flags [.], seq 83984:86880, ack 1, win 58, options [nop,nop,TS val 27913698 ecr 27913697], length 2896
17:53:34.736614 IP 10.0.0.2.5001 > 10.0.0.1.42166: Flags [.], ack 86880, win 1030, options [nop,nop,TS val 27913720 ecr 27913698], length 0
17:53:34.739177 IP 10.0.0.1.42166 > 10.0.0.2.5001: Flags [.], seq 86880:89776, ack 1, win 58, options [nop,nop,TS val 27913699 ecr 27913698], length 2896
17:53:34.739375 IP 10.0.0.2.5001 > 10.0.0.1.42166: Flags [.], ack 89776, win 1030, options [nop,nop,TS val 27913721 ecr 27913699], length 0
17:53:34.741425 IP 10.0.0.1.42166 > 10.0.0.2.5001: Flags [.], seq 89776:92672, ack 1, win 58, options [nop,nop,TS val 27913699 ecr 27913699], length 2896
17:53:34.741444 IP 10.0.0.2.5001 > 10.0.0.1.42166: Flags [.], ack 92672, win 1030, options [nop,nop,TS val 27913722 ecr 27913699], length 0
17:53:34.743847 IP 10.0.0.1.42166 > 10.0.0.2.5001: Flags [.], seq 92672:95568, ack 1, win 58, options [nop,nop,TS val 27913700 ecr 27913699], length 2896
17:53:34.743867 IP 10.0.0.2.5001 > 10.0.0.1.42166: Flags [.], ack 95568, win 1030, options [nop,nop,TS val 27913722 ecr 27913700], length 0
17:53:34.746269 IP 10.0.0.1.42166 > 10.0.0.2.5001: Flags [.], seq 95568:98464, ack 1, win 58, options [nop,nop,TS val 27913700 ecr 27913700], length 2896
17:53:34.746289 IP 10.0.0.2.5001 > 10.0.0.1.42166: Flags [.], ack 98464, win 1030, options [nop,nop,TS val 27913723 ecr 27913700], length 0
17:53:34.748693 IP 10.0.0.1.42166 > 10.0.0.2.5001: Flags [.], seq 98464:101360, ack 1, win 58, options [nop,nop,TS val 27913701 ecr 27913700], length 2896
17:53:34.748716 IP 10.0.0.2.5001 > 10.0.0.1.42166: Flags [.], ack 101360, win 1030, options [nop,nop,TS val 27913723 ecr 27913701], length 0
17:53:34.751114 IP 10.0.0.1.42166 > 10.0.0.2.5001: Flags [.], seq 101360:104256, ack 1, win 58, options [nop,nop,TS val 27913702 ecr 27913701], length 2896
17:53:34.751132 IP 10.0.0.2.5001 > 10.0.0.1.42166: Flags [.], ack 104256, win 1030, options [nop,nop,TS val 27913724 ecr 27913702], length 0
17:53:34.753536 IP 10.0.0.1.42166 > 10.0.0.2.5001: Flags [.], seq 104256:107152, ack 1, win 58, options [nop,nop,TS val 27913702 ecr 27913702], length 2896
17:53:34.753920 IP 10.0.0.2.5001 > 10.0.0.1.42166: Flags [.], ack 107152, win 1030, options [nop,nop,TS val 27913725 ecr 27913702], length 0
17:53:34.755959 IP 10.0.0.1.42166 > 10.0.0.2.5001: Flags [.], seq 107152:110048, ack 1, win 58, options [nop,nop,TS val 27913703 ecr 27913702], length 2896
17:53:34.755978 IP 10.0.0.2.5001 > 10.0.0.1.42166: Flags [.], ack 110048, win 1030, options [nop,nop,TS val 27913725 ecr 27913703], length 0
17:53:34.758381 IP 10.0.0.1.42166 > 10.0.0.2.5001: Flags [.], seq 110048:112944, ack 1, win 58, options [nop,nop,TS val 27913703 ecr 27913703], length 2896
17:53:34.758399 IP 10.0.0.2.5001 > 10.0.0.1.42166: Flags [.], ack 112944, win 1030, options [nop,nop,TS val 27913726 ecr 27913703], length 0
17:53:34.760804 IP 10.0.0.1.42166 > 10.0.0.2.5001: Flags [.], seq 112944:115840, ack 1, win 58, options [nop,nop,TS val 27913704 ecr 27913703], length 2896
17:53:34.760821 IP 10.0.0.2.5001 > 10.0.0.1.42166: Flags [.], ack 115840, win 1030, options [nop,nop,TS val 27913726 ecr 27913704], length 0
17:53:34.763226 IP 10.0.0.1.42166 > 10.0.0.2.5001: Flags [.], seq 115840:118736, ack 1, win 58, options [nop,nop,TS val 27913705 ecr 27913704], length 2896
17:53:34.764328 IP 10.0.0.2.5001 > 10.0.0.1.42166: Flags [.], ack 118736, win 1030, options [nop,nop,TS val 27913727 ecr 27913705], length 0
17:53:34.765649 IP 10.0.0.1.42166 > 10.0.0.2.5001: Flags [.], seq 118736:121632, ack 1, win 58, options [nop,nop,TS val 27913705 ecr 27913705], length 2896
17:53:34.765667 IP 10.0.0.2.5001 > 10.0.0.1.42166: Flags [.], ack 121632, win 1030, options [nop,nop,TS val 27913728 ecr 27913705], length 0
17:53:34.768071 IP 10.0.0.1.42166 > 10.0.0.2.5001: Flags [.], seq 121632:124528, ack 1, win 58, options [nop,nop,TS val 27913706 ecr 27913705], length 2896
17:53:34.768086 IP 10.0.0.2.5001 > 10.0.0.1.42166: Flags [.], ack 124528, win 1030, options [nop,nop,TS val 27913728 ecr 27913706], length 0
17:53:34.770493 IP 10.0.0.1.42166 > 10.0.0.2.5001: Flags [.], seq 124528:127424, ack 1, win 58, options [nop,nop,TS val 27913706 ecr 27913706], length 2896
17:53:34.770508 IP 10.0.0.2.5001 > 10.0.0.1.42166: Flags [.], ack 127424, win 1030, options [nop,nop,TS val 27913729 ecr 27913706], length 0
17:53:34.772915 IP 10.0.0.1.42166 > 10.0.0.2.5001: Flags [.], seq 127424:130320, ack 1, win 58, options [nop,nop,TS val 27913707 ecr 27913706], length 2896
17:53:34.772930 IP 10.0.0.2.5001 > 10.0.0.1.42166: Flags [.], ack 130320, win 1030, options [nop,nop,TS val 27913729 ecr 27913707], length 0
17:53:34.775338 IP 10.0.0.1.42166 > 10.0.0.2.5001: Flags [.], seq 130320:133216, ack 1, win 58, options [nop,nop,TS val 27913708 ecr 27913707], length 2896
17:53:34.775353 IP 10.0.0.2.5001 > 10.0.0.1.42166: Flags [.], ack 133216, win 1030, options [nop,nop,TS val 27913730 ecr 27913708], length 0
17:53:34.777760 IP 10.0.0.1.42166 > 10.0.0.2.5001: Flags [.], seq 133216:136112, ack 1, win 58, options [nop,nop,TS val 27913708 ecr 27913708], length 2896
17:53:34.777775 IP 10.0.0.2.5001 > 10.0.0.1.42166: Flags [.], ack 136112, win 1030, options [nop,nop,TS val 27913731 ecr 27913708], length 0
17:53:34.780182 IP 10.0.0.1.42166 > 10.0.0.2.5001: Flags [.], seq 136112:139008, ack 1, win 58, options [nop,nop,TS val 27913709 ecr 27913708], length 2896
17:53:34.780197 IP 10.0.0.2.5001 > 10.0.0.1.42166: Flags [.], ack 139008, win 1030, options [nop,nop,TS val 27913731 ecr 27913709], length 0
17:53:34.782605 IP 10.0.0.1.42166 > 10.0.0.2.5001: Flags [.], seq 139008:141904, ack 1, win 58, options [nop,nop,TS val 27913709 ecr 27913709], length 2896
17:53:34.782619 IP 10.0.0.2.5001 > 10.0.0.1.42166: Flags [.], ack 141904, win 1030, options [nop,nop,TS val 27913732 ecr 27913709], length 0
17:53:34.785028 IP 10.0.0.1.42166 > 10.0.0.2.5001: Flags [.], seq 141904:144800, ack 1, win 58, options [nop,nop,TS val 27913710 ecr 27913709], length 2896
17:53:34.785045 IP 10.0.0.2.5001 > 10.0.0.1.42166: Flags [.], ack 144800, win 1030, options [nop,nop,TS val 27913732 ecr 27913710], length 0
17:53:34.787450 IP 10.0.0.1.42166 > 10.0.0.2.5001: Flags [.], seq 144800:147696, ack 1, win 58, options [nop,nop,TS val 27913711 ecr 27913710], length 2896
17:53:34.787465 IP 10.0.0.2.5001 > 10.0.0.1.42166: Flags [.], ack 147696, win 1030, options [nop,nop,TS val 27913733 ecr 27913711], length 0
17:53:34.789873 IP 10.0.0.1.42166 > 10.0.0.2.5001: Flags [.], seq 147696:150592, ack 1, win 58, options [nop,nop,TS val 27913711 ecr 27913711], length 2896
17:53:34.789893 IP 10.0.0.2.5001 > 10.0.0.1.42166: Flags [.], ack 150592, win 1030, options [nop,nop,TS val 27913734 ecr 27913711], length 0
17:53:34.792294 IP 10.0.0.1.42166 > 10.0.0.2.5001: Flags [.], seq 150592:153488, ack 1, win 58, options [nop,nop,TS val 27913712 ecr 27913711], length 2896
17:53:34.792367 IP 10.0.0.2.5001 > 10.0.0.1.42166: Flags [.], ack 153488, win 1030, options [nop,nop,TS val 27913734 ecr 27913712], length 0
17:53:34.794721 IP 10.0.0.1.42166 > 10.0.0.2.5001: Flags [.], seq 153488:156384, ack 1, win 58, options [nop,nop,TS val 27913712 ecr 27913712], length 2896
17:53:34.795375 IP 10.0.0.2.5001 > 10.0.0.1.42166: Flags [.], ack 156384, win 1030, options [nop,nop,TS val 27913735 ecr 27913712], length 0
17:53:34.797142 IP 10.0.0.1.42166 > 10.0.0.2.5001: Flags [.], seq 156384:159280, ack 1, win 58, options [nop,nop,TS val 27913713 ecr 27913712], length 2896
17:53:34.797169 IP 10.0.0.2.5001 > 10.0.0.1.42166: Flags [.], ack 159280, win 1030, options [nop,nop,TS val 27913735 ecr 27913713], length 0
17:53:34.799563 IP 10.0.0.1.42166 > 10.0.0.2.5001: Flags [.], seq 159280:162176, ack 1, win 58, options [nop,nop,TS val 27913714 ecr 27913713], length 2896
17:53:34.799584 IP 10.0.0.2.5001 > 10.0.0.1.42166: Flags [.], ack 162176, win 1030, options [nop,nop,TS val 27913736 ecr 27913714], length 0
17:53:34.801984 IP 10.0.0.1.42166 > 10.0.0.2.5001: Flags [.], seq 162176:165072, ack 1, win 58, options [nop,nop,TS val 27913714 ecr 27913714], length 2896
17:53:34.802001 IP 10.0.0.2.5001 > 10.0.0.1.42166: Flags [.], ack 165072, win 1030, options [nop,nop,TS val 27913737 ecr 27913714], length 0
17:53:34.804406 IP 10.0.0.1.42166 > 10.0.0.2.5001: Flags [.], seq 165072:167968, ack 1, win 58, options [nop,nop,TS val 27913715 ecr 27913714], length 2896
17:53:34.804421 IP 10.0.0.2.5001 > 10.0.0.1.42166: Flags [.], ack 167968, win 1030, options [nop,nop,TS val 27913737 ecr 27913715], length 0
17:53:34.806829 IP 10.0.0.1.42166 > 10.0.0.2.5001: Flags [.], seq 167968:170864, ack 1, win 58, options [nop,nop,TS val 27913715 ecr 27913715], length 2896
17:53:34.806844 IP 10.0.0.2.5001 > 10.0.0.1.42166: Flags [.], ack 170864, win 1030, options [nop,nop,TS val 27913738 ecr 27913715], length 0
17:53:34.809251 IP 10.0.0.1.42166 > 10.0.0.2.5001: Flags [.], seq 170864:173760, ack 1, win 58, options [nop,nop,TS val 27913716 ecr 27913715], length 2896
17:53:34.809265 IP 10.0.0.2.5001 > 10.0.0.1.42166: Flags [.], ack 173760, win 1030, options [nop,nop,TS val 27913738 ecr 27913716], length 0
17:53:34.811674 IP 10.0.0.1.42166 > 10.0.0.2.5001: Flags [.], seq 173760:176656, ack 1, win 58, options [nop,nop,TS val 27913717 ecr 27913716], length 2896
17:53:34.811688 IP 10.0.0.2.5001 > 10.0.0.1.42166: Flags [.], ack 176656, win 1030, options [nop,nop,TS val 27913739 ecr 27913717], length 0
17:53:34.814097 IP 10.0.0.1.42166 > 10.0.0.2.5001: Flags [.], seq 176656:179552, ack 1, win 58, options [nop,nop,TS val 27913717 ecr 27913717], length 2896
17:53:34.814116 IP 10.0.0.2.5001 > 10.0.0.1.42166: Flags [.], ack 179552, win 1030, options [nop,nop,TS val 27913740 ecr 27913717], length 0
17:53:34.816519 IP 10.0.0.1.42166 > 10.0.0.2.5001: Flags [.], seq 179552:182448, ack 1, win 58, options [nop,nop,TS val 27913718 ecr 27913717], length 2896
17:53:34.816533 IP 10.0.0.2.5001 > 10.0.0.1.42166: Flags [.], ack 182448, win 1030, options [nop,nop,TS val 27913740 ecr 27913718], length 0
17:53:34.818941 IP 10.0.0.1.42166 > 10.0.0.2.5001: Flags [.], seq 182448:185344, ack 1, win 58, options [nop,nop,TS val 27913718 ecr 27913718], length 2896
17:53:34.818956 IP 10.0.0.2.5001 > 10.0.0.1.42166: Flags [.], ack 185344, win 1030, options [nop,nop,TS val 27913741 ecr 27913718], length 0
17:53:34.821363 IP 10.0.0.1.42166 > 10.0.0.2.5001: Flags [.], seq 185344:188240, ack 1, win 58, options [nop,nop,TS val 27913719 ecr 27913719], length 2896
17:53:34.821379 IP 10.0.0.2.5001 > 10.0.0.1.42166: Flags [.], ack 188240, win 1030, options [nop,nop,TS val 27913742 ecr 27913719], length 0
17:53:34.823786 IP 10.0.0.1.42166 > 10.0.0.2.5001: Flags [.], seq 188240:191136, ack 1, win 58, options [nop,nop,TS val 27913720 ecr 27913719], length 2896
17:53:34.823800 IP 10.0.0.2.5001 > 10.0.0.1.42166: Flags [.], ack 191136, win 1030, options [nop,nop,TS val 27913742 ecr 27913720], length 0
17:53:34.826209 IP 10.0.0.1.42166 > 10.0.0.2.5001: Flags [.], seq 191136:194032, ack 1, win 58, options [nop,nop,TS val 27913720 ecr 27913720], length 2896
17:53:34.826228 IP 10.0.0.2.5001 > 10.0.0.1.42166: Flags [.], ack 194032, win 1030, options [nop,nop,TS val 27913743 ecr 27913720], length 0
17:53:34.828631 IP 10.0.0.1.42166 > 10.0.0.2.5001: Flags [.], seq 194032:196928, ack 1, win 58, options [nop,nop,TS val 27913721 ecr 27913720], length 2896
17:53:34.828646 IP 10.0.0.2.5001 > 10.0.0.1.42166: Flags [.], ack 196928, win 1030, options [nop,nop,TS val 27913743 ecr 27913721], length 0
17:53:34.831053 IP 10.0.0.1.42166 > 10.0.0.2.5001: Flags [.], seq 196928:199824, ack 1, win 58, options [nop,nop,TS val 27913722 ecr 27913721], length 2896
17:53:34.831068 IP 10.0.0.2.5001 > 10.0.0.1.42166: Flags [.], ack 199824, win 1030, options [nop,nop,TS val 27913744 ecr 27913722], length 0
17:53:34.833475 IP 10.0.0.1.42166 > 10.0.0.2.5001: Flags [.], seq 199824:202720, ack 1, win 58, options [nop,nop,TS val 27913722 ecr 27913722], length 2896
17:53:34.834446 IP 10.0.0.2.5001 > 10.0.0.1.42166: Flags [.], ack 202720, win 1030, options [nop,nop,TS val 27913745 ecr 27913722], length 0
17:53:34.835898 IP 10.0.0.1.42166 > 10.0.0.2.5001: Flags [.], seq 202720:205616, ack 1, win 58, options [nop,nop,TS val 27913723 ecr 27913722], length 2896
17:53:34.835913 IP 10.0.0.2.5001 > 10.0.0.1.42166: Flags [.], ack 205616, win 1030, options [nop,nop,TS val 27913745 ecr 27913723], length 0
17:53:34.838320 IP 10.0.0.1.42166 > 10.0.0.2.5001: Flags [.], seq 205616:208512, ack 1, win 58, options [nop,nop,TS val 27913723 ecr 27913723], length 2896
17:53:34.838335 IP 10.0.0.2.5001 > 10.0.0.1.42166: Flags [.], ack 208512, win 1030, options [nop,nop,TS val 27913746 ecr 27913723], length 0
17:53:34.840742 IP 10.0.0.1.42166 > 10.0.0.2.5001: Flags [.], seq 208512:211408, ack 1, win 58, options [nop,nop,TS val 27913724 ecr 27913723], length 2896
17:53:34.840757 IP 10.0.0.2.5001 > 10.0.0.1.42166: Flags [.], ack 211408, win 1030, options [nop,nop,TS val 27913746 ecr 27913724], length 0
17:53:34.843165 IP 10.0.0.1.42166 > 10.0.0.2.5001: Flags [.], seq 211408:214304, ack 1, win 58, options [nop,nop,TS val 27913725 ecr 27913724], length 2896
17:53:34.843181 IP 10.0.0.2.5001 > 10.0.0.1.42166: Flags [.], ack 214304, win 1030, options [nop,nop,TS val 27913747 ecr 27913725], length 0
17:53:34.845587 IP 10.0.0.1.42166 > 10.0.0.2.5001: Flags [.], seq 214304:217200, ack 1, win 58, options [nop,nop,TS val 27913725 ecr 27913725], length 2896
17:53:34.845602 IP 10.0.0.2.5001 > 10.0.0.1.42166: Flags [.], ack 217200, win 1030, options [nop,nop,TS val 27913748 ecr 27913725], length 0
17:53:34.848009 IP 10.0.0.1.42166 > 10.0.0.2.5001: Flags [.], seq 217200:220096, ack 1, win 58, options [nop,nop,TS val 27913726 ecr 27913725], length 2896
17:53:34.848024 IP 10.0.0.2.5001 > 10.0.0.1.42166: Flags [.], ack 220096, win 1030, options [nop,nop,TS val 27913748 ecr 27913726], length 0
17:53:34.850432 IP 10.0.0.1.42166 > 10.0.0.2.5001: Flags [.], seq 220096:222992, ack 1, win 58, options [nop,nop,TS val 27913726 ecr 27913726], length 2896
17:53:34.850447 IP 10.0.0.2.5001 > 10.0.0.1.42166: Flags [.], ack 222992, win 1030, options [nop,nop,TS val 27913749 ecr 27913726], length 0
17:53:34.852855 IP 10.0.0.1.42166 > 10.0.0.2.5001: Flags [.], seq 222992:225888, ack 1, win 58, options [nop,nop,TS val 27913727 ecr 27913726], length 2896
17:53:34.852869 IP 10.0.0.2.5001 > 10.0.0.1.42166: Flags [.], ack 225888, win 1030, options [nop,nop,TS val 27913749 ecr 27913727], length 0
17:53:34.855277 IP 10.0.0.1.42166 > 10.0.0.2.5001: Flags [.], seq 225888:228784, ack 1, win 58, options [nop,nop,TS val 27913728 ecr 27913727], length 2896
17:53:34.855292 IP 10.0.0.2.5001 > 10.0.0.1.42166: Flags [.], ack 228784, win 1030, options [nop,nop,TS val 27913750 ecr 27913728], length 0
17:53:34.857699 IP 10.0.0.1.42166 > 10.0.0.2.5001: Flags [.], seq 228784:231680, ack 1, win 58, options [nop,nop,TS val 27913728 ecr 27913728], length 2896
17:53:34.857714 IP 10.0.0.2.5001 > 10.0.0.1.42166: Flags [.], ack 231680, win 1030, options [nop,nop,TS val 27913751 ecr 27913728], length 0
17:53:34.860125 IP 10.0.0.1.42166 > 10.0.0.2.5001: Flags [P.], seq 231680:234576, ack 1, win 58, options [nop,nop,TS val 27913729 ecr 27913728], length 2896
17:53:34.860144 IP 10.0.0.2.5001 > 10.0.0.1.42166: Flags [.], ack 234576, win 1030, options [nop,nop,TS val 27913751 ecr 27913729], length 0
17:53:34.862545 IP 10.0.0.1.42166 > 10.0.0.2.5001: Flags [.], seq 234576:237472, ack 1, win 58, options [nop,nop,TS val 27913729 ecr 27913729], length 2896
17:53:34.862561 IP 10.0.0.2.5001 > 10.0.0.1.42166: Flags [.], ack 237472, win 1030, options [nop,nop,TS val 27913752 ecr 27913729], length 0
17:53:34.864967 IP 10.0.0.1.42166 > 10.0.0.2.5001: Flags [.], seq 237472:240368, ack 1, win 58, options [nop,nop,TS val 27913730 ecr 27913729], length 2896
17:53:34.864984 IP 10.0.0.2.5001 > 10.0.0.1.42166: Flags [.], ack 240368, win 1030, options [nop,nop,TS val 27913752 ecr 27913730], length 0
17:53:34.867389 IP 10.0.0.1.42166 > 10.0.0.2.5001: Flags [.], seq 240368:243264, ack 1, win 58, options [nop,nop,TS val 27913731 ecr 27913730], length 2896
17:53:34.867405 IP 10.0.0.2.5001 > 10.0.0.1.42166: Flags [.], ack 243264, win 1030, options [nop,nop,TS val 27913753 ecr 27913731], length 0
17:53:34.869811 IP 10.0.0.1.42166 > 10.0.0.2.5001: Flags [.], seq 243264:246160, ack 1, win 58, options [nop,nop,TS val 27913731 ecr 27913731], length 2896
17:53:34.869826 IP 10.0.0.2.5001 > 10.0.0.1.42166: Flags [.], ack 246160, win 1030, options [nop,nop,TS val 27913754 ecr 27913731], length 0
17:53:34.872234 IP 10.0.0.1.42166 > 10.0.0.2.5001: Flags [.], seq 246160:249056, ack 1, win 58, options [nop,nop,TS val 27913732 ecr 27913731], length 2896
17:53:34.872250 IP 10.0.0.2.5001 > 10.0.0.1.42166: Flags [.], ack 249056, win 1030, options [nop,nop,TS val 27913754 ecr 27913732], length 0
17:53:34.874659 IP 10.0.0.1.42166 > 10.0.0.2.5001: Flags [.], seq 249056:251952, ack 1, win 58, options [nop,nop,TS val 27913732 ecr 27913732], length 2896
17:53:34.874676 IP 10.0.0.2.5001 > 10.0.0.1.42166: Flags [.], ack 251952, win 1030, options [nop,nop,TS val 27913755 ecr 27913732], length 0
17:53:34.877078 IP 10.0.0.1.42166 > 10.0.0.2.5001: Flags [.], seq 251952:254848, ack 1, win 58, options [nop,nop,TS val 27913733 ecr 27913732], length 2896
17:53:34.877093 IP 10.0.0.2.5001 > 10.0.0.1.42166: Flags [.], ack 254848, win 1030, options [nop,nop,TS val 27913755 ecr 27913733], length 0
17:53:34.879501 IP 10.0.0.1.42166 > 10.0.0.2.5001: Flags [.], seq 254848:257744, ack 1, win 58, options [nop,nop,TS val 27913734 ecr 27913733], length 2896
17:53:34.879516 IP 10.0.0.2.5001 > 10.0.0.1.42166: Flags [.], ack 257744, win 1030, options [nop,nop,TS val 27913756 ecr 27913734], length 0
17:53:34.881923 IP 10.0.0.1.42166 > 10.0.0.2.5001: Flags [.], seq 257744:260640, ack 1, win 58, options [nop,nop,TS val 27913734 ecr 27913734], length 2896
17:53:34.881940 IP 10.0.0.2.5001 > 10.0.0.1.42166: Flags [.], ack 260640, win 1030, options [nop,nop,TS val 27913757 ecr 27913734], length 0
17:53:34.884346 IP 10.0.0.1.42166 > 10.0.0.2.5001: Flags [.], seq 260640:263536, ack 1, win 58, options [nop,nop,TS val 27913735 ecr 27913734], length 2896
17:53:34.884360 IP 10.0.0.2.5001 > 10.0.0.1.42166: Flags [.], ack 263536, win 1030, options [nop,nop,TS val 27913757 ecr 27913735], length 0
17:53:34.886768 IP 10.0.0.1.42166 > 10.0.0.2.5001: Flags [.], seq 263536:266432, ack 1, win 58, options [nop,nop,TS val 27913735 ecr 27913735], length 2896
17:53:34.886782 IP 10.0.0.2.5001 > 10.0.0.1.42166: Flags [.], ack 266432, win 1030, options [nop,nop,TS val 27913758 ecr 27913735], length 0
17:53:34.889190 IP 10.0.0.1.42166 > 10.0.0.2.5001: Flags [.], seq 266432:269328, ack 1, win 58, options [nop,nop,TS val 27913736 ecr 27913735], length 2896
17:53:34.889205 IP 10.0.0.2.5001 > 10.0.0.1.42166: Flags [.], ack 269328, win 1030, options [nop,nop,TS val 27913758 ecr 27913736], length 0
17:53:34.891613 IP 10.0.0.1.42166 > 10.0.0.2.5001: Flags [.], seq 269328:272224, ack 1, win 58, options [nop,nop,TS val 27913737 ecr 27913736], length 2896
17:53:34.891627 IP 10.0.0.2.5001 > 10.0.0.1.42166: Flags [.], ack 272224, win 1030, options [nop,nop,TS val 27913759 ecr 27913737], length 0
17:53:34.894035 IP 10.0.0.1.42166 > 10.0.0.2.5001: Flags [.], seq 272224:275120, ack 1, win 58, options [nop,nop,TS val 27913737 ecr 27913737], length 2896
17:53:34.894050 IP 10.0.0.2.5001 > 10.0.0.1.42166: Flags [.], ack 275120, win 1030, options [nop,nop,TS val 27913760 ecr 27913737], length 0
17:53:34.896457 IP 10.0.0.1.42166 > 10.0.0.2.5001: Flags [.], seq 275120:278016, ack 1, win 58, options [nop,nop,TS val 27913738 ecr 27913737], length 2896
17:53:34.896495 IP 10.0.0.2.5001 > 10.0.0.1.42166: Flags [.], ack 278016, win 1030, options [nop,nop,TS val 27913760 ecr 27913738], length 0
17:53:34.898884 IP 10.0.0.1.42166 > 10.0.0.2.5001: Flags [.], seq 278016:280912, ack 1, win 58, options [nop,nop,TS val 27913738 ecr 27913738], length 2896
17:53:34.900463 IP 10.0.0.2.5001 > 10.0.0.1.42166: Flags [.], ack 280912, win 1030, options [nop,nop,TS val 27913761 ecr 27913738], length 0
17:53:34.901306 IP 10.0.0.1.42166 > 10.0.0.2.5001: Flags [.], seq 280912:283808, ack 1, win 58, options [nop,nop,TS val 27913739 ecr 27913738], length 2896
17:53:34.901341 IP 10.0.0.2.5001 > 10.0.0.1.42166: Flags [.], ack 283808, win 1030, options [nop,nop,TS val 27913762 ecr 27913739], length 0
17:53:34.903729 IP 10.0.0.1.42166 > 10.0.0.2.5001: Flags [.], seq 283808:286704, ack 1, win 58, options [nop,nop,TS val 27913740 ecr 27913739], length 2896
17:53:34.903764 IP 10.0.0.2.5001 > 10.0.0.1.42166: Flags [.], ack 286704, win 1030, options [nop,nop,TS val 27913762 ecr 27913740], length 0
17:53:34.906150 IP 10.0.0.1.42166 > 10.0.0.2.5001: Flags [.], seq 286704:289600, ack 1, win 58, options [nop,nop,TS val 27913740 ecr 27913740], length 2896
17:53:34.906184 IP 10.0.0.2.5001 > 10.0.0.1.42166: Flags [.], ack 289600, win 1030, options [nop,nop,TS val 27913763 ecr 27913740], length 0
17:53:34.908573 IP 10.0.0.1.42166 > 10.0.0.2.5001: Flags [.], seq 289600:292496, ack 1, win 58, options [nop,nop,TS val 27913741 ecr 27913740], length 2896
17:53:34.908600 IP 10.0.0.2.5001 > 10.0.0.1.42166: Flags [.], ack 292496, win 1030, options [nop,nop,TS val 27913763 ecr 27913741], length 0
17:53:34.910992 IP 10.0.0.1.42166 > 10.0.0.2.5001: Flags [.], seq 292496:295392, ack 1, win 58, options [nop,nop,TS val 27913742 ecr 27913741], length 2896
17:53:34.911008 IP 10.0.0.2.5001 > 10.0.0.1.42166: Flags [.], ack 295392, win 1030, options [nop,nop,TS val 27913764 ecr 27913742], length 0
17:53:34.913415 IP 10.0.0.1.42166 > 10.0.0.2.5001: Flags [.], seq 295392:298288, ack 1, win 58, options [nop,nop,TS val 27913742 ecr 27913742], length 2896
17:53:34.913429 IP 10.0.0.2.5001 > 10.0.0.1.42166: Flags [.], ack 298288, win 1030, options [nop,nop,TS val 27913765 ecr 27913742], length 0
17:53:34.915837 IP 10.0.0.1.42166 > 10.0.0.2.5001: Flags [.], seq 298288:301184, ack 1, win 58, options [nop,nop,TS val 27913743 ecr 27913742], length 2896
17:53:34.915853 IP 10.0.0.2.5001 > 10.0.0.1.42166: Flags [.], ack 301184, win 1030, options [nop,nop,TS val 27913765 ecr 27913743], length 0
17:53:34.918261 IP 10.0.0.1.42166 > 10.0.0.2.5001: Flags [.], seq 301184:304080, ack 1, win 58, options [nop,nop,TS val 27913743 ecr 27913743], length 2896
17:53:34.918280 IP 10.0.0.2.5001 > 10.0.0.1.42166: Flags [.], ack 304080, win 1030, options [nop,nop,TS val 27913766 ecr 27913743], length 0
17:53:34.920682 IP 10.0.0.1.42166 > 10.0.0.2.5001: Flags [.], seq 304080:306976, ack 1, win 58, options [nop,nop,TS val 27913744 ecr 27913743], length 2896
17:53:34.920696 IP 10.0.0.2.5001 > 10.0.0.1.42166: Flags [.], ack 306976, win 1030, options [nop,nop,TS val 27913766 ecr 27913744], length 0
17:53:34.923104 IP 10.0.0.1.42166 > 10.0.0.2.5001: Flags [.], seq 306976:309872, ack 1, win 58, options [nop,nop,TS val 27913745 ecr 27913744], length 2896
17:53:34.923119 IP 10.0.0.2.5001 > 10.0.0.1.42166: Flags [.], ack 309872, win 1030, options [nop,nop,TS val 27913767 ecr 27913745], length 0
17:53:34.925527 IP 10.0.0.1.42166 > 10.0.0.2.5001: Flags [.], seq 309872:312768, ack 1, win 58, options [nop,nop,TS val 27913745 ecr 27913745], length 2896
17:53:34.925541 IP 10.0.0.2.5001 > 10.0.0.1.42166: Flags [.], ack 312768, win 1030, options [nop,nop,TS val 27913768 ecr 27913745], length 0
17:53:34.927949 IP 10.0.0.1.42166 > 10.0.0.2.5001: Flags [.], seq 312768:315664, ack 1, win 58, options [nop,nop,TS val 27913746 ecr 27913745], length 2896
17:53:34.927963 IP 10.0.0.2.5001 > 10.0.0.1.42166: Flags [.], ack 315664, win 1030, options [nop,nop,TS val 27913768 ecr 27913746], length 0
17:53:34.930371 IP 10.0.0.1.42166 > 10.0.0.2.5001: Flags [.], seq 315664:318560, ack 1, win 58, options [nop,nop,TS val 27913746 ecr 27913746], length 2896
17:53:34.930386 IP 10.0.0.2.5001 > 10.0.0.1.42166: Flags [.], ack 318560, win 1030, options [nop,nop,TS val 27913769 ecr 27913746], length 0
17:53:34.932793 IP 10.0.0.1.42166 > 10.0.0.2.5001: Flags [.], seq 318560:321456, ack 1, win 58, options [nop,nop,TS val 27913747 ecr 27913746], length 2896
17:53:34.933346 IP 10.0.0.2.5001 > 10.0.0.1.42166: Flags [.], ack 321456, win 1030, options [nop,nop,TS val 27913770 ecr 27913747], length 0
17:53:34.935217 IP 10.0.0.1.42166 > 10.0.0.2.5001: Flags [.], seq 321456:324352, ack 1, win 58, options [nop,nop,TS val 27913748 ecr 27913747], length 2896
17:53:34.935235 IP 10.0.0.2.5001 > 10.0.0.1.42166: Flags [.], ack 324352, win 1030, options [nop,nop,TS val 27913770 ecr 27913748], length 0
17:53:34.937639 IP 10.0.0.1.42166 > 10.0.0.2.5001: Flags [.], seq 324352:327248, ack 1, win 58, options [nop,nop,TS val 27913748 ecr 27913748], length 2896
17:53:34.937654 IP 10.0.0.2.5001 > 10.0.0.1.42166: Flags [.], ack 327248, win 1030, options [nop,nop,TS val 27913771 ecr 27913748], length 0
17:53:34.940061 IP 10.0.0.1.42166 > 10.0.0.2.5001: Flags [.], seq 327248:330144, ack 1, win 58, options [nop,nop,TS val 27913749 ecr 27913748], length 2896
17:53:34.940075 IP 10.0.0.2.5001 > 10.0.0.1.42166: Flags [.], ack 330144, win 1030, options [nop,nop,TS val 27913771 ecr 27913749], length 0
17:53:34.942484 IP 10.0.0.1.42166 > 10.0.0.2.5001: Flags [.], seq 330144:333040, ack 1, win 58, options [nop,nop,TS val 27913749 ecr 27913749], length 2896
17:53:34.942500 IP 10.0.0.2.5001 > 10.0.0.1.42166: Flags [.], ack 333040, win 1030, options [nop,nop,TS val 27913772 ecr 27913749], length 0
17:53:34.944906 IP 10.0.0.1.42166 > 10.0.0.2.5001: Flags [.], seq 333040:335936, ack 1, win 58, options [nop,nop,TS val 27913750 ecr 27913749], length 2896
17:53:34.944943 IP 10.0.0.2.5001 > 10.0.0.1.42166: Flags [.], ack 335936, win 1030, options [nop,nop,TS val 27913772 ecr 27913750], length 0
17:53:34.947329 IP 10.0.0.1.42166 > 10.0.0.2.5001: Flags [.], seq 335936:338832, ack 1, win 58, options [nop,nop,TS val 27913751 ecr 27913750], length 2896
17:53:34.947346 IP 10.0.0.2.5001 > 10.0.0.1.42166: Flags [.], ack 338832, win 1030, options [nop,nop,TS val 27913773 ecr 27913751], length 0
17:53:34.949751 IP 10.0.0.1.42166 > 10.0.0.2.5001: Flags [.], seq 338832:341728, ack 1, win 58, options [nop,nop,TS val 27913751 ecr 27913751], length 2896
17:53:34.949766 IP 10.0.0.2.5001 > 10.0.0.1.42166: Flags [.], ack 341728, win 1030, options [nop,nop,TS val 27913774 ecr 27913751], length 0
17:53:34.952173 IP 10.0.0.1.42166 > 10.0.0.2.5001: Flags [.], seq 341728:344624, ack 1, win 58, options [nop,nop,TS val 27913752 ecr 27913751], length 2896
17:53:34.952187 IP 10.0.0.2.5001 > 10.0.0.1.42166: Flags [.], ack 344624, win 1030, options [nop,nop,TS val 27913774 ecr 27913752], length 0
17:53:34.954595 IP 10.0.0.1.42166 > 10.0.0.2.5001: Flags [.], seq 344624:347520, ack 1, win 58, options [nop,nop,TS val 27913752 ecr 27913752], length 2896
17:53:34.954614 IP 10.0.0.2.5001 > 10.0.0.1.42166: Flags [.], ack 347520, win 1030, options [nop,nop,TS val 27913775 ecr 27913752], length 0
17:53:34.957018 IP 10.0.0.1.42166 > 10.0.0.2.5001: Flags [.], seq 347520:350416, ack 1, win 58, options [nop,nop,TS val 27913753 ecr 27913752], length 2896
17:53:34.957035 IP 10.0.0.2.5001 > 10.0.0.1.42166: Flags [.], ack 350416, win 1030, options [nop,nop,TS val 27913775 ecr 27913753], length 0
17:53:34.959441 IP 10.0.0.1.42166 > 10.0.0.2.5001: Flags [.], seq 350416:353312, ack 1, win 58, options [nop,nop,TS val 27913754 ecr 27913753], length 2896
17:53:34.959459 IP 10.0.0.2.5001 > 10.0.0.1.42166: Flags [.], ack 353312, win 1030, options [nop,nop,TS val 27913776 ecr 27913754], length 0
17:53:34.961862 IP 10.0.0.1.42166 > 10.0.0.2.5001: Flags [.], seq 353312:356208, ack 1, win 58, options [nop,nop,TS val 27913754 ecr 27913754], length 2896
17:53:34.961878 IP 10.0.0.2.5001 > 10.0.0.1.42166: Flags [.], ack 356208, win 1030, options [nop,nop,TS val 27913777 ecr 27913754], length 0
17:53:34.964285 IP 10.0.0.1.42166 > 10.0.0.2.5001: Flags [.], seq 356208:359104, ack 1, win 58, options [nop,nop,TS val 27913755 ecr 27913754], length 2896
17:53:34.964300 IP 10.0.0.2.5001 > 10.0.0.1.42166: Flags [.], ack 359104, win 1030, options [nop,nop,TS val 27913777 ecr 27913755], length 0
17:53:34.966707 IP 10.0.0.1.42166 > 10.0.0.2.5001: Flags [.], seq 359104:362000, ack 1, win 58, options [nop,nop,TS val 27913755 ecr 27913755], length 2896
17:53:34.966722 IP 10.0.0.2.5001 > 10.0.0.1.42166: Flags [.], ack 362000, win 1030, options [nop,nop,TS val 27913778 ecr 27913755], length 0
17:53:34.969130 IP 10.0.0.1.42166 > 10.0.0.2.5001: Flags [.], seq 362000:364896, ack 1, win 58, options [nop,nop,TS val 27913756 ecr 27913755], length 2896
17:53:34.969144 IP 10.0.0.2.5001 > 10.0.0.1.42166: Flags [.], ack 364896, win 1030, options [nop,nop,TS val 27913778 ecr 27913756], length 0
17:53:34.971552 IP 10.0.0.1.42166 > 10.0.0.2.5001: Flags [.], seq 364896:367792, ack 1, win 58, options [nop,nop,TS val 27913757 ecr 27913756], length 2896
17:53:34.971567 IP 10.0.0.2.5001 > 10.0.0.1.42166: Flags [.], ack 367792, win 1030, options [nop,nop,TS val 27913779 ecr 27913757], length 0
17:53:34.973974 IP 10.0.0.1.42166 > 10.0.0.2.5001: Flags [.], seq 367792:370688, ack 1, win 58, options [nop,nop,TS val 27913757 ecr 27913757], length 2896
17:53:34.973989 IP 10.0.0.2.5001 > 10.0.0.1.42166: Flags [.], ack 370688, win 1030, options [nop,nop,TS val 27913780 ecr 27913757], length 0
17:53:34.976397 IP 10.0.0.1.42166 > 10.0.0.2.5001: Flags [.], seq 370688:373584, ack 1, win 58, options [nop,nop,TS val 27913758 ecr 27913757], length 2896
17:53:34.976411 IP 10.0.0.2.5001 > 10.0.0.1.42166: Flags [.], ack 373584, win 1030, options [nop,nop,TS val 27913780 ecr 27913758], length 0
17:53:34.978819 IP 10.0.0.1.42166 > 10.0.0.2.5001: Flags [.], seq 373584:376480, ack 1, win 58, options [nop,nop,TS val 27913758 ecr 27913758], length 2896
17:53:34.978834 IP 10.0.0.2.5001 > 10.0.0.1.42166: Flags [.], ack 376480, win 1030, options [nop,nop,TS val 27913781 ecr 27913758], length 0
17:53:34.981241 IP 10.0.0.1.42166 > 10.0.0.2.5001: Flags [.], seq 376480:379376, ack 1, win 58, options [nop,nop,TS val 27913759 ecr 27913758], length 2896
17:53:34.981256 IP 10.0.0.2.5001 > 10.0.0.1.42166: Flags [.], ack 379376, win 1030, options [nop,nop,TS val 27913781 ecr 27913759], length 0
17:53:34.983664 IP 10.0.0.1.42166 > 10.0.0.2.5001: Flags [.], seq 379376:382272, ack 1, win 58, options [nop,nop,TS val 27913760 ecr 27913759], length 2896
17:53:34.983678 IP 10.0.0.2.5001 > 10.0.0.1.42166: Flags [.], ack 382272, win 1030, options [nop,nop,TS val 27913782 ecr 27913760], length 0
17:53:34.986087 IP 10.0.0.1.42166 > 10.0.0.2.5001: Flags [.], seq 382272:385168, ack 1, win 58, options [nop,nop,TS val 27913760 ecr 27913760], length 2896
17:53:34.986104 IP 10.0.0.2.5001 > 10.0.0.1.42166: Flags [.], ack 385168, win 1030, options [nop,nop,TS val 27913783 ecr 27913760], length 0
17:53:34.988509 IP6 :: > ff02::16: HBH ICMP6, multicast listener report v2, 1 group record(s), length 28
17:53:34.988581 IP 10.0.0.1.42166 > 10.0.0.2.5001: Flags [.], seq 385168:388064, ack 1, win 58, options [nop,nop,TS val 27913761 ecr 27913760], length 2896
17:53:34.988596 IP 10.0.0.2.5001 > 10.0.0.1.42166: Flags [.], ack 388064, win 1030, options [nop,nop,TS val 27913783 ecr 27913761], length 0
