17:53:34.666334 IP 10.0.0.1.42166 > 10.0.0.2.5001: Flags [.], seq 102474683:102477579, ack 729078006, win 58, options [nop,nop,TS val 27913680 ecr 27913679], length 2896
17:53:34.668756 IP 10.0.0.1.42166 > 10.0.0.2.5001: Flags [.], seq 2896:5792, ack 1, win 58, options [nop,nop,TS val 27913681 ecr 27913680], length 2896
17:53:34.671175 IP 10.0.0.1.42166 > 10.0.0.2.5001: Flags [.], seq 5792:8688, ack 1, win 58, options [nop,nop,TS val 27913682 ecr 27913681], length 2896
17:53:34.673597 IP 10.0.0.1.42166 > 10.0.0.2.5001: Flags [.], seq 8688:11584, ack 1, win 58, options [nop,nop,TS val 27913682 ecr 27913681], length 2896
17:53:34.676019 IP 10.0.0.1.42166 > 10.0.0.2.5001: Flags [.], seq 11584:14480, ack 1, win 58, options [nop,nop,TS val 27913682 ecr 27913682], length 2896
17:53:34.678442 IP 10.0.0.1.42166 > 10.0.0.2.5001: Flags [.], seq 14480:17376, ack 1, win 58, options [nop,nop,TS val 27913683 ecr 27913682], length 2896
17:53:34.680865 IP 10.0.0.1.42166 > 10.0.0.2.5001: Flags [.], seq 17376:20272, ack 1, win 58, options [nop,nop,TS val 27913684 ecr 27913683], length 2896
17:53:34.683289 IP 10.0.0.1.42166 > 10.0.0.2.5001: Flags [.], seq 20272:23168, ack 1, win 58, options [nop,nop,TS val 27913685 ecr 27913684], length 2896
17:53:34.685711 IP 10.0.0.1.42166 > 10.0.0.2.5001: Flags [.], seq 23168:26064, ack 1, win 58, options [nop,nop,TS val 27913685 ecr 27913685], length 2896
17:53:34.688133 IP 10.0.0.1.42166 > 10.0.0.2.5001: Flags [.], seq 26064:28960, ack 1, win 58, options [nop,nop,TS val 27913686 ecr 27913685], length 2896
17:53:34.690558 IP 10.0.0.1.42166 > 10.0.0.2.5001: Flags [.], seq 28960:31856, ack 1, win 58, options [nop,nop,TS val 27913686 ecr 27913686], length 2896
17:53:34.692979 IP 10.0.0.1.42166 > 10.0.0.2.5001: Flags [.], seq 31856:34752, ack 1, win 58, options [nop,nop,TS val 27913687 ecr 27913686], length 2896
17:53:34.695399 IP 10.0.0.1.42166 > 10.0.0.2.5001: Flags [.], seq 34752:37648, ack 1, win 58, options [nop,nop,TS val 27913688 ecr 27913687], length 2896
17:53:34.697821 IP 10.0.0.1.42166 > 10.0.0.2.5001: Flags [P.], seq 37648:40544, ack 1, win 58, options [nop,nop,TS val 27913688 ecr 27913688], length 2896
17:53:34.700243 IP 10.0.0.1.42166 > 10.0.0.2.5001: Flags [.], seq 40544:43440, ack 1, win 58, options [nop,nop,TS val 27913689 ecr 27913688], length 2896
17:53:34.702666 IP 10.0.0.1.42166 > 10.0.0.2.5001: Flags [.], seq 43440:46336, ack 1, win 58, options [nop,nop,TS val 27913689 ecr 27913689], length 2896
17:53:34.705089 IP 10.0.0.1.42166 > 10.0.0.2.5001: Flags [.], seq 46336:49232, ack 1, win 58, options [nop,nop,TS val 27913690 ecr 27913689], length 2896
17:53:34.707511 IP 10.0.0.1.42166 > 10.0.0.2.5001: Flags [.], seq 49232:52128, ack 1, win 58, options [nop,nop,TS val 27913691 ecr 27913690], length 2896
17:53:34.709933 IP 10.0.0.1.42166 > 10.0.0.2.5001: Flags [.], seq 52128:55024, ack 1, win 58, options [nop,nop,TS val 27913691 ecr 27913691], length 2896
17:53:34.712355 IP 10.0.0.1.42166 > 10.0.0.2.5001: Flags [.], seq 55024:57920, ack 1, win 58, options [nop,nop,TS val 27913692 ecr 27913691], length 2896
17:53:34.714778 IP 10.0.0.1.42166 > 10.0.0.2.5001: Flags [.], seq 57920:60816, ack 1, win 58, options [nop,nop,TS val 27913692 ecr 27913691], length 2896
17:53:34.717200 IP 10.0.0.1.42166 > 10.0.0.2.5001: Flags [.], seq 60816:63712, ack 1, win 58, options [nop,nop,TS val 27913693 ecr 27913693], length 2896
17:53:34.719622 IP 10.0.0.1.42166 > 10.0.0.2.5001: Flags [.], seq 63712:66608, ack 1, win 58, options [nop,nop,TS val 27913694 ecr 27913693], length 2896
17:53:34.722045 IP 10.0.0.1.42166 > 10.0.0.2.5001: Flags [.], seq 66608:69504, ack 1, win 58, options [nop,nop,TS val 27913694 ecr 27913694], length 2896
17:53:34.724467 IP 10.0.0.1.42166 > 10.0.0.2.5001: Flags [.], seq 69504:72400, ack 1, win 58, options [nop,nop,TS val 27913695 ecr 27913694], length 2896
17:53:34.726893 IP 10.0.0.1.42166 > 10.0.0.2.5001: Flags [P.], seq 72400:75296, ack 1, win 58, options [nop,nop,TS val 27913695 ecr 27913695], length 2896
17:53:34.729313 IP 10.0.0.1.42166 > 10.0.0.2.5001: Flags [.], seq 75296:78192, ack 1, win 58, options [nop,nop,TS val 27913696 ecr 27913695], length 2896
17:53:34.731735 IP 10.0.0.1.42166 > 10.0.0.2.5001: Flags [.], seq 78192:81088, ack 1, win 58, options [nop,nop,TS val 27913697 ecr 27913696], length 2896
17:53:34.734159 IP 10.0.0.1.42166 > 10.0.0.2.5001: Flags [.], seq 81088:83984, ack 1, win 58, options [nop,nop,TS val 27913697 ecr 27913697], length 2896
17:53:34.736582 IP 10.0.0.1.42166 > 10.0.0.2.5001: Flags [.], seq 83984:86880, ack 1, win 58, options [nop,nop,TS val 27913698 ecr 27913697], length 2896
17:53:34.739177 IP 10.0.0.1.42166 > 10.0.0.2.5001: Flags [.], seq 86880:89776, ack 1, win 58, options [nop,nop,TS val 27913699 ecr 27913698], length 2896
17:53:34.741425 IP 10.0.0.1.42166 > 10.0.0.2.5001: Flags [.], seq 89776:92672, ack 1, win 58, options [nop,nop,TS val 27913699 ecr 27913699], length 2896
17:53:34.743847 IP 10.0.0.1.42166 > 10.0.0.2.5001: Flags [.], seq 92672:95568, ack 1, win 58, options [nop,nop,TS val 27913700 ecr 27913699], length 2896
17:53:34.746269 IP 10.0.0.1.42166 > 10.0.0.2.5001: Flags [.], seq 95568:98464, ack 1, win 58, options [nop,nop,TS val 27913700 ecr 27913700], length 2896
17:53:34.748693 IP 10.0.0.1.42166 > 10.0.0.2.5001: Flags [.], seq 98464:101360, ack 1, win 58, options [nop,nop,TS val 27913701 ecr 27913700], length 2896
17:53:34.751114 IP 10.0.0.1.42166 > 10.0.0.2.5001: Flags [.], seq 101360:104256, ack 1, win 58, options [nop,nop,TS val 27913702 ecr 27913701], length 2896
17:53:34.753536 IP 10.0.0.1.42166 > 10.0.0.2.5001: Flags [.], seq 104256:107152, ack 1, win 58, options [nop,nop,TS val 27913702 ecr 27913702], length 2896
17:53:34.755959 IP 10.0.0.1.42166 > 10.0.0.2.5001: Flags [.], seq 107152:110048, ack 1, win 58, options [nop,nop,TS val 27913703 ecr 27913702], length 2896
17:53:34.758381 IP 10.0.0.1.42166 > 10.0.0.2.5001: Flags [.], seq 110048:112944, ack 1, win 58, options [nop,nop,TS val 27913703 ecr 27913703], length 2896
17:53:34.760804 IP 10.0.0.1.42166 > 10.0.0.2.5001: Flags [.], seq 112944:115840, ack 1, win 58, options [nop,nop,TS val 27913704 ecr 27913703], length 2896
17:53:34.763226 IP 10.0.0.1.42166 > 10.0.0.2.5001: Flags [.], seq 115840:118736, ack 1, win 58, options [nop,nop,TS val 27913705 ecr 27913704], length 2896
17:53:34.765649 IP 10.0.0.1.42166 > 10.0.0.2.5001: Flags [.], seq 118736:121632, ack 1, win 58, options [nop,nop,TS val 27913705 ecr 27913705], length 2896
17:53:34.768071 IP 10.0.0.1.42166 > 10.0.0.2.5001: Flags [.], seq 121632:124528, ack 1, win 58, options [nop,nop,TS val 27913706 ecr 27913705], length 2896
17:53:34.770493 IP 10.0.0.1.42166 > 10.0.0.2.5001: Flags [.], seq 124528:127424, ack 1, win 58, options [nop,nop,TS val 27913706 ecr 27913706], length 2896
17:53:34.772915 IP 10.0.0.1.42166 > 10.0.0.2.5001: Flags [.], seq 127424:130320, ack 1, win 58, options [nop,nop,TS val 27913707 ecr 27913706], length 2896
17:53:34.775338 IP 10.0.0.1.42166 > 10.0.0.2.5001: Flags [.], seq 130320:133216, ack 1, win 58, options [nop,nop,TS val 27913708 ecr 27913707], length 2896
17:53:34.777760 IP 10.0.0.1.42166 > 10.0.0.2.5001: Flags [.], seq 133216:136112, ack 1, win 58, options [nop,nop,TS val 27913708 ecr 27913708], length 2896
17:53:34.780182 IP 10.0.0.1.42166 > 10.0.0.2.5001: Flags [.], seq 136112:139008, ack 1, win 58, options [nop,nop,TS val 27913709 ecr 27913708], length 2896
17:53:34.782605 IP 10.0.0.1.42166 > 10.0.0.2.5001: Flags [.], seq 139008:141904, ack 1, win 58, options [nop,nop,TS val 27913709 ecr 27913709], length 2896
17:53:34.785028 IP 10.0.0.1.42166 > 10.0.0.2.5001: Flags [.], seq 141904:144800, ack 1, win 58, options [nop,nop,TS val 27913710 ecr 27913709], length 2896
17:53:34.787450 IP 10.0.0.1.42166 > 10.0.0.2.5001: Flags [.], seq 144800:147696, ack 1, win 58, options [nop,nop,TS val 27913711 ecr 27913710], length 2896
17:53:34.789873 IP 10.0.0.1.42166 > 10.0.0.2.5001: Flags [.], seq 147696:150592, ack 1, win 58, options [nop,nop,TS val 27913711 ecr 27913711], length 2896
17:53:34.792294 IP 10.0.0.1.42166 > 10.0.0.2.5001: Flags [.], seq 150592:153488, ack 1, win 58, options [nop,nop,TS val 27913712 ecr 27913711], length 2896
17:53:34.794721 IP 10.0.0.1.42166 > 10.0.0.2.5001: Flags [.], seq 153488:156384, ack 1, win 58, options [nop,nop,TS val 27913712 ecr 27913712], length 2896
17:53:34.797142 IP 10.0.0.1.42166 > 10.0.0.2.5001: Flags [.], seq 156384:159280, ack 1, win 58, options [nop,nop,TS val 27913713 ecr 27913712], length 2896
17:53:34.799563 IP 10.0.0.1.42166 > 10.0.0.2.5001: Flags [.], seq 159280:162176, ack 1, win 58, options [nop,nop,TS val 27913714 ecr 27913713], length 2896
17:53:34.801984 IP 10.0.0.1.42166 > 10.0.0.2.5001: Flags [.], seq 162176:165072, ack 1, win 58, options [nop,nop,TS val 27913714 ecr 27913714], length 2896
17:53:34.804406 IP 10.0.0.1.42166 > 10.0.0.2.5001: Flags [.], seq 165072:167968, ack 1, win 58, options [nop,nop,TS val 27913715 ecr 27913714], length 2896
17:53:34.806829 IP 10.0.0.1.42166 > 10.0.0.2.5001: Flags [.], seq 167968:170864, ack 1, win 58, options [nop,nop,TS val 27913715 ecr 27913715], length 2896
17:53:34.809251 IP 10.0.0.1.42166 > 10.0.0.2.5001: Flags [.], seq 170864:173760, ack 1, win 58, options [nop,nop,TS val 27913716 ecr 27913715], length 2896
17:53:34.811674 IP 10.0.0.1.42166 > 10.0.0.2.5001: Flags [.], seq 173760:176656, ack 1, win 58, options [nop,nop,TS val 27913717 ecr 27913716], length 2896
17:53:34.814097 IP 10.0.0.1.42166 > 10.0.0.2.5001: Flags [.], seq 176656:179552, ack 1, win 58, options [nop,nop,TS val 27913717 ecr 27913717], length 2896
17:53:34.816519 IP 10.0.0.1.42166 > 10.0.0.2.5001: Flags [.], seq 179552:182448, ack 1, win 58, options [nop,nop,TS val 27913718 ecr 27913717], length 2896
17:53:34.818941 IP 10.0.0.1.42166 > 10.0.0.2.5001: Flags [.], seq 182448:185344, ack 1, win 58, options [nop,nop,TS val 27913718 ecr 27913718], length 2896
17:53:34.821363 IP 10.0.0.1.42166 > 10.0.0.2.5001: Flags [.], seq 185344:188240, ack 1, win 58, options [nop,nop,TS val 27913719 ecr 27913719], length 2896
17:53:34.823786 IP 10.0.0.1.42166 > 10.0.0.2.5001: Flags [.], seq 188240:191136, ack 1, win 58, options [nop,nop,TS val 27913720 ecr 27913719], length 2896
17:53:34.826209 IP 10.0.0.1.42166 > 10.0.0.2.5001: Flags [.], seq 191136:194032, ack 1, win 58, options [nop,nop,TS val 27913720 ecr 27913720], length 2896
17:53:34.828631 IP 10.0.0.1.42166 > 10.0.0.2.5001: Flags [.], seq 194032:196928, ack 1, win 58, options [nop,nop,TS val 27913721 ecr 27913720], length 2896
17:53:34.831053 IP 10.0.0.1.42166 > 10.0.0.2.5001: Flags [.], seq 196928:199824, ack 1, win 58, options [nop,nop,TS val 27913722 ecr 27913721], length 2896
17:53:34.833475 IP 10.0.0.1.42166 > 10.0.0.2.5001: Flags [.], seq 199824:202720, ack 1, win 58, options [nop,nop,TS val 27913722 ecr 27913722], length 2896
17:53:34.835898 IP 10.0.0.1.42166 > 10.0.0.2.5001: Flags [.], seq 202720:205616, ack 1, win 58, options [nop,nop,TS val 27913723 ecr 27913722], length 2896
17:53:34.838320 IP 10.0.0.1.42166 > 10.0.0.2.5001: Flags [.], seq 205616:208512, ack 1, win 58, options [nop,nop,TS val 27913723 ecr 27913723], length 2896
17:53:34.840742 IP 10.0.0.1.42166 > 10.0.0.2.5001: Flags [.], seq 208512:211408, ack 1, win 58, options [nop,nop,TS val 27913724 ecr 27913723], length 2896
17:53:34.843165 IP 10.0.0.1.42166 > 10.0.0.2.5001: Flags [.], seq 211408:214304, ack 1, win 58, options [nop,nop,TS val 27913725 ecr 27913724], length 2896
17:53:34.845587 IP 10.0.0.1.42166 > 10.0.0.2.5001: Flags [.], seq 214304:217200, ack 1, win 58, options [nop,nop,TS val 27913725 ecr 27913725], length 2896
17:53:34.848009 IP 10.0.0.1.42166 > 10.0.0.2.5001: Flags [.], seq 217200:220096, ack 1, win 58, options [nop,nop,TS val 27913726 ecr 27913725], length 2896
17:53:34.850432 IP 10.0.0.1.42166 > 10.0.0.2.5001: Flags [.], seq 220096:222992, ack 1, win 58, options [nop,nop,TS val 27913726 ecr 27913726], length 2896
17:53:34.852855 IP 10.0.0.1.42166 > 10.0.0.2.5001: Flags [.], seq 222992:225888, ack 1, win 58, options [nop,nop,TS val 27913727 ecr 27913726], length 2896
17:53:34.855277 IP 10.0.0.1.42166 > 10.0.0.2.5001: Flags [.], seq 225888:228784, ack 1, win 58, options [nop,nop,TS val 27913728 ecr 27913727], length 2896
17:53:34.857699 IP 10.0.0.1.42166 > 10.0.0.2.5001: Flags [.], seq 228784:231680, ack 1, win 58, options [nop,nop,TS val 27913728 ecr 27913728], length 2896
17:53:34.860125 IP 10.0.0.1.42166 > 10.0.0.2.5001: Flags [P.], seq 231680:234576, ack 1, win 58, options [nop,nop,TS val 27913729 ecr 27913728], length 2896
17:53:34.862545 IP 10.0.0.1.42166 > 10.0.0.2.5001: Flags [.], seq 234576:237472, ack 1, win 58, options [nop,nop,TS val 27913729 ecr 27913729], length 2896
17:53:34.864967 IP 10.0.0.1.42166 > 10.0.0.2.5001: Flags [.], seq 237472:240368, ack 1, win 58, options [nop,nop,TS val 27913730 ecr 27913729], length 2896
17:53:34.867389 IP 10.0.0.1.42166 > 10.0.0.2.5001: Flags [.], seq 240368:243264, ack 1, win 58, options [nop,nop,TS val 27913731 ecr 27913730], length 2896
17:53:34.869811 IP 10.0.0.1.42166 > 10.0.0.2.5001: Flags [.], seq 243264:246160, ack 1, win 58, options [nop,nop,TS val 27913731 ecr 27913731], length 2896
17:53:34.872234 IP 10.0.0.1.42166 > 10.0.0.2.5001: Flags [.], seq 246160:249056, ack 1, win 58, options [nop,nop,TS val 27913732 ecr 27913731], length 2896
17:53:34.874659 IP 10.0.0.1.42166 > 10.0.0.2.5001: Flags [.], seq 249056:251952, ack 1, win 58, options [nop,nop,TS val 27913732 ecr 27913732], length 2896
17:53:34.877078 IP 10.0.0.1.42166 > 10.0.0.2.5001: Flags [.], seq 251952:254848, ack 1, win 58, options [nop,nop,TS val 27913733 ecr 27913732], length 2896
17:53:34.879501 IP 10.0.0.1.42166 > 10.0.0.2.5001: Flags [.], seq 254848:257744, ack 1, win 58, options [nop,nop,TS val 27913734 ecr 27913733], length 2896
17:53:34.881923 IP 10.0.0.1.42166 > 10.0.0.2.5001: Flags [.], seq 257744:260640, ack 1, win 58, options [nop,nop,TS val 27913734 ecr 27913734], length 2896
17:53:34.884346 IP 10.0.0.1.42166 > 10.0.0.2.5001: Flags [.], seq 260640:263536, ack 1, win 58, options [nop,nop,TS val 27913735 ecr 27913734], length 2896
17:53:34.886768 IP 10.0.0.1.42166 > 10.0.0.2.5001: Flags [.], seq 263536:266432, ack 1, win 58, options [nop,nop,TS val 27913735 ecr 27913735], length 2896
17:53:34.889190 IP 10.0.0.1.42166 > 10.0.0.2.5001: Flags [.], seq 266432:269328, ack 1, win 58, options [nop,nop,TS val 27913736 ecr 27913735], length 2896
17:53:34.891613 IP 10.0.0.1.42166 > 10.0.0.2.5001: Flags [.], seq 269328:272224, ack 1, win 58, options [nop,nop,TS val 27913737 ecr 27913736], length 2896
17:53:34.894035 IP 10.0.0.1.42166 > 10.0.0.2.5001: Flags [.], seq 272224:275120, ack 1, win 58, options [nop,nop,TS val 27913737 ecr 27913737], length 2896
17:53:34.896457 IP 10.0.0.1.42166 > 10.0.0.2.5001: Flags [.], seq 275120:278016, ack 1, win 58, options [nop,nop,TS val 27913738 ecr 27913737], length 2896
17:53:34.898884 IP 10.0.0.1.42166 > 10.0.0.2.5001: Flags [.], seq 278016:280912, ack 1, win 58, options [nop,nop,TS val 27913738 ecr 27913738], length 2896
17:53:34.901306 IP 10.0.0.1.42166 > 10.0.0.2.5001: Flags [.], seq 280912:283808, ack 1, win 58, options [nop,nop,TS val 27913739 ecr 27913738], length 2896
17:53:34.903729 IP 10.0.0.1.42166 > 10.0.0.2.5001: Flags [.], seq 283808:286704, ack 1, win 58, options [nop,nop,TS val 27913740 ecr 27913739], length 2896
17:53:34.906150 IP 10.0.0.1.42166 > 10.0.0.2.5001: Flags [.], seq 286704:289600, ack 1, win 58, options [nop,nop,TS val 27913740 ecr 27913740], length 2896
17:53:34.908573 IP 10.0.0.1.42166 > 10.0.0.2.5001: Flags [.], seq 289600:292496, ack 1, win 58, options [nop,nop,TS val 27913741 ecr 27913740], length 2896
17:53:34.910992 IP 10.0.0.1.42166 > 10.0.0.2.5001: Flags [.], seq 292496:295392, ack 1, win 58, options [nop,nop,TS val 27913742 ecr 27913741], length 2896
17:53:34.913415 IP 10.0.0.1.42166 > 10.0.0.2.5001: Flags [.], seq 295392:298288, ack 1, win 58, options [nop,nop,TS val 27913742 ecr 27913742], length 2896
17:53:34.915837 IP 10.0.0.1.42166 > 10.0.0.2.5001: Flags [.], seq 298288:301184, ack 1, win 58, options [nop,nop,TS val 27913743 ecr 27913742], length 2896
17:53:34.918261 IP 10.0.0.1.42166 > 10.0.0.2.5001: Flags [.], seq 301184:304080, ack 1, win 58, options [nop,nop,TS val 27913743 ecr 27913743], length 2896
17:53:34.920682 IP 10.0.0.1.42166 > 10.0.0.2.5001: Flags [.], seq 304080:306976, ack 1, win 58, options [nop,nop,TS val 27913744 ecr 27913743], length 2896
17:53:34.923104 IP 10.0.0.1.42166 > 10.0.0.2.5001: Flags [.], seq 306976:309872, ack 1, win 58, options [nop,nop,TS val 27913745 ecr 27913744], length 2896
17:53:34.925527 IP 10.0.0.1.42166 > 10.0.0.2.5001: Flags [.], seq 309872:312768, ack 1, win 58, options [nop,nop,TS val 27913745 ecr 27913745], length 2896
17:53:34.927949 IP 10.0.0.1.42166 > 10.0.0.2.5001: Flags [.], seq 312768:315664, ack 1, win 58, options [nop,nop,TS val 27913746 ecr 27913745], length 2896
17:53:34.930371 IP 10.0.0.1.42166 > 10.0.0.2.5001: Flags [.], seq 315664:318560, ack 1, win 58, options [nop,nop,TS val 27913746 ecr 27913746], length 2896
17:53:34.932793 IP 10.0.0.1.42166 > 10.0.0.2.5001: Flags [.], seq 318560:321456, ack 1, win 58, options [nop,nop,TS val 27913747 ecr 27913746], length 2896
17:53:34.935217 IP 10.0.0.1.42166 > 10.0.0.2.5001: Flags [.], seq 321456:324352, ack 1, win 58, options [nop,nop,TS val 27913748 ecr 27913747], length 2896
17:53:34.937639 IP 10.0.0.1.42166 > 10.0.0.2.5001: Flags [.], seq 324352:327248, ack 1, win 58, options [nop,nop,TS val 27913748 ecr 27913748], length 2896
17:53:34.940061 IP 10.0.0.1.42166 > 10.0.0.2.5001: Flags [.], seq 327248:330144, ack 1, win 58, options [nop,nop,TS val 27913749 ecr 27913748], length 2896
17:53:34.942484 IP 10.0.0.1.42166 > 10.0.0.2.5001: Flags [.], seq 330144:333040, ack 1, win 58, options [nop,nop,TS val 27913749 ecr 27913749], length 2896
17:53:34.944906 IP 10.0.0.1.42166 > 10.0.0.2.5001: Flags [.], seq 333040:335936, ack 1, win 58, options [nop,nop,TS val 27913750 ecr 27913749], length 2896
17:53:34.947329 IP 10.0.0.1.42166 > 10.0.0.2.5001: Flags [.], seq 335936:338832, ack 1, win 58, options [nop,nop,TS val 27913751 ecr 27913750], length 2896
17:53:34.949751 IP 10.0.0.1.42166 > 10.0.0.2.5001: Flags [.], seq 338832:341728, ack 1, win 58, options [nop,nop,TS val 27913751 ecr 27913751], length 2896
17:53:34.952173 IP 10.0.0.1.42166 > 10.0.0.2.5001: Flags [.], seq 341728:344624, ack 1, win 58, options [nop,nop,TS val 27913752 ecr 27913751], length 2896
17:53:34.954595 IP 10.0.0.1.42166 > 10.0.0.2.5001: Flags [.], seq 344624:347520, ack 1, win 58, options [nop,nop,TS val 27913752 ecr 27913752], length 2896
17:53:34.957018 IP 10.0.0.1.42166 > 10.0.0.2.5001: Flags [.], seq 347520:350416, ack 1, win 58, options [nop,nop,TS val 27913753 ecr 27913752], length 2896
17:53:34.959441 IP 10.0.0.1.42166 > 10.0.0.2.5001: Flags [.], seq 350416:353312, ack 1, win 58, options [nop,nop,TS val 27913754 ecr 27913753], length 2896
17:53:34.961862 IP 10.0.0.1.42166 > 10.0.0.2.5001: Flags [.], seq 353312:356208, ack 1, win 58, options [nop,nop,TS val 27913754 ecr 27913754], length 2896
17:53:34.964285 IP 10.0.0.1.42166 > 10.0.0.2.5001: Flags [.], seq 356208:359104, ack 1, win 58, options [nop,nop,TS val 27913755 ecr 27913754], length 2896
17:53:34.966707 IP 10.0.0.1.42166 > 10.0.0.2.5001: Flags [.], seq 359104:362000, ack 1, win 58, options [nop,nop,TS val 27913755 ecr 27913755], length 2896
17:53:34.969130 IP 10.0.0.1.42166 > 10.0.0.2.5001: Flags [.], seq 362000:364896, ack 1, win 58, options [nop,nop,TS val 27913756 ecr 27913755], length 2896
17:53:34.971552 IP 10.0.0.1.42166 > 10.0.0.2.5001: Flags [.], seq 364896:367792, ack 1, win 58, options [nop,nop,TS val 27913757 ecr 27913756], length 2896
17:53:34.973974 IP 10.0.0.1.42166 > 10.0.0.2.5001: Flags [.], seq 367792:370688, ack 1, win 58, options [nop,nop,TS val 27913757 ecr 27913757], length 2896
17:53:34.976397 IP 10.0.0.1.42166 > 10.0.0.2.5001: Flags [.], seq 370688:373584, ack 1, win 58, options [nop,nop,TS val 27913758 ecr 27913757], length 2896
17:53:34.978819 IP 10.0.0.1.42166 > 10.0.0.2.5001: Flags [.], seq 373584:376480, ack 1, win 58, options [nop,nop,TS val 27913758 ecr 27913758], length 2896
17:53:34.981241 IP 10.0.0.1.42166 > 10.0.0.2.5001: Flags [.], seq 376480:379376, ack 1, win 58, options [nop,nop,TS val 27913759 ecr 27913758], length 2896
17:53:34.983664 IP 10.0.0.1.42166 > 10.0.0.2.5001: Flags [.], seq 379376:382272, ack 1, win 58, options [nop,nop,TS val 27913760 ecr 27913759], length 2896
17:53:34.986087 IP 10.0.0.1.42166 > 10.0.0.2.5001: Flags [.], seq 382272:385168, ack 1, win 58, options [nop,nop,TS val 27913760 ecr 27913760], length 2896
17:53:34.988581 IP 10.0.0.1.42166 > 10.0.0.2.5001: Flags [.], seq 385168:388064, ack 1, win 58, options [nop,nop,TS val 27913761 ecr 27913760], length 2896
17:53:34.991003 IP 10.0.0.1.42166 > 10.0.0.2.5001: Flags [P.], seq 388064:390960, ack 1, win 58, options [nop,nop,TS val 27913761 ecr 27913761], length 2896
17:53:34.993426 IP 10.0.0.1.42166 > 10.0.0.2.5001: Flags [.], seq 390960:393856, ack 1, win 58, options [nop,nop,TS val 27913762 ecr 27913762], length 2896
17:53:34.995848 IP 10.0.0.1.42166 > 10.0.0.2.5001: Flags [.], seq 393856:396752, ack 1, win 58, options [nop,nop,TS val 27913763 ecr 27913762], length 2896
17:53:34.998271 IP 10.0.0.1.42166 > 10.0.0.2.5001: Flags [.], seq 396752:399648, ack 1, win 58, options [nop,nop,TS val 27913763 ecr 27913763], length 2896
17:53:35.000693 IP 10.0.0.1.42166 > 10.0.0.2.5001: Flags [.], seq 399648:402544, ack 1, win 58, options [nop,nop,TS val 27913764 ecr 27913763], length 2896
17:53:35.003115 IP 10.0.0.1.42166 > 10.0.0.2.5001: Flags [.], seq 402544:405440, ack 1, win 58, options [nop,nop,TS val 27913765 ecr 27913764], length 2896
17:53:35.005538 IP 10.0.0.1.42166 > 10.0.0.2.5001: Flags [.], seq 405440:408336, ack 1, win 58, options [nop,nop,TS val 27913765 ecr 27913765], length 2896
17:53:35.007960 IP 10.0.0.1.42166 > 10.0.0.2.5001: Flags [.], seq 408336:411232, ack 1, win 58, options [nop,nop,TS val 27913766 ecr 27913765], length 2896
17:53:35.010383 IP 10.0.0.1.42166 > 10.0.0.2.5001: Flags [.], seq 411232:414128, ack 1, win 58, options [nop,nop,TS val 27913766 ecr 27913766], length 2896
17:53:35.012805 IP 10.0.0.1.42166 > 10.0.0.2.5001: Flags [.], seq 414128:417024, ack 1, win 58, options [nop,nop,TS val 27913767 ecr 27913766], length 2896
17:53:35.015227 IP 10.0.0.1.42166 > 10.0.0.2.5001: Flags [.], seq 417024:419920, ack 1, win 58, options [nop,nop,TS val 27913768 ecr 27913767], length 2896
17:53:35.017650 IP 10.0.0.1.42166 > 10.0.0.2.5001: Flags [.], seq 419920:422816, ack 1, win 58, options [nop,nop,TS val 27913768 ecr 27913768], length 2896
17:53:35.020072 IP 10.0.0.1.42166 > 10.0.0.2.5001: Flags [.], seq 422816:425712, ack 1, win 58, options [nop,nop,TS val 27913769 ecr 27913768], length 2896
17:53:35.022494 IP 10.0.0.1.42166 > 10.0.0.2.5001: Flags [.], seq 425712:428608, ack 1, win 58, options [nop,nop,TS val 27913769 ecr 27913769], length 2896
17:53:35.024917 IP 10.0.0.1.42166 > 10.0.0.2.5001: Flags [.], seq 428608:431504, ack 1, win 58, options [nop,nop,TS val 27913770 ecr 27913770], length 2896
17:53:35.027340 IP 10.0.0.1.42166 > 10.0.0.2.5001: Flags [.], seq 431504:434400, ack 1, win 58, options [nop,nop,TS val 27913771 ecr 27913770], length 2896
17:53:35.029762 IP 10.0.0.1.42166 > 10.0.0.2.5001: Flags [.], seq 434400:437296, ack 1, win 58, options [nop,nop,TS val 27913771 ecr 27913771], length 2896
17:53:35.032184 IP 10.0.0.1.42166 > 10.0.0.2.5001: Flags [.], seq 437296:440192, ack 1, win 58, options [nop,nop,TS val 27913772 ecr 27913771], length 2896
17:53:35.034606 IP 10.0.0.1.42166 > 10.0.0.2.5001: Flags [.], seq 440192:443088, ack 1, win 58, options [nop,nop,TS val 27913772 ecr 27913772], length 2896
17:53:35.037029 IP 10.0.0.1.42166 > 10.0.0.2.5001: Flags [.], seq 443088:445984, ack 1, win 58, options [nop,nop,TS val 27913773 ecr 27913772], length 2896
17:53:35.039451 IP 10.0.0.1.42166 > 10.0.0.2.5001: Flags [.], seq 445984:448880, ack 1, win 58, options [nop,nop,TS val 27913774 ecr 27913773], length 2896
17:53:35.041874 IP 10.0.0.1.42166 > 10.0.0.2.5001: Flags [.], seq 448880:451776, ack 1, win 58, options [nop,nop,TS val 27913774 ecr 27913774], length 2896
17:53:35.044296 IP 10.0.0.1.42166 > 10.0.0.2.5001: Flags [.], seq 451776:454672, ack 1, win 58, options [nop,nop,TS val 27913775 ecr 27913774], length 2896
17:53:35.046718 IP 10.0.0.1.42166 > 10.0.0.2.5001: Flags [.], seq 454672:457568, ack 1, win 58, options [nop,nop,TS val 27913775 ecr 27913775], length 2896
17:53:35.049141 IP 10.0.0.1.42166 > 10.0.0.2.5001: Flags [.], seq 457568:460464, ack 1, win 58, options [nop,nop,TS val 27913776 ecr 27913775], length 2896
17:53:35.051563 IP 10.0.0.1.42166 > 10.0.0.2.5001: Flags [.], seq 460464:463360, ack 1, win 58, options [nop,nop,TS val 27913777 ecr 27913776], length 2896
17:53:35.053986 IP 10.0.0.1.42166 > 10.0.0.2.5001: Flags [.], seq 463360:466256, ack 1, win 58, options [nop,nop,TS val 27913777 ecr 27913777], length 2896
17:53:35.056409 IP 10.0.0.1.42166 > 10.0.0.2.5001: Flags [.], seq 466256:469152, ack 1, win 58, options [nop,nop,TS val 27913778 ecr 27913777], length 2896
17:53:35.058831 IP 10.0.0.1.42166 > 10.0.0.2.5001: Flags [.], seq 469152:472048, ack 1, win 58, options [nop,nop,TS val 27913778 ecr 27913778], length 2896
17:53:35.061255 IP 10.0.0.1.42166 > 10.0.0.2.5001: Flags [.], seq 472048:474944, ack 1, win 58, options [nop,nop,TS val 27913779 ecr 27913778], length 2896
17:53:35.063676 IP 10.0.0.1.42166 > 10.0.0.2.5001: Flags [.], seq 474944:477840, ack 1, win 58, options [nop,nop,TS val 27913780 ecr 27913779], length 2896
17:53:35.066099 IP 10.0.0.1.42166 > 10.0.0.2.5001: Flags [.], seq 477840:480736, ack 1, win 58, options [nop,nop,TS val 27913780 ecr 27913780], length 2896
17:53:35.068523 IP 10.0.0.1.42166 > 10.0.0.2.5001: Flags [.], seq 480736:483632, ack 1, win 58, options [nop,nop,TS val 27913781 ecr 27913780], length 2896
17:53:35.070944 IP 10.0.0.1.42166 > 10.0.0.2.5001: Flags [.], seq 483632:486528, ack 1, win 58, options [nop,nop,TS val 27913781 ecr 27913781], length 2896
17:53:35.073365 IP 10.0.0.1.42166 > 10.0.0.2.5001: Flags [.], seq 486528:489424, ack 1, win 58, options [nop,nop,TS val 27913782 ecr 27913781], length 2896
17:53:35.075788 IP 10.0.0.1.42166 > 10.0.0.2.5001: Flags [.], seq 489424:492320, ack 1, win 58, options [nop,nop,TS val 27913783 ecr 27913782], length 2896
17:53:35.078210 IP 10.0.0.1.42166 > 10.0.0.2.5001: Flags [.], seq 492320:495216, ack 1, win 58, options [nop,nop,TS val 27913783 ecr 27913783], length 2896
17:53:35.080632 IP 10.0.0.1.42166 > 10.0.0.2.5001: Flags [.], seq 495216:498112, ack 1, win 58, options [nop,nop,TS val 27913784 ecr 27913783], length 2896
17:53:35.083054 IP 10.0.0.1.42166 > 10.0.0.2.5001: Flags [.], seq 498112:501008, ack 1, win 58, options [nop,nop,TS val 27913785 ecr 27913784], length 2896
17:53:35.085477 IP 10.0.0.1.42166 > 10.0.0.2.5001: Flags [.], seq 501008:503904, ack 1, win 58, options [nop,nop,TS val 27913785 ecr 27913785], length 2896
17:53:35.087900 IP 10.0.0.1.42166 > 10.0.0.2.5001: Flags [.], seq 503904:506800, ack 1, win 58, options [nop,nop,TS val 27913786 ecr 27913785], length 2896
17:53:35.090323 IP 10.0.0.1.42166 > 10.0.0.2.5001: Flags [.], seq 506800:509696, ack 1, win 58, options [nop,nop,TS val 27913786 ecr 27913786], length 2896
17:53:35.092745 IP 10.0.0.1.42166 > 10.0.0.2.5001: Flags [.], seq 509696:512592, ack 1, win 58, options [nop,nop,TS val 27913787 ecr 27913786], length 2896
17:53:35.095167 IP 10.0.0.1.42166 > 10.0.0.2.5001: Flags [.], seq 512592:515488, ack 1, win 58, options [nop,nop,TS val 27913788 ecr 27913787], length 2896
17:53:35.097589 IP 10.0.0.1.42166 > 10.0.0.2.5001: Flags [.], seq 515488:518384, ack 1, win 58, options [nop,nop,TS val 27913788 ecr 27913788], length 2896
17:53:35.100011 IP 10.0.0.1.42166 > 10.0.0.2.5001: Flags [.], seq 518384:521280, ack 1, win 58, options [nop,nop,TS val 27913789 ecr 27913788], length 2896
17:53:35.102434 IP 10.0.0.1.42166 > 10.0.0.2.5001: Flags [.], seq 521280:524176, ack 1, win 58, options [nop,nop,TS val 27913789 ecr 27913789], length 2896
17:53:35.104856 IP 10.0.0.1.42166 > 10.0.0.2.5001: Flags [.], seq 524176:527072, ack 1, win 58, options [nop,nop,TS val 27913790 ecr 27913789], length 2896
17:53:35.107279 IP 10.0.0.1.42166 > 10.0.0.2.5001: Flags [.], seq 527072:529968, ack 1, win 58, options [nop,nop,TS val 27913791 ecr 27913790], length 2896
17:53:35.109701 IP 10.0.0.1.42166 > 10.0.0.2.5001: Flags [.], seq 529968:532864, ack 1, win 58, options [nop,nop,TS val 27913791 ecr 27913791], length 2896
17:53:35.112123 IP 10.0.0.1.42166 > 10.0.0.2.5001: Flags [.], seq 532864:535760, ack 1, win 58, options [nop,nop,TS val 27913792 ecr 27913791], length 2896
17:53:35.114546 IP 10.0.0.1.42166 > 10.0.0.2.5001: Flags [.], seq 535760:538656, ack 1, win 58, options [nop,nop,TS val 27913792 ecr 27913792], length 2896
17:53:35.116969 IP 10.0.0.1.42166 > 10.0.0.2.5001: Flags [.], seq 538656:541552, ack 1, win 58, options [nop,nop,TS val 27913793 ecr 27913792], length 2896
17:53:35.119391 IP 10.0.0.1.42166 > 10.0.0.2.5001: Flags [.], seq 541552:544448, ack 1, win 58, options [nop,nop,TS val 27913794 ecr 27913793], length 2896
17:53:35.121814 IP 10.0.0.1.42166 > 10.0.0.2.5001: Flags [P.], seq 544448:547344, ack 1, win 58, options [nop,nop,TS val 27913794 ecr 27913794], length 2896
17:53:35.124235 IP 10.0.0.1.42166 > 10.0.0.2.5001: Flags [.], seq 547344:550240, ack 1, win 58, options [nop,nop,TS val 27913795 ecr 27913794], length 2896
17:53:35.126658 IP 10.0.0.1.42166 > 10.0.0.2.5001: Flags [.], seq 550240:553136, ack 1, win 58, options [nop,nop,TS val 27913795 ecr 27913795], length 2896
17:53:35.129080 IP 10.0.0.1.42166 > 10.0.0.2.5001: Flags [.], seq 553136:556032, ack 1, win 58, options [nop,nop,TS val 27913796 ecr 27913795], length 2896
17:53:35.131503 IP 10.0.0.1.42166 > 10.0.0.2.5001: Flags [.], seq 556032:558928, ack 1, win 58, options [nop,nop,TS val 27913797 ecr 27913796], length 2896
17:53:35.133927 IP 10.0.0.1.42166 > 10.0.0.2.5001: Flags [.], seq 558928:561824, ack 1, win 58, options [nop,nop,TS val 27913797 ecr 27913797], length 2896
17:53:35.136347 IP 10.0.0.1.42166 > 10.0.0.2.5001: Flags [.], seq 561824:564720, ack 1, win 58, options [nop,nop,TS val 27913798 ecr 27913797], length 2896
17:53:35.138770 IP 10.0.0.1.42166 > 10.0.0.2.5001: Flags [.], seq 564720:567616, ack 1, win 58, options [nop,nop,TS val 27913798 ecr 27913798], length 2896
17:53:35.141192 IP 10.0.0.1.42166 > 10.0.0.2.5001: Flags [.], seq 567616:570512, ack 1, win 58, options [nop,nop,TS val 27913799 ecr 27913798], length 2896
17:53:35.143614 IP 10.0.0.1.42166 > 10.0.0.2.5001: Flags [.], seq 570512:573408, ack 1, win 58, options [nop,nop,TS val 27913800 ecr 27913799], length 2896
17:53:35.146037 IP 10.0.0.1.42166 > 10.0.0.2.5001: Flags [.], seq 573408:576304, ack 1, win 58, options [nop,nop,TS val 27913800 ecr 27913800], length 2896
17:53:35.148460 IP 10.0.0.1.42166 > 10.0.0.2.5001: Flags [.], seq 576304:579200, ack 1, win 58, options [nop,nop,TS val 27913801 ecr 27913800], length 2896
17:53:35.150882 IP 10.0.0.1.42166 > 10.0.0.2.5001: Flags [.], seq 579200:582096, ack 1, win 58, options [nop,nop,TS val 27913801 ecr 27913801], length 2896
17:53:35.153304 IP 10.0.0.1.42166 > 10.0.0.2.5001: Flags [.], seq 582096:584992, ack 1, win 58, options [nop,nop,TS val 27913802 ecr 27913802], length 2896
17:53:35.155729 IP 10.0.0.1.42166 > 10.0.0.2.5001: Flags [.], seq 584992:587888, ack 1, win 58, options [nop,nop,TS val 27913803 ecr 27913802], length 2896
17:53:35.158149 IP 10.0.0.1.42166 > 10.0.0.2.5001: Flags [.], seq 587888:590784, ack 1, win 58, options [nop,nop,TS val 27913803 ecr 27913803], length 2896
17:53:35.160571 IP 10.0.0.1.42166 > 10.0.0.2.5001: Flags [.], seq 590784:593680, ack 1, win 58, options [nop,nop,TS val 27913804 ecr 27913803], length 2896
17:53:35.162994 IP 10.0.0.1.42166 > 10.0.0.2.5001: Flags [.], seq 593680:596576, ack 1, win 58, options [nop,nop,TS val 27913805 ecr 27913804], length 2896
17:53:35.165416 IP 10.0.0.1.42166 > 10.0.0.2.5001: Flags [.], seq 596576:599472, ack 1, win 58, options [nop,nop,TS val 27913805 ecr 27913805], length 2896
17:53:35.167838 IP 10.0.0.1.42166 > 10.0.0.2.5001: Flags [.], seq 599472:602368, ack 1, win 58, options [nop,nop,TS val 27913806 ecr 27913805], length 2896
17:53:35.170261 IP 10.0.0.1.42166 > 10.0.0.2.5001: Flags [.], seq 602368:605264, ack 1, win 58, options [nop,nop,TS val 27913806 ecr 27913806], length 2896
17:53:35.172683 IP 10.0.0.1.42166 > 10.0.0.2.5001: Flags [.], seq 605264:608160, ack 1, win 58, options [nop,nop,TS val 27913807 ecr 27913806], length 2896
17:53:35.175106 IP 10.0.0.1.42166 > 10.0.0.2.5001: Flags [.], seq 608160:611056, ack 1, win 58, options [nop,nop,TS val 27913808 ecr 27913807], length 2896
17:53:35.177528 IP 10.0.0.1.42166 > 10.0.0.2.5001: Flags [.], seq 611056:613952, ack 1, win 58, options [nop,nop,TS val 27913808 ecr 27913808], length 2896
17:53:35.179950 IP 10.0.0.1.42166 > 10.0.0.2.5001: Flags [.], seq 613952:616848, ack 1, win 58, options [nop,nop,TS val 27913809 ecr 27913808], length 2896
17:53:35.182373 IP 10.0.0.1.42166 > 10.0.0.2.5001: Flags [.], seq 616848:619744, ack 1, win 58, options [nop,nop,TS val 27913809 ecr 27913809], length 2896
17:53:35.184795 IP 10.0.0.1.42166 > 10.0.0.2.5001: Flags [.], seq 619744:622640, ack 1, win 58, options [nop,nop,TS val 27913810 ecr 27913809], length 2896
17:53:35.187218 IP 10.0.0.1.42166 > 10.0.0.2.5001: Flags [.], seq 622640:625536, ack 1, win 58, options [nop,nop,TS val 27913811 ecr 27913810], length 2896
17:53:35.189640 IP 10.0.0.1.42166 > 10.0.0.2.5001: Flags [.], seq 625536:628432, ack 1, win 58, options [nop,nop,TS val 27913811 ecr 27913811], length 2896
17:53:35.192065 IP 10.0.0.1.42166 > 10.0.0.2.5001: Flags [.], seq 628432:631328, ack 1, win 58, options [nop,nop,TS val 27913812 ecr 27913811], length 2896
17:53:35.194488 IP 10.0.0.1.42166 > 10.0.0.2.5001: Flags [.], seq 631328:634224, ack 1, win 58, options [nop,nop,TS val 27913812 ecr 27913812], length 2896
17:53:35.196909 IP 10.0.0.1.42166 > 10.0.0.2.5001: Flags [.], seq 634224:637120, ack 1, win 58, options [nop,nop,TS val 27913813 ecr 27913812], length 2896
17:53:35.199332 IP 10.0.0.1.42166 > 10.0.0.2.5001: Flags [.], seq 637120:640016, ack 1, win 58, options [nop,nop,TS val 27913814 ecr 27913813], length 2896
17:53:35.201753 IP 10.0.0.1.42166 > 10.0.0.2.5001: Flags [.], seq 640016:642912, ack 1, win 58, options [nop,nop,TS val 27913814 ecr 27913814], length 2896
17:53:35.204586 IP 10.0.0.1.42166 > 10.0.0.2.5001: Flags [.], seq 642912:645808, ack 1, win 58, options [nop,nop,TS val 27913815 ecr 27913814], length 2896
17:53:35.207277 IP 10.0.0.1.42166 > 10.0.0.2.5001: Flags [.], seq 645808:648704, ack 1, win 58, options [nop,nop,TS val 27913815 ecr 27913815], length 2896
17:53:35.209969 IP 10.0.0.1.42166 > 10.0.0.2.5001: Flags [.], seq 648704:651600, ack 1, win 58, options [nop,nop,TS val 27913816 ecr 27913815], length 2896
17:53:35.212660 IP 10.0.0.1.42166 > 10.0.0.2.5001: Flags [.], seq 651600:654496, ack 1, win 58, options [nop,nop,TS val 27913817 ecr 27913816], length 2896
17:53:35.215352 IP 10.0.0.1.42166 > 10.0.0.2.5001: Flags [.], seq 654496:657392, ack 1, win 58, options [nop,nop,TS val 27913817 ecr 27913817], length 2896
17:53:35.218043 IP 10.0.0.1.42166 > 10.0.0.2.5001: Flags [.], seq 657392:660288, ack 1, win 58, options [nop,nop,TS val 27913818 ecr 27913817], length 2896
17:53:35.220735 IP 10.0.0.1.42166 > 10.0.0.2.5001: Flags [.], seq 660288:663184, ack 1, win 58, options [nop,nop,TS val 27913818 ecr 27913818], length 2896
17:53:35.223427 IP 10.0.0.1.42166 > 10.0.0.2.5001: Flags [.], seq 663184:666080, ack 1, win 58, options [nop,nop,TS val 27913819 ecr 27913818], length 2896
17:53:35.226118 IP 10.0.0.1.42166 > 10.0.0.2.5001: Flags [.], seq 666080:668976, ack 1, win 58, options [nop,nop,TS val 27913820 ecr 27913819], length 2896
17:53:35.228810 IP 10.0.0.1.42166 > 10.0.0.2.5001: Flags [.], seq 668976:671872, ack 1, win 58, options [nop,nop,TS val 27913820 ecr 27913820], length 2896
17:53:35.231503 IP 10.0.0.1.42166 > 10.0.0.2.5001: Flags [.], seq 671872:674768, ack 1, win 58, options [nop,nop,TS val 27913821 ecr 27913820], length 2896
17:53:35.234193 IP 10.0.0.1.42166 > 10.0.0.2.5001: Flags [.], seq 674768:677664, ack 1, win 58, options [nop,nop,TS val 27913821 ecr 27913821], length 2896
17:53:35.236885 IP 10.0.0.1.42166 > 10.0.0.2.5001: Flags [.], seq 677664:680560, ack 1, win 58, options [nop,nop,TS val 27913822 ecr 27913821], length 2896
17:53:35.239576 IP 10.0.0.1.42166 > 10.0.0.2.5001: Flags [.], seq 680560:683456, ack 1, win 58, options [nop,nop,TS val 27913823 ecr 27913822], length 2896
17:53:35.242268 IP 10.0.0.1.42166 > 10.0.0.2.5001: Flags [.], seq 683456:686352, ack 1, win 58, options [nop,nop,TS val 27913823 ecr 27913823], length 2896
17:53:35.244959 IP 10.0.0.1.42166 > 10.0.0.2.5001: Flags [.], seq 686352:689248, ack 1, win 58, options [nop,nop,TS val 27913824 ecr 27913823], length 2896
17:53:35.247651 IP 10.0.0.1.42166 > 10.0.0.2.5001: Flags [.], seq 689248:692144, ack 1, win 58, options [nop,nop,TS val 27913824 ecr 27913824], length 2896
17:53:35.250342 IP 10.0.0.1.42166 > 10.0.0.2.5001: Flags [.], seq 692144:695040, ack 1, win 58, options [nop,nop,TS val 27913825 ecr 27913824], length 2896
17:53:35.253034 IP 10.0.0.1.42166 > 10.0.0.2.5001: Flags [.], seq 695040:697936, ack 1, win 58, options [nop,nop,TS val 27913826 ecr 27913825], length 2896
17:53:35.255726 IP 10.0.0.1.42166 > 10.0.0.2.5001: Flags [.], seq 697936:700832, ack 1, win 58, options [nop,nop,TS val 27913826 ecr 27913826], length 2896
17:53:35.258417 IP 10.0.0.1.42166 > 10.0.0.2.5001: Flags [P.], seq 700832:703728, ack 1, win 58, options [nop,nop,TS val 27913827 ecr 27913826], length 2896
17:53:35.261108 IP 10.0.0.1.42166 > 10.0.0.2.5001: Flags [.], seq 703728:706624, ack 1, win 58, options [nop,nop,TS val 27913828 ecr 27913827], length 2896
17:53:35.263800 IP 10.0.0.1.42166 > 10.0.0.2.5001: Flags [.], seq 706624:709520, ack 1, win 58, options [nop,nop,TS val 27913828 ecr 27913828], length 2896
17:53:35.266492 IP 10.0.0.1.42166 > 10.0.0.2.5001: Flags [.], seq 709520:712416, ack 1, win 58, options [nop,nop,TS val 27913829 ecr 27913828], length 2896
17:53:35.269184 IP 10.0.0.1.42166 > 10.0.0.2.5001: Flags [.], seq 712416:715312, ack 1, win 58, options [nop,nop,TS val 27913829 ecr 27913829], length 2896
17:53:35.271875 IP 10.0.0.1.42166 > 10.0.0.2.5001: Flags [.], seq 715312:718208, ack 1, win 58, options [nop,nop,TS val 27913830 ecr 27913829], length 2896
17:53:35.274568 IP 10.0.0.1.42166 > 10.0.0.2.5001: Flags [.], seq 718208:721104, ack 1, win 58, options [nop,nop,TS val 27913831 ecr 27913830], length 2896
17:53:35.277258 IP 10.0.0.1.42166 > 10.0.0.2.5001: Flags [.], seq 721104:724000, ack 1, win 58, options [nop,nop,TS val 27913831 ecr 27913831], length 2896
17:53:35.279950 IP 10.0.0.1.42166 > 10.0.0.2.5001: Flags [.], seq 724000:726896, ack 1, win 58, options [nop,nop,TS val 27913832 ecr 27913831], length 2896
17:53:35.282641 IP 10.0.0.1.42166 > 10.0.0.2.5001: Flags [.], seq 726896:729792, ack 1, win 58, options [nop,nop,TS val 27913832 ecr 27913832], length 2896
17:53:35.285333 IP 10.0.0.1.42166 > 10.0.0.2.5001: Flags [.], seq 729792:732688, ack 1, win 58, options [nop,nop,TS val 27913833 ecr 27913832], length 2896
17:53:35.288024 IP 10.0.0.1.42166 > 10.0.0.2.5001: Flags [.], seq 732688:735584, ack 1, win 58, options [nop,nop,TS val 27913834 ecr 27913833], length 2896
17:53:35.290715 IP 10.0.0.1.42166 > 10.0.0.2.5001: Flags [.], seq 735584:738480, ack 1, win 58, options [nop,nop,TS val 27913834 ecr 27913834], length 2896
17:53:35.293407 IP 10.0.0.1.42166 > 10.0.0.2.5001: Flags [.], seq 738480:741376, ack 1, win 58, options [nop,nop,TS val 27913835 ecr 27913834], length 2896
