tcpdump: verbose output suppressed, use -v or -vv for full protocol decode
listening on h1-eth0, link-type EN10MB (Ethernet), capture size 65535 bytes
18:04:48.350526 IP 10.0.0.1.42874 > 10.0.0.2.5001: Flags [.], seq 1041973850:1041978194, ack 4257395387, win 58, options [nop,nop,TS val 28082096 ecr 28082095], length 4344
18:04:48.350553 IP 10.0.0.2.5001 > 10.0.0.1.42874: Flags [.], ack 4344, win 1007, options [nop,nop,TS val 28082124 ecr 28082096], length 0
18:04:48.355068 IP 10.0.0.1.42874 > 10.0.0.2.5001: Flags [.], seq 4344:8688, ack 1, win 58, options [nop,nop,TS val 28082097 ecr 28082096], length 4344
18:04:48.355092 IP 10.0.0.2.5001 > 10.0.0.1.42874: Flags [.], ack 8688, win 1007, options [nop,nop,TS val 28082125 ecr 28082097], length 0
18:04:48.359608 IP 10.0.0.1.42874 > 10.0.0.2.5001: Flags [.], seq 8688:13032, ack 1, win 58, options [nop,nop,TS val 28082098 ecr 28082097], length 4344
18:04:48.359626 IP 10.0.0.2.5001 > 10.0.0.1.42874: Flags [.], ack 13032, win 1007, options [nop,nop,TS val 28082126 ecr 28082098], length 0
18:04:48.364150 IP 10.0.0.1.42874 > 10.0.0.2.5001: Flags [.], seq 13032:17376, ack 1, win 58, options [nop,nop,TS val 28082099 ecr 28082098], length 4344
18:04:48.364313 IP 10.0.0.2.5001 > 10.0.0.1.42874: Flags [.], ack 17376, win 1007, options [nop,nop,TS val 28082127 ecr 28082099], length 0
18:04:48.368693 IP 10.0.0.1.42874 > 10.0.0.2.5001: Flags [.], seq 17376:21720, ack 1, win 58, options [nop,nop,TS val 28082100 ecr 28082099], length 4344
18:04:48.368712 IP 10.0.0.2.5001 > 10.0.0.1.42874: Flags [.], ack 21720, win 1007, options [nop,nop,TS val 28082128 ecr 28082100], length 0
18:04:48.373235 IP 10.0.0.1.42874 > 10.0.0.2.5001: Flags [P.], seq 21720:26064, ack 1, win 58, options [nop,nop,TS val 28082101 ecr 28082100], length 4344
18:04:48.373251 IP 10.0.0.2.5001 > 10.0.0.1.42874: Flags [.], ack 26064, win 1007, options [nop,nop,TS val 28082129 ecr 28082101], length 0
18:04:48.377776 IP 10.0.0.1.42874 > 10.0.0.2.5001: Flags [.], seq 26064:28960, ack 1, win 58, options [nop,nop,TS val 28082102 ecr 28082101], length 2896
18:04:48.377792 IP 10.0.0.2.5001 > 10.0.0.1.42874: Flags [.], ack 28960, win 1007, options [nop,nop,TS val 28082131 ecr 28082102], length 0
18:04:48.380805 IP 10.0.0.1.42874 > 10.0.0.2.5001: Flags [.], seq 28960:31856, ack 1, win 58, options [nop,nop,TS val 28082103 ecr 28082102], length 2896
18:04:48.380819 IP 10.0.0.2.5001 > 10.0.0.1.42874: Flags [.], ack 31856, win 1007, options [nop,nop,TS val 28082131 ecr 28082103], length 0
18:04:48.383832 IP 10.0.0.1.42874 > 10.0.0.2.5001: Flags [.], seq 31856:34752, ack 1, win 58, options [nop,nop,TS val 28082104 ecr 28082103], length 2896
18:04:48.383847 IP 10.0.0.2.5001 > 10.0.0.1.42874: Flags [.], ack 34752, win 1007, options [nop,nop,TS val 28082132 ecr 28082104], length 0
18:04:48.386860 IP 10.0.0.1.42874 > 10.0.0.2.5001: Flags [.], seq 34752:37648, ack 1, win 58, options [nop,nop,TS val 28082105 ecr 28082104], length 2896
18:04:48.386875 IP 10.0.0.2.5001 > 10.0.0.1.42874: Flags [.], ack 37648, win 1007, options [nop,nop,TS val 28082133 ecr 28082105], length 0
18:04:48.389888 IP 10.0.0.1.42874 > 10.0.0.2.5001: Flags [.], seq 37648:40544, ack 1, win 58, options [nop,nop,TS val 28082105 ecr 28082104], length 2896
18:04:48.389904 IP 10.0.0.2.5001 > 10.0.0.1.42874: Flags [.], ack 40544, win 1007, options [nop,nop,TS val 28082134 ecr 28082105], length 0
18:04:48.392916 IP 10.0.0.1.42874 > 10.0.0.2.5001: Flags [.], seq 40544:43440, ack 1, win 58, options [nop,nop,TS val 28082106 ecr 28082105], length 2896
18:04:48.392931 IP 10.0.0.2.5001 > 10.0.0.1.42874: Flags [.], ack 43440, win 1007, options [nop,nop,TS val 28082134 ecr 28082106], length 0
18:04:48.395947 IP 10.0.0.1.42874 > 10.0.0.2.5001: Flags [.], seq 43440:46336, ack 1, win 58, options [nop,nop,TS val 28082107 ecr 28082106], length 2896
18:04:48.395971 IP 10.0.0.2.5001 > 10.0.0.1.42874: Flags [.], ack 46336, win 1007, options [nop,nop,TS val 28082135 ecr 28082107], length 0
18:04:48.398973 IP 10.0.0.1.42874 > 10.0.0.2.5001: Flags [.], seq 46336:49232, ack 1, win 58, options [nop,nop,TS val 28082107 ecr 28082106], length 2896
18:04:48.398988 IP 10.0.0.2.5001 > 10.0.0.1.42874: Flags [.], ack 49232, win 1007, options [nop,nop,TS val 28082136 ecr 28082107], length 0
18:04:48.402001 IP 10.0.0.1.42874 > 10.0.0.2.5001: Flags [.], seq 49232:52128, ack 1, win 58, options [nop,nop,TS val 28082108 ecr 28082107], length 2896
18:04:48.402016 IP 10.0.0.2.5001 > 10.0.0.1.42874: Flags [.], ack 52128, win 1007, options [nop,nop,TS val 28082137 ecr 28082108], length 0
18:04:48.405028 IP 10.0.0.1.42874 > 10.0.0.2.5001: Flags [.], seq 52128:55024, ack 1, win 58, options [nop,nop,TS val 28082109 ecr 28082108], length 2896
18:04:48.405045 IP 10.0.0.2.5001 > 10.0.0.1.42874: Flags [.], ack 55024, win 1007, options [nop,nop,TS val 28082137 ecr 28082109], length 0
18:04:48.408057 IP 10.0.0.1.42874 > 10.0.0.2.5001: Flags [.], seq 55024:57920, ack 1, win 58, options [nop,nop,TS val 28082110 ecr 28082109], length 2896
18:04:48.408073 IP 10.0.0.2.5001 > 10.0.0.1.42874: Flags [.], ack 57920, win 1007, options [nop,nop,TS val 28082138 ecr 28082110], length 0
18:04:48.411087 IP 10.0.0.1.42874 > 10.0.0.2.5001: Flags [.], seq 57920:60816, ack 1, win 58, options [nop,nop,TS val 28082110 ecr 28082109], length 2896
18:04:48.411111 IP 10.0.0.2.5001 > 10.0.0.1.42874: Flags [.], ack 60816, win 1007, options [nop,nop,TS val 28082139 ecr 28082110], length 0
18:04:48.414116 IP 10.0.0.1.42874 > 10.0.0.2.5001: Flags [.], seq 60816:63712, ack 1, win 58, options [nop,nop,TS val 28082111 ecr 28082110], length 2896
18:04:48.414153 IP 10.0.0.2.5001 > 10.0.0.1.42874: Flags [.], ack 63712, win 1007, options [nop,nop,TS val 28082140 ecr 28082111], length 0
18:04:48.417142 IP 10.0.0.1.42874 > 10.0.0.2.5001: Flags [.], seq 63712:66608, ack 1, win 58, options [nop,nop,TS val 28082112 ecr 28082111], length 2896
18:04:48.417160 IP 10.0.0.2.5001 > 10.0.0.1.42874: Flags [.], ack 66608, win 1007, options [nop,nop,TS val 28082140 ecr 28082112], length 0
18:04:48.420601 IP 10.0.0.1.42874 > 10.0.0.2.5001: Flags [.], seq 66608:69504, ack 1, win 58, options [nop,nop,TS val 28082112 ecr 28082111], length 2896
18:04:48.420616 IP 10.0.0.2.5001 > 10.0.0.1.42874: Flags [.], ack 69504, win 1007, options [nop,nop,TS val 28082141 ecr 28082112], length 0
18:04:48.424062 IP 10.0.0.1.42874 > 10.0.0.2.5001: Flags [.], seq 69504:72400, ack 1, win 58, options [nop,nop,TS val 28082113 ecr 28082112], length 2896
18:04:48.424077 IP 10.0.0.2.5001 > 10.0.0.1.42874: Flags [.], ack 72400, win 1007, options [nop,nop,TS val 28082142 ecr 28082113], length 0
18:04:48.427522 IP 10.0.0.1.42874 > 10.0.0.2.5001: Flags [.], seq 72400:75296, ack 1, win 58, options [nop,nop,TS val 28082114 ecr 28082113], length 2896
18:04:48.427537 IP 10.0.0.2.5001 > 10.0.0.1.42874: Flags [.], ack 75296, win 1007, options [nop,nop,TS val 28082143 ecr 28082114], length 0
18:04:48.430983 IP 10.0.0.1.42874 > 10.0.0.2.5001: Flags [.], seq 75296:78192, ack 1, win 58, options [nop,nop,TS val 28082115 ecr 28082114], length 2896
18:04:48.430997 IP 10.0.0.2.5001 > 10.0.0.1.42874: Flags [.], ack 78192, win 1007, options [nop,nop,TS val 28082144 ecr 28082115], length 0
18:04:48.434447 IP 10.0.0.1.42874 > 10.0.0.2.5001: Flags [.], seq 78192:81088, ack 1, win 58, options [nop,nop,TS val 28082115 ecr 28082114], length 2896
18:04:48.434482 IP 10.0.0.2.5001 > 10.0.0.1.42874: Flags [.], ack 81088, win 1007, options [nop,nop,TS val 28082145 ecr 28082115], length 0
18:04:48.437911 IP 10.0.0.1.42874 > 10.0.0.2.5001: Flags [.], seq 81088:83984, ack 1, win 58, options [nop,nop,TS val 28082116 ecr 28082115], length 2896
18:04:48.437947 IP 10.0.0.2.5001 > 10.0.0.1.42874: Flags [.], ack 83984, win 1007, options [nop,nop,TS val 28082146 ecr 28082116], length 0
18:04:48.441365 IP 10.0.0.1.42874 > 10.0.0.2.5001: Flags [.], seq 83984:86880, ack 1, win 58, options [nop,nop,TS val 28082117 ecr 28082116], length 2896
18:04:48.441390 IP 10.0.0.2.5001 > 10.0.0.1.42874: Flags [.], ack 86880, win 1007, options [nop,nop,TS val 28082147 ecr 28082117], length 0
18:04:48.444825 IP 10.0.0.1.42874 > 10.0.0.2.5001: Flags [.], seq 86880:89776, ack 1, win 58, options [nop,nop,TS val 28082117 ecr 28082116], length 2896
18:04:48.445353 IP 10.0.0.2.5001 > 10.0.0.1.42874: Flags [.], ack 89776, win 1007, options [nop,nop,TS val 28082148 ecr 28082117], length 0
18:04:48.448285 IP 10.0.0.1.42874 > 10.0.0.2.5001: Flags [.], seq 89776:92672, ack 1, win 58, options [nop,nop,TS val 28082118 ecr 28082117], length 2896
18:04:48.448301 IP 10.0.0.2.5001 > 10.0.0.1.42874: Flags [.], ack 92672, win 1007, options [nop,nop,TS val 28082148 ecr 28082118], length 0
18:04:48.451746 IP 10.0.0.1.42874 > 10.0.0.2.5001: Flags [.], seq 92672:95568, ack 1, win 58, options [nop,nop,TS val 28082119 ecr 28082118], length 2896
18:04:48.451762 IP 10.0.0.2.5001 > 10.0.0.1.42874: Flags [.], ack 95568, win 1007, options [nop,nop,TS val 28082149 ecr 28082119], length 0
18:04:48.455206 IP 10.0.0.1.42874 > 10.0.0.2.5001: Flags [.], seq 95568:98464, ack 1, win 58, options [nop,nop,TS val 28082120 ecr 28082119], length 2896
18:04:48.455223 IP 10.0.0.2.5001 > 10.0.0.1.42874: Flags [.], ack 98464, win 1007, options [nop,nop,TS val 28082150 ecr 28082120], length 0
18:04:48.458667 IP 10.0.0.1.42874 > 10.0.0.2.5001: Flags [.], seq 98464:101360, ack 1, win 58, options [nop,nop,TS val 28082120 ecr 28082119], length 2896
18:04:48.458684 IP 10.0.0.2.5001 > 10.0.0.1.42874: Flags [.], ack 101360, win 1007, options [nop,nop,TS val 28082151 ecr 28082120], length 0
18:04:48.462127 IP 10.0.0.1.42874 > 10.0.0.2.5001: Flags [.], seq 101360:104256, ack 1, win 58, options [nop,nop,TS val 28082122 ecr 28082120], length 2896
18:04:48.462143 IP 10.0.0.2.5001 > 10.0.0.1.42874: Flags [.], ack 104256, win 1007, options [nop,nop,TS val 28082152 ecr 28082122], length 0
18:04:48.465588 IP 10.0.0.1.42874 > 10.0.0.2.5001: Flags [.], seq 104256:107152, ack 1, win 58, options [nop,nop,TS val 28082123 ecr 28082122], length 2896
18:04:48.465603 IP 10.0.0.2.5001 > 10.0.0.1.42874: Flags [.], ack 107152, win 1007, options [nop,nop,TS val 28082153 ecr 28082123], length 0
18:04:48.469048 IP 10.0.0.1.42874 > 10.0.0.2.5001: Flags [.], seq 107152:110048, ack 1, win 58, options [nop,nop,TS val 28082123 ecr 28082122], length 2896
18:04:48.469064 IP 10.0.0.2.5001 > 10.0.0.1.42874: Flags [.], ack 110048, win 1007, options [nop,nop,TS val 28082153 ecr 28082123], length 0
18:04:48.472509 IP 10.0.0.1.42874 > 10.0.0.2.5001: Flags [P.], seq 110048:112944, ack 1, win 58, options [nop,nop,TS val 28082124 ecr 28082123], length 2896
18:04:48.472525 IP 10.0.0.2.5001 > 10.0.0.1.42874: Flags [.], ack 112944, win 1007, options [nop,nop,TS val 28082154 ecr 28082124], length 0
18:04:48.475970 IP 10.0.0.1.42874 > 10.0.0.2.5001: Flags [.], seq 112944:115840, ack 1, win 58, options [nop,nop,TS val 28082125 ecr 28082124], length 2896
18:04:48.475985 IP 10.0.0.2.5001 > 10.0.0.1.42874: Flags [.], ack 115840, win 1007, options [nop,nop,TS val 28082155 ecr 28082125], length 0
18:04:48.479432 IP 10.0.0.1.42874 > 10.0.0.2.5001: Flags [.], seq 115840:118736, ack 1, win 58, options [nop,nop,TS val 28082126 ecr 28082125], length 2896
18:04:48.480745 IP 10.0.0.2.5001 > 10.0.0.1.42874: Flags [.], ack 118736, win 1007, options [nop,nop,TS val 28082156 ecr 28082126], length 0
18:04:48.482893 IP 10.0.0.1.42874 > 10.0.0.2.5001: Flags [.], seq 118736:121632, ack 1, win 58, options [nop,nop,TS val 28082126 ecr 28082125], length 2896
18:04:48.484918 IP 10.0.0.2.5001 > 10.0.0.1.42874: Flags [.], ack 121632, win 1007, options [nop,nop,TS val 28082157 ecr 28082126], length 0
18:04:48.486353 IP 10.0.0.1.42874 > 10.0.0.2.5001: Flags [.], seq 121632:124528, ack 1, win 58, options [nop,nop,TS val 28082127 ecr 28082126], length 2896
18:04:48.486374 IP 10.0.0.2.5001 > 10.0.0.1.42874: Flags [.], ack 124528, win 1007, options [nop,nop,TS val 28082158 ecr 28082127], length 0
18:04:48.489345 IP6 :: > ff02::1:ff2d:145a: ICMP6, neighbor solicitation, who has fe80::e050:c1ff:fe2d:145a, length 24
18:04:48.489812 IP 10.0.0.1.42874 > 10.0.0.2.5001: Flags [.], seq 124528:127424, ack 1, win 58, options [nop,nop,TS val 28082128 ecr 28082127], length 2896
18:04:48.489834 IP 10.0.0.2.5001 > 10.0.0.1.42874: Flags [.], ack 127424, win 1007, options [nop,nop,TS val 28082159 ecr 28082128], length 0
18:04:48.493274 IP 10.0.0.1.42874 > 10.0.0.2.5001: Flags [.], seq 127424:130320, ack 1, win 58, options [nop,nop,TS val 28082128 ecr 28082127], length 2896
18:04:48.493298 IP 10.0.0.2.5001 > 10.0.0.1.42874: Flags [.], ack 130320, win 1007, options [nop,nop,TS val 28082159 ecr 28082128], length 0
18:04:48.496735 IP 10.0.0.1.42874 > 10.0.0.2.5001: Flags [.], seq 130320:133216, ack 1, win 58, options [nop,nop,TS val 28082129 ecr 28082128], length 2896
18:04:48.496758 IP 10.0.0.2.5001 > 10.0.0.1.42874: Flags [.], ack 133216, win 1007, options [nop,nop,TS val 28082160 ecr 28082129], length 0
18:04:48.500195 IP 10.0.0.1.42874 > 10.0.0.2.5001: Flags [.], seq 133216:136112, ack 1, win 58, options [nop,nop,TS val 28082131 ecr 28082129], length 2896
18:04:48.500363 IP 10.0.0.2.5001 > 10.0.0.1.42874: Flags [.], ack 136112, win 1007, options [nop,nop,TS val 28082161 ecr 28082131], length 0
18:04:48.503654 IP 10.0.0.1.42874 > 10.0.0.2.5001: Flags [.], seq 136112:139008, ack 1, win 58, options [nop,nop,TS val 28082131 ecr 28082131], length 2896
18:04:48.503672 IP 10.0.0.2.5001 > 10.0.0.1.42874: Flags [.], ack 139008, win 1007, options [nop,nop,TS val 28082162 ecr 28082131], length 0
18:04:48.507115 IP 10.0.0.1.42874 > 10.0.0.2.5001: Flags [.], seq 139008:141904, ack 1, win 58, options [nop,nop,TS val 28082132 ecr 28082131], length 2896
18:04:48.507131 IP 10.0.0.2.5001 > 10.0.0.1.42874: Flags [.], ack 141904, win 1007, options [nop,nop,TS val 28082163 ecr 28082132], length 0
18:04:48.510575 IP 10.0.0.1.42874 > 10.0.0.2.5001: Flags [.], seq 141904:144800, ack 1, win 58, options [nop,nop,TS val 28082133 ecr 28082132], length 2896
18:04:48.510590 IP 10.0.0.2.5001 > 10.0.0.1.42874: Flags [.], ack 144800, win 1007, options [nop,nop,TS val 28082164 ecr 28082133], length 0
18:04:48.513342 IP6 :: > ff02::16: HBH ICMP6, multicast listener report v2, 1 group record(s), length 28
18:04:48.514036 IP 10.0.0.1.42874 > 10.0.0.2.5001: Flags [.], seq 144800:147696, ack 1, win 58, options [nop,nop,TS val 28082134 ecr 28082133], length 2896
18:04:48.514051 IP 10.0.0.2.5001 > 10.0.0.1.42874: Flags [.], ack 147696, win 1007, options [nop,nop,TS val 28082165 ecr 28082134], length 0
18:04:48.517502 IP 10.0.0.1.42874 > 10.0.0.2.5001: Flags [.], seq 147696:150592, ack 1, win 58, options [nop,nop,TS val 28082134 ecr 28082134], length 2896
18:04:48.517533 IP 10.0.0.2.5001 > 10.0.0.1.42874: Flags [.], ack 150592, win 1007, options [nop,nop,TS val 28082166 ecr 28082134], length 0
18:04:48.520960 IP 10.0.0.1.42874 > 10.0.0.2.5001: Flags [.], seq 150592:153488, ack 1, win 58, options [nop,nop,TS val 28082135 ecr 28082134], length 2896
18:04:48.520981 IP 10.0.0.2.5001 > 10.0.0.1.42874: Flags [.], ack 153488, win 1007, options [nop,nop,TS val 28082166 ecr 28082135], length 0
18:04:48.524994 IP 10.0.0.1.42874 > 10.0.0.2.5001: Flags [.], seq 153488:156384, ack 1, win 58, options [nop,nop,TS val 28082136 ecr 28082135], length 2896
18:04:48.525011 IP 10.0.0.2.5001 > 10.0.0.1.42874: Flags [.], ack 156384, win 1007, options [nop,nop,TS val 28082167 ecr 28082136], length 0
18:04:48.529032 IP 10.0.0.1.42874 > 10.0.0.2.5001: Flags [.], seq 156384:159280, ack 1, win 58, options [nop,nop,TS val 28082137 ecr 28082136], length 2896
18:04:48.529048 IP 10.0.0.2.5001 > 10.0.0.1.42874: Flags [.], ack 159280, win 1007, options [nop,nop,TS val 28082168 ecr 28082137], length 0
18:04:48.533069 IP 10.0.0.1.42874 > 10.0.0.2.5001: Flags [.], seq 159280:162176, ack 1, win 58, options [nop,nop,TS val 28082137 ecr 28082137], length 2896
18:04:48.533085 IP 10.0.0.2.5001 > 10.0.0.1.42874: Flags [.], ack 162176, win 1007, options [nop,nop,TS val 28082169 ecr 28082137], length 0
18:04:48.537107 IP 10.0.0.1.42874 > 10.0.0.2.5001: Flags [.], seq 162176:165072, ack 1, win 58, options [nop,nop,TS val 28082138 ecr 28082137], length 2896
18:04:48.537145 IP 10.0.0.2.5001 > 10.0.0.1.42874: Flags [.], ack 165072, win 1007, options [nop,nop,TS val 28082170 ecr 28082138], length 0
18:04:48.541144 IP 10.0.0.1.42874 > 10.0.0.2.5001: Flags [.], seq 165072:167968, ack 1, win 58, options [nop,nop,TS val 28082139 ecr 28082138], length 2896
18:04:48.541161 IP 10.0.0.2.5001 > 10.0.0.1.42874: Flags [.], ack 167968, win 1007, options [nop,nop,TS val 28082171 ecr 28082139], length 0
18:04:48.545181 IP 10.0.0.1.42874 > 10.0.0.2.5001: Flags [P.], seq 167968:170864, ack 1, win 58, options [nop,nop,TS val 28082140 ecr 28082139], length 2896
18:04:48.545197 IP 10.0.0.2.5001 > 10.0.0.1.42874: Flags [.], ack 170864, win 1007, options [nop,nop,TS val 28082172 ecr 28082140], length 0
18:04:48.549218 IP 10.0.0.1.42874 > 10.0.0.2.5001: Flags [.], seq 170864:173760, ack 1, win 58, options [nop,nop,TS val 28082140 ecr 28082140], length 2896
18:04:48.549234 IP 10.0.0.2.5001 > 10.0.0.1.42874: Flags [.], ack 173760, win 1007, options [nop,nop,TS val 28082173 ecr 28082140], length 0
18:04:48.553255 IP 10.0.0.1.42874 > 10.0.0.2.5001: Flags [.], seq 173760:176656, ack 1, win 58, options [nop,nop,TS val 28082141 ecr 28082140], length 2896
18:04:48.553271 IP 10.0.0.2.5001 > 10.0.0.1.42874: Flags [.], ack 176656, win 1007, options [nop,nop,TS val 28082174 ecr 28082141], length 0
18:04:48.557293 IP 10.0.0.1.42874 > 10.0.0.2.5001: Flags [.], seq 176656:179552, ack 1, win 58, options [nop,nop,TS val 28082142 ecr 28082141], length 2896
18:04:48.557310 IP 10.0.0.2.5001 > 10.0.0.1.42874: Flags [.], ack 179552, win 1007, options [nop,nop,TS val 28082175 ecr 28082142], length 0
18:04:48.561333 IP 10.0.0.1.42874 > 10.0.0.2.5001: Flags [.], seq 179552:182448, ack 1, win 58, options [nop,nop,TS val 28082143 ecr 28082142], length 2896
18:04:48.561352 IP 10.0.0.2.5001 > 10.0.0.1.42874: Flags [.], ack 182448, win 1007, options [nop,nop,TS val 28082177 ecr 28082143], length 0
18:04:48.565368 IP 10.0.0.1.42874 > 10.0.0.2.5001: Flags [.], seq 182448:185344, ack 1, win 58, options [nop,nop,TS val 28082144 ecr 28082143], length 2896
18:04:48.566416 IP 10.0.0.2.5001 > 10.0.0.1.42874: Flags [.], ack 185344, win 1007, options [nop,nop,TS val 28082178 ecr 28082144], length 0
18:04:48.569405 IP6 :: > ff02::1:ffe9:3248: ICMP6, neighbor solicitation, who has fe80::ccf:b8ff:fee9:3248, length 24
18:04:48.569509 IP 10.0.0.1.42874 > 10.0.0.2.5001: Flags [.], seq 185344:188240, ack 1, win 58, options [nop,nop,TS val 28082145 ecr 28082144], length 2896
18:04:48.569525 IP 10.0.0.2.5001 > 10.0.0.1.42874: Flags [.], ack 188240, win 1007, options [nop,nop,TS val 28082179 ecr 28082145], length 0
18:04:48.573546 IP 10.0.0.1.42874 > 10.0.0.2.5001: Flags [.], seq 188240:191136, ack 1, win 58, options [nop,nop,TS val 28082146 ecr 28082145], length 2896
18:04:48.573562 IP 10.0.0.2.5001 > 10.0.0.1.42874: Flags [.], ack 191136, win 1007, options [nop,nop,TS val 28082180 ecr 28082146], length 0
18:04:48.577584 IP 10.0.0.1.42874 > 10.0.0.2.5001: Flags [.], seq 191136:194032, ack 1, win 58, options [nop,nop,TS val 28082147 ecr 28082146], length 2896
18:04:48.577599 IP 10.0.0.2.5001 > 10.0.0.1.42874: Flags [.], ack 194032, win 1007, options [nop,nop,TS val 28082181 ecr 28082147], length 0
18:04:48.581621 IP 10.0.0.1.42874 > 10.0.0.2.5001: Flags [.], seq 194032:196928, ack 1, win 58, options [nop,nop,TS val 28082147 ecr 28082147], length 2896
18:04:48.581636 IP 10.0.0.2.5001 > 10.0.0.1.42874: Flags [.], ack 196928, win 1007, options [nop,nop,TS val 28082182 ecr 28082147], length 0
18:04:48.585658 IP 10.0.0.1.42874 > 10.0.0.2.5001: Flags [.], seq 196928:199824, ack 1, win 58, options [nop,nop,TS val 28082148 ecr 28082148], length 2896
18:04:48.585679 IP 10.0.0.2.5001 > 10.0.0.1.42874: Flags [.], ack 199824, win 1007, options [nop,nop,TS val 28082183 ecr 28082148], length 0
18:04:48.589696 IP 10.0.0.1.42874 > 10.0.0.2.5001: Flags [.], seq 199824:202720, ack 1, win 58, options [nop,nop,TS val 28082149 ecr 28082148], length 2896
18:04:48.589712 IP 10.0.0.2.5001 > 10.0.0.1.42874: Flags [.], ack 202720, win 1007, options [nop,nop,TS val 28082184 ecr 28082149], length 0
18:04:48.593733 IP 10.0.0.1.42874 > 10.0.0.2.5001: Flags [.], seq 202720:205616, ack 1, win 58, options [nop,nop,TS val 28082150 ecr 28082149], length 2896
18:04:48.593748 IP 10.0.0.2.5001 > 10.0.0.1.42874: Flags [.], ack 205616, win 1007, options [nop,nop,TS val 28082185 ecr 28082150], length 0
18:04:48.597770 IP 10.0.0.1.42874 > 10.0.0.2.5001: Flags [.], seq 205616:208512, ack 1, win 58, options [nop,nop,TS val 28082151 ecr 28082150], length 2896
18:04:48.597786 IP 10.0.0.2.5001 > 10.0.0.1.42874: Flags [.], ack 208512, win 1007, options [nop,nop,TS val 28082186 ecr 28082151], length 0
18:04:48.601808 IP 10.0.0.1.42874 > 10.0.0.2.5001: Flags [.], seq 208512:211408, ack 1, win 58, options [nop,nop,TS val 28082152 ecr 28082151], length 2896
18:04:48.601824 IP 10.0.0.2.5001 > 10.0.0.1.42874: Flags [.], ack 211408, win 1007, options [nop,nop,TS val 28082187 ecr 28082152], length 0
18:04:48.605845 IP 10.0.0.1.42874 > 10.0.0.2.5001: Flags [.], seq 211408:214304, ack 1, win 58, options [nop,nop,TS val 28082153 ecr 28082152], length 2896
18:04:48.605861 IP 10.0.0.2.5001 > 10.0.0.1.42874: Flags [.], ack 214304, win 1007, options [nop,nop,TS val 28082188 ecr 28082153], length 0
18:04:48.609882 IP 10.0.0.1.42874 > 10.0.0.2.5001: Flags [.], seq 214304:217200, ack 1, win 58, options [nop,nop,TS val 28082153 ecr 28082153], length 2896
18:04:48.609903 IP 10.0.0.2.5001 > 10.0.0.1.42874: Flags [.], ack 217200, win 1007, options [nop,nop,TS val 28082189 ecr 28082153], length 0
18:04:48.613922 IP 10.0.0.1.42874 > 10.0.0.2.5001: Flags [.], seq 217200:220096, ack 1, win 58, options [nop,nop,TS val 28082154 ecr 28082153], length 2896
18:04:48.614519 IP 10.0.0.2.5001 > 10.0.0.1.42874: Flags [.], ack 220096, win 1007, options [nop,nop,TS val 28082190 ecr 28082154], length 0
18:04:48.617958 IP 10.0.0.1.42874 > 10.0.0.2.5001: Flags [.], seq 220096:222992, ack 1, win 58, options [nop,nop,TS val 28082155 ecr 28082154], length 2896
18:04:48.617985 IP 10.0.0.2.5001 > 10.0.0.1.42874: Flags [.], ack 222992, win 1007, options [nop,nop,TS val 28082191 ecr 28082155], length 0
18:04:48.621999 IP 10.0.0.1.42874 > 10.0.0.2.5001: Flags [.], seq 222992:225888, ack 1, win 58, options [nop,nop,TS val 28082156 ecr 28082155], length 2896
18:04:48.622037 IP 10.0.0.2.5001 > 10.0.0.1.42874: Flags [.], ack 225888, win 1007, options [nop,nop,TS val 28082192 ecr 28082156], length 0
18:04:48.626034 IP 10.0.0.1.42874 > 10.0.0.2.5001: Flags [.], seq 225888:228784, ack 1, win 58, options [nop,nop,TS val 28082157 ecr 28082156], length 2896
18:04:48.626062 IP 10.0.0.2.5001 > 10.0.0.1.42874: Flags [.], ack 228784, win 1007, options [nop,nop,TS val 28082193 ecr 28082157], length 0
18:04:48.630888 IP 10.0.0.1.42874 > 10.0.0.2.5001: Flags [.], seq 228784:231680, ack 1, win 58, options [nop,nop,TS val 28082158 ecr 28082157], length 2896
18:04:48.630912 IP 10.0.0.2.5001 > 10.0.0.1.42874: Flags [.], ack 231680, win 1007, options [nop,nop,TS val 28082194 ecr 28082158], length 0
18:04:48.635723 IP 10.0.0.1.42874 > 10.0.0.2.5001: Flags [.], seq 231680:234576, ack 1, win 58, options [nop,nop,TS val 28082159 ecr 28082158], length 2896
18:04:48.635745 IP 10.0.0.2.5001 > 10.0.0.1.42874: Flags [.], ack 234576, win 1007, options [nop,nop,TS val 28082195 ecr 28082159], length 0
18:04:48.640577 IP 10.0.0.1.42874 > 10.0.0.2.5001: Flags [.], seq 234576:237472, ack 1, win 58, options [nop,nop,TS val 28082159 ecr 28082159], length 2896
18:04:48.641522 IP 10.0.0.2.5001 > 10.0.0.1.42874: Flags [.], ack 237472, win 1007, options [nop,nop,TS val 28082197 ecr 28082159], length 0
18:04:48.645412 IP 10.0.0.1.42874 > 10.0.0.2.5001: Flags [.], seq 237472:240368, ack 1, win 58, options [nop,nop,TS val 28082160 ecr 28082159], length 2896
18:04:48.645428 IP 10.0.0.2.5001 > 10.0.0.1.42874: Flags [.], ack 240368, win 1007, options [nop,nop,TS val 28082198 ecr 28082160], length 0
18:04:48.650257 IP 10.0.0.1.42874 > 10.0.0.2.5001: Flags [.], seq 240368:243264, ack 1, win 58, options [nop,nop,TS val 28082161 ecr 28082160], length 2896
18:04:48.650273 IP 10.0.0.2.5001 > 10.0.0.1.42874: Flags [.], ack 243264, win 1007, options [nop,nop,TS val 28082199 ecr 28082161], length 0
18:04:48.655101 IP 10.0.0.1.42874 > 10.0.0.2.5001: Flags [.], seq 243264:246160, ack 1, win 58, options [nop,nop,TS val 28082162 ecr 28082161], length 2896
18:04:48.655115 IP 10.0.0.2.5001 > 10.0.0.1.42874: Flags [.], ack 246160, win 1007, options [nop,nop,TS val 28082200 ecr 28082162], length 0
18:04:48.659946 IP 10.0.0.1.42874 > 10.0.0.2.5001: Flags [.], seq 246160:249056, ack 1, win 58, options [nop,nop,TS val 28082163 ecr 28082162], length 2896
18:04:48.659960 IP 10.0.0.2.5001 > 10.0.0.1.42874: Flags [.], ack 249056, win 1007, options [nop,nop,TS val 28082201 ecr 28082163], length 0
18:04:48.664791 IP 10.0.0.1.42874 > 10.0.0.2.5001: Flags [.], seq 249056:251952, ack 1, win 58, options [nop,nop,TS val 28082164 ecr 28082163], length 2896
18:04:48.664806 IP 10.0.0.2.5001 > 10.0.0.1.42874: Flags [.], ack 251952, win 1007, options [nop,nop,TS val 28082202 ecr 28082164], length 0
18:04:48.669635 IP 10.0.0.1.42874 > 10.0.0.2.5001: Flags [.], seq 251952:254848, ack 1, win 58, options [nop,nop,TS val 28082165 ecr 28082164], length 2896
18:04:48.669651 IP 10.0.0.2.5001 > 10.0.0.1.42874: Flags [.], ack 254848, win 1007, options [nop,nop,TS val 28082204 ecr 28082165], length 0
18:04:48.674480 IP 10.0.0.1.42874 > 10.0.0.2.5001: Flags [.], seq 254848:257744, ack 1, win 58, options [nop,nop,TS val 28082166 ecr 28082165], length 2896
18:04:48.674495 IP 10.0.0.2.5001 > 10.0.0.1.42874: Flags [.], ack 257744, win 1007, options [nop,nop,TS val 28082205 ecr 28082166], length 0
18:04:48.679325 IP 10.0.0.1.42874 > 10.0.0.2.5001: Flags [.], seq 257744:260640, ack 1, win 58, options [nop,nop,TS val 28082166 ecr 28082166], length 2896
18:04:48.679342 IP 10.0.0.2.5001 > 10.0.0.1.42874: Flags [.], ack 260640, win 1007, options [nop,nop,TS val 28082206 ecr 28082166], length 0
18:04:48.684170 IP 10.0.0.1.42874 > 10.0.0.2.5001: Flags [.], seq 260640:263536, ack 1, win 58, options [nop,nop,TS val 28082167 ecr 28082166], length 2896
18:04:48.684185 IP 10.0.0.2.5001 > 10.0.0.1.42874: Flags [.], ack 263536, win 1007, options [nop,nop,TS val 28082207 ecr 28082167], length 0
18:04:48.689015 IP 10.0.0.1.42874 > 10.0.0.2.5001: Flags [.], seq 263536:266432, ack 1, win 58, options [nop,nop,TS val 28082168 ecr 28082167], length 2896
18:04:48.689031 IP 10.0.0.2.5001 > 10.0.0.1.42874: Flags [.], ack 266432, win 1007, options [nop,nop,TS val 28082208 ecr 28082168], length 0
18:04:48.693860 IP 10.0.0.1.42874 > 10.0.0.2.5001: Flags [.], seq 266432:269328, ack 1, win 58, options [nop,nop,TS val 28082169 ecr 28082168], length 2896
18:04:48.693875 IP 10.0.0.2.5001 > 10.0.0.1.42874: Flags [.], ack 269328, win 1007, options [nop,nop,TS val 28082210 ecr 28082169], length 0
18:04:48.698704 IP 10.0.0.1.42874 > 10.0.0.2.5001: Flags [.], seq 269328:272224, ack 1, win 58, options [nop,nop,TS val 28082170 ecr 28082169], length 2896
18:04:48.698718 IP 10.0.0.2.5001 > 10.0.0.1.42874: Flags [.], ack 272224, win 1007, options [nop,nop,TS val 28082211 ecr 28082170], length 0
18:04:48.703549 IP 10.0.0.1.42874 > 10.0.0.2.5001: Flags [.], seq 272224:275120, ack 1, win 58, options [nop,nop,TS val 28082171 ecr 28082170], length 2896
18:04:48.703563 IP 10.0.0.2.5001 > 10.0.0.1.42874: Flags [.], ack 275120, win 1007, options [nop,nop,TS val 28082212 ecr 28082171], length 0
18:04:48.708394 IP 10.0.0.1.42874 > 10.0.0.2.5001: Flags [.], seq 275120:278016, ack 1, win 58, options [nop,nop,TS val 28082172 ecr 28082171], length 2896
18:04:48.708408 IP 10.0.0.2.5001 > 10.0.0.1.42874: Flags [.], ack 278016, win 1007, options [nop,nop,TS val 28082213 ecr 28082172], length 0
18:04:48.713243 IP 10.0.0.1.42874 > 10.0.0.2.5001: Flags [.], seq 278016:280912, ack 1, win 58, options [nop,nop,TS val 28082173 ecr 28082172], length 2896
18:04:48.713282 IP 10.0.0.2.5001 > 10.0.0.1.42874: Flags [.], ack 280912, win 1007, options [nop,nop,TS val 28082214 ecr 28082173], length 0
18:04:48.718084 IP 10.0.0.1.42874 > 10.0.0.2.5001: Flags [.], seq 280912:283808, ack 1, win 58, options [nop,nop,TS val 28082174 ecr 28082173], length 2896
18:04:48.718108 IP 10.0.0.2.5001 > 10.0.0.1.42874: Flags [.], ack 283808, win 1007, options [nop,nop,TS val 28082216 ecr 28082174], length 0
18:04:48.722928 IP 10.0.0.1.42874 > 10.0.0.2.5001: Flags [.], seq 283808:286704, ack 1, win 58, options [nop,nop,TS val 28082175 ecr 28082174], length 2896
18:04:48.723464 IP 10.0.0.2.5001 > 10.0.0.1.42874: Flags [.], ack 286704, win 1007, options [nop,nop,TS val 28082217 ecr 28082175], length 0
18:04:48.727776 IP 10.0.0.1.42874 > 10.0.0.2.5001: Flags [.], seq 286704:289600, ack 1, win 58, options [nop,nop,TS val 28082177 ecr 28082175], length 2896
18:04:48.727803 IP 10.0.0.2.5001 > 10.0.0.1.42874: Flags [.], ack 289600, win 1007, options [nop,nop,TS val 28082218 ecr 28082177], length 0
18:04:48.732619 IP 10.0.0.1.42874 > 10.0.0.2.5001: Flags [.], seq 289600:292496, ack 1, win 58, options [nop,nop,TS val 28082178 ecr 28082177], length 2896
18:04:48.732646 IP 10.0.0.2.5001 > 10.0.0.1.42874: Flags [.], ack 292496, win 1007, options [nop,nop,TS val 28082219 ecr 28082178], length 0
18:04:48.738673 IP 10.0.0.1.42874 > 10.0.0.2.5001: Flags [.], seq 292496:295392, ack 1, win 58, options [nop,nop,TS val 28082179 ecr 28082178], length 2896
18:04:48.738691 IP 10.0.0.2.5001 > 10.0.0.1.42874: Flags [.], ack 295392, win 1007, options [nop,nop,TS val 28082221 ecr 28082179], length 0
18:04:48.744729 IP 10.0.0.1.42874 > 10.0.0.2.5001: Flags [.], seq 295392:298288, ack 1, win 58, options [nop,nop,TS val 28082180 ecr 28082179], length 2896
18:04:48.744745 IP 10.0.0.2.5001 > 10.0.0.1.42874: Flags [.], ack 298288, win 1007, options [nop,nop,TS val 28082222 ecr 28082180], length 0
18:04:48.750785 IP 10.0.0.1.42874 > 10.0.0.2.5001: Flags [.], seq 298288:301184, ack 1, win 58, options [nop,nop,TS val 28082181 ecr 28082180], length 2896
18:04:48.750802 IP 10.0.0.2.5001 > 10.0.0.1.42874: Flags [.], ack 301184, win 1007, options [nop,nop,TS val 28082224 ecr 28082181], length 0
18:04:48.756841 IP 10.0.0.1.42874 > 10.0.0.2.5001: Flags [.], seq 301184:304080, ack 1, win 58, options [nop,nop,TS val 28082182 ecr 28082181], length 2896
18:04:48.756857 IP 10.0.0.2.5001 > 10.0.0.1.42874: Flags [.], ack 304080, win 1007, options [nop,nop,TS val 28082225 ecr 28082182], length 0
18:04:48.762898 IP 10.0.0.1.42874 > 10.0.0.2.5001: Flags [.], seq 304080:306976, ack 1, win 58, options [nop,nop,TS val 28082183 ecr 28082182], length 2896
18:04:48.762915 IP 10.0.0.2.5001 > 10.0.0.1.42874: Flags [.], ack 306976, win 1007, options [nop,nop,TS val 28082227 ecr 28082183], length 0
18:04:48.768953 IP 10.0.0.1.42874 > 10.0.0.2.5001: Flags [.], seq 306976:309872, ack 1, win 58, options [nop,nop,TS val 28082184 ecr 28082183], length 2896
18:04:48.768970 IP 10.0.0.2.5001 > 10.0.0.1.42874: Flags [.], ack 309872, win 1007, options [nop,nop,TS val 28082228 ecr 28082184], length 0
18:04:48.775009 IP 10.0.0.1.42874 > 10.0.0.2.5001: Flags [.], seq 309872:312768, ack 1, win 58, options [nop,nop,TS val 28082185 ecr 28082184], length 2896
18:04:48.775026 IP 10.0.0.2.5001 > 10.0.0.1.42874: Flags [.], ack 312768, win 1007, options [nop,nop,TS val 28082230 ecr 28082185], length 0
18:04:48.781065 IP 10.0.0.1.42874 > 10.0.0.2.5001: Flags [.], seq 312768:315664, ack 1, win 58, options [nop,nop,TS val 28082186 ecr 28082185], length 2896
18:04:48.781081 IP 10.0.0.2.5001 > 10.0.0.1.42874: Flags [.], ack 315664, win 1007, options [nop,nop,TS val 28082231 ecr 28082186], length 0
18:04:48.787121 IP 10.0.0.1.42874 > 10.0.0.2.5001: Flags [.], seq 315664:318560, ack 1, win 58, options [nop,nop,TS val 28082187 ecr 28082186], length 2896
18:04:48.787138 IP 10.0.0.2.5001 > 10.0.0.1.42874: Flags [.], ack 318560, win 1007, options [nop,nop,TS val 28082233 ecr 28082187], length 0
18:04:48.793177 IP 10.0.0.1.42874 > 10.0.0.2.5001: Flags [P.], seq 318560:321456, ack 1, win 58, options [nop,nop,TS val 28082188 ecr 28082187], length 2896
18:04:48.793192 IP 10.0.0.2.5001 > 10.0.0.1.42874: Flags [.], ack 321456, win 1007, options [nop,nop,TS val 28082234 ecr 28082188], length 0
18:04:48.799233 IP 10.0.0.1.42874 > 10.0.0.2.5001: Flags [.], seq 321456:324352, ack 1, win 58, options [nop,nop,TS val 28082189 ecr 28082188], length 2896
18:04:48.799250 IP 10.0.0.2.5001 > 10.0.0.1.42874: Flags [.], ack 324352, win 1007, options [nop,nop,TS val 28082236 ecr 28082189], length 0
18:04:48.805289 IP 10.0.0.1.42874 > 10.0.0.2.5001: Flags [.], seq 324352:327248, ack 1, win 58, options [nop,nop,TS val 28082190 ecr 28082189], length 2896
18:04:48.805305 IP 10.0.0.2.5001 > 10.0.0.1.42874: Flags [.], ack 327248, win 1007, options [nop,nop,TS val 28082237 ecr 28082190], length 0
18:04:48.811345 IP 10.0.0.1.42874 > 10.0.0.2.5001: Flags [.], seq 327248:330144, ack 1, win 58, options [nop,nop,TS val 28082191 ecr 28082190], length 2896
18:04:48.811362 IP 10.0.0.2.5001 > 10.0.0.1.42874: Flags [.], ack 330144, win 1007, options [nop,nop,TS val 28082239 ecr 28082191], length 0
18:04:48.817401 IP 10.0.0.1.42874 > 10.0.0.2.5001: Flags [.], seq 330144:333040, ack 1, win 58, options [nop,nop,TS val 28082192 ecr 28082191], length 2896
18:04:48.817417 IP 10.0.0.2.5001 > 10.0.0.1.42874: Flags [.], ack 333040, win 1007, options [nop,nop,TS val 28082241 ecr 28082192], length 0
18:04:48.823457 IP 10.0.0.1.42874 > 10.0.0.2.5001: Flags [.], seq 333040:335936, ack 1, win 58, options [nop,nop,TS val 28082193 ecr 28082192], length 2896
18:04:48.823473 IP 10.0.0.2.5001 > 10.0.0.1.42874: Flags [.], ack 335936, win 1007, options [nop,nop,TS val 28082242 ecr 28082193], length 0
18:04:48.829513 IP 10.0.0.1.42874 > 10.0.0.2.5001: Flags [.], seq 335936:338832, ack 1, win 58, options [nop,nop,TS val 28082194 ecr 28082193], length 2896
18:04:48.829693 IP 10.0.0.2.5001 > 10.0.0.1.42874: Flags [.], ack 338832, win 1007, options [nop,nop,TS val 28082244 ecr 28082194], length 0
18:04:48.835572 IP 10.0.0.1.42874 > 10.0.0.2.5001: Flags [.], seq 338832:341728, ack 1, win 58, options [nop,nop,TS val 28082195 ecr 28082194], length 2896
18:04:48.835608 IP 10.0.0.2.5001 > 10.0.0.1.42874: Flags [.], ack 341728, win 1007, options [nop,nop,TS val 28082245 ecr 28082195], length 0
18:04:48.843644 IP 10.0.0.1.42874 > 10.0.0.2.5001: Flags [.], seq 341728:344624, ack 1, win 58, options [nop,nop,TS val 28082196 ecr 28082195], length 2896
18:04:48.843662 IP 10.0.0.2.5001 > 10.0.0.1.42874: Flags [.], ack 344624, win 1007, options [nop,nop,TS val 28082247 ecr 28082196], length 0
18:04:48.851719 IP 10.0.0.1.42874 > 10.0.0.2.5001: Flags [.], seq 344624:347520, ack 1, win 58, options [nop,nop,TS val 28082198 ecr 28082197], length 2896
18:04:48.851739 IP 10.0.0.2.5001 > 10.0.0.1.42874: Flags [.], ack 347520, win 1007, options [nop,nop,TS val 28082249 ecr 28082198], length 0
18:04:48.859794 IP 10.0.0.1.42874 > 10.0.0.2.5001: Flags [.], seq 347520:350416, ack 1, win 58, options [nop,nop,TS val 28082199 ecr 28082198], length 2896
18:04:48.859811 IP 10.0.0.2.5001 > 10.0.0.1.42874: Flags [.], ack 350416, win 1007, options [nop,nop,TS val 28082251 ecr 28082199], length 0
18:04:48.867868 IP 10.0.0.1.42874 > 10.0.0.2.5001: Flags [.], seq 350416:353312, ack 1, win 58, options [nop,nop,TS val 28082200 ecr 28082199], length 2896
18:04:48.868351 IP 10.0.0.2.5001 > 10.0.0.1.42874: Flags [.], ack 353312, win 1007, options [nop,nop,TS val 28082253 ecr 28082200], length 0
18:04:48.875943 IP 10.0.0.1.42874 > 10.0.0.2.5001: Flags [.], seq 353312:356208, ack 1, win 58, options [nop,nop,TS val 28082201 ecr 28082200], length 2896
18:04:48.875959 IP 10.0.0.2.5001 > 10.0.0.1.42874: Flags [.], ack 356208, win 1007, options [nop,nop,TS val 28082255 ecr 28082201], length 0
18:04:48.884017 IP 10.0.0.1.42874 > 10.0.0.2.5001: Flags [.], seq 356208:359104, ack 1, win 58, options [nop,nop,TS val 28082202 ecr 28082201], length 2896
18:04:48.884034 IP 10.0.0.2.5001 > 10.0.0.1.42874: Flags [.], ack 359104, win 1007, options [nop,nop,TS val 28082257 ecr 28082202], length 0
18:04:48.892092 IP 10.0.0.1.42874 > 10.0.0.2.5001: Flags [.], seq 359104:362000, ack 1, win 58, options [nop,nop,TS val 28082204 ecr 28082202], length 2896
18:04:48.892109 IP 10.0.0.2.5001 > 10.0.0.1.42874: Flags [.], ack 362000, win 1007, options [nop,nop,TS val 28082259 ecr 28082204], length 0
18:04:48.900166 IP 10.0.0.1.42874 > 10.0.0.2.5001: Flags [.], seq 362000:364896, ack 1, win 58, options [nop,nop,TS val 28082205 ecr 28082204], length 2896
18:04:48.900182 IP 10.0.0.2.5001 > 10.0.0.1.42874: Flags [.], ack 364896, win 1007, options [nop,nop,TS val 28082261 ecr 28082205], length 0
18:04:48.908241 IP 10.0.0.1.42874 > 10.0.0.2.5001: Flags [.], seq 364896:367792, ack 1, win 58, options [nop,nop,TS val 28082206 ecr 28082205], length 2896
18:04:48.908262 IP 10.0.0.2.5001 > 10.0.0.1.42874: Flags [.], ack 367792, win 1007, options [nop,nop,TS val 28082263 ecr 28082206], length 0
18:04:48.916316 IP 10.0.0.1.42874 > 10.0.0.2.5001: Flags [.], seq 367792:370688, ack 1, win 58, options [nop,nop,TS val 28082207 ecr 28082206], length 2896
18:04:48.916335 IP 10.0.0.2.5001 > 10.0.0.1.42874: Flags [.], ack 370688, win 1007, options [nop,nop,TS val 28082265 ecr 28082207], length 0
18:04:48.924395 IP 10.0.0.1.42874 > 10.0.0.2.5001: Flags [.], seq 370688:373584, ack 1, win 58, options [nop,nop,TS val 28082208 ecr 28082207], length 2896
18:04:48.924431 IP 10.0.0.2.5001 > 10.0.0.1.42874: Flags [.], ack 373584, win 1007, options [nop,nop,TS val 28082267 ecr 28082208], length 0
18:04:48.932469 IP 10.0.0.1.42874 > 10.0.0.2.5001: Flags [.], seq 373584:376480, ack 1, win 58, options [nop,nop,TS val 28082210 ecr 28082208], length 2896
18:04:48.932500 IP 10.0.0.2.5001 > 10.0.0.1.42874: Flags [.], ack 376480, win 1007, options [nop,nop,TS val 28082269 ecr 28082210], length 0
18:04:48.940544 IP 10.0.0.1.42874 > 10.0.0.2.5001: Flags [.], seq 376480:379376, ack 1, win 58, options [nop,nop,TS val 28082211 ecr 28082210], length 2896
18:04:48.940582 IP 10.0.0.2.5001 > 10.0.0.1.42874: Flags [.], ack 379376, win 1007, options [nop,nop,TS val 28082271 ecr 28082211], length 0
18:04:48.952655 IP 10.0.0.1.42874 > 10.0.0.2.5001: Flags [.], seq 379376:382272, ack 1, win 58, options [nop,nop,TS val 28082212 ecr 28082211], length 2896
18:04:48.952683 IP 10.0.0.2.5001 > 10.0.0.1.42874: Flags [.], ack 382272, win 1007, options [nop,nop,TS val 28082274 ecr 28082212], length 0
18:04:48.964764 IP 10.0.0.1.42874 > 10.0.0.2.5001: Flags [.], seq 382272:385168, ack 1, win 58, options [nop,nop,TS val 28082213 ecr 28082212], length 2896
18:04:48.964787 IP 10.0.0.2.5001 > 10.0.0.1.42874: Flags [.], ack 385168, win 1007, options [nop,nop,TS val 28082277 ecr 28082213], length 0
18:04:48.976876 IP 10.0.0.1.42874 > 10.0.0.2.5001: Flags [.], seq 385168:388064, ack 1, win 58, options [nop,nop,TS val 28082214 ecr 28082213], length 2896
18:04:48.976898 IP 10.0.0.2.5001 > 10.0.0.1.42874: Flags [.], ack 388064, win 1007, options [nop,nop,TS val 28082280 ecr 28082214], length 0
18:04:48.988988 IP 10.0.0.1.42874 > 10.0.0.2.5001: Flags [.], seq 388064:390960, ack 1, win 58, options [nop,nop,TS val 28082216 ecr 28082214], length 2896
18:04:48.989009 IP 10.0.0.2.5001 > 10.0.0.1.42874: Flags [.], ack 390960, win 1007, options [nop,nop,TS val 28082283 ecr 28082216], length 0
18:04:49.001100 IP 10.0.0.1.42874 > 10.0.0.2.5001: Flags [.], seq 390960:393856, ack 1, win 58, options [nop,nop,TS val 28082217 ecr 28082216], length 2896
18:04:49.001120 IP 10.0.0.2.5001 > 10.0.0.1.42874: Flags [.], ack 393856, win 1007, options [nop,nop,TS val 28082286 ecr 28082217], length 0
