tcpdump: verbose output suppressed, use -v or -vv for full protocol decode
listening on h1-eth0, link-type EN10MB (Ethernet), capture size 65535 bytes
18:00:43.315060 IP 10.0.0.1.42621 > 10.0.0.2.5001: Flags [.], seq 2018407598:2018410494, ack 646911753, win 58, options [nop,nop,TS val 28020843 ecr 28020842], length 2896
18:00:43.315085 IP 10.0.0.2.5001 > 10.0.0.1.42621: Flags [.], ack 2896, win 1041, options [nop,nop,TS val 28020865 ecr 28020843], length 0
18:00:43.317482 IP 10.0.0.1.42621 > 10.0.0.2.5001: Flags [.], seq 2896:5792, ack 1, win 58, options [nop,nop,TS val 28020843 ecr 28020843], length 2896
18:00:43.317498 IP 10.0.0.2.5001 > 10.0.0.1.42621: Flags [.], ack 5792, win 1041, options [nop,nop,TS val 28020866 ecr 28020843], length 0
18:00:43.319904 IP 10.0.0.1.42621 > 10.0.0.2.5001: Flags [.], seq 5792:8688, ack 1, win 58, options [nop,nop,TS val 28020844 ecr 28020843], length 2896
18:00:43.319921 IP 10.0.0.2.5001 > 10.0.0.1.42621: Flags [.], ack 8688, win 1041, options [nop,nop,TS val 28020866 ecr 28020844], length 0
18:00:43.322327 IP 10.0.0.1.42621 > 10.0.0.2.5001: Flags [.], seq 8688:11584, ack 1, win 58, options [nop,nop,TS val 28020844 ecr 28020844], length 2896
18:00:43.322343 IP 10.0.0.2.5001 > 10.0.0.1.42621: Flags [.], ack 11584, win 1041, options [nop,nop,TS val 28020867 ecr 28020844], length 0
18:00:43.324749 IP 10.0.0.1.42621 > 10.0.0.2.5001: Flags [.], seq 11584:14480, ack 1, win 58, options [nop,nop,TS val 28020845 ecr 28020844], length 2896
18:00:43.324770 IP 10.0.0.2.5001 > 10.0.0.1.42621: Flags [.], ack 14480, win 1041, options [nop,nop,TS val 28020867 ecr 28020845], length 0
18:00:43.327171 IP 10.0.0.1.42621 > 10.0.0.2.5001: Flags [P.], seq 14480:17376, ack 1, win 58, options [nop,nop,TS val 28020846 ecr 28020845], length 2896
18:00:43.327191 IP 10.0.0.2.5001 > 10.0.0.1.42621: Flags [.], ack 17376, win 1041, options [nop,nop,TS val 28020868 ecr 28020846], length 0
18:00:43.329595 IP 10.0.0.1.42621 > 10.0.0.2.5001: Flags [.], seq 17376:20272, ack 1, win 58, options [nop,nop,TS val 28020846 ecr 28020846], length 2896
18:00:43.329616 IP 10.0.0.2.5001 > 10.0.0.1.42621: Flags [.], ack 20272, win 1041, options [nop,nop,TS val 28020869 ecr 28020846], length 0
18:00:43.332016 IP 10.0.0.1.42621 > 10.0.0.2.5001: Flags [.], seq 20272:23168, ack 1, win 58, options [nop,nop,TS val 28020847 ecr 28020846], length 2896
18:00:43.332035 IP 10.0.0.2.5001 > 10.0.0.1.42621: Flags [.], ack 23168, win 1041, options [nop,nop,TS val 28020869 ecr 28020847], length 0
18:00:43.334438 IP 10.0.0.1.42621 > 10.0.0.2.5001: Flags [.], seq 23168:26064, ack 1, win 58, options [nop,nop,TS val 28020847 ecr 28020847], length 2896
18:00:43.334455 IP 10.0.0.2.5001 > 10.0.0.1.42621: Flags [.], ack 26064, win 1041, options [nop,nop,TS val 28020870 ecr 28020847], length 0
18:00:43.336861 IP 10.0.0.1.42621 > 10.0.0.2.5001: Flags [.], seq 26064:28960, ack 1, win 58, options [nop,nop,TS val 28020848 ecr 28020847], length 2896
18:00:43.336876 IP 10.0.0.2.5001 > 10.0.0.1.42621: Flags [.], ack 28960, win 1041, options [nop,nop,TS val 28020870 ecr 28020848], length 0
18:00:43.339283 IP 10.0.0.1.42621 > 10.0.0.2.5001: Flags [.], seq 28960:31856, ack 1, win 58, options [nop,nop,TS val 28020849 ecr 28020848], length 2896
18:00:43.339299 IP 10.0.0.2.5001 > 10.0.0.1.42621: Flags [.], ack 31856, win 1041, options [nop,nop,TS val 28020871 ecr 28020849], length 0
18:00:43.341705 IP 10.0.0.1.42621 > 10.0.0.2.5001: Flags [.], seq 31856:34752, ack 1, win 58, options [nop,nop,TS val 28020849 ecr 28020849], length 2896
18:00:43.341721 IP 10.0.0.2.5001 > 10.0.0.1.42621: Flags [.], ack 34752, win 1041, options [nop,nop,TS val 28020872 ecr 28020849], length 0
18:00:43.344128 IP 10.0.0.1.42621 > 10.0.0.2.5001: Flags [.], seq 34752:37648, ack 1, win 58, options [nop,nop,TS val 28020850 ecr 28020849], length 2896
18:00:43.344143 IP 10.0.0.2.5001 > 10.0.0.1.42621: Flags [.], ack 37648, win 1041, options [nop,nop,TS val 28020872 ecr 28020850], length 0
18:00:43.346550 IP 10.0.0.1.42621 > 10.0.0.2.5001: Flags [.], seq 37648:40544, ack 1, win 58, options [nop,nop,TS val 28020850 ecr 28020850], length 2896
18:00:43.346566 IP 10.0.0.2.5001 > 10.0.0.1.42621: Flags [.], ack 40544, win 1041, options [nop,nop,TS val 28020873 ecr 28020850], length 0
18:00:43.348973 IP 10.0.0.1.42621 > 10.0.0.2.5001: Flags [.], seq 40544:43440, ack 1, win 58, options [nop,nop,TS val 28020851 ecr 28020850], length 2896
18:00:43.348992 IP 10.0.0.2.5001 > 10.0.0.1.42621: Flags [.], ack 43440, win 1041, options [nop,nop,TS val 28020873 ecr 28020851], length 0
18:00:43.351395 IP 10.0.0.1.42621 > 10.0.0.2.5001: Flags [.], seq 43440:46336, ack 1, win 58, options [nop,nop,TS val 28020852 ecr 28020851], length 2896
18:00:43.351413 IP 10.0.0.2.5001 > 10.0.0.1.42621: Flags [.], ack 46336, win 1041, options [nop,nop,TS val 28020874 ecr 28020852], length 0
18:00:43.353818 IP 10.0.0.1.42621 > 10.0.0.2.5001: Flags [.], seq 46336:49232, ack 1, win 58, options [nop,nop,TS val 28020852 ecr 28020852], length 2896
18:00:43.353834 IP 10.0.0.2.5001 > 10.0.0.1.42621: Flags [.], ack 49232, win 1041, options [nop,nop,TS val 28020875 ecr 28020852], length 0
18:00:43.356244 IP 10.0.0.1.42621 > 10.0.0.2.5001: Flags [.], seq 49232:52128, ack 1, win 58, options [nop,nop,TS val 28020853 ecr 28020852], length 2896
18:00:43.356277 IP 10.0.0.2.5001 > 10.0.0.1.42621: Flags [.], ack 52128, win 1041, options [nop,nop,TS val 28020875 ecr 28020853], length 0
18:00:43.358676 IP 10.0.0.1.42621 > 10.0.0.2.5001: Flags [.], seq 52128:55024, ack 1, win 58, options [nop,nop,TS val 28020853 ecr 28020853], length 2896
18:00:43.358709 IP 10.0.0.2.5001 > 10.0.0.1.42621: Flags [.], ack 55024, win 1041, options [nop,nop,TS val 28020876 ecr 28020853], length 0
18:00:43.361088 IP 10.0.0.1.42621 > 10.0.0.2.5001: Flags [.], seq 55024:57920, ack 1, win 58, options [nop,nop,TS val 28020854 ecr 28020853], length 2896
18:00:43.361121 IP 10.0.0.2.5001 > 10.0.0.1.42621: Flags [.], ack 57920, win 1041, options [nop,nop,TS val 28020876 ecr 28020854], length 0
18:00:43.363777 IP 10.0.0.1.42621 > 10.0.0.2.5001: Flags [.], seq 57920:60816, ack 1, win 58, options [nop,nop,TS val 28020855 ecr 28020854], length 2896
18:00:43.363796 IP 10.0.0.2.5001 > 10.0.0.1.42621: Flags [.], ack 60816, win 1041, options [nop,nop,TS val 28020877 ecr 28020855], length 0
18:00:43.366468 IP 10.0.0.1.42621 > 10.0.0.2.5001: Flags [.], seq 60816:63712, ack 1, win 58, options [nop,nop,TS val 28020855 ecr 28020855], length 2896
18:00:43.366487 IP 10.0.0.2.5001 > 10.0.0.1.42621: Flags [.], ack 63712, win 1041, options [nop,nop,TS val 28020878 ecr 28020855], length 0
18:00:43.369160 IP 10.0.0.1.42621 > 10.0.0.2.5001: Flags [.], seq 63712:66608, ack 1, win 58, options [nop,nop,TS val 28020856 ecr 28020855], length 2896
18:00:43.369180 IP 10.0.0.2.5001 > 10.0.0.1.42621: Flags [.], ack 66608, win 1041, options [nop,nop,TS val 28020878 ecr 28020856], length 0
18:00:43.371852 IP 10.0.0.1.42621 > 10.0.0.2.5001: Flags [.], seq 66608:69504, ack 1, win 58, options [nop,nop,TS val 28020856 ecr 28020856], length 2896
18:00:43.371871 IP 10.0.0.2.5001 > 10.0.0.1.42621: Flags [.], ack 69504, win 1041, options [nop,nop,TS val 28020879 ecr 28020856], length 0
18:00:43.374543 IP 10.0.0.1.42621 > 10.0.0.2.5001: Flags [.], seq 69504:72400, ack 1, win 58, options [nop,nop,TS val 28020857 ecr 28020856], length 2896
18:00:43.374561 IP 10.0.0.2.5001 > 10.0.0.1.42621: Flags [.], ack 72400, win 1041, options [nop,nop,TS val 28020880 ecr 28020857], length 0
18:00:43.377234 IP 10.0.0.1.42621 > 10.0.0.2.5001: Flags [.], seq 72400:75296, ack 1, win 58, options [nop,nop,TS val 28020858 ecr 28020857], length 2896
18:00:43.377252 IP 10.0.0.2.5001 > 10.0.0.1.42621: Flags [.], ack 75296, win 1041, options [nop,nop,TS val 28020880 ecr 28020858], length 0
18:00:43.379932 IP 10.0.0.1.42621 > 10.0.0.2.5001: Flags [.], seq 75296:78192, ack 1, win 58, options [nop,nop,TS val 28020858 ecr 28020858], length 2896
18:00:43.380450 IP 10.0.0.2.5001 > 10.0.0.1.42621: Flags [.], ack 78192, win 1041, options [nop,nop,TS val 28020881 ecr 28020858], length 0
18:00:43.382622 IP 10.0.0.1.42621 > 10.0.0.2.5001: Flags [.], seq 78192:81088, ack 1, win 58, options [nop,nop,TS val 28020859 ecr 28020858], length 2896
18:00:43.382659 IP 10.0.0.2.5001 > 10.0.0.1.42621: Flags [.], ack 81088, win 1041, options [nop,nop,TS val 28020882 ecr 28020859], length 0
18:00:43.385314 IP 10.0.0.1.42621 > 10.0.0.2.5001: Flags [.], seq 81088:83984, ack 1, win 58, options [nop,nop,TS val 28020859 ecr 28020859], length 2896
18:00:43.385374 IP 10.0.0.2.5001 > 10.0.0.1.42621: Flags [.], ack 83984, win 1041, options [nop,nop,TS val 28020883 ecr 28020859], length 0
18:00:43.388003 IP 10.0.0.1.42621 > 10.0.0.2.5001: Flags [.], seq 83984:86880, ack 1, win 58, options [nop,nop,TS val 28020860 ecr 28020859], length 2896
18:00:43.388028 IP 10.0.0.2.5001 > 10.0.0.1.42621: Flags [.], ack 86880, win 1041, options [nop,nop,TS val 28020883 ecr 28020860], length 0
18:00:43.390693 IP 10.0.0.1.42621 > 10.0.0.2.5001: Flags [.], seq 86880:89776, ack 1, win 58, options [nop,nop,TS val 28020861 ecr 28020860], length 2896
18:00:43.390710 IP 10.0.0.2.5001 > 10.0.0.1.42621: Flags [.], ack 89776, win 1041, options [nop,nop,TS val 28020884 ecr 28020861], length 0
18:00:43.393385 IP 10.0.0.1.42621 > 10.0.0.2.5001: Flags [.], seq 89776:92672, ack 1, win 58, options [nop,nop,TS val 28020861 ecr 28020861], length 2896
18:00:43.393414 IP 10.0.0.2.5001 > 10.0.0.1.42621: Flags [.], ack 92672, win 1041, options [nop,nop,TS val 28020885 ecr 28020861], length 0
18:00:43.396080 IP 10.0.0.1.42621 > 10.0.0.2.5001: Flags [.], seq 92672:95568, ack 1, win 58, options [nop,nop,TS val 28020862 ecr 28020861], length 2896
18:00:43.396112 IP 10.0.0.2.5001 > 10.0.0.1.42621: Flags [.], ack 95568, win 1041, options [nop,nop,TS val 28020885 ecr 28020862], length 0
18:00:43.398767 IP 10.0.0.1.42621 > 10.0.0.2.5001: Flags [.], seq 95568:98464, ack 1, win 58, options [nop,nop,TS val 28020863 ecr 28020862], length 2896
18:00:43.398785 IP 10.0.0.2.5001 > 10.0.0.1.42621: Flags [.], ack 98464, win 1041, options [nop,nop,TS val 28020886 ecr 28020863], length 0
18:00:43.401459 IP 10.0.0.1.42621 > 10.0.0.2.5001: Flags [.], seq 98464:101360, ack 1, win 58, options [nop,nop,TS val 28020863 ecr 28020863], length 2896
18:00:43.401480 IP 10.0.0.2.5001 > 10.0.0.1.42621: Flags [.], ack 101360, win 1041, options [nop,nop,TS val 28020887 ecr 28020863], length 0
18:00:43.404150 IP 10.0.0.1.42621 > 10.0.0.2.5001: Flags [.], seq 101360:104256, ack 1, win 58, options [nop,nop,TS val 28020864 ecr 28020863], length 2896
18:00:43.404167 IP 10.0.0.2.5001 > 10.0.0.1.42621: Flags [.], ack 104256, win 1041, options [nop,nop,TS val 28020887 ecr 28020864], length 0
18:00:43.406842 IP 10.0.0.1.42621 > 10.0.0.2.5001: Flags [.], seq 104256:107152, ack 1, win 58, options [nop,nop,TS val 28020864 ecr 28020864], length 2896
18:00:43.406859 IP 10.0.0.2.5001 > 10.0.0.1.42621: Flags [.], ack 107152, win 1041, options [nop,nop,TS val 28020888 ecr 28020864], length 0
18:00:43.409533 IP 10.0.0.1.42621 > 10.0.0.2.5001: Flags [.], seq 107152:110048, ack 1, win 58, options [nop,nop,TS val 28020865 ecr 28020864], length 2896
18:00:43.409553 IP 10.0.0.2.5001 > 10.0.0.1.42621: Flags [.], ack 110048, win 1041, options [nop,nop,TS val 28020889 ecr 28020865], length 0
18:00:43.412225 IP 10.0.0.1.42621 > 10.0.0.2.5001: Flags [.], seq 110048:112944, ack 1, win 58, options [nop,nop,TS val 28020866 ecr 28020865], length 2896
18:00:43.412245 IP 10.0.0.2.5001 > 10.0.0.1.42621: Flags [.], ack 112944, win 1041, options [nop,nop,TS val 28020889 ecr 28020866], length 0
18:00:43.414916 IP 10.0.0.1.42621 > 10.0.0.2.5001: Flags [.], seq 112944:115840, ack 1, win 58, options [nop,nop,TS val 28020866 ecr 28020866], length 2896
18:00:43.414935 IP 10.0.0.2.5001 > 10.0.0.1.42621: Flags [.], ack 115840, win 1041, options [nop,nop,TS val 28020890 ecr 28020866], length 0
18:00:43.417608 IP 10.0.0.1.42621 > 10.0.0.2.5001: Flags [.], seq 115840:118736, ack 1, win 58, options [nop,nop,TS val 28020867 ecr 28020866], length 2896
18:00:43.418741 IP 10.0.0.2.5001 > 10.0.0.1.42621: Flags [.], ack 118736, win 1041, options [nop,nop,TS val 28020891 ecr 28020867], length 0
18:00:43.420301 IP 10.0.0.1.42621 > 10.0.0.2.5001: Flags [.], seq 118736:121632, ack 1, win 58, options [nop,nop,TS val 28020867 ecr 28020867], length 2896
18:00:43.420318 IP 10.0.0.2.5001 > 10.0.0.1.42621: Flags [.], ack 121632, win 1041, options [nop,nop,TS val 28020891 ecr 28020867], length 0
18:00:43.422991 IP 10.0.0.1.42621 > 10.0.0.2.5001: Flags [.], seq 121632:124528, ack 1, win 58, options [nop,nop,TS val 28020868 ecr 28020867], length 2896
18:00:43.423007 IP 10.0.0.2.5001 > 10.0.0.1.42621: Flags [.], ack 124528, win 1041, options [nop,nop,TS val 28020892 ecr 28020868], length 0
18:00:43.425688 IP 10.0.0.1.42621 > 10.0.0.2.5001: Flags [.], seq 124528:127424, ack 1, win 58, options [nop,nop,TS val 28020869 ecr 28020868], length 2896
18:00:43.425704 IP 10.0.0.2.5001 > 10.0.0.1.42621: Flags [.], ack 127424, win 1041, options [nop,nop,TS val 28020893 ecr 28020869], length 0
18:00:43.428374 IP 10.0.0.1.42621 > 10.0.0.2.5001: Flags [.], seq 127424:130320, ack 1, win 58, options [nop,nop,TS val 28020869 ecr 28020869], length 2896
18:00:43.428388 IP 10.0.0.2.5001 > 10.0.0.1.42621: Flags [.], ack 130320, win 1041, options [nop,nop,TS val 28020893 ecr 28020869], length 0
18:00:43.431066 IP 10.0.0.1.42621 > 10.0.0.2.5001: Flags [.], seq 130320:133216, ack 1, win 58, options [nop,nop,TS val 28020870 ecr 28020869], length 2896
18:00:43.431082 IP 10.0.0.2.5001 > 10.0.0.1.42621: Flags [.], ack 133216, win 1041, options [nop,nop,TS val 28020894 ecr 28020870], length 0
18:00:43.433757 IP 10.0.0.1.42621 > 10.0.0.2.5001: Flags [.], seq 133216:136112, ack 1, win 58, options [nop,nop,TS val 28020870 ecr 28020870], length 2896
18:00:43.433772 IP 10.0.0.2.5001 > 10.0.0.1.42621: Flags [.], ack 136112, win 1041, options [nop,nop,TS val 28020895 ecr 28020870], length 0
18:00:43.436449 IP 10.0.0.1.42621 > 10.0.0.2.5001: Flags [.], seq 136112:139008, ack 1, win 58, options [nop,nop,TS val 28020871 ecr 28020870], length 2896
18:00:43.436464 IP 10.0.0.2.5001 > 10.0.0.1.42621: Flags [.], ack 139008, win 1041, options [nop,nop,TS val 28020895 ecr 28020871], length 0
18:00:43.439140 IP 10.0.0.1.42621 > 10.0.0.2.5001: Flags [.], seq 139008:141904, ack 1, win 58, options [nop,nop,TS val 28020872 ecr 28020871], length 2896
18:00:43.439154 IP 10.0.0.2.5001 > 10.0.0.1.42621: Flags [.], ack 141904, win 1041, options [nop,nop,TS val 28020896 ecr 28020872], length 0
18:00:43.441832 IP 10.0.0.1.42621 > 10.0.0.2.5001: Flags [.], seq 141904:144800, ack 1, win 58, options [nop,nop,TS val 28020872 ecr 28020872], length 2896
18:00:43.441850 IP 10.0.0.2.5001 > 10.0.0.1.42621: Flags [.], ack 144800, win 1041, options [nop,nop,TS val 28020897 ecr 28020872], length 0
18:00:43.444524 IP 10.0.0.1.42621 > 10.0.0.2.5001: Flags [.], seq 144800:147696, ack 1, win 58, options [nop,nop,TS val 28020873 ecr 28020872], length 2896
18:00:43.444540 IP 10.0.0.2.5001 > 10.0.0.1.42621: Flags [.], ack 147696, win 1041, options [nop,nop,TS val 28020897 ecr 28020873], length 0
18:00:43.447216 IP 10.0.0.1.42621 > 10.0.0.2.5001: Flags [.], seq 147696:150592, ack 1, win 58, options [nop,nop,TS val 28020873 ecr 28020873], length 2896
18:00:43.447232 IP 10.0.0.2.5001 > 10.0.0.1.42621: Flags [.], ack 150592, win 1041, options [nop,nop,TS val 28020898 ecr 28020873], length 0
18:00:43.449906 IP 10.0.0.1.42621 > 10.0.0.2.5001: Flags [.], seq 150592:153488, ack 1, win 58, options [nop,nop,TS val 28020874 ecr 28020873], length 2896
18:00:43.449926 IP 10.0.0.2.5001 > 10.0.0.1.42621: Flags [.], ack 153488, win 1041, options [nop,nop,TS val 28020899 ecr 28020874], length 0
18:00:43.452598 IP 10.0.0.1.42621 > 10.0.0.2.5001: Flags [.], seq 153488:156384, ack 1, win 58, options [nop,nop,TS val 28020875 ecr 28020874], length 2896
18:00:43.452613 IP 10.0.0.2.5001 > 10.0.0.1.42621: Flags [.], ack 156384, win 1041, options [nop,nop,TS val 28020899 ecr 28020875], length 0
18:00:43.455290 IP 10.0.0.1.42621 > 10.0.0.2.5001: Flags [.], seq 156384:159280, ack 1, win 58, options [nop,nop,TS val 28020875 ecr 28020875], length 2896
18:00:43.455304 IP 10.0.0.2.5001 > 10.0.0.1.42621: Flags [.], ack 159280, win 1041, options [nop,nop,TS val 28020900 ecr 28020875], length 0
18:00:43.457981 IP 10.0.0.1.42621 > 10.0.0.2.5001: Flags [.], seq 159280:162176, ack 1, win 58, options [nop,nop,TS val 28020876 ecr 28020875], length 2896
18:00:43.457995 IP 10.0.0.2.5001 > 10.0.0.1.42621: Flags [.], ack 162176, win 1041, options [nop,nop,TS val 28020901 ecr 28020876], length 0
18:00:43.460673 IP 10.0.0.1.42621 > 10.0.0.2.5001: Flags [P.], seq 162176:165072, ack 1, win 58, options [nop,nop,TS val 28020876 ecr 28020876], length 2896
18:00:43.460689 IP 10.0.0.2.5001 > 10.0.0.1.42621: Flags [.], ack 165072, win 1041, options [nop,nop,TS val 28020901 ecr 28020876], length 0
18:00:43.463365 IP 10.0.0.1.42621 > 10.0.0.2.5001: Flags [.], seq 165072:167968, ack 1, win 58, options [nop,nop,TS val 28020877 ecr 28020876], length 2896
18:00:43.463380 IP 10.0.0.2.5001 > 10.0.0.1.42621: Flags [.], ack 167968, win 1041, options [nop,nop,TS val 28020902 ecr 28020877], length 0
18:00:43.466056 IP 10.0.0.1.42621 > 10.0.0.2.5001: Flags [.], seq 167968:170864, ack 1, win 58, options [nop,nop,TS val 28020878 ecr 28020877], length 2896
18:00:43.466071 IP 10.0.0.2.5001 > 10.0.0.1.42621: Flags [.], ack 170864, win 1041, options [nop,nop,TS val 28020903 ecr 28020878], length 0
18:00:43.468747 IP 10.0.0.1.42621 > 10.0.0.2.5001: Flags [.], seq 170864:173760, ack 1, win 58, options [nop,nop,TS val 28020878 ecr 28020878], length 2896
18:00:43.468762 IP 10.0.0.2.5001 > 10.0.0.1.42621: Flags [.], ack 173760, win 1041, options [nop,nop,TS val 28020903 ecr 28020878], length 0
18:00:43.471439 IP 10.0.0.1.42621 > 10.0.0.2.5001: Flags [.], seq 173760:176656, ack 1, win 58, options [nop,nop,TS val 28020879 ecr 28020878], length 2896
18:00:43.471455 IP 10.0.0.2.5001 > 10.0.0.1.42621: Flags [.], ack 176656, win 1041, options [nop,nop,TS val 28020904 ecr 28020879], length 0
18:00:43.474131 IP 10.0.0.1.42621 > 10.0.0.2.5001: Flags [.], seq 176656:179552, ack 1, win 58, options [nop,nop,TS val 28020880 ecr 28020879], length 2896
18:00:43.474145 IP 10.0.0.2.5001 > 10.0.0.1.42621: Flags [.], ack 179552, win 1041, options [nop,nop,TS val 28020905 ecr 28020880], length 0
18:00:43.476822 IP 10.0.0.1.42621 > 10.0.0.2.5001: Flags [.], seq 179552:182448, ack 1, win 58, options [nop,nop,TS val 28020880 ecr 28020880], length 2896
18:00:43.476836 IP 10.0.0.2.5001 > 10.0.0.1.42621: Flags [.], ack 182448, win 1041, options [nop,nop,TS val 28020905 ecr 28020880], length 0
18:00:43.479514 IP 10.0.0.1.42621 > 10.0.0.2.5001: Flags [.], seq 182448:185344, ack 1, win 58, options [nop,nop,TS val 28020881 ecr 28020880], length 2896
18:00:43.479528 IP 10.0.0.2.5001 > 10.0.0.1.42621: Flags [.], ack 185344, win 1041, options [nop,nop,TS val 28020906 ecr 28020881], length 0
18:00:43.482206 IP 10.0.0.1.42621 > 10.0.0.2.5001: Flags [.], seq 185344:188240, ack 1, win 58, options [nop,nop,TS val 28020882 ecr 28020881], length 2896
18:00:43.482224 IP 10.0.0.2.5001 > 10.0.0.1.42621: Flags [.], ack 188240, win 1041, options [nop,nop,TS val 28020907 ecr 28020882], length 0
18:00:43.484897 IP 10.0.0.1.42621 > 10.0.0.2.5001: Flags [.], seq 188240:191136, ack 1, win 58, options [nop,nop,TS val 28020883 ecr 28020882], length 2896
18:00:43.484912 IP 10.0.0.2.5001 > 10.0.0.1.42621: Flags [.], ack 191136, win 1041, options [nop,nop,TS val 28020907 ecr 28020883], length 0
18:00:43.487588 IP 10.0.0.1.42621 > 10.0.0.2.5001: Flags [.], seq 191136:194032, ack 1, win 58, options [nop,nop,TS val 28020883 ecr 28020883], length 2896
18:00:43.487603 IP 10.0.0.2.5001 > 10.0.0.1.42621: Flags [.], ack 194032, win 1041, options [nop,nop,TS val 28020908 ecr 28020883], length 0
18:00:43.490280 IP 10.0.0.1.42621 > 10.0.0.2.5001: Flags [.], seq 194032:196928, ack 1, win 58, options [nop,nop,TS val 28020884 ecr 28020883], length 2896
18:00:43.490300 IP 10.0.0.2.5001 > 10.0.0.1.42621: Flags [.], ack 196928, win 1041, options [nop,nop,TS val 28020909 ecr 28020884], length 0
18:00:43.492971 IP 10.0.0.1.42621 > 10.0.0.2.5001: Flags [.], seq 196928:199824, ack 1, win 58, options [nop,nop,TS val 28020885 ecr 28020884], length 2896
18:00:43.492991 IP 10.0.0.2.5001 > 10.0.0.1.42621: Flags [.], ack 199824, win 1041, options [nop,nop,TS val 28020909 ecr 28020885], length 0
18:00:43.495663 IP 10.0.0.1.42621 > 10.0.0.2.5001: Flags [.], seq 199824:202720, ack 1, win 58, options [nop,nop,TS val 28020885 ecr 28020885], length 2896
18:00:43.495681 IP 10.0.0.2.5001 > 10.0.0.1.42621: Flags [.], ack 202720, win 1041, options [nop,nop,TS val 28020910 ecr 28020885], length 0
18:00:43.498354 IP 10.0.0.1.42621 > 10.0.0.2.5001: Flags [.], seq 202720:205616, ack 1, win 58, options [nop,nop,TS val 28020886 ecr 28020885], length 2896
18:00:43.498372 IP 10.0.0.2.5001 > 10.0.0.1.42621: Flags [.], ack 205616, win 1041, options [nop,nop,TS val 28020911 ecr 28020886], length 0
18:00:43.501046 IP 10.0.0.1.42621 > 10.0.0.2.5001: Flags [.], seq 205616:208512, ack 1, win 58, options [nop,nop,TS val 28020887 ecr 28020886], length 2896
18:00:43.501064 IP 10.0.0.2.5001 > 10.0.0.1.42621: Flags [.], ack 208512, win 1041, options [nop,nop,TS val 28020911 ecr 28020887], length 0
18:00:43.503738 IP 10.0.0.1.42621 > 10.0.0.2.5001: Flags [.], seq 208512:211408, ack 1, win 58, options [nop,nop,TS val 28020887 ecr 28020887], length 2896
18:00:43.503755 IP 10.0.0.2.5001 > 10.0.0.1.42621: Flags [.], ack 211408, win 1041, options [nop,nop,TS val 28020912 ecr 28020887], length 0
18:00:43.506429 IP 10.0.0.1.42621 > 10.0.0.2.5001: Flags [.], seq 211408:214304, ack 1, win 58, options [nop,nop,TS val 28020888 ecr 28020887], length 2896
18:00:43.506447 IP 10.0.0.2.5001 > 10.0.0.1.42621: Flags [.], ack 214304, win 1041, options [nop,nop,TS val 28020913 ecr 28020888], length 0
18:00:43.509121 IP 10.0.0.1.42621 > 10.0.0.2.5001: Flags [.], seq 214304:217200, ack 1, win 58, options [nop,nop,TS val 28020889 ecr 28020888], length 2896
18:00:43.509138 IP 10.0.0.2.5001 > 10.0.0.1.42621: Flags [.], ack 217200, win 1041, options [nop,nop,TS val 28020913 ecr 28020889], length 0
18:00:43.511812 IP 10.0.0.1.42621 > 10.0.0.2.5001: Flags [.], seq 217200:220096, ack 1, win 58, options [nop,nop,TS val 28020889 ecr 28020889], length 2896
18:00:43.511830 IP 10.0.0.2.5001 > 10.0.0.1.42621: Flags [.], ack 220096, win 1041, options [nop,nop,TS val 28020914 ecr 28020889], length 0
18:00:43.514504 IP 10.0.0.1.42621 > 10.0.0.2.5001: Flags [.], seq 220096:222992, ack 1, win 58, options [nop,nop,TS val 28020890 ecr 28020889], length 2896
18:00:43.514522 IP 10.0.0.2.5001 > 10.0.0.1.42621: Flags [.], ack 222992, win 1041, options [nop,nop,TS val 28020915 ecr 28020890], length 0
18:00:43.517195 IP 10.0.0.1.42621 > 10.0.0.2.5001: Flags [.], seq 222992:225888, ack 1, win 58, options [nop,nop,TS val 28020891 ecr 28020890], length 2896
18:00:43.517212 IP 10.0.0.2.5001 > 10.0.0.1.42621: Flags [.], ack 225888, win 1041, options [nop,nop,TS val 28020915 ecr 28020891], length 0
18:00:43.519887 IP 10.0.0.1.42621 > 10.0.0.2.5001: Flags [.], seq 225888:228784, ack 1, win 58, options [nop,nop,TS val 28020891 ecr 28020891], length 2896
18:00:43.519904 IP 10.0.0.2.5001 > 10.0.0.1.42621: Flags [.], ack 228784, win 1041, options [nop,nop,TS val 28020916 ecr 28020891], length 0
18:00:43.522579 IP 10.0.0.1.42621 > 10.0.0.2.5001: Flags [.], seq 228784:231680, ack 1, win 58, options [nop,nop,TS val 28020892 ecr 28020891], length 2896
18:00:43.522600 IP 10.0.0.2.5001 > 10.0.0.1.42621: Flags [.], ack 231680, win 1041, options [nop,nop,TS val 28020917 ecr 28020892], length 0
18:00:43.525270 IP 10.0.0.1.42621 > 10.0.0.2.5001: Flags [.], seq 231680:234576, ack 1, win 58, options [nop,nop,TS val 28020893 ecr 28020892], length 2896
18:00:43.525344 IP 10.0.0.2.5001 > 10.0.0.1.42621: Flags [.], ack 234576, win 1041, options [nop,nop,TS val 28020918 ecr 28020893], length 0
18:00:43.527962 IP 10.0.0.1.42621 > 10.0.0.2.5001: Flags [.], seq 234576:237472, ack 1, win 58, options [nop,nop,TS val 28020893 ecr 28020893], length 2896
18:00:43.527979 IP 10.0.0.2.5001 > 10.0.0.1.42621: Flags [.], ack 237472, win 1041, options [nop,nop,TS val 28020918 ecr 28020893], length 0
18:00:43.530654 IP 10.0.0.1.42621 > 10.0.0.2.5001: Flags [.], seq 237472:240368, ack 1, win 58, options [nop,nop,TS val 28020894 ecr 28020893], length 2896
18:00:43.530673 IP 10.0.0.2.5001 > 10.0.0.1.42621: Flags [.], ack 240368, win 1041, options [nop,nop,TS val 28020919 ecr 28020894], length 0
18:00:43.533345 IP 10.0.0.1.42621 > 10.0.0.2.5001: Flags [.], seq 240368:243264, ack 1, win 58, options [nop,nop,TS val 28020895 ecr 28020894], length 2896
18:00:43.533363 IP 10.0.0.2.5001 > 10.0.0.1.42621: Flags [.], ack 243264, win 1041, options [nop,nop,TS val 28020920 ecr 28020895], length 0
18:00:43.536036 IP 10.0.0.1.42621 > 10.0.0.2.5001: Flags [.], seq 243264:246160, ack 1, win 58, options [nop,nop,TS val 28020895 ecr 28020895], length 2896
18:00:43.536053 IP 10.0.0.2.5001 > 10.0.0.1.42621: Flags [.], ack 246160, win 1041, options [nop,nop,TS val 28020920 ecr 28020895], length 0
18:00:43.538728 IP 10.0.0.1.42621 > 10.0.0.2.5001: Flags [.], seq 246160:249056, ack 1, win 58, options [nop,nop,TS val 28020896 ecr 28020895], length 2896
18:00:43.538746 IP 10.0.0.2.5001 > 10.0.0.1.42621: Flags [.], ack 249056, win 1041, options [nop,nop,TS val 28020921 ecr 28020896], length 0
18:00:43.541419 IP 10.0.0.1.42621 > 10.0.0.2.5001: Flags [.], seq 249056:251952, ack 1, win 58, options [nop,nop,TS val 28020897 ecr 28020896], length 2896
18:00:43.541436 IP 10.0.0.2.5001 > 10.0.0.1.42621: Flags [.], ack 251952, win 1041, options [nop,nop,TS val 28020922 ecr 28020897], length 0
18:00:43.544111 IP 10.0.0.1.42621 > 10.0.0.2.5001: Flags [.], seq 251952:254848, ack 1, win 58, options [nop,nop,TS val 28020897 ecr 28020897], length 2896
18:00:43.544129 IP 10.0.0.2.5001 > 10.0.0.1.42621: Flags [.], ack 254848, win 1041, options [nop,nop,TS val 28020922 ecr 28020897], length 0
18:00:43.546803 IP 10.0.0.1.42621 > 10.0.0.2.5001: Flags [.], seq 254848:257744, ack 1, win 58, options [nop,nop,TS val 28020898 ecr 28020897], length 2896
18:00:43.546819 IP 10.0.0.2.5001 > 10.0.0.1.42621: Flags [.], ack 257744, win 1041, options [nop,nop,TS val 28020923 ecr 28020898], length 0
18:00:43.549494 IP 10.0.0.1.42621 > 10.0.0.2.5001: Flags [.], seq 257744:260640, ack 1, win 58, options [nop,nop,TS val 28020899 ecr 28020898], length 2896
18:00:43.549511 IP 10.0.0.2.5001 > 10.0.0.1.42621: Flags [.], ack 260640, win 1041, options [nop,nop,TS val 28020924 ecr 28020899], length 0
18:00:43.552186 IP 10.0.0.1.42621 > 10.0.0.2.5001: Flags [.], seq 260640:263536, ack 1, win 58, options [nop,nop,TS val 28020899 ecr 28020899], length 2896
18:00:43.552203 IP 10.0.0.2.5001 > 10.0.0.1.42621: Flags [.], ack 263536, win 1041, options [nop,nop,TS val 28020924 ecr 28020899], length 0
18:00:43.554877 IP 10.0.0.1.42621 > 10.0.0.2.5001: Flags [.], seq 263536:266432, ack 1, win 58, options [nop,nop,TS val 28020900 ecr 28020899], length 2896
18:00:43.554895 IP 10.0.0.2.5001 > 10.0.0.1.42621: Flags [.], ack 266432, win 1041, options [nop,nop,TS val 28020925 ecr 28020900], length 0
18:00:43.557569 IP 10.0.0.1.42621 > 10.0.0.2.5001: Flags [.], seq 266432:269328, ack 1, win 58, options [nop,nop,TS val 28020901 ecr 28020900], length 2896
18:00:43.557586 IP 10.0.0.2.5001 > 10.0.0.1.42621: Flags [.], ack 269328, win 1041, options [nop,nop,TS val 28020926 ecr 28020901], length 0
18:00:43.560260 IP 10.0.0.1.42621 > 10.0.0.2.5001: Flags [.], seq 269328:272224, ack 1, win 58, options [nop,nop,TS val 28020901 ecr 28020901], length 2896
18:00:43.560277 IP 10.0.0.2.5001 > 10.0.0.1.42621: Flags [.], ack 272224, win 1041, options [nop,nop,TS val 28020926 ecr 28020901], length 0
18:00:43.562952 IP 10.0.0.1.42621 > 10.0.0.2.5001: Flags [.], seq 272224:275120, ack 1, win 58, options [nop,nop,TS val 28020902 ecr 28020901], length 2896
18:00:43.562973 IP 10.0.0.2.5001 > 10.0.0.1.42621: Flags [.], ack 275120, win 1041, options [nop,nop,TS val 28020927 ecr 28020902], length 0
18:00:43.565643 IP 10.0.0.1.42621 > 10.0.0.2.5001: Flags [.], seq 275120:278016, ack 1, win 58, options [nop,nop,TS val 28020903 ecr 28020902], length 2896
18:00:43.565661 IP 10.0.0.2.5001 > 10.0.0.1.42621: Flags [.], ack 278016, win 1041, options [nop,nop,TS val 28020928 ecr 28020903], length 0
18:00:43.568335 IP 10.0.0.1.42621 > 10.0.0.2.5001: Flags [.], seq 278016:280912, ack 1, win 58, options [nop,nop,TS val 28020903 ecr 28020903], length 2896
18:00:43.568352 IP 10.0.0.2.5001 > 10.0.0.1.42621: Flags [.], ack 280912, win 1041, options [nop,nop,TS val 28020928 ecr 28020903], length 0
18:00:43.571027 IP 10.0.0.1.42621 > 10.0.0.2.5001: Flags [.], seq 280912:283808, ack 1, win 58, options [nop,nop,TS val 28020904 ecr 28020903], length 2896
18:00:43.571046 IP 10.0.0.2.5001 > 10.0.0.1.42621: Flags [.], ack 283808, win 1041, options [nop,nop,TS val 28020929 ecr 28020904], length 0
18:00:43.573718 IP 10.0.0.1.42621 > 10.0.0.2.5001: Flags [.], seq 283808:286704, ack 1, win 58, options [nop,nop,TS val 28020905 ecr 28020904], length 2896
18:00:43.573735 IP 10.0.0.2.5001 > 10.0.0.1.42621: Flags [.], ack 286704, win 1041, options [nop,nop,TS val 28020930 ecr 28020905], length 0
18:00:43.576410 IP 10.0.0.1.42621 > 10.0.0.2.5001: Flags [.], seq 286704:289600, ack 1, win 58, options [nop,nop,TS val 28020905 ecr 28020905], length 2896
18:00:43.576427 IP 10.0.0.2.5001 > 10.0.0.1.42621: Flags [.], ack 289600, win 1041, options [nop,nop,TS val 28020930 ecr 28020905], length 0
18:00:43.579101 IP 10.0.0.1.42621 > 10.0.0.2.5001: Flags [.], seq 289600:292496, ack 1, win 58, options [nop,nop,TS val 28020906 ecr 28020905], length 2896
18:00:43.579118 IP 10.0.0.2.5001 > 10.0.0.1.42621: Flags [.], ack 292496, win 1041, options [nop,nop,TS val 28020931 ecr 28020906], length 0
18:00:43.581793 IP 10.0.0.1.42621 > 10.0.0.2.5001: Flags [.], seq 292496:295392, ack 1, win 58, options [nop,nop,TS val 28020907 ecr 28020906], length 2896
18:00:43.581811 IP 10.0.0.2.5001 > 10.0.0.1.42621: Flags [.], ack 295392, win 1041, options [nop,nop,TS val 28020932 ecr 28020907], length 0
18:00:43.584484 IP 10.0.0.1.42621 > 10.0.0.2.5001: Flags [.], seq 295392:298288, ack 1, win 58, options [nop,nop,TS val 28020907 ecr 28020907], length 2896
18:00:43.584501 IP 10.0.0.2.5001 > 10.0.0.1.42621: Flags [.], ack 298288, win 1041, options [nop,nop,TS val 28020932 ecr 28020907], length 0
18:00:43.587176 IP 10.0.0.1.42621 > 10.0.0.2.5001: Flags [.], seq 298288:301184, ack 1, win 58, options [nop,nop,TS val 28020908 ecr 28020907], length 2896
18:00:43.587193 IP 10.0.0.2.5001 > 10.0.0.1.42621: Flags [.], ack 301184, win 1041, options [nop,nop,TS val 28020933 ecr 28020908], length 0
18:00:43.589867 IP 10.0.0.1.42621 > 10.0.0.2.5001: Flags [.], seq 301184:304080, ack 1, win 58, options [nop,nop,TS val 28020909 ecr 28020908], length 2896
18:00:43.589884 IP 10.0.0.2.5001 > 10.0.0.1.42621: Flags [.], ack 304080, win 1041, options [nop,nop,TS val 28020934 ecr 28020909], length 0
18:00:43.592559 IP 10.0.0.1.42621 > 10.0.0.2.5001: Flags [.], seq 304080:306976, ack 1, win 58, options [nop,nop,TS val 28020909 ecr 28020909], length 2896
18:00:43.592576 IP 10.0.0.2.5001 > 10.0.0.1.42621: Flags [.], ack 306976, win 1041, options [nop,nop,TS val 28020934 ecr 28020909], length 0
18:00:43.595250 IP 10.0.0.1.42621 > 10.0.0.2.5001: Flags [.], seq 306976:309872, ack 1, win 58, options [nop,nop,TS val 28020910 ecr 28020909], length 2896
18:00:43.595268 IP 10.0.0.2.5001 > 10.0.0.1.42621: Flags [.], ack 309872, win 1041, options [nop,nop,TS val 28020935 ecr 28020910], length 0
18:00:43.597942 IP 10.0.0.1.42621 > 10.0.0.2.5001: Flags [.], seq 309872:312768, ack 1, win 58, options [nop,nop,TS val 28020911 ecr 28020910], length 2896
18:00:43.597959 IP 10.0.0.2.5001 > 10.0.0.1.42621: Flags [.], ack 312768, win 1041, options [nop,nop,TS val 28020936 ecr 28020911], length 0
18:00:43.600633 IP 10.0.0.1.42621 > 10.0.0.2.5001: Flags [.], seq 312768:315664, ack 1, win 58, options [nop,nop,TS val 28020911 ecr 28020911], length 2896
18:00:43.600785 IP 10.0.0.2.5001 > 10.0.0.1.42621: Flags [.], ack 315664, win 1041, options [nop,nop,TS val 28020936 ecr 28020911], length 0
18:00:43.603326 IP 10.0.0.1.42621 > 10.0.0.2.5001: Flags [P.], seq 315664:318560, ack 1, win 58, options [nop,nop,TS val 28020912 ecr 28020911], length 2896
18:00:43.603347 IP 10.0.0.2.5001 > 10.0.0.1.42621: Flags [.], ack 318560, win 1041, options [nop,nop,TS val 28020937 ecr 28020912], length 0
18:00:43.606017 IP 10.0.0.1.42621 > 10.0.0.2.5001: Flags [.], seq 318560:321456, ack 1, win 58, options [nop,nop,TS val 28020913 ecr 28020912], length 2896
18:00:43.606034 IP 10.0.0.2.5001 > 10.0.0.1.42621: Flags [.], ack 321456, win 1041, options [nop,nop,TS val 28020938 ecr 28020913], length 0
18:00:43.608708 IP 10.0.0.1.42621 > 10.0.0.2.5001: Flags [.], seq 321456:324352, ack 1, win 58, options [nop,nop,TS val 28020913 ecr 28020913], length 2896
18:00:43.608726 IP 10.0.0.2.5001 > 10.0.0.1.42621: Flags [.], ack 324352, win 1041, options [nop,nop,TS val 28020938 ecr 28020913], length 0
18:00:43.611404 IP 10.0.0.1.42621 > 10.0.0.2.5001: Flags [.], seq 324352:327248, ack 1, win 58, options [nop,nop,TS val 28020914 ecr 28020913], length 2896
18:00:43.611435 IP 10.0.0.2.5001 > 10.0.0.1.42621: Flags [.], ack 327248, win 1041, options [nop,nop,TS val 28020939 ecr 28020914], length 0
18:00:43.614095 IP 10.0.0.1.42621 > 10.0.0.2.5001: Flags [.], seq 327248:330144, ack 1, win 58, options [nop,nop,TS val 28020915 ecr 28020914], length 2896
18:00:43.614129 IP 10.0.0.2.5001 > 10.0.0.1.42621: Flags [.], ack 330144, win 1041, options [nop,nop,TS val 28020940 ecr 28020915], length 0
18:00:43.616786 IP 10.0.0.1.42621 > 10.0.0.2.5001: Flags [.], seq 330144:333040, ack 1, win 58, options [nop,nop,TS val 28020915 ecr 28020915], length 2896
18:00:43.616816 IP 10.0.0.2.5001 > 10.0.0.1.42621: Flags [.], ack 333040, win 1041, options [nop,nop,TS val 28020940 ecr 28020915], length 0
18:00:43.619811 IP 10.0.0.1.42621 > 10.0.0.2.5001: Flags [.], seq 333040:335936, ack 1, win 58, options [nop,nop,TS val 28020916 ecr 28020915], length 2896
18:00:43.619830 IP 10.0.0.2.5001 > 10.0.0.1.42621: Flags [.], ack 335936, win 1041, options [nop,nop,TS val 28020941 ecr 28020916], length 0
18:00:43.622839 IP 10.0.0.1.42621 > 10.0.0.2.5001: Flags [.], seq 335936:338832, ack 1, win 58, options [nop,nop,TS val 28020917 ecr 28020916], length 2896
18:00:43.622857 IP 10.0.0.2.5001 > 10.0.0.1.42621: Flags [.], ack 338832, win 1041, options [nop,nop,TS val 28020942 ecr 28020917], length 0
18:00:43.625867 IP 10.0.0.1.42621 > 10.0.0.2.5001: Flags [.], seq 338832:341728, ack 1, win 58, options [nop,nop,TS val 28020917 ecr 28020917], length 2896
18:00:43.625885 IP 10.0.0.2.5001 > 10.0.0.1.42621: Flags [.], ack 341728, win 1041, options [nop,nop,TS val 28020943 ecr 28020917], length 0
18:00:43.628895 IP 10.0.0.1.42621 > 10.0.0.2.5001: Flags [.], seq 341728:344624, ack 1, win 58, options [nop,nop,TS val 28020918 ecr 28020918], length 2896
18:00:43.628912 IP 10.0.0.2.5001 > 10.0.0.1.42621: Flags [.], ack 344624, win 1041, options [nop,nop,TS val 28020943 ecr 28020918], length 0
18:00:43.631923 IP 10.0.0.1.42621 > 10.0.0.2.5001: Flags [.], seq 344624:347520, ack 1, win 58, options [nop,nop,TS val 28020919 ecr 28020918], length 2896
18:00:43.631940 IP 10.0.0.2.5001 > 10.0.0.1.42621: Flags [.], ack 347520, win 1041, options [nop,nop,TS val 28020944 ecr 28020919], length 0
18:00:43.633344 IP6 :: > ff02::1:ff4b:6132: ICMP6, neighbor solicitation, who has fe80::28c9:8ff:fe4b:6132, length 24
18:00:43.634951 IP 10.0.0.1.42621 > 10.0.0.2.5001: Flags [.], seq 347520:350416, ack 1, win 58, options [nop,nop,TS val 28020920 ecr 28020919], length 2896
18:00:43.635641 IP 10.0.0.2.5001 > 10.0.0.1.42621: Flags [.], ack 350416, win 1041, options [nop,nop,TS val 28020945 ecr 28020920], length 0
18:00:43.637979 IP 10.0.0.1.42621 > 10.0.0.2.5001: Flags [.], seq 350416:353312, ack 1, win 58, options [nop,nop,TS val 28020920 ecr 28020920], length 2896
18:00:43.638000 IP 10.0.0.2.5001 > 10.0.0.1.42621: Flags [.], ack 353312, win 1041, options [nop,nop,TS val 28020946 ecr 28020920], length 0
18:00:43.641007 IP 10.0.0.1.42621 > 10.0.0.2.5001: Flags [.], seq 353312:356208, ack 1, win 58, options [nop,nop,TS val 28020921 ecr 28020920], length 2896
18:00:43.641141 IP 10.0.0.2.5001 > 10.0.0.1.42621: Flags [.], ack 356208, win 1041, options [nop,nop,TS val 28020946 ecr 28020921], length 0
18:00:43.644035 IP 10.0.0.1.42621 > 10.0.0.2.5001: Flags [.], seq 356208:359104, ack 1, win 58, options [nop,nop,TS val 28020922 ecr 28020921], length 2896
18:00:43.644052 IP 10.0.0.2.5001 > 10.0.0.1.42621: Flags [.], ack 359104, win 1041, options [nop,nop,TS val 28020947 ecr 28020922], length 0
18:00:43.647062 IP 10.0.0.1.42621 > 10.0.0.2.5001: Flags [.], seq 359104:362000, ack 1, win 58, options [nop,nop,TS val 28020922 ecr 28020922], length 2896
18:00:43.647078 IP 10.0.0.2.5001 > 10.0.0.1.42621: Flags [.], ack 362000, win 1041, options [nop,nop,TS val 28020948 ecr 28020922], length 0
18:00:43.650090 IP 10.0.0.1.42621 > 10.0.0.2.5001: Flags [.], seq 362000:364896, ack 1, win 58, options [nop,nop,TS val 28020923 ecr 28020922], length 2896
18:00:43.650112 IP 10.0.0.2.5001 > 10.0.0.1.42621: Flags [.], ack 364896, win 1041, options [nop,nop,TS val 28020949 ecr 28020923], length 0
18:00:43.653118 IP 10.0.0.1.42621 > 10.0.0.2.5001: Flags [.], seq 364896:367792, ack 1, win 58, options [nop,nop,TS val 28020924 ecr 28020923], length 2896
18:00:43.653135 IP 10.0.0.2.5001 > 10.0.0.1.42621: Flags [.], ack 367792, win 1041, options [nop,nop,TS val 28020949 ecr 28020924], length 0
18:00:43.656146 IP 10.0.0.1.42621 > 10.0.0.2.5001: Flags [.], seq 367792:370688, ack 1, win 58, options [nop,nop,TS val 28020924 ecr 28020924], length 2896
18:00:43.656162 IP 10.0.0.2.5001 > 10.0.0.1.42621: Flags [.], ack 370688, win 1041, options [nop,nop,TS val 28020950 ecr 28020924], length 0
18:00:43.659174 IP 10.0.0.1.42621 > 10.0.0.2.5001: Flags [.], seq 370688:373584, ack 1, win 58, options [nop,nop,TS val 28020925 ecr 28020924], length 2896
18:00:43.659191 IP 10.0.0.2.5001 > 10.0.0.1.42621: Flags [.], ack 373584, win 1041, options [nop,nop,TS val 28020951 ecr 28020925], length 0
18:00:43.662202 IP 10.0.0.1.42621 > 10.0.0.2.5001: Flags [.], seq 373584:376480, ack 1, win 58, options [nop,nop,TS val 28020926 ecr 28020925], length 2896
18:00:43.662218 IP 10.0.0.2.5001 > 10.0.0.1.42621: Flags [.], ack 376480, win 1041, options [nop,nop,TS val 28020952 ecr 28020926], length 0
18:00:43.665230 IP 10.0.0.1.42621 > 10.0.0.2.5001: Flags [.], seq 376480:379376, ack 1, win 58, options [nop,nop,TS val 28020926 ecr 28020926], length 2896
18:00:43.665246 IP 10.0.0.2.5001 > 10.0.0.1.42621: Flags [.], ack 379376, win 1041, options [nop,nop,TS val 28020952 ecr 28020926], length 0
18:00:43.668258 IP 10.0.0.1.42621 > 10.0.0.2.5001: Flags [.], seq 379376:382272, ack 1, win 58, options [nop,nop,TS val 28020927 ecr 28020926], length 2896
18:00:43.668274 IP 10.0.0.2.5001 > 10.0.0.1.42621: Flags [.], ack 382272, win 1041, options [nop,nop,TS val 28020953 ecr 28020927], length 0
18:00:43.671286 IP 10.0.0.1.42621 > 10.0.0.2.5001: Flags [.], seq 382272:385168, ack 1, win 58, options [nop,nop,TS val 28020928 ecr 28020927], length 2896
18:00:43.671303 IP 10.0.0.2.5001 > 10.0.0.1.42621: Flags [.], ack 385168, win 1041, options [nop,nop,TS val 28020954 ecr 28020928], length 0
18:00:43.674314 IP 10.0.0.1.42621 > 10.0.0.2.5001: Flags [.], seq 385168:388064, ack 1, win 58, options [nop,nop,TS val 28020928 ecr 28020928], length 2896
18:00:43.674331 IP 10.0.0.2.5001 > 10.0.0.1.42621: Flags [.], ack 388064, win 1041, options [nop,nop,TS val 28020955 ecr 28020928], length 0
