18:00:43.315060 IP 10.0.0.1.42621 > 10.0.0.2.5001: Flags [.], seq 2018407598:2018410494, ack 646911753, win 58, options [nop,nop,TS val 28020843 ecr 28020842], length 2896
18:00:43.317482 IP 10.0.0.1.42621 > 10.0.0.2.5001: Flags [.], seq 2896:5792, ack 1, win 58, options [nop,nop,TS val 28020843 ecr 28020843], length 2896
18:00:43.319904 IP 10.0.0.1.42621 > 10.0.0.2.5001: Flags [.], seq 5792:8688, ack 1, win 58, options [nop,nop,TS val 28020844 ecr 28020843], length 2896
18:00:43.322327 IP 10.0.0.1.42621 > 10.0.0.2.5001: Flags [.], seq 8688:11584, ack 1, win 58, options [nop,nop,TS val 28020844 ecr 28020844], length 2896
18:00:43.324749 IP 10.0.0.1.42621 > 10.0.0.2.5001: Flags [.], seq 11584:14480, ack 1, win 58, options [nop,nop,TS val 28020845 ecr 28020844], length 2896
18:00:43.327171 IP 10.0.0.1.42621 > 10.0.0.2.5001: Flags [P.], seq 14480:17376, ack 1, win 58, options [nop,nop,TS val 28020846 ecr 28020845], length 2896
18:00:43.329595 IP 10.0.0.1.42621 > 10.0.0.2.5001: Flags [.], seq 17376:20272, ack 1, win 58, options [nop,nop,TS val 28020846 ecr 28020846], length 2896
18:00:43.332016 IP 10.0.0.1.42621 > 10.0.0.2.5001: Flags [.], seq 20272:23168, ack 1, win 58, options [nop,nop,TS val 28020847 ecr 28020846], length 2896
18:00:43.334438 IP 10.0.0.1.42621 > 10.0.0.2.5001: Flags [.], seq 23168:26064, ack 1, win 58, options [nop,nop,TS val 28020847 ecr 28020847], length 2896
18:00:43.336861 IP 10.0.0.1.42621 > 10.0.0.2.5001: Flags [.], seq 26064:28960, ack 1, win 58, options [nop,nop,TS val 28020848 ecr 28020847], length 2896
18:00:43.339283 IP 10.0.0.1.42621 > 10.0.0.2.5001: Flags [.], seq 28960:31856, ack 1, win 58, options [nop,nop,TS val 28020849 ecr 28020848], length 2896
18:00:43.341705 IP 10.0.0.1.42621 > 10.0.0.2.5001: Flags [.], seq 31856:34752, ack 1, win 58, options [nop,nop,TS val 28020849 ecr 28020849], length 2896
18:00:43.344128 IP 10.0.0.1.42621 > 10.0.0.2.5001: Flags [.], seq 34752:37648, ack 1, win 58, options [nop,nop,TS val 28020850 ecr 28020849], length 2896
18:00:43.346550 IP 10.0.0.1.42621 > 10.0.0.2.5001: Flags [.], seq 37648:40544, ack 1, win 58, options [nop,nop,TS val 28020850 ecr 28020850], length 2896
18:00:43.348973 IP 10.0.0.1.42621 > 10.0.0.2.5001: Flags [.], seq 40544:43440, ack 1, win 58, options [nop,nop,TS val 28020851 ecr 28020850], length 2896
18:00:43.351395 IP 10.0.0.1.42621 > 10.0.0.2.5001: Flags [.], seq 43440:46336, ack 1, win 58, options [nop,nop,TS val 28020852 ecr 28020851], length 2896
18:00:43.353818 IP 10.0.0.1.42621 > 10.0.0.2.5001: Flags [.], seq 46336:49232, ack 1, win 58, options [nop,nop,TS val 28020852 ecr 28020852], length 2896
18:00:43.356244 IP 10.0.0.1.42621 > 10.0.0.2.5001: Flags [.], seq 49232:52128, ack 1, win 58, options [nop,nop,TS val 28020853 ecr 28020852], length 2896
18:00:43.358676 IP 10.0.0.1.42621 > 10.0.0.2.5001: Flags [.], seq 52128:55024, ack 1, win 58, options [nop,nop,TS val 28020853 ecr 28020853], length 2896
18:00:43.361088 IP 10.0.0.1.42621 > 10.0.0.2.5001: Flags [.], seq 55024:57920, ack 1, win 58, options [nop,nop,TS val 28020854 ecr 28020853], length 2896
18:00:43.363777 IP 10.0.0.1.42621 > 10.0.0.2.5001: Flags [.], seq 57920:60816, ack 1, win 58, options [nop,nop,TS val 28020855 ecr 28020854], length 2896
18:00:43.366468 IP 10.0.0.1.42621 > 10.0.0.2.5001: Flags [.], seq 60816:63712, ack 1, win 58, options [nop,nop,TS val 28020855 ecr 28020855], length 2896
18:00:43.369160 IP 10.0.0.1.42621 > 10.0.0.2.5001: Flags [.], seq 63712:66608, ack 1, win 58, options [nop,nop,TS val 28020856 ecr 28020855], length 2896
18:00:43.371852 IP 10.0.0.1.42621 > 10.0.0.2.5001: Flags [.], seq 66608:69504, ack 1, win 58, options [nop,nop,TS val 28020856 ecr 28020856], length 2896
18:00:43.374543 IP 10.0.0.1.42621 > 10.0.0.2.5001: Flags [.], seq 69504:72400, ack 1, win 58, options [nop,nop,TS val 28020857 ecr 28020856], length 2896
18:00:43.377234 IP 10.0.0.1.42621 > 10.0.0.2.5001: Flags [.], seq 72400:75296, ack 1, win 58, options [nop,nop,TS val 28020858 ecr 28020857], length 2896
18:00:43.379932 IP 10.0.0.1.42621 > 10.0.0.2.5001: Flags [.], seq 75296:78192, ack 1, win 58, options [nop,nop,TS val 28020858 ecr 28020858], length 2896
18:00:43.382622 IP 10.0.0.1.42621 > 10.0.0.2.5001: Flags [.], seq 78192:81088, ack 1, win 58, options [nop,nop,TS val 28020859 ecr 28020858], length 2896
18:00:43.385314 IP 10.0.0.1.42621 > 10.0.0.2.5001: Flags [.], seq 81088:83984, ack 1, win 58, options [nop,nop,TS val 28020859 ecr 28020859], length 2896
18:00:43.388003 IP 10.0.0.1.42621 > 10.0.0.2.5001: Flags [.], seq 83984:86880, ack 1, win 58, options [nop,nop,TS val 28020860 ecr 28020859], length 2896
18:00:43.390693 IP 10.0.0.1.42621 > 10.0.0.2.5001: Flags [.], seq 86880:89776, ack 1, win 58, options [nop,nop,TS val 28020861 ecr 28020860], length 2896
18:00:43.393385 IP 10.0.0.1.42621 > 10.0.0.2.5001: Flags [.], seq 89776:92672, ack 1, win 58, options [nop,nop,TS val 28020861 ecr 28020861], length 2896
18:00:43.396080 IP 10.0.0.1.42621 > 10.0.0.2.5001: Flags [.], seq 92672:95568, ack 1, win 58, options [nop,nop,TS val 28020862 ecr 28020861], length 2896
18:00:43.398767 IP 10.0.0.1.42621 > 10.0.0.2.5001: Flags [.], seq 95568:98464, ack 1, win 58, options [nop,nop,TS val 28020863 ecr 28020862], length 2896
18:00:43.401459 IP 10.0.0.1.42621 > 10.0.0.2.5001: Flags [.], seq 98464:101360, ack 1, win 58, options [nop,nop,TS val 28020863 ecr 28020863], length 2896
18:00:43.404150 IP 10.0.0.1.42621 > 10.0.0.2.5001: Flags [.], seq 101360:104256, ack 1, win 58, options [nop,nop,TS val 28020864 ecr 28020863], length 2896
18:00:43.406842 IP 10.0.0.1.42621 > 10.0.0.2.5001: Flags [.], seq 104256:107152, ack 1, win 58, options [nop,nop,TS val 28020864 ecr 28020864], length 2896
18:00:43.409533 IP 10.0.0.1.42621 > 10.0.0.2.5001: Flags [.], seq 107152:110048, ack 1, win 58, options [nop,nop,TS val 28020865 ecr 28020864], length 2896
18:00:43.412225 IP 10.0.0.1.42621 > 10.0.0.2.5001: Flags [.], seq 110048:112944, ack 1, win 58, options [nop,nop,TS val 28020866 ecr 28020865], length 2896
18:00:43.414916 IP 10.0.0.1.42621 > 10.0.0.2.5001: Flags [.], seq 112944:115840, ack 1, win 58, options [nop,nop,TS val 28020866 ecr 28020866], length 2896
18:00:43.417608 IP 10.0.0.1.42621 > 10.0.0.2.5001: Flags [.], seq 115840:118736, ack 1, win 58, options [nop,nop,TS val 28020867 ecr 28020866], length 2896
18:00:43.420301 IP 10.0.0.1.42621 > 10.0.0.2.5001: Flags [.], seq 118736:121632, ack 1, win 58, options [nop,nop,TS val 28020867 ecr 28020867], length 2896
18:00:43.422991 IP 10.0.0.1.42621 > 10.0.0.2.5001: Flags [.], seq 121632:124528, ack 1, win 58, options [nop,nop,TS val 28020868 ecr 28020867], length 2896
18:00:43.425688 IP 10.0.0.1.42621 > 10.0.0.2.5001: Flags [.], seq 124528:127424, ack 1, win 58, options [nop,nop,TS val 28020869 ecr 28020868], length 2896
18:00:43.428374 IP 10.0.0.1.42621 > 10.0.0.2.5001: Flags [.], seq 127424:130320, ack 1, win 58, options [nop,nop,TS val 28020869 ecr 28020869], length 2896
18:00:43.431066 IP 10.0.0.1.42621 > 10.0.0.2.5001: Flags [.], seq 130320:133216, ack 1, win 58, options [nop,nop,TS val 28020870 ecr 28020869], length 2896
18:00:43.433757 IP 10.0.0.1.42621 > 10.0.0.2.5001: Flags [.], seq 133216:136112, ack 1, win 58, options [nop,nop,TS val 28020870 ecr 28020870], length 2896
18:00:43.436449 IP 10.0.0.1.42621 > 10.0.0.2.5001: Flags [.], seq 136112:139008, ack 1, win 58, options [nop,nop,TS val 28020871 ecr 28020870], length 2896
18:00:43.439140 IP 10.0.0.1.42621 > 10.0.0.2.5001: Flags [.], seq 139008:141904, ack 1, win 58, options [nop,nop,TS val 28020872 ecr 28020871], length 2896
18:00:43.441832 IP 10.0.0.1.42621 > 10.0.0.2.5001: Flags [.], seq 141904:144800, ack 1, win 58, options [nop,nop,TS val 28020872 ecr 28020872], length 2896
18:00:43.444524 IP 10.0.0.1.42621 > 10.0.0.2.5001: Flags [.], seq 144800:147696, ack 1, win 58, options [nop,nop,TS val 28020873 ecr 28020872], length 2896
18:00:43.447216 IP 10.0.0.1.42621 > 10.0.0.2.5001: Flags [.], seq 147696:150592, ack 1, win 58, options [nop,nop,TS val 28020873 ecr 28020873], length 2896
18:00:43.449906 IP 10.0.0.1.42621 > 10.0.0.2.5001: Flags [.], seq 150592:153488, ack 1, win 58, options [nop,nop,TS val 28020874 ecr 28020873], length 2896
18:00:43.452598 IP 10.0.0.1.42621 > 10.0.0.2.5001: Flags [.], seq 153488:156384, ack 1, win 58, options [nop,nop,TS val 28020875 ecr 28020874], length 2896
18:00:43.455290 IP 10.0.0.1.42621 > 10.0.0.2.5001: Flags [.], seq 156384:159280, ack 1, win 58, options [nop,nop,TS val 28020875 ecr 28020875], length 2896
18:00:43.457981 IP 10.0.0.1.42621 > 10.0.0.2.5001: Flags [.], seq 159280:162176, ack 1, win 58, options [nop,nop,TS val 28020876 ecr 28020875], length 2896
18:00:43.460673 IP 10.0.0.1.42621 > 10.0.0.2.5001: Flags [P.], seq 162176:165072, ack 1, win 58, options [nop,nop,TS val 28020876 ecr 28020876], length 2896
18:00:43.463365 IP 10.0.0.1.42621 > 10.0.0.2.5001: Flags [.], seq 165072:167968, ack 1, win 58, options [nop,nop,TS val 28020877 ecr 28020876], length 2896
18:00:43.466056 IP 10.0.0.1.42621 > 10.0.0.2.5001: Flags [.], seq 167968:170864, ack 1, win 58, options [nop,nop,TS val 28020878 ecr 28020877], length 2896
18:00:43.468747 IP 10.0.0.1.42621 > 10.0.0.2.5001: Flags [.], seq 170864:173760, ack 1, win 58, options [nop,nop,TS val 28020878 ecr 28020878], length 2896
18:00:43.471439 IP 10.0.0.1.42621 > 10.0.0.2.5001: Flags [.], seq 173760:176656, ack 1, win 58, options [nop,nop,TS val 28020879 ecr 28020878], length 2896
18:00:43.474131 IP 10.0.0.1.42621 > 10.0.0.2.5001: Flags [.], seq 176656:179552, ack 1, win 58, options [nop,nop,TS val 28020880 ecr 28020879], length 2896
18:00:43.476822 IP 10.0.0.1.42621 > 10.0.0.2.5001: Flags [.], seq 179552:182448, ack 1, win 58, options [nop,nop,TS val 28020880 ecr 28020880], length 2896
18:00:43.479514 IP 10.0.0.1.42621 > 10.0.0.2.5001: Flags [.], seq 182448:185344, ack 1, win 58, options [nop,nop,TS val 28020881 ecr 28020880], length 2896
18:00:43.482206 IP 10.0.0.1.42621 > 10.0.0.2.5001: Flags [.], seq 185344:188240, ack 1, win 58, options [nop,nop,TS val 28020882 ecr 28020881], length 2896
18:00:43.484897 IP 10.0.0.1.42621 > 10.0.0.2.5001: Flags [.], seq 188240:191136, ack 1, win 58, options [nop,nop,TS val 28020883 ecr 28020882], length 2896
18:00:43.487588 IP 10.0.0.1.42621 > 10.0.0.2.5001: Flags [.], seq 191136:194032, ack 1, win 58, options [nop,nop,TS val 28020883 ecr 28020883], length 2896
18:00:43.490280 IP 10.0.0.1.42621 > 10.0.0.2.5001: Flags [.], seq 194032:196928, ack 1, win 58, options [nop,nop,TS val 28020884 ecr 28020883], length 2896
18:00:43.492971 IP 10.0.0.1.42621 > 10.0.0.2.5001: Flags [.], seq 196928:199824, ack 1, win 58, options [nop,nop,TS val 28020885 ecr 28020884], length 2896
18:00:43.495663 IP 10.0.0.1.42621 > 10.0.0.2.5001: Flags [.], seq 199824:202720, ack 1, win 58, options [nop,nop,TS val 28020885 ecr 28020885], length 2896
18:00:43.498354 IP 10.0.0.1.42621 > 10.0.0.2.5001: Flags [.], seq 202720:205616, ack 1, win 58, options [nop,nop,TS val 28020886 ecr 28020885], length 2896
18:00:43.501046 IP 10.0.0.1.42621 > 10.0.0.2.5001: Flags [.], seq 205616:208512, ack 1, win 58, options [nop,nop,TS val 28020887 ecr 28020886], length 2896
18:00:43.503738 IP 10.0.0.1.42621 > 10.0.0.2.5001: Flags [.], seq 208512:211408, ack 1, win 58, options [nop,nop,TS val 28020887 ecr 28020887], length 2896
18:00:43.506429 IP 10.0.0.1.42621 > 10.0.0.2.5001: Flags [.], seq 211408:214304, ack 1, win 58, options [nop,nop,TS val 28020888 ecr 28020887], length 2896
18:00:43.509121 IP 10.0.0.1.42621 > 10.0.0.2.5001: Flags [.], seq 214304:217200, ack 1, win 58, options [nop,nop,TS val 28020889 ecr 28020888], length 2896
18:00:43.511812 IP 10.0.0.1.42621 > 10.0.0.2.5001: Flags [.], seq 217200:220096, ack 1, win 58, options [nop,nop,TS val 28020889 ecr 28020889], length 2896
18:00:43.514504 IP 10.0.0.1.42621 > 10.0.0.2.5001: Flags [.], seq 220096:222992, ack 1, win 58, options [nop,nop,TS val 28020890 ecr 28020889], length 2896
18:00:43.517195 IP 10.0.0.1.42621 > 10.0.0.2.5001: Flags [.], seq 222992:225888, ack 1, win 58, options [nop,nop,TS val 28020891 ecr 28020890], length 2896
18:00:43.519887 IP 10.0.0.1.42621 > 10.0.0.2.5001: Flags [.], seq 225888:228784, ack 1, win 58, options [nop,nop,TS val 28020891 ecr 28020891], length 2896
18:00:43.522579 IP 10.0.0.1.42621 > 10.0.0.2.5001: Flags [.], seq 228784:231680, ack 1, win 58, options [nop,nop,TS val 28020892 ecr 28020891], length 2896
18:00:43.525270 IP 10.0.0.1.42621 > 10.0.0.2.5001: Flags [.], seq 231680:234576, ack 1, win 58, options [nop,nop,TS val 28020893 ecr 28020892], length 2896
18:00:43.527962 IP 10.0.0.1.42621 > 10.0.0.2.5001: Flags [.], seq 234576:237472, ack 1, win 58, options [nop,nop,TS val 28020893 ecr 28020893], length 2896
18:00:43.530654 IP 10.0.0.1.42621 > 10.0.0.2.5001: Flags [.], seq 237472:240368, ack 1, win 58, options [nop,nop,TS val 28020894 ecr 28020893], length 2896
18:00:43.533345 IP 10.0.0.1.42621 > 10.0.0.2.5001: Flags [.], seq 240368:243264, ack 1, win 58, options [nop,nop,TS val 28020895 ecr 28020894], length 2896
18:00:43.536036 IP 10.0.0.1.42621 > 10.0.0.2.5001: Flags [.], seq 243264:246160, ack 1, win 58, options [nop,nop,TS val 28020895 ecr 28020895], length 2896
18:00:43.538728 IP 10.0.0.1.42621 > 10.0.0.2.5001: Flags [.], seq 246160:249056, ack 1, win 58, options [nop,nop,TS val 28020896 ecr 28020895], length 2896
18:00:43.541419 IP 10.0.0.1.42621 > 10.0.0.2.5001: Flags [.], seq 249056:251952, ack 1, win 58, options [nop,nop,TS val 28020897 ecr 28020896], length 2896
18:00:43.544111 IP 10.0.0.1.42621 > 10.0.0.2.5001: Flags [.], seq 251952:254848, ack 1, win 58, options [nop,nop,TS val 28020897 ecr 28020897], length 2896
18:00:43.546803 IP 10.0.0.1.42621 > 10.0.0.2.5001: Flags [.], seq 254848:257744, ack 1, win 58, options [nop,nop,TS val 28020898 ecr 28020897], length 2896
18:00:43.549494 IP 10.0.0.1.42621 > 10.0.0.2.5001: Flags [.], seq 257744:260640, ack 1, win 58, options [nop,nop,TS val 28020899 ecr 28020898], length 2896
18:00:43.552186 IP 10.0.0.1.42621 > 10.0.0.2.5001: Flags [.], seq 260640:263536, ack 1, win 58, options [nop,nop,TS val 28020899 ecr 28020899], length 2896
18:00:43.554877 IP 10.0.0.1.42621 > 10.0.0.2.5001: Flags [.], seq 263536:266432, ack 1, win 58, options [nop,nop,TS val 28020900 ecr 28020899], length 2896
18:00:43.557569 IP 10.0.0.1.42621 > 10.0.0.2.5001: Flags [.], seq 266432:269328, ack 1, win 58, options [nop,nop,TS val 28020901 ecr 28020900], length 2896
18:00:43.560260 IP 10.0.0.1.42621 > 10.0.0.2.5001: Flags [.], seq 269328:272224, ack 1, win 58, options [nop,nop,TS val 28020901 ecr 28020901], length 2896
18:00:43.562952 IP 10.0.0.1.42621 > 10.0.0.2.5001: Flags [.], seq 272224:275120, ack 1, win 58, options [nop,nop,TS val 28020902 ecr 28020901], length 2896
18:00:43.565643 IP 10.0.0.1.42621 > 10.0.0.2.5001: Flags [.], seq 275120:278016, ack 1, win 58, options [nop,nop,TS val 28020903 ecr 28020902], length 2896
18:00:43.568335 IP 10.0.0.1.42621 > 10.0.0.2.5001: Flags [.], seq 278016:280912, ack 1, win 58, options [nop,nop,TS val 28020903 ecr 28020903], length 2896
18:00:43.571027 IP 10.0.0.1.42621 > 10.0.0.2.5001: Flags [.], seq 280912:283808, ack 1, win 58, options [nop,nop,TS val 28020904 ecr 28020903], length 2896
18:00:43.573718 IP 10.0.0.1.42621 > 10.0.0.2.5001: Flags [.], seq 283808:286704, ack 1, win 58, options [nop,nop,TS val 28020905 ecr 28020904], length 2896
18:00:43.576410 IP 10.0.0.1.42621 > 10.0.0.2.5001: Flags [.], seq 286704:289600, ack 1, win 58, options [nop,nop,TS val 28020905 ecr 28020905], length 2896
18:00:43.579101 IP 10.0.0.1.42621 > 10.0.0.2.5001: Flags [.], seq 289600:292496, ack 1, win 58, options [nop,nop,TS val 28020906 ecr 28020905], length 2896
18:00:43.581793 IP 10.0.0.1.42621 > 10.0.0.2.5001: Flags [.], seq 292496:295392, ack 1, win 58, options [nop,nop,TS val 28020907 ecr 28020906], length 2896
18:00:43.584484 IP 10.0.0.1.42621 > 10.0.0.2.5001: Flags [.], seq 295392:298288, ack 1, win 58, options [nop,nop,TS val 28020907 ecr 28020907], length 2896
18:00:43.587176 IP 10.0.0.1.42621 > 10.0.0.2.5001: Flags [.], seq 298288:301184, ack 1, win 58, options [nop,nop,TS val 28020908 ecr 28020907], length 2896
18:00:43.589867 IP 10.0.0.1.42621 > 10.0.0.2.5001: Flags [.], seq 301184:304080, ack 1, win 58, options [nop,nop,TS val 28020909 ecr 28020908], length 2896
18:00:43.592559 IP 10.0.0.1.42621 > 10.0.0.2.5001: Flags [.], seq 304080:306976, ack 1, win 58, options [nop,nop,TS val 28020909 ecr 28020909], length 2896
18:00:43.595250 IP 10.0.0.1.42621 > 10.0.0.2.5001: Flags [.], seq 306976:309872, ack 1, win 58, options [nop,nop,TS val 28020910 ecr 28020909], length 2896
18:00:43.597942 IP 10.0.0.1.42621 > 10.0.0.2.5001: Flags [.], seq 309872:312768, ack 1, win 58, options [nop,nop,TS val 28020911 ecr 28020910], length 2896
18:00:43.600633 IP 10.0.0.1.42621 > 10.0.0.2.5001: Flags [.], seq 312768:315664, ack 1, win 58, options [nop,nop,TS val 28020911 ecr 28020911], length 2896
18:00:43.603326 IP 10.0.0.1.42621 > 10.0.0.2.5001: Flags [P.], seq 315664:318560, ack 1, win 58, options [nop,nop,TS val 28020912 ecr 28020911], length 2896
18:00:43.606017 IP 10.0.0.1.42621 > 10.0.0.2.5001: Flags [.], seq 318560:321456, ack 1, win 58, options [nop,nop,TS val 28020913 ecr 28020912], length 2896
18:00:43.608708 IP 10.0.0.1.42621 > 10.0.0.2.5001: Flags [.], seq 321456:324352, ack 1, win 58, options [nop,nop,TS val 28020913 ecr 28020913], length 2896
18:00:43.611404 IP 10.0.0.1.42621 > 10.0.0.2.5001: Flags [.], seq 324352:327248, ack 1, win 58, options [nop,nop,TS val 28020914 ecr 28020913], length 2896
18:00:43.614095 IP 10.0.0.1.42621 > 10.0.0.2.5001: Flags [.], seq 327248:330144, ack 1, win 58, options [nop,nop,TS val 28020915 ecr 28020914], length 2896
18:00:43.616786 IP 10.0.0.1.42621 > 10.0.0.2.5001: Flags [.], seq 330144:333040, ack 1, win 58, options [nop,nop,TS val 28020915 ecr 28020915], length 2896
18:00:43.619811 IP 10.0.0.1.42621 > 10.0.0.2.5001: Flags [.], seq 333040:335936, ack 1, win 58, options [nop,nop,TS val 28020916 ecr 28020915], length 2896
18:00:43.622839 IP 10.0.0.1.42621 > 10.0.0.2.5001: Flags [.], seq 335936:338832, ack 1, win 58, options [nop,nop,TS val 28020917 ecr 28020916], length 2896
18:00:43.625867 IP 10.0.0.1.42621 > 10.0.0.2.5001: Flags [.], seq 338832:341728, ack 1, win 58, options [nop,nop,TS val 28020917 ecr 28020917], length 2896
18:00:43.628895 IP 10.0.0.1.42621 > 10.0.0.2.5001: Flags [.], seq 341728:344624, ack 1, win 58, options [nop,nop,TS val 28020918 ecr 28020918], length 2896
18:00:43.631923 IP 10.0.0.1.42621 > 10.0.0.2.5001: Flags [.], seq 344624:347520, ack 1, win 58, options [nop,nop,TS val 28020919 ecr 28020918], length 2896
18:00:43.634951 IP 10.0.0.1.42621 > 10.0.0.2.5001: Flags [.], seq 347520:350416, ack 1, win 58, options [nop,nop,TS val 28020920 ecr 28020919], length 2896
18:00:43.637979 IP 10.0.0.1.42621 > 10.0.0.2.5001: Flags [.], seq 350416:353312, ack 1, win 58, options [nop,nop,TS val 28020920 ecr 28020920], length 2896
18:00:43.641007 IP 10.0.0.1.42621 > 10.0.0.2.5001: Flags [.], seq 353312:356208, ack 1, win 58, options [nop,nop,TS val 28020921 ecr 28020920], length 2896
18:00:43.644035 IP 10.0.0.1.42621 > 10.0.0.2.5001: Flags [.], seq 356208:359104, ack 1, win 58, options [nop,nop,TS val 28020922 ecr 28020921], length 2896
18:00:43.647062 IP 10.0.0.1.42621 > 10.0.0.2.5001: Flags [.], seq 359104:362000, ack 1, win 58, options [nop,nop,TS val 28020922 ecr 28020922], length 2896
18:00:43.650090 IP 10.0.0.1.42621 > 10.0.0.2.5001: Flags [.], seq 362000:364896, ack 1, win 58, options [nop,nop,TS val 28020923 ecr 28020922], length 2896
18:00:43.653118 IP 10.0.0.1.42621 > 10.0.0.2.5001: Flags [.], seq 364896:367792, ack 1, win 58, options [nop,nop,TS val 28020924 ecr 28020923], length 2896
18:00:43.656146 IP 10.0.0.1.42621 > 10.0.0.2.5001: Flags [.], seq 367792:370688, ack 1, win 58, options [nop,nop,TS val 28020924 ecr 28020924], length 2896
18:00:43.659174 IP 10.0.0.1.42621 > 10.0.0.2.5001: Flags [.], seq 370688:373584, ack 1, win 58, options [nop,nop,TS val 28020925 ecr 28020924], length 2896
18:00:43.662202 IP 10.0.0.1.42621 > 10.0.0.2.5001: Flags [.], seq 373584:376480, ack 1, win 58, options [nop,nop,TS val 28020926 ecr 28020925], length 2896
18:00:43.665230 IP 10.0.0.1.42621 > 10.0.0.2.5001: Flags [.], seq 376480:379376, ack 1, win 58, options [nop,nop,TS val 28020926 ecr 28020926], length 2896
18:00:43.668258 IP 10.0.0.1.42621 > 10.0.0.2.5001: Flags [.], seq 379376:382272, ack 1, win 58, options [nop,nop,TS val 28020927 ecr 28020926], length 2896
18:00:43.671286 IP 10.0.0.1.42621 > 10.0.0.2.5001: Flags [.], seq 382272:385168, ack 1, win 58, options [nop,nop,TS val 28020928 ecr 28020927], length 2896
18:00:43.674314 IP 10.0.0.1.42621 > 10.0.0.2.5001: Flags [.], seq 385168:388064, ack 1, win 58, options [nop,nop,TS val 28020928 ecr 28020928], length 2896
18:00:43.677342 IP 10.0.0.1.42621 > 10.0.0.2.5001: Flags [.], seq 388064:390960, ack 1, win 58, options [nop,nop,TS val 28020929 ecr 28020928], length 2896
18:00:43.680370 IP 10.0.0.1.42621 > 10.0.0.2.5001: Flags [.], seq 390960:393856, ack 1, win 58, options [nop,nop,TS val 28020930 ecr 28020929], length 2896
18:00:43.683398 IP 10.0.0.1.42621 > 10.0.0.2.5001: Flags [.], seq 393856:396752, ack 1, win 58, options [nop,nop,TS val 28020930 ecr 28020930], length 2896
18:00:43.686426 IP 10.0.0.1.42621 > 10.0.0.2.5001: Flags [.], seq 396752:399648, ack 1, win 58, options [nop,nop,TS val 28020931 ecr 28020930], length 2896
18:00:43.689454 IP 10.0.0.1.42621 > 10.0.0.2.5001: Flags [.], seq 399648:402544, ack 1, win 58, options [nop,nop,TS val 28020932 ecr 28020931], length 2896
18:00:43.692482 IP 10.0.0.1.42621 > 10.0.0.2.5001: Flags [.], seq 402544:405440, ack 1, win 58, options [nop,nop,TS val 28020932 ecr 28020932], length 2896
18:00:43.695510 IP 10.0.0.1.42621 > 10.0.0.2.5001: Flags [.], seq 405440:408336, ack 1, win 58, options [nop,nop,TS val 28020933 ecr 28020932], length 2896
18:00:43.698538 IP 10.0.0.1.42621 > 10.0.0.2.5001: Flags [.], seq 408336:411232, ack 1, win 58, options [nop,nop,TS val 28020934 ecr 28020933], length 2896
18:00:43.701566 IP 10.0.0.1.42621 > 10.0.0.2.5001: Flags [.], seq 411232:414128, ack 1, win 58, options [nop,nop,TS val 28020934 ecr 28020934], length 2896
18:00:43.704594 IP 10.0.0.1.42621 > 10.0.0.2.5001: Flags [.], seq 414128:417024, ack 1, win 58, options [nop,nop,TS val 28020935 ecr 28020934], length 2896
18:00:43.707622 IP 10.0.0.1.42621 > 10.0.0.2.5001: Flags [.], seq 417024:419920, ack 1, win 58, options [nop,nop,TS val 28020936 ecr 28020935], length 2896
18:00:43.710650 IP 10.0.0.1.42621 > 10.0.0.2.5001: Flags [.], seq 419920:422816, ack 1, win 58, options [nop,nop,TS val 28020936 ecr 28020936], length 2896
18:00:43.713678 IP 10.0.0.1.42621 > 10.0.0.2.5001: Flags [.], seq 422816:425712, ack 1, win 58, options [nop,nop,TS val 28020937 ecr 28020936], length 2896
18:00:43.716706 IP 10.0.0.1.42621 > 10.0.0.2.5001: Flags [.], seq 425712:428608, ack 1, win 58, options [nop,nop,TS val 28020938 ecr 28020937], length 2896
18:00:43.719734 IP 10.0.0.1.42621 > 10.0.0.2.5001: Flags [.], seq 428608:431504, ack 1, win 58, options [nop,nop,TS val 28020938 ecr 28020938], length 2896
18:00:43.722762 IP 10.0.0.1.42621 > 10.0.0.2.5001: Flags [.], seq 431504:434400, ack 1, win 58, options [nop,nop,TS val 28020939 ecr 28020938], length 2896
18:00:43.725790 IP 10.0.0.1.42621 > 10.0.0.2.5001: Flags [.], seq 434400:437296, ack 1, win 58, options [nop,nop,TS val 28020940 ecr 28020939], length 2896
18:00:43.728818 IP 10.0.0.1.42621 > 10.0.0.2.5001: Flags [.], seq 437296:440192, ack 1, win 58, options [nop,nop,TS val 28020940 ecr 28020940], length 2896
18:00:43.731846 IP 10.0.0.1.42621 > 10.0.0.2.5001: Flags [.], seq 440192:443088, ack 1, win 58, options [nop,nop,TS val 28020941 ecr 28020940], length 2896
18:00:43.734874 IP 10.0.0.1.42621 > 10.0.0.2.5001: Flags [.], seq 443088:445984, ack 1, win 58, options [nop,nop,TS val 28020942 ecr 28020941], length 2896
18:00:43.737902 IP 10.0.0.1.42621 > 10.0.0.2.5001: Flags [.], seq 445984:448880, ack 1, win 58, options [nop,nop,TS val 28020943 ecr 28020942], length 2896
18:00:43.740930 IP 10.0.0.1.42621 > 10.0.0.2.5001: Flags [.], seq 448880:451776, ack 1, win 58, options [nop,nop,TS val 28020943 ecr 28020943], length 2896
18:00:43.743958 IP 10.0.0.1.42621 > 10.0.0.2.5001: Flags [.], seq 451776:454672, ack 1, win 58, options [nop,nop,TS val 28020944 ecr 28020943], length 2896
18:00:43.746986 IP 10.0.0.1.42621 > 10.0.0.2.5001: Flags [.], seq 454672:457568, ack 1, win 58, options [nop,nop,TS val 28020945 ecr 28020944], length 2896
18:00:43.750104 IP 10.0.0.1.42621 > 10.0.0.2.5001: Flags [.], seq 457568:460464, ack 1, win 58, options [nop,nop,TS val 28020946 ecr 28020945], length 2896
18:00:43.753132 IP 10.0.0.1.42621 > 10.0.0.2.5001: Flags [.], seq 460464:463360, ack 1, win 58, options [nop,nop,TS val 28020946 ecr 28020946], length 2896
18:00:43.756160 IP 10.0.0.1.42621 > 10.0.0.2.5001: Flags [.], seq 463360:466256, ack 1, win 58, options [nop,nop,TS val 28020947 ecr 28020946], length 2896
18:00:43.759188 IP 10.0.0.1.42621 > 10.0.0.2.5001: Flags [P.], seq 466256:469152, ack 1, win 58, options [nop,nop,TS val 28020948 ecr 28020947], length 2896
18:00:43.762221 IP 10.0.0.1.42621 > 10.0.0.2.5001: Flags [.], seq 469152:472048, ack 1, win 58, options [nop,nop,TS val 28020949 ecr 28020948], length 2896
18:00:43.765246 IP 10.0.0.1.42621 > 10.0.0.2.5001: Flags [.], seq 472048:474944, ack 1, win 58, options [nop,nop,TS val 28020949 ecr 28020949], length 2896
18:00:43.768272 IP 10.0.0.1.42621 > 10.0.0.2.5001: Flags [.], seq 474944:477840, ack 1, win 58, options [nop,nop,TS val 28020950 ecr 28020949], length 2896
18:00:43.771300 IP 10.0.0.1.42621 > 10.0.0.2.5001: Flags [.], seq 477840:480736, ack 1, win 58, options [nop,nop,TS val 28020951 ecr 28020950], length 2896
18:00:43.774328 IP 10.0.0.1.42621 > 10.0.0.2.5001: Flags [.], seq 480736:483632, ack 1, win 58, options [nop,nop,TS val 28020952 ecr 28020951], length 2896
18:00:43.777356 IP 10.0.0.1.42621 > 10.0.0.2.5001: Flags [.], seq 483632:486528, ack 1, win 58, options [nop,nop,TS val 28020952 ecr 28020952], length 2896
18:00:43.780384 IP 10.0.0.1.42621 > 10.0.0.2.5001: Flags [.], seq 486528:489424, ack 1, win 58, options [nop,nop,TS val 28020953 ecr 28020952], length 2896
18:00:43.783412 IP 10.0.0.1.42621 > 10.0.0.2.5001: Flags [.], seq 489424:492320, ack 1, win 58, options [nop,nop,TS val 28020954 ecr 28020953], length 2896
18:00:43.786441 IP 10.0.0.1.42621 > 10.0.0.2.5001: Flags [.], seq 492320:495216, ack 1, win 58, options [nop,nop,TS val 28020955 ecr 28020954], length 2896
18:00:43.789468 IP 10.0.0.1.42621 > 10.0.0.2.5001: Flags [.], seq 495216:498112, ack 1, win 58, options [nop,nop,TS val 28020956 ecr 28020955], length 2896
18:00:43.792497 IP 10.0.0.1.42621 > 10.0.0.2.5001: Flags [.], seq 498112:501008, ack 1, win 58, options [nop,nop,TS val 28020956 ecr 28020956], length 2896
18:00:43.795524 IP 10.0.0.1.42621 > 10.0.0.2.5001: Flags [.], seq 501008:503904, ack 1, win 58, options [nop,nop,TS val 28020957 ecr 28020956], length 2896
18:00:43.798552 IP 10.0.0.1.42621 > 10.0.0.2.5001: Flags [.], seq 503904:506800, ack 1, win 58, options [nop,nop,TS val 28020958 ecr 28020957], length 2896
18:00:43.801580 IP 10.0.0.1.42621 > 10.0.0.2.5001: Flags [.], seq 506800:509696, ack 1, win 58, options [nop,nop,TS val 28020959 ecr 28020958], length 2896
18:00:43.804608 IP 10.0.0.1.42621 > 10.0.0.2.5001: Flags [.], seq 509696:512592, ack 1, win 58, options [nop,nop,TS val 28020959 ecr 28020959], length 2896
18:00:43.807636 IP 10.0.0.1.42621 > 10.0.0.2.5001: Flags [.], seq 512592:515488, ack 1, win 58, options [nop,nop,TS val 28020960 ecr 28020959], length 2896
18:00:43.810664 IP 10.0.0.1.42621 > 10.0.0.2.5001: Flags [.], seq 515488:518384, ack 1, win 58, options [nop,nop,TS val 28020961 ecr 28020960], length 2896
18:00:43.813692 IP 10.0.0.1.42621 > 10.0.0.2.5001: Flags [.], seq 518384:521280, ack 1, win 58, options [nop,nop,TS val 28020962 ecr 28020961], length 2896
18:00:43.816720 IP 10.0.0.1.42621 > 10.0.0.2.5001: Flags [.], seq 521280:524176, ack 1, win 58, options [nop,nop,TS val 28020962 ecr 28020962], length 2896
18:00:43.819748 IP 10.0.0.1.42621 > 10.0.0.2.5001: Flags [.], seq 524176:527072, ack 1, win 58, options [nop,nop,TS val 28020963 ecr 28020962], length 2896
18:00:43.822776 IP 10.0.0.1.42621 > 10.0.0.2.5001: Flags [.], seq 527072:529968, ack 1, win 58, options [nop,nop,TS val 28020964 ecr 28020963], length 2896
18:00:43.825804 IP 10.0.0.1.42621 > 10.0.0.2.5001: Flags [.], seq 529968:532864, ack 1, win 58, options [nop,nop,TS val 28020965 ecr 28020964], length 2896
18:00:43.828832 IP 10.0.0.1.42621 > 10.0.0.2.5001: Flags [.], seq 532864:535760, ack 1, win 58, options [nop,nop,TS val 28020965 ecr 28020965], length 2896
18:00:43.831860 IP 10.0.0.1.42621 > 10.0.0.2.5001: Flags [.], seq 535760:538656, ack 1, win 58, options [nop,nop,TS val 28020966 ecr 28020965], length 2896
18:00:43.834888 IP 10.0.0.1.42621 > 10.0.0.2.5001: Flags [.], seq 538656:541552, ack 1, win 58, options [nop,nop,TS val 28020967 ecr 28020966], length 2896
18:00:43.837917 IP 10.0.0.1.42621 > 10.0.0.2.5001: Flags [.], seq 541552:544448, ack 1, win 58, options [nop,nop,TS val 28020968 ecr 28020967], length 2896
18:00:43.840944 IP 10.0.0.1.42621 > 10.0.0.2.5001: Flags [.], seq 544448:547344, ack 1, win 58, options [nop,nop,TS val 28020968 ecr 28020968], length 2896
18:00:43.843972 IP 10.0.0.1.42621 > 10.0.0.2.5001: Flags [.], seq 547344:550240, ack 1, win 58, options [nop,nop,TS val 28020969 ecr 28020968], length 2896
18:00:43.847000 IP 10.0.0.1.42621 > 10.0.0.2.5001: Flags [.], seq 550240:553136, ack 1, win 58, options [nop,nop,TS val 28020970 ecr 28020969], length 2896
18:00:43.850028 IP 10.0.0.1.42621 > 10.0.0.2.5001: Flags [.], seq 553136:556032, ack 1, win 58, options [nop,nop,TS val 28020971 ecr 28020970], length 2896
18:00:43.853056 IP 10.0.0.1.42621 > 10.0.0.2.5001: Flags [.], seq 556032:558928, ack 1, win 58, options [nop,nop,TS val 28020971 ecr 28020971], length 2896
18:00:43.856084 IP 10.0.0.1.42621 > 10.0.0.2.5001: Flags [.], seq 558928:561824, ack 1, win 58, options [nop,nop,TS val 28020972 ecr 28020971], length 2896
18:00:43.859112 IP 10.0.0.1.42621 > 10.0.0.2.5001: Flags [.], seq 561824:564720, ack 1, win 58, options [nop,nop,TS val 28020973 ecr 28020972], length 2896
18:00:43.862140 IP 10.0.0.1.42621 > 10.0.0.2.5001: Flags [.], seq 564720:567616, ack 1, win 58, options [nop,nop,TS val 28020974 ecr 28020973], length 2896
18:00:43.865168 IP 10.0.0.1.42621 > 10.0.0.2.5001: Flags [.], seq 567616:570512, ack 1, win 58, options [nop,nop,TS val 28020974 ecr 28020974], length 2896
18:00:43.868199 IP 10.0.0.1.42621 > 10.0.0.2.5001: Flags [.], seq 570512:573408, ack 1, win 58, options [nop,nop,TS val 28020975 ecr 28020974], length 2896
18:00:43.871228 IP 10.0.0.1.42621 > 10.0.0.2.5001: Flags [.], seq 573408:576304, ack 1, win 58, options [nop,nop,TS val 28020976 ecr 28020975], length 2896
18:00:43.874254 IP 10.0.0.1.42621 > 10.0.0.2.5001: Flags [.], seq 576304:579200, ack 1, win 58, options [nop,nop,TS val 28020977 ecr 28020976], length 2896
18:00:43.877713 IP 10.0.0.1.42621 > 10.0.0.2.5001: Flags [.], seq 579200:582096, ack 1, win 58, options [nop,nop,TS val 28020977 ecr 28020977], length 2896
18:00:43.881173 IP 10.0.0.1.42621 > 10.0.0.2.5001: Flags [.], seq 582096:584992, ack 1, win 58, options [nop,nop,TS val 28020978 ecr 28020977], length 2896
18:00:43.884634 IP 10.0.0.1.42621 > 10.0.0.2.5001: Flags [.], seq 584992:587888, ack 1, win 58, options [nop,nop,TS val 28020979 ecr 28020978], length 2896
18:00:43.888095 IP 10.0.0.1.42621 > 10.0.0.2.5001: Flags [.], seq 587888:590784, ack 1, win 58, options [nop,nop,TS val 28020980 ecr 28020979], length 2896
18:00:43.891555 IP 10.0.0.1.42621 > 10.0.0.2.5001: Flags [.], seq 590784:593680, ack 1, win 58, options [nop,nop,TS val 28020981 ecr 28020980], length 2896
18:00:43.895016 IP 10.0.0.1.42621 > 10.0.0.2.5001: Flags [.], seq 593680:596576, ack 1, win 58, options [nop,nop,TS val 28020981 ecr 28020981], length 2896
18:00:43.898477 IP 10.0.0.1.42621 > 10.0.0.2.5001: Flags [.], seq 596576:599472, ack 1, win 58, options [nop,nop,TS val 28020982 ecr 28020981], length 2896
18:00:43.901937 IP 10.0.0.1.42621 > 10.0.0.2.5001: Flags [.], seq 599472:602368, ack 1, win 58, options [nop,nop,TS val 28020983 ecr 28020982], length 2896
18:00:43.905397 IP 10.0.0.1.42621 > 10.0.0.2.5001: Flags [.], seq 602368:605264, ack 1, win 58, options [nop,nop,TS val 28020984 ecr 28020983], length 2896
18:00:43.908858 IP 10.0.0.1.42621 > 10.0.0.2.5001: Flags [.], seq 605264:608160, ack 1, win 58, options [nop,nop,TS val 28020984 ecr 28020984], length 2896
18:00:43.912319 IP 10.0.0.1.42621 > 10.0.0.2.5001: Flags [.], seq 608160:611056, ack 1, win 58, options [nop,nop,TS val 28020985 ecr 28020984], length 2896
18:00:43.915779 IP 10.0.0.1.42621 > 10.0.0.2.5001: Flags [.], seq 611056:613952, ack 1, win 58, options [nop,nop,TS val 28020986 ecr 28020985], length 2896
18:00:43.919240 IP 10.0.0.1.42621 > 10.0.0.2.5001: Flags [.], seq 613952:616848, ack 1, win 58, options [nop,nop,TS val 28020987 ecr 28020986], length 2896
18:00:43.922700 IP 10.0.0.1.42621 > 10.0.0.2.5001: Flags [P.], seq 616848:619744, ack 1, win 58, options [nop,nop,TS val 28020987 ecr 28020987], length 2896
18:00:43.926161 IP 10.0.0.1.42621 > 10.0.0.2.5001: Flags [.], seq 619744:622640, ack 1, win 58, options [nop,nop,TS val 28020988 ecr 28020987], length 2896
18:00:43.929621 IP 10.0.0.1.42621 > 10.0.0.2.5001: Flags [.], seq 622640:625536, ack 1, win 58, options [nop,nop,TS val 28020989 ecr 28020988], length 2896
18:00:43.933082 IP 10.0.0.1.42621 > 10.0.0.2.5001: Flags [.], seq 625536:628432, ack 1, win 58, options [nop,nop,TS val 28020990 ecr 28020989], length 2896
18:00:43.936543 IP 10.0.0.1.42621 > 10.0.0.2.5001: Flags [.], seq 628432:631328, ack 1, win 58, options [nop,nop,TS val 28020990 ecr 28020990], length 2896
18:00:43.940003 IP 10.0.0.1.42621 > 10.0.0.2.5001: Flags [.], seq 631328:634224, ack 1, win 58, options [nop,nop,TS val 28020991 ecr 28020990], length 2896
18:00:43.943464 IP 10.0.0.1.42621 > 10.0.0.2.5001: Flags [.], seq 634224:637120, ack 1, win 58, options [nop,nop,TS val 28020992 ecr 28020991], length 2896
18:00:43.946924 IP 10.0.0.1.42621 > 10.0.0.2.5001: Flags [.], seq 637120:640016, ack 1, win 58, options [nop,nop,TS val 28020993 ecr 28020992], length 2896
18:00:43.950385 IP 10.0.0.1.42621 > 10.0.0.2.5001: Flags [.], seq 640016:642912, ack 1, win 58, options [nop,nop,TS val 28020993 ecr 28020993], length 2896
18:00:43.953845 IP 10.0.0.1.42621 > 10.0.0.2.5001: Flags [.], seq 642912:645808, ack 1, win 58, options [nop,nop,TS val 28020994 ecr 28020993], length 2896
18:00:43.957306 IP 10.0.0.1.42621 > 10.0.0.2.5001: Flags [.], seq 645808:648704, ack 1, win 58, options [nop,nop,TS val 28020995 ecr 28020994], length 2896
18:00:43.960949 IP 10.0.0.1.42621 > 10.0.0.2.5001: Flags [.], seq 648704:651600, ack 1, win 58, options [nop,nop,TS val 28020996 ecr 28020995], length 2896
18:00:43.964410 IP 10.0.0.1.42621 > 10.0.0.2.5001: Flags [.], seq 651600:654496, ack 1, win 58, options [nop,nop,TS val 28020996 ecr 28020996], length 2896
18:00:43.967870 IP 10.0.0.1.42621 > 10.0.0.2.5001: Flags [.], seq 654496:657392, ack 1, win 58, options [nop,nop,TS val 28020997 ecr 28020996], length 2896
18:00:43.971331 IP 10.0.0.1.42621 > 10.0.0.2.5001: Flags [.], seq 657392:660288, ack 1, win 58, options [nop,nop,TS val 28020998 ecr 28020997], length 2896
18:00:43.974792 IP 10.0.0.1.42621 > 10.0.0.2.5001: Flags [.], seq 660288:663184, ack 1, win 58, options [nop,nop,TS val 28020999 ecr 28020998], length 2896
18:00:43.978252 IP 10.0.0.1.42621 > 10.0.0.2.5001: Flags [.], seq 663184:666080, ack 1, win 58, options [nop,nop,TS val 28020999 ecr 28020999], length 2896
18:00:43.981713 IP 10.0.0.1.42621 > 10.0.0.2.5001: Flags [.], seq 666080:668976, ack 1, win 58, options [nop,nop,TS val 28021000 ecr 28020999], length 2896
18:00:43.985173 IP 10.0.0.1.42621 > 10.0.0.2.5001: Flags [.], seq 668976:671872, ack 1, win 58, options [nop,nop,TS val 28021001 ecr 28021000], length 2896
18:00:43.988634 IP 10.0.0.1.42621 > 10.0.0.2.5001: Flags [.], seq 671872:674768, ack 1, win 58, options [nop,nop,TS val 28021002 ecr 28021001], length 2896
18:00:43.992094 IP 10.0.0.1.42621 > 10.0.0.2.5001: Flags [.], seq 674768:677664, ack 1, win 58, options [nop,nop,TS val 28021002 ecr 28021002], length 2896
18:00:43.995555 IP 10.0.0.1.42621 > 10.0.0.2.5001: Flags [.], seq 677664:680560, ack 1, win 58, options [nop,nop,TS val 28021003 ecr 28021002], length 2896
18:00:43.999016 IP 10.0.0.1.42621 > 10.0.0.2.5001: Flags [.], seq 680560:683456, ack 1, win 58, options [nop,nop,TS val 28021004 ecr 28021003], length 2896
18:00:44.002476 IP 10.0.0.1.42621 > 10.0.0.2.5001: Flags [.], seq 683456:686352, ack 1, win 58, options [nop,nop,TS val 28021005 ecr 28021004], length 2896
18:00:44.005937 IP 10.0.0.1.42621 > 10.0.0.2.5001: Flags [.], seq 686352:689248, ack 1, win 58, options [nop,nop,TS val 28021006 ecr 28021005], length 2896
18:00:44.009397 IP 10.0.0.1.42621 > 10.0.0.2.5001: Flags [.], seq 689248:692144, ack 1, win 58, options [nop,nop,TS val 28021006 ecr 28021006], length 2896
18:00:44.012858 IP 10.0.0.1.42621 > 10.0.0.2.5001: Flags [.], seq 692144:695040, ack 1, win 58, options [nop,nop,TS val 28021007 ecr 28021006], length 2896
18:00:44.016318 IP 10.0.0.1.42621 > 10.0.0.2.5001: Flags [.], seq 695040:697936, ack 1, win 58, options [nop,nop,TS val 28021008 ecr 28021007], length 2896
18:00:44.019779 IP 10.0.0.1.42621 > 10.0.0.2.5001: Flags [.], seq 697936:700832, ack 1, win 58, options [nop,nop,TS val 28021009 ecr 28021008], length 2896
18:00:44.023240 IP 10.0.0.1.42621 > 10.0.0.2.5001: Flags [.], seq 700832:703728, ack 1, win 58, options [nop,nop,TS val 28021010 ecr 28021009], length 2896
18:00:44.026700 IP 10.0.0.1.42621 > 10.0.0.2.5001: Flags [.], seq 703728:706624, ack 1, win 58, options [nop,nop,TS val 28021011 ecr 28021010], length 2896
18:00:44.030161 IP 10.0.0.1.42621 > 10.0.0.2.5001: Flags [.], seq 706624:709520, ack 1, win 58, options [nop,nop,TS val 28021012 ecr 28021011], length 2896
18:00:44.033621 IP 10.0.0.1.42621 > 10.0.0.2.5001: Flags [.], seq 709520:712416, ack 1, win 58, options [nop,nop,TS val 28021013 ecr 28021012], length 2896
18:00:44.037082 IP 10.0.0.1.42621 > 10.0.0.2.5001: Flags [.], seq 712416:715312, ack 1, win 58, options [nop,nop,TS val 28021013 ecr 28021013], length 2896
18:00:44.040542 IP 10.0.0.1.42621 > 10.0.0.2.5001: Flags [.], seq 715312:718208, ack 1, win 58, options [nop,nop,TS val 28021014 ecr 28021013], length 2896
18:00:44.044003 IP 10.0.0.1.42621 > 10.0.0.2.5001: Flags [.], seq 718208:721104, ack 1, win 58, options [nop,nop,TS val 28021015 ecr 28021014], length 2896
18:00:44.047464 IP 10.0.0.1.42621 > 10.0.0.2.5001: Flags [.], seq 721104:724000, ack 1, win 58, options [nop,nop,TS val 28021016 ecr 28021015], length 2896
18:00:44.050924 IP 10.0.0.1.42621 > 10.0.0.2.5001: Flags [.], seq 724000:726896, ack 1, win 58, options [nop,nop,TS val 28021017 ecr 28021016], length 2896
18:00:44.054385 IP 10.0.0.1.42621 > 10.0.0.2.5001: Flags [.], seq 726896:729792, ack 1, win 58, options [nop,nop,TS val 28021018 ecr 28021017], length 2896
18:00:44.057845 IP 10.0.0.1.42621 > 10.0.0.2.5001: Flags [.], seq 729792:732688, ack 1, win 58, options [nop,nop,TS val 28021019 ecr 28021018], length 2896
18:00:44.061306 IP 10.0.0.1.42621 > 10.0.0.2.5001: Flags [.], seq 732688:735584, ack 1, win 58, options [nop,nop,TS val 28021019 ecr 28021019], length 2896
18:00:44.064766 IP 10.0.0.1.42621 > 10.0.0.2.5001: Flags [.], seq 735584:738480, ack 1, win 58, options [nop,nop,TS val 28021020 ecr 28021020], length 2896
18:00:44.068227 IP 10.0.0.1.42621 > 10.0.0.2.5001: Flags [.], seq 738480:741376, ack 1, win 58, options [nop,nop,TS val 28021021 ecr 28021020], length 2896
