17:48:25.910994 IP 10.0.0.1.41848 > 10.0.0.2.5001: Flags [.], seq 3574583819:3574586715, ack 2860355411, win 58, options [nop,nop,TS val 27836492 ecr 27836491], length 2896
17:48:25.913415 IP 10.0.0.1.41848 > 10.0.0.2.5001: Flags [.], seq 2896:5792, ack 1, win 58, options [nop,nop,TS val 27836492 ecr 27836492], length 2896
17:48:25.915837 IP 10.0.0.1.41848 > 10.0.0.2.5001: Flags [.], seq 5792:8688, ack 1, win 58, options [nop,nop,TS val 27836493 ecr 27836492], length 2896
17:48:25.918270 IP 10.0.0.1.41848 > 10.0.0.2.5001: Flags [.], seq 8688:11584, ack 1, win 58, options [nop,nop,TS val 27836493 ecr 27836493], length 2896
17:48:25.920682 IP 10.0.0.1.41848 > 10.0.0.2.5001: Flags [.], seq 11584:14480, ack 1, win 58, options [nop,nop,TS val 27836494 ecr 27836493], length 2896
17:48:25.923114 IP 10.0.0.1.41848 > 10.0.0.2.5001: Flags [.], seq 14480:17376, ack 1, win 58, options [nop,nop,TS val 27836495 ecr 27836494], length 2896
17:48:25.925526 IP 10.0.0.1.41848 > 10.0.0.2.5001: Flags [P.], seq 17376:20272, ack 1, win 58, options [nop,nop,TS val 27836495 ecr 27836495], length 2896
17:48:25.927948 IP 10.0.0.1.41848 > 10.0.0.2.5001: Flags [.], seq 20272:23168, ack 1, win 58, options [nop,nop,TS val 27836496 ecr 27836495], length 2896
17:48:25.930371 IP 10.0.0.1.41848 > 10.0.0.2.5001: Flags [.], seq 23168:26064, ack 1, win 58, options [nop,nop,TS val 27836496 ecr 27836495], length 2896
17:48:25.932793 IP 10.0.0.1.41848 > 10.0.0.2.5001: Flags [.], seq 26064:28960, ack 1, win 58, options [nop,nop,TS val 27836497 ecr 27836495], length 2896
17:48:25.935216 IP 10.0.0.1.41848 > 10.0.0.2.5001: Flags [.], seq 28960:31856, ack 1, win 58, options [nop,nop,TS val 27836498 ecr 27836497], length 2896
17:48:25.937638 IP 10.0.0.1.41848 > 10.0.0.2.5001: Flags [.], seq 31856:34752, ack 1, win 58, options [nop,nop,TS val 27836498 ecr 27836498], length 2896
17:48:25.940060 IP 10.0.0.1.41848 > 10.0.0.2.5001: Flags [.], seq 34752:37648, ack 1, win 58, options [nop,nop,TS val 27836499 ecr 27836498], length 2896
17:48:25.942483 IP 10.0.0.1.41848 > 10.0.0.2.5001: Flags [.], seq 37648:40544, ack 1, win 58, options [nop,nop,TS val 27836499 ecr 27836499], length 2896
17:48:25.944905 IP 10.0.0.1.41848 > 10.0.0.2.5001: Flags [.], seq 40544:43440, ack 1, win 58, options [nop,nop,TS val 27836500 ecr 27836499], length 2896
17:48:25.947328 IP 10.0.0.1.41848 > 10.0.0.2.5001: Flags [.], seq 43440:46336, ack 1, win 58, options [nop,nop,TS val 27836501 ecr 27836500], length 2896
17:48:25.949750 IP 10.0.0.1.41848 > 10.0.0.2.5001: Flags [.], seq 46336:49232, ack 1, win 58, options [nop,nop,TS val 27836501 ecr 27836501], length 2896
17:48:25.952172 IP 10.0.0.1.41848 > 10.0.0.2.5001: Flags [.], seq 49232:52128, ack 1, win 58, options [nop,nop,TS val 27836502 ecr 27836501], length 2896
17:48:25.954595 IP 10.0.0.1.41848 > 10.0.0.2.5001: Flags [P.], seq 52128:55024, ack 1, win 58, options [nop,nop,TS val 27836502 ecr 27836502], length 2896
17:48:25.957017 IP 10.0.0.1.41848 > 10.0.0.2.5001: Flags [.], seq 55024:57920, ack 1, win 58, options [nop,nop,TS val 27836503 ecr 27836502], length 2896
17:48:25.959440 IP 10.0.0.1.41848 > 10.0.0.2.5001: Flags [.], seq 57920:60816, ack 1, win 58, options [nop,nop,TS val 27836504 ecr 27836503], length 2896
17:48:25.961862 IP 10.0.0.1.41848 > 10.0.0.2.5001: Flags [.], seq 60816:63712, ack 1, win 58, options [nop,nop,TS val 27836504 ecr 27836504], length 2896
17:48:25.964285 IP 10.0.0.1.41848 > 10.0.0.2.5001: Flags [.], seq 63712:66608, ack 1, win 58, options [nop,nop,TS val 27836505 ecr 27836504], length 2896
17:48:25.966707 IP 10.0.0.1.41848 > 10.0.0.2.5001: Flags [.], seq 66608:69504, ack 1, win 58, options [nop,nop,TS val 27836505 ecr 27836505], length 2896
17:48:25.969129 IP 10.0.0.1.41848 > 10.0.0.2.5001: Flags [.], seq 69504:72400, ack 1, win 58, options [nop,nop,TS val 27836506 ecr 27836505], length 2896
17:48:25.971552 IP 10.0.0.1.41848 > 10.0.0.2.5001: Flags [.], seq 72400:75296, ack 1, win 58, options [nop,nop,TS val 27836507 ecr 27836506], length 2896
17:48:25.973974 IP 10.0.0.1.41848 > 10.0.0.2.5001: Flags [.], seq 75296:78192, ack 1, win 58, options [nop,nop,TS val 27836507 ecr 27836507], length 2896
17:48:25.976396 IP 10.0.0.1.41848 > 10.0.0.2.5001: Flags [.], seq 78192:81088, ack 1, win 58, options [nop,nop,TS val 27836508 ecr 27836507], length 2896
17:48:25.978819 IP 10.0.0.1.41848 > 10.0.0.2.5001: Flags [.], seq 81088:83984, ack 1, win 58, options [nop,nop,TS val 27836508 ecr 27836508], length 2896
17:48:25.981241 IP 10.0.0.1.41848 > 10.0.0.2.5001: Flags [.], seq 83984:86880, ack 1, win 58, options [nop,nop,TS val 27836509 ecr 27836508], length 2896
17:48:25.983664 IP 10.0.0.1.41848 > 10.0.0.2.5001: Flags [.], seq 86880:89776, ack 1, win 58, options [nop,nop,TS val 27836510 ecr 27836509], length 2896
17:48:25.986086 IP 10.0.0.1.41848 > 10.0.0.2.5001: Flags [.], seq 89776:92672, ack 1, win 58, options [nop,nop,TS val 27836510 ecr 27836510], length 2896
17:48:25.988508 IP 10.0.0.1.41848 > 10.0.0.2.5001: Flags [.], seq 92672:95568, ack 1, win 58, options [nop,nop,TS val 27836511 ecr 27836510], length 2896
17:48:25.990931 IP 10.0.0.1.41848 > 10.0.0.2.5001: Flags [.], seq 95568:98464, ack 1, win 58, options [nop,nop,TS val 27836511 ecr 27836511], length 2896
17:48:25.993353 IP 10.0.0.1.41848 > 10.0.0.2.5001: Flags [.], seq 98464:101360, ack 1, win 58, options [nop,nop,TS val 27836512 ecr 27836511], length 2896
17:48:25.995776 IP 10.0.0.1.41848 > 10.0.0.2.5001: Flags [.], seq 101360:104256, ack 1, win 58, options [nop,nop,TS val 27836513 ecr 27836512], length 2896
17:48:25.998198 IP 10.0.0.1.41848 > 10.0.0.2.5001: Flags [.], seq 104256:107152, ack 1, win 58, options [nop,nop,TS val 27836513 ecr 27836513], length 2896
17:48:26.000620 IP 10.0.0.1.41848 > 10.0.0.2.5001: Flags [.], seq 107152:110048, ack 1, win 58, options [nop,nop,TS val 27836514 ecr 27836513], length 2896
17:48:26.003043 IP 10.0.0.1.41848 > 10.0.0.2.5001: Flags [.], seq 110048:112944, ack 1, win 58, options [nop,nop,TS val 27836515 ecr 27836514], length 2896
17:48:26.005465 IP 10.0.0.1.41848 > 10.0.0.2.5001: Flags [.], seq 112944:115840, ack 1, win 58, options [nop,nop,TS val 27836515 ecr 27836515], length 2896
17:48:26.007888 IP 10.0.0.1.41848 > 10.0.0.2.5001: Flags [.], seq 115840:118736, ack 1, win 58, options [nop,nop,TS val 27836516 ecr 27836515], length 2896
17:48:26.010310 IP 10.0.0.1.41848 > 10.0.0.2.5001: Flags [.], seq 118736:121632, ack 1, win 58, options [nop,nop,TS val 27836516 ecr 27836516], length 2896
17:48:26.012733 IP 10.0.0.1.41848 > 10.0.0.2.5001: Flags [.], seq 121632:124528, ack 1, win 58, options [nop,nop,TS val 27836517 ecr 27836516], length 2896
17:48:26.015155 IP 10.0.0.1.41848 > 10.0.0.2.5001: Flags [.], seq 124528:127424, ack 1, win 58, options [nop,nop,TS val 27836518 ecr 27836517], length 2896
17:48:26.017577 IP 10.0.0.1.41848 > 10.0.0.2.5001: Flags [.], seq 127424:130320, ack 1, win 58, options [nop,nop,TS val 27836518 ecr 27836518], length 2896
17:48:26.020003 IP 10.0.0.1.41848 > 10.0.0.2.5001: Flags [.], seq 130320:133216, ack 1, win 58, options [nop,nop,TS val 27836519 ecr 27836518], length 2896
17:48:26.022426 IP 10.0.0.1.41848 > 10.0.0.2.5001: Flags [.], seq 133216:136112, ack 1, win 58, options [nop,nop,TS val 27836519 ecr 27836519], length 2896
17:48:26.024845 IP 10.0.0.1.41848 > 10.0.0.2.5001: Flags [.], seq 136112:139008, ack 1, win 58, options [nop,nop,TS val 27836520 ecr 27836519], length 2896
17:48:26.027268 IP 10.0.0.1.41848 > 10.0.0.2.5001: Flags [.], seq 139008:141904, ack 1, win 58, options [nop,nop,TS val 27836521 ecr 27836520], length 2896
17:48:26.029702 IP 10.0.0.1.41848 > 10.0.0.2.5001: Flags [.], seq 141904:144800, ack 1, win 58, options [nop,nop,TS val 27836521 ecr 27836521], length 2896
17:48:26.032123 IP 10.0.0.1.41848 > 10.0.0.2.5001: Flags [.], seq 144800:147696, ack 1, win 58, options [nop,nop,TS val 27836522 ecr 27836521], length 2896
17:48:26.034535 IP 10.0.0.1.41848 > 10.0.0.2.5001: Flags [.], seq 147696:150592, ack 1, win 58, options [nop,nop,TS val 27836522 ecr 27836522], length 2896
17:48:26.036957 IP 10.0.0.1.41848 > 10.0.0.2.5001: Flags [.], seq 150592:153488, ack 1, win 58, options [nop,nop,TS val 27836523 ecr 27836522], length 2896
17:48:26.039380 IP 10.0.0.1.41848 > 10.0.0.2.5001: Flags [.], seq 153488:156384, ack 1, win 58, options [nop,nop,TS val 27836524 ecr 27836523], length 2896
17:48:26.041802 IP 10.0.0.1.41848 > 10.0.0.2.5001: Flags [.], seq 156384:159280, ack 1, win 58, options [nop,nop,TS val 27836524 ecr 27836524], length 2896
17:48:26.044224 IP 10.0.0.1.41848 > 10.0.0.2.5001: Flags [.], seq 159280:162176, ack 1, win 58, options [nop,nop,TS val 27836525 ecr 27836524], length 2896
17:48:26.046647 IP 10.0.0.1.41848 > 10.0.0.2.5001: Flags [.], seq 162176:165072, ack 1, win 58, options [nop,nop,TS val 27836525 ecr 27836525], length 2896
17:48:26.049069 IP 10.0.0.1.41848 > 10.0.0.2.5001: Flags [.], seq 165072:167968, ack 1, win 58, options [nop,nop,TS val 27836526 ecr 27836525], length 2896
17:48:26.051491 IP 10.0.0.1.41848 > 10.0.0.2.5001: Flags [.], seq 167968:170864, ack 1, win 58, options [nop,nop,TS val 27836527 ecr 27836526], length 2896
17:48:26.053914 IP 10.0.0.1.41848 > 10.0.0.2.5001: Flags [.], seq 170864:173760, ack 1, win 58, options [nop,nop,TS val 27836527 ecr 27836527], length 2896
17:48:26.056336 IP 10.0.0.1.41848 > 10.0.0.2.5001: Flags [.], seq 173760:176656, ack 1, win 58, options [nop,nop,TS val 27836528 ecr 27836527], length 2896
17:48:26.058759 IP 10.0.0.1.41848 > 10.0.0.2.5001: Flags [.], seq 176656:179552, ack 1, win 58, options [nop,nop,TS val 27836528 ecr 27836528], length 2896
17:48:26.061181 IP 10.0.0.1.41848 > 10.0.0.2.5001: Flags [.], seq 179552:182448, ack 1, win 58, options [nop,nop,TS val 27836529 ecr 27836528], length 2896
17:48:26.063603 IP 10.0.0.1.41848 > 10.0.0.2.5001: Flags [.], seq 182448:185344, ack 1, win 58, options [nop,nop,TS val 27836530 ecr 27836529], length 2896
17:48:26.066026 IP 10.0.0.1.41848 > 10.0.0.2.5001: Flags [.], seq 185344:188240, ack 1, win 58, options [nop,nop,TS val 27836530 ecr 27836530], length 2896
17:48:26.068448 IP 10.0.0.1.41848 > 10.0.0.2.5001: Flags [.], seq 188240:191136, ack 1, win 58, options [nop,nop,TS val 27836531 ecr 27836530], length 2896
17:48:26.070871 IP 10.0.0.1.41848 > 10.0.0.2.5001: Flags [.], seq 191136:194032, ack 1, win 58, options [nop,nop,TS val 27836531 ecr 27836531], length 2896
17:48:26.073293 IP 10.0.0.1.41848 > 10.0.0.2.5001: Flags [.], seq 194032:196928, ack 1, win 58, options [nop,nop,TS val 27836532 ecr 27836531], length 2896
17:48:26.075715 IP 10.0.0.1.41848 > 10.0.0.2.5001: Flags [.], seq 196928:199824, ack 1, win 58, options [nop,nop,TS val 27836533 ecr 27836532], length 2896
17:48:26.078138 IP 10.0.0.1.41848 > 10.0.0.2.5001: Flags [.], seq 199824:202720, ack 1, win 58, options [nop,nop,TS val 27836533 ecr 27836533], length 2896
17:48:26.080560 IP 10.0.0.1.41848 > 10.0.0.2.5001: Flags [.], seq 202720:205616, ack 1, win 58, options [nop,nop,TS val 27836534 ecr 27836533], length 2896
17:48:26.082983 IP 10.0.0.1.41848 > 10.0.0.2.5001: Flags [.], seq 205616:208512, ack 1, win 58, options [nop,nop,TS val 27836535 ecr 27836534], length 2896
17:48:26.085405 IP 10.0.0.1.41848 > 10.0.0.2.5001: Flags [.], seq 208512:211408, ack 1, win 58, options [nop,nop,TS val 27836535 ecr 27836535], length 2896
17:48:26.087828 IP 10.0.0.1.41848 > 10.0.0.2.5001: Flags [P.], seq 211408:214304, ack 1, win 58, options [nop,nop,TS val 27836536 ecr 27836535], length 2896
17:48:26.090250 IP 10.0.0.1.41848 > 10.0.0.2.5001: Flags [.], seq 214304:217200, ack 1, win 58, options [nop,nop,TS val 27836536 ecr 27836536], length 2896
17:48:26.092672 IP 10.0.0.1.41848 > 10.0.0.2.5001: Flags [.], seq 217200:220096, ack 1, win 58, options [nop,nop,TS val 27836537 ecr 27836536], length 2896
17:48:26.095095 IP 10.0.0.1.41848 > 10.0.0.2.5001: Flags [.], seq 220096:222992, ack 1, win 58, options [nop,nop,TS val 27836538 ecr 27836537], length 2896
17:48:26.097517 IP 10.0.0.1.41848 > 10.0.0.2.5001: Flags [.], seq 222992:225888, ack 1, win 58, options [nop,nop,TS val 27836538 ecr 27836538], length 2896
17:48:26.099940 IP 10.0.0.1.41848 > 10.0.0.2.5001: Flags [.], seq 225888:228784, ack 1, win 58, options [nop,nop,TS val 27836539 ecr 27836538], length 2896
17:48:26.102362 IP 10.0.0.1.41848 > 10.0.0.2.5001: Flags [.], seq 228784:231680, ack 1, win 58, options [nop,nop,TS val 27836539 ecr 27836539], length 2896
17:48:26.104784 IP 10.0.0.1.41848 > 10.0.0.2.5001: Flags [.], seq 231680:234576, ack 1, win 58, options [nop,nop,TS val 27836540 ecr 27836539], length 2896
17:48:26.107207 IP 10.0.0.1.41848 > 10.0.0.2.5001: Flags [.], seq 234576:237472, ack 1, win 58, options [nop,nop,TS val 27836541 ecr 27836540], length 2896
17:48:26.109629 IP 10.0.0.1.41848 > 10.0.0.2.5001: Flags [.], seq 237472:240368, ack 1, win 58, options [nop,nop,TS val 27836541 ecr 27836541], length 2896
17:48:26.112052 IP 10.0.0.1.41848 > 10.0.0.2.5001: Flags [.], seq 240368:243264, ack 1, win 58, options [nop,nop,TS val 27836542 ecr 27836541], length 2896
17:48:26.114474 IP 10.0.0.1.41848 > 10.0.0.2.5001: Flags [.], seq 243264:246160, ack 1, win 58, options [nop,nop,TS val 27836542 ecr 27836542], length 2896
17:48:26.116896 IP 10.0.0.1.41848 > 10.0.0.2.5001: Flags [.], seq 246160:249056, ack 1, win 58, options [nop,nop,TS val 27836543 ecr 27836542], length 2896
17:48:26.119320 IP 10.0.0.1.41848 > 10.0.0.2.5001: Flags [.], seq 249056:251952, ack 1, win 58, options [nop,nop,TS val 27836544 ecr 27836543], length 2896
17:48:26.121741 IP 10.0.0.1.41848 > 10.0.0.2.5001: Flags [.], seq 251952:254848, ack 1, win 58, options [nop,nop,TS val 27836544 ecr 27836544], length 2896
17:48:26.124164 IP 10.0.0.1.41848 > 10.0.0.2.5001: Flags [.], seq 254848:257744, ack 1, win 58, options [nop,nop,TS val 27836545 ecr 27836544], length 2896
17:48:26.126586 IP 10.0.0.1.41848 > 10.0.0.2.5001: Flags [.], seq 257744:260640, ack 1, win 58, options [nop,nop,TS val 27836545 ecr 27836545], length 2896
17:48:26.129008 IP 10.0.0.1.41848 > 10.0.0.2.5001: Flags [.], seq 260640:263536, ack 1, win 58, options [nop,nop,TS val 27836546 ecr 27836545], length 2896
17:48:26.131431 IP 10.0.0.1.41848 > 10.0.0.2.5001: Flags [.], seq 263536:266432, ack 1, win 58, options [nop,nop,TS val 27836547 ecr 27836546], length 2896
17:48:26.133855 IP 10.0.0.1.41848 > 10.0.0.2.5001: Flags [.], seq 266432:269328, ack 1, win 58, options [nop,nop,TS val 27836547 ecr 27836547], length 2896
17:48:26.136276 IP 10.0.0.1.41848 > 10.0.0.2.5001: Flags [.], seq 269328:272224, ack 1, win 58, options [nop,nop,TS val 27836548 ecr 27836547], length 2896
17:48:26.138698 IP 10.0.0.1.41848 > 10.0.0.2.5001: Flags [.], seq 272224:275120, ack 1, win 58, options [nop,nop,TS val 27836548 ecr 27836548], length 2896
17:48:26.141120 IP 10.0.0.1.41848 > 10.0.0.2.5001: Flags [.], seq 275120:278016, ack 1, win 58, options [nop,nop,TS val 27836549 ecr 27836548], length 2896
17:48:26.143543 IP 10.0.0.1.41848 > 10.0.0.2.5001: Flags [.], seq 278016:280912, ack 1, win 58, options [nop,nop,TS val 27836550 ecr 27836549], length 2896
17:48:26.145965 IP 10.0.0.1.41848 > 10.0.0.2.5001: Flags [.], seq 280912:283808, ack 1, win 58, options [nop,nop,TS val 27836550 ecr 27836550], length 2896
17:48:26.148387 IP 10.0.0.1.41848 > 10.0.0.2.5001: Flags [.], seq 283808:286704, ack 1, win 58, options [nop,nop,TS val 27836551 ecr 27836550], length 2896
17:48:26.150810 IP 10.0.0.1.41848 > 10.0.0.2.5001: Flags [.], seq 286704:289600, ack 1, win 58, options [nop,nop,TS val 27836551 ecr 27836551], length 2896
17:48:26.153232 IP 10.0.0.1.41848 > 10.0.0.2.5001: Flags [.], seq 289600:292496, ack 1, win 58, options [nop,nop,TS val 27836552 ecr 27836551], length 2896
17:48:26.155655 IP 10.0.0.1.41848 > 10.0.0.2.5001: Flags [.], seq 292496:295392, ack 1, win 58, options [nop,nop,TS val 27836553 ecr 27836552], length 2896
17:48:26.158077 IP 10.0.0.1.41848 > 10.0.0.2.5001: Flags [.], seq 295392:298288, ack 1, win 58, options [nop,nop,TS val 27836553 ecr 27836553], length 2896
17:48:26.160500 IP 10.0.0.1.41848 > 10.0.0.2.5001: Flags [.], seq 298288:301184, ack 1, win 58, options [nop,nop,TS val 27836554 ecr 27836553], length 2896
17:48:26.162922 IP 10.0.0.1.41848 > 10.0.0.2.5001: Flags [.], seq 301184:304080, ack 1, win 58, options [nop,nop,TS val 27836554 ecr 27836554], length 2896
17:48:26.165347 IP 10.0.0.1.41848 > 10.0.0.2.5001: Flags [.], seq 304080:306976, ack 1, win 58, options [nop,nop,TS val 27836555 ecr 27836554], length 2896
17:48:26.167769 IP 10.0.0.1.41848 > 10.0.0.2.5001: Flags [.], seq 306976:309872, ack 1, win 58, options [nop,nop,TS val 27836556 ecr 27836555], length 2896
17:48:26.170191 IP 10.0.0.1.41848 > 10.0.0.2.5001: Flags [.], seq 309872:312768, ack 1, win 58, options [nop,nop,TS val 27836556 ecr 27836556], length 2896
17:48:26.172611 IP 10.0.0.1.41848 > 10.0.0.2.5001: Flags [.], seq 312768:315664, ack 1, win 58, options [nop,nop,TS val 27836557 ecr 27836556], length 2896
17:48:26.175033 IP 10.0.0.1.41848 > 10.0.0.2.5001: Flags [.], seq 315664:318560, ack 1, win 58, options [nop,nop,TS val 27836558 ecr 27836557], length 2896
17:48:26.177456 IP 10.0.0.1.41848 > 10.0.0.2.5001: Flags [.], seq 318560:321456, ack 1, win 58, options [nop,nop,TS val 27836558 ecr 27836558], length 2896
17:48:26.179878 IP 10.0.0.1.41848 > 10.0.0.2.5001: Flags [.], seq 321456:324352, ack 1, win 58, options [nop,nop,TS val 27836559 ecr 27836558], length 2896
17:48:26.182300 IP 10.0.0.1.41848 > 10.0.0.2.5001: Flags [.], seq 324352:327248, ack 1, win 58, options [nop,nop,TS val 27836559 ecr 27836559], length 2896
17:48:26.184723 IP 10.0.0.1.41848 > 10.0.0.2.5001: Flags [.], seq 327248:330144, ack 1, win 58, options [nop,nop,TS val 27836560 ecr 27836559], length 2896
17:48:26.187145 IP 10.0.0.1.41848 > 10.0.0.2.5001: Flags [.], seq 330144:333040, ack 1, win 58, options [nop,nop,TS val 27836561 ecr 27836560], length 2896
17:48:26.189568 IP 10.0.0.1.41848 > 10.0.0.2.5001: Flags [.], seq 333040:335936, ack 1, win 58, options [nop,nop,TS val 27836561 ecr 27836561], length 2896
17:48:26.191990 IP 10.0.0.1.41848 > 10.0.0.2.5001: Flags [.], seq 335936:338832, ack 1, win 58, options [nop,nop,TS val 27836562 ecr 27836561], length 2896
17:48:26.194413 IP 10.0.0.1.41848 > 10.0.0.2.5001: Flags [.], seq 338832:341728, ack 1, win 58, options [nop,nop,TS val 27836562 ecr 27836562], length 2896
17:48:26.196835 IP 10.0.0.1.41848 > 10.0.0.2.5001: Flags [.], seq 341728:344624, ack 1, win 58, options [nop,nop,TS val 27836563 ecr 27836563], length 2896
17:48:26.199257 IP 10.0.0.1.41848 > 10.0.0.2.5001: Flags [.], seq 344624:347520, ack 1, win 58, options [nop,nop,TS val 27836564 ecr 27836563], length 2896
17:48:26.201680 IP 10.0.0.1.41848 > 10.0.0.2.5001: Flags [.], seq 347520:350416, ack 1, win 58, options [nop,nop,TS val 27836564 ecr 27836564], length 2896
17:48:26.204102 IP 10.0.0.1.41848 > 10.0.0.2.5001: Flags [.], seq 350416:353312, ack 1, win 58, options [nop,nop,TS val 27836565 ecr 27836564], length 2896
17:48:26.206524 IP 10.0.0.1.41848 > 10.0.0.2.5001: Flags [.], seq 353312:356208, ack 1, win 58, options [nop,nop,TS val 27836565 ecr 27836565], length 2896
17:48:26.208947 IP 10.0.0.1.41848 > 10.0.0.2.5001: Flags [.], seq 356208:359104, ack 1, win 58, options [nop,nop,TS val 27836566 ecr 27836565], length 2896
17:48:26.211369 IP 10.0.0.1.41848 > 10.0.0.2.5001: Flags [.], seq 359104:362000, ack 1, win 58, options [nop,nop,TS val 27836567 ecr 27836566], length 2896
17:48:26.213792 IP 10.0.0.1.41848 > 10.0.0.2.5001: Flags [.], seq 362000:364896, ack 1, win 58, options [nop,nop,TS val 27836567 ecr 27836567], length 2896
17:48:26.216214 IP 10.0.0.1.41848 > 10.0.0.2.5001: Flags [.], seq 364896:367792, ack 1, win 58, options [nop,nop,TS val 27836568 ecr 27836567], length 2896
17:48:26.218636 IP 10.0.0.1.41848 > 10.0.0.2.5001: Flags [P.], seq 367792:370688, ack 1, win 58, options [nop,nop,TS val 27836568 ecr 27836568], length 2896
17:48:26.221059 IP 10.0.0.1.41848 > 10.0.0.2.5001: Flags [.], seq 370688:373584, ack 1, win 58, options [nop,nop,TS val 27836569 ecr 27836568], length 2896
17:48:26.223481 IP 10.0.0.1.41848 > 10.0.0.2.5001: Flags [.], seq 373584:376480, ack 1, win 58, options [nop,nop,TS val 27836570 ecr 27836569], length 2896
17:48:26.225904 IP 10.0.0.1.41848 > 10.0.0.2.5001: Flags [.], seq 376480:379376, ack 1, win 58, options [nop,nop,TS val 27836570 ecr 27836570], length 2896
17:48:26.228326 IP 10.0.0.1.41848 > 10.0.0.2.5001: Flags [.], seq 379376:382272, ack 1, win 58, options [nop,nop,TS val 27836571 ecr 27836570], length 2896
17:48:26.230748 IP 10.0.0.1.41848 > 10.0.0.2.5001: Flags [.], seq 382272:385168, ack 1, win 58, options [nop,nop,TS val 27836571 ecr 27836571], length 2896
17:48:26.233171 IP 10.0.0.1.41848 > 10.0.0.2.5001: Flags [.], seq 385168:388064, ack 1, win 58, options [nop,nop,TS val 27836572 ecr 27836571], length 2896
17:48:26.235593 IP 10.0.0.1.41848 > 10.0.0.2.5001: Flags [.], seq 388064:390960, ack 1, win 58, options [nop,nop,TS val 27836573 ecr 27836572], length 2896
17:48:26.238016 IP 10.0.0.1.41848 > 10.0.0.2.5001: Flags [.], seq 390960:393856, ack 1, win 58, options [nop,nop,TS val 27836573 ecr 27836573], length 2896
17:48:26.240438 IP 10.0.0.1.41848 > 10.0.0.2.5001: Flags [.], seq 393856:396752, ack 1, win 58, options [nop,nop,TS val 27836574 ecr 27836573], length 2896
17:48:26.242860 IP 10.0.0.1.41848 > 10.0.0.2.5001: Flags [.], seq 396752:399648, ack 1, win 58, options [nop,nop,TS val 27836574 ecr 27836574], length 2896
17:48:26.245283 IP 10.0.0.1.41848 > 10.0.0.2.5001: Flags [.], seq 399648:402544, ack 1, win 58, options [nop,nop,TS val 27836575 ecr 27836574], length 2896
17:48:26.247705 IP 10.0.0.1.41848 > 10.0.0.2.5001: Flags [.], seq 402544:405440, ack 1, win 58, options [nop,nop,TS val 27836576 ecr 27836575], length 2896
17:48:26.250128 IP 10.0.0.1.41848 > 10.0.0.2.5001: Flags [.], seq 405440:408336, ack 1, win 58, options [nop,nop,TS val 27836576 ecr 27836576], length 2896
17:48:26.252612 IP 10.0.0.1.41848 > 10.0.0.2.5001: Flags [.], seq 408336:411232, ack 1, win 58, options [nop,nop,TS val 27836577 ecr 27836576], length 2896
17:48:26.255035 IP 10.0.0.1.41848 > 10.0.0.2.5001: Flags [.], seq 411232:414128, ack 1, win 58, options [nop,nop,TS val 27836578 ecr 27836577], length 2896
17:48:26.257457 IP 10.0.0.1.41848 > 10.0.0.2.5001: Flags [.], seq 414128:417024, ack 1, win 58, options [nop,nop,TS val 27836578 ecr 27836578], length 2896
17:48:26.259879 IP 10.0.0.1.41848 > 10.0.0.2.5001: Flags [.], seq 417024:419920, ack 1, win 58, options [nop,nop,TS val 27836579 ecr 27836578], length 2896
17:48:26.262302 IP 10.0.0.1.41848 > 10.0.0.2.5001: Flags [.], seq 419920:422816, ack 1, win 58, options [nop,nop,TS val 27836579 ecr 27836579], length 2896
17:48:26.264724 IP 10.0.0.1.41848 > 10.0.0.2.5001: Flags [.], seq 422816:425712, ack 1, win 58, options [nop,nop,TS val 27836580 ecr 27836579], length 2896
17:48:26.267147 IP 10.0.0.1.41848 > 10.0.0.2.5001: Flags [.], seq 425712:428608, ack 1, win 58, options [nop,nop,TS val 27836581 ecr 27836580], length 2896
17:48:26.269569 IP 10.0.0.1.41848 > 10.0.0.2.5001: Flags [.], seq 428608:431504, ack 1, win 58, options [nop,nop,TS val 27836581 ecr 27836581], length 2896
17:48:26.271992 IP 10.0.0.1.41848 > 10.0.0.2.5001: Flags [.], seq 431504:434400, ack 1, win 58, options [nop,nop,TS val 27836582 ecr 27836581], length 2896
17:48:26.274414 IP 10.0.0.1.41848 > 10.0.0.2.5001: Flags [.], seq 434400:437296, ack 1, win 58, options [nop,nop,TS val 27836582 ecr 27836582], length 2896
17:48:26.276837 IP 10.0.0.1.41848 > 10.0.0.2.5001: Flags [.], seq 437296:440192, ack 1, win 58, options [nop,nop,TS val 27836583 ecr 27836582], length 2896
17:48:26.279259 IP 10.0.0.1.41848 > 10.0.0.2.5001: Flags [.], seq 440192:443088, ack 1, win 58, options [nop,nop,TS val 27836584 ecr 27836583], length 2896
17:48:26.281681 IP 10.0.0.1.41848 > 10.0.0.2.5001: Flags [.], seq 443088:445984, ack 1, win 58, options [nop,nop,TS val 27836584 ecr 27836584], length 2896
17:48:26.284104 IP 10.0.0.1.41848 > 10.0.0.2.5001: Flags [.], seq 445984:448880, ack 1, win 58, options [nop,nop,TS val 27836585 ecr 27836584], length 2896
17:48:26.286526 IP 10.0.0.1.41848 > 10.0.0.2.5001: Flags [.], seq 448880:451776, ack 1, win 58, options [nop,nop,TS val 27836585 ecr 27836585], length 2896
17:48:26.288948 IP 10.0.0.1.41848 > 10.0.0.2.5001: Flags [.], seq 451776:454672, ack 1, win 58, options [nop,nop,TS val 27836586 ecr 27836585], length 2896
17:48:26.291371 IP 10.0.0.1.41848 > 10.0.0.2.5001: Flags [.], seq 454672:457568, ack 1, win 58, options [nop,nop,TS val 27836587 ecr 27836586], length 2896
17:48:26.293793 IP 10.0.0.1.41848 > 10.0.0.2.5001: Flags [.], seq 457568:460464, ack 1, win 58, options [nop,nop,TS val 27836587 ecr 27836587], length 2896
17:48:26.296216 IP 10.0.0.1.41848 > 10.0.0.2.5001: Flags [.], seq 460464:463360, ack 1, win 58, options [nop,nop,TS val 27836588 ecr 27836587], length 2896
17:48:26.298638 IP 10.0.0.1.41848 > 10.0.0.2.5001: Flags [.], seq 463360:466256, ack 1, win 58, options [nop,nop,TS val 27836588 ecr 27836588], length 2896
17:48:26.301061 IP 10.0.0.1.41848 > 10.0.0.2.5001: Flags [.], seq 466256:469152, ack 1, win 58, options [nop,nop,TS val 27836589 ecr 27836588], length 2896
17:48:26.303483 IP 10.0.0.1.41848 > 10.0.0.2.5001: Flags [.], seq 469152:472048, ack 1, win 58, options [nop,nop,TS val 27836590 ecr 27836589], length 2896
17:48:26.305905 IP 10.0.0.1.41848 > 10.0.0.2.5001: Flags [.], seq 472048:474944, ack 1, win 58, options [nop,nop,TS val 27836590 ecr 27836590], length 2896
17:48:26.308328 IP 10.0.0.1.41848 > 10.0.0.2.5001: Flags [.], seq 474944:477840, ack 1, win 58, options [nop,nop,TS val 27836591 ecr 27836590], length 2896
17:48:26.310750 IP 10.0.0.1.41848 > 10.0.0.2.5001: Flags [.], seq 477840:480736, ack 1, win 58, options [nop,nop,TS val 27836591 ecr 27836591], length 2896
17:48:26.313173 IP 10.0.0.1.41848 > 10.0.0.2.5001: Flags [.], seq 480736:483632, ack 1, win 58, options [nop,nop,TS val 27836592 ecr 27836591], length 2896
17:48:26.315595 IP 10.0.0.1.41848 > 10.0.0.2.5001: Flags [.], seq 483632:486528, ack 1, win 58, options [nop,nop,TS val 27836593 ecr 27836592], length 2896
17:48:26.318017 IP 10.0.0.1.41848 > 10.0.0.2.5001: Flags [.], seq 486528:489424, ack 1, win 58, options [nop,nop,TS val 27836593 ecr 27836593], length 2896
17:48:26.320440 IP 10.0.0.1.41848 > 10.0.0.2.5001: Flags [.], seq 489424:492320, ack 1, win 58, options [nop,nop,TS val 27836594 ecr 27836593], length 2896
17:48:26.322862 IP 10.0.0.1.41848 > 10.0.0.2.5001: Flags [.], seq 492320:495216, ack 1, win 58, options [nop,nop,TS val 27836594 ecr 27836594], length 2896
17:48:26.325284 IP 10.0.0.1.41848 > 10.0.0.2.5001: Flags [.], seq 495216:498112, ack 1, win 58, options [nop,nop,TS val 27836595 ecr 27836594], length 2896
17:48:26.327707 IP 10.0.0.1.41848 > 10.0.0.2.5001: Flags [.], seq 498112:501008, ack 1, win 58, options [nop,nop,TS val 27836596 ecr 27836595], length 2896
17:48:26.330130 IP 10.0.0.1.41848 > 10.0.0.2.5001: Flags [.], seq 501008:503904, ack 1, win 58, options [nop,nop,TS val 27836596 ecr 27836596], length 2896
17:48:26.332552 IP 10.0.0.1.41848 > 10.0.0.2.5001: Flags [.], seq 503904:506800, ack 1, win 58, options [nop,nop,TS val 27836597 ecr 27836596], length 2896
17:48:26.334974 IP 10.0.0.1.41848 > 10.0.0.2.5001: Flags [.], seq 506800:509696, ack 1, win 58, options [nop,nop,TS val 27836597 ecr 27836597], length 2896
17:48:26.337396 IP 10.0.0.1.41848 > 10.0.0.2.5001: Flags [.], seq 509696:512592, ack 1, win 58, options [nop,nop,TS val 27836598 ecr 27836597], length 2896
17:48:26.339819 IP 10.0.0.1.41848 > 10.0.0.2.5001: Flags [.], seq 512592:515488, ack 1, win 58, options [nop,nop,TS val 27836599 ecr 27836598], length 2896
17:48:26.342242 IP 10.0.0.1.41848 > 10.0.0.2.5001: Flags [.], seq 515488:518384, ack 1, win 58, options [nop,nop,TS val 27836599 ecr 27836599], length 2896
17:48:26.344664 IP 10.0.0.1.41848 > 10.0.0.2.5001: Flags [.], seq 518384:521280, ack 1, win 58, options [nop,nop,TS val 27836600 ecr 27836599], length 2896
17:48:26.347086 IP 10.0.0.1.41848 > 10.0.0.2.5001: Flags [.], seq 521280:524176, ack 1, win 58, options [nop,nop,TS val 27836601 ecr 27836600], length 2896
17:48:26.349508 IP 10.0.0.1.41848 > 10.0.0.2.5001: Flags [P.], seq 524176:527072, ack 1, win 58, options [nop,nop,TS val 27836601 ecr 27836601], length 2896
17:48:26.351931 IP 10.0.0.1.41848 > 10.0.0.2.5001: Flags [.], seq 527072:529968, ack 1, win 58, options [nop,nop,TS val 27836602 ecr 27836601], length 2896
17:48:26.354353 IP 10.0.0.1.41848 > 10.0.0.2.5001: Flags [.], seq 529968:532864, ack 1, win 58, options [nop,nop,TS val 27836602 ecr 27836602], length 2896
17:48:26.356776 IP 10.0.0.1.41848 > 10.0.0.2.5001: Flags [.], seq 532864:535760, ack 1, win 58, options [nop,nop,TS val 27836603 ecr 27836602], length 2896
17:48:26.359198 IP 10.0.0.1.41848 > 10.0.0.2.5001: Flags [.], seq 535760:538656, ack 1, win 58, options [nop,nop,TS val 27836604 ecr 27836603], length 2896
17:48:26.361621 IP 10.0.0.1.41848 > 10.0.0.2.5001: Flags [.], seq 538656:541552, ack 1, win 58, options [nop,nop,TS val 27836604 ecr 27836604], length 2896
17:48:26.364043 IP 10.0.0.1.41848 > 10.0.0.2.5001: Flags [.], seq 541552:544448, ack 1, win 58, options [nop,nop,TS val 27836605 ecr 27836604], length 2896
17:48:26.366465 IP 10.0.0.1.41848 > 10.0.0.2.5001: Flags [.], seq 544448:547344, ack 1, win 58, options [nop,nop,TS val 27836605 ecr 27836605], length 2896
17:48:26.368888 IP 10.0.0.1.41848 > 10.0.0.2.5001: Flags [.], seq 547344:550240, ack 1, win 58, options [nop,nop,TS val 27836606 ecr 27836605], length 2896
17:48:26.371310 IP 10.0.0.1.41848 > 10.0.0.2.5001: Flags [.], seq 550240:553136, ack 1, win 58, options [nop,nop,TS val 27836607 ecr 27836606], length 2896
17:48:26.373734 IP 10.0.0.1.41848 > 10.0.0.2.5001: Flags [.], seq 553136:556032, ack 1, win 58, options [nop,nop,TS val 27836607 ecr 27836607], length 2896
17:48:26.376155 IP 10.0.0.1.41848 > 10.0.0.2.5001: Flags [.], seq 556032:558928, ack 1, win 58, options [nop,nop,TS val 27836608 ecr 27836607], length 2896
17:48:26.378578 IP 10.0.0.1.41848 > 10.0.0.2.5001: Flags [.], seq 558928:561824, ack 1, win 58, options [nop,nop,TS val 27836608 ecr 27836608], length 2896
17:48:26.381001 IP 10.0.0.1.41848 > 10.0.0.2.5001: Flags [.], seq 561824:564720, ack 1, win 58, options [nop,nop,TS val 27836609 ecr 27836608], length 2896
17:48:26.383422 IP 10.0.0.1.41848 > 10.0.0.2.5001: Flags [.], seq 564720:567616, ack 1, win 58, options [nop,nop,TS val 27836610 ecr 27836609], length 2896
17:48:26.385845 IP 10.0.0.1.41848 > 10.0.0.2.5001: Flags [.], seq 567616:570512, ack 1, win 58, options [nop,nop,TS val 27836610 ecr 27836610], length 2896
17:48:26.388268 IP 10.0.0.1.41848 > 10.0.0.2.5001: Flags [.], seq 570512:573408, ack 1, win 58, options [nop,nop,TS val 27836611 ecr 27836610], length 2896
17:48:26.390690 IP 10.0.0.1.41848 > 10.0.0.2.5001: Flags [.], seq 573408:576304, ack 1, win 58, options [nop,nop,TS val 27836611 ecr 27836611], length 2896
17:48:26.393112 IP 10.0.0.1.41848 > 10.0.0.2.5001: Flags [.], seq 576304:579200, ack 1, win 58, options [nop,nop,TS val 27836612 ecr 27836611], length 2896
17:48:26.395538 IP 10.0.0.1.41848 > 10.0.0.2.5001: Flags [.], seq 579200:582096, ack 1, win 58, options [nop,nop,TS val 27836613 ecr 27836612], length 2896
17:48:26.397958 IP 10.0.0.1.41848 > 10.0.0.2.5001: Flags [.], seq 582096:584992, ack 1, win 58, options [nop,nop,TS val 27836613 ecr 27836613], length 2896
17:48:26.400379 IP 10.0.0.1.41848 > 10.0.0.2.5001: Flags [.], seq 584992:587888, ack 1, win 58, options [nop,nop,TS val 27836614 ecr 27836613], length 2896
17:48:26.402802 IP 10.0.0.1.41848 > 10.0.0.2.5001: Flags [.], seq 587888:590784, ack 1, win 58, options [nop,nop,TS val 27836614 ecr 27836614], length 2896
17:48:26.405224 IP 10.0.0.1.41848 > 10.0.0.2.5001: Flags [.], seq 590784:593680, ack 1, win 58, options [nop,nop,TS val 27836615 ecr 27836614], length 2896
17:48:26.407646 IP 10.0.0.1.41848 > 10.0.0.2.5001: Flags [.], seq 593680:596576, ack 1, win 58, options [nop,nop,TS val 27836616 ecr 27836615], length 2896
17:48:26.410068 IP 10.0.0.1.41848 > 10.0.0.2.5001: Flags [.], seq 596576:599472, ack 1, win 58, options [nop,nop,TS val 27836616 ecr 27836616], length 2896
17:48:26.412491 IP 10.0.0.1.41848 > 10.0.0.2.5001: Flags [.], seq 599472:602368, ack 1, win 58, options [nop,nop,TS val 27836617 ecr 27836616], length 2896
17:48:26.414914 IP 10.0.0.1.41848 > 10.0.0.2.5001: Flags [.], seq 602368:605264, ack 1, win 58, options [nop,nop,TS val 27836617 ecr 27836617], length 2896
17:48:26.417336 IP 10.0.0.1.41848 > 10.0.0.2.5001: Flags [.], seq 605264:608160, ack 1, win 58, options [nop,nop,TS val 27836618 ecr 27836617], length 2896
17:48:26.419759 IP 10.0.0.1.41848 > 10.0.0.2.5001: Flags [.], seq 608160:611056, ack 1, win 58, options [nop,nop,TS val 27836619 ecr 27836618], length 2896
17:48:26.422180 IP 10.0.0.1.41848 > 10.0.0.2.5001: Flags [.], seq 611056:613952, ack 1, win 58, options [nop,nop,TS val 27836619 ecr 27836619], length 2896
17:48:26.424603 IP 10.0.0.1.41848 > 10.0.0.2.5001: Flags [.], seq 613952:616848, ack 1, win 58, options [nop,nop,TS val 27836620 ecr 27836619], length 2896
17:48:26.427025 IP 10.0.0.1.41848 > 10.0.0.2.5001: Flags [.], seq 616848:619744, ack 1, win 58, options [nop,nop,TS val 27836621 ecr 27836620], length 2896
17:48:26.429448 IP 10.0.0.1.41848 > 10.0.0.2.5001: Flags [.], seq 619744:622640, ack 1, win 58, options [nop,nop,TS val 27836621 ecr 27836621], length 2896
17:48:26.431870 IP 10.0.0.1.41848 > 10.0.0.2.5001: Flags [.], seq 622640:625536, ack 1, win 58, options [nop,nop,TS val 27836622 ecr 27836621], length 2896
17:48:26.434292 IP 10.0.0.1.41848 > 10.0.0.2.5001: Flags [.], seq 625536:628432, ack 1, win 58, options [nop,nop,TS val 27836622 ecr 27836622], length 2896
17:48:26.436715 IP 10.0.0.1.41848 > 10.0.0.2.5001: Flags [.], seq 628432:631328, ack 1, win 58, options [nop,nop,TS val 27836623 ecr 27836622], length 2896
17:48:26.439137 IP 10.0.0.1.41848 > 10.0.0.2.5001: Flags [.], seq 631328:634224, ack 1, win 58, options [nop,nop,TS val 27836624 ecr 27836623], length 2896
17:48:26.441560 IP 10.0.0.1.41848 > 10.0.0.2.5001: Flags [.], seq 634224:637120, ack 1, win 58, options [nop,nop,TS val 27836624 ecr 27836624], length 2896
17:48:26.443982 IP 10.0.0.1.41848 > 10.0.0.2.5001: Flags [.], seq 637120:640016, ack 1, win 58, options [nop,nop,TS val 27836625 ecr 27836624], length 2896
17:48:26.446404 IP 10.0.0.1.41848 > 10.0.0.2.5001: Flags [.], seq 640016:642912, ack 1, win 58, options [nop,nop,TS val 27836625 ecr 27836625], length 2896
17:48:26.448827 IP 10.0.0.1.41848 > 10.0.0.2.5001: Flags [.], seq 642912:645808, ack 1, win 58, options [nop,nop,TS val 27836626 ecr 27836625], length 2896
17:48:26.451249 IP 10.0.0.1.41848 > 10.0.0.2.5001: Flags [.], seq 645808:648704, ack 1, win 58, options [nop,nop,TS val 27836627 ecr 27836626], length 2896
17:48:26.453672 IP 10.0.0.1.41848 > 10.0.0.2.5001: Flags [.], seq 648704:651600, ack 1, win 58, options [nop,nop,TS val 27836627 ecr 27836627], length 2896
17:48:26.456094 IP 10.0.0.1.41848 > 10.0.0.2.5001: Flags [.], seq 651600:654496, ack 1, win 58, options [nop,nop,TS val 27836628 ecr 27836627], length 2896
17:48:26.458516 IP 10.0.0.1.41848 > 10.0.0.2.5001: Flags [.], seq 654496:657392, ack 1, win 58, options [nop,nop,TS val 27836628 ecr 27836628], length 2896
17:48:26.460939 IP 10.0.0.1.41848 > 10.0.0.2.5001: Flags [.], seq 657392:660288, ack 1, win 58, options [nop,nop,TS val 27836629 ecr 27836628], length 2896
17:48:26.463361 IP 10.0.0.1.41848 > 10.0.0.2.5001: Flags [.], seq 660288:663184, ack 1, win 58, options [nop,nop,TS val 27836630 ecr 27836629], length 2896
17:48:26.465784 IP 10.0.0.1.41848 > 10.0.0.2.5001: Flags [.], seq 663184:666080, ack 1, win 58, options [nop,nop,TS val 27836630 ecr 27836630], length 2896
17:48:26.468206 IP 10.0.0.1.41848 > 10.0.0.2.5001: Flags [.], seq 666080:668976, ack 1, win 58, options [nop,nop,TS val 27836631 ecr 27836631], length 2896
17:48:26.470628 IP 10.0.0.1.41848 > 10.0.0.2.5001: Flags [.], seq 668976:671872, ack 1, win 58, options [nop,nop,TS val 27836631 ecr 27836631], length 2896
17:48:26.473051 IP 10.0.0.1.41848 > 10.0.0.2.5001: Flags [.], seq 671872:674768, ack 1, win 58, options [nop,nop,TS val 27836632 ecr 27836631], length 2896
17:48:26.475473 IP 10.0.0.1.41848 > 10.0.0.2.5001: Flags [.], seq 674768:677664, ack 1, win 58, options [nop,nop,TS val 27836633 ecr 27836632], length 2896
17:48:26.477896 IP 10.0.0.1.41848 > 10.0.0.2.5001: Flags [.], seq 677664:680560, ack 1, win 58, options [nop,nop,TS val 27836633 ecr 27836633], length 2896
17:48:26.480318 IP 10.0.0.1.41848 > 10.0.0.2.5001: Flags [P.], seq 680560:683456, ack 1, win 58, options [nop,nop,TS val 27836634 ecr 27836633], length 2896
17:48:26.482740 IP 10.0.0.1.41848 > 10.0.0.2.5001: Flags [.], seq 683456:686352, ack 1, win 58, options [nop,nop,TS val 27836634 ecr 27836634], length 2896
17:48:26.485163 IP 10.0.0.1.41848 > 10.0.0.2.5001: Flags [.], seq 686352:689248, ack 1, win 58, options [nop,nop,TS val 27836635 ecr 27836634], length 2896
17:48:26.487585 IP 10.0.0.1.41848 > 10.0.0.2.5001: Flags [.], seq 689248:692144, ack 1, win 58, options [nop,nop,TS val 27836636 ecr 27836635], length 2896
17:48:26.490008 IP 10.0.0.1.41848 > 10.0.0.2.5001: Flags [.], seq 692144:695040, ack 1, win 58, options [nop,nop,TS val 27836636 ecr 27836636], length 2896
17:48:26.492430 IP 10.0.0.1.41848 > 10.0.0.2.5001: Flags [.], seq 695040:697936, ack 1, win 58, options [nop,nop,TS val 27836637 ecr 27836636], length 2896
17:48:26.494852 IP 10.0.0.1.41848 > 10.0.0.2.5001: Flags [.], seq 697936:700832, ack 1, win 58, options [nop,nop,TS val 27836637 ecr 27836637], length 2896
17:48:26.497275 IP 10.0.0.1.41848 > 10.0.0.2.5001: Flags [.], seq 700832:703728, ack 1, win 58, options [nop,nop,TS val 27836638 ecr 27836637], length 2896
17:48:26.499697 IP 10.0.0.1.41848 > 10.0.0.2.5001: Flags [.], seq 703728:706624, ack 1, win 58, options [nop,nop,TS val 27836639 ecr 27836638], length 2896
17:48:26.502120 IP 10.0.0.1.41848 > 10.0.0.2.5001: Flags [.], seq 706624:709520, ack 1, win 58, options [nop,nop,TS val 27836639 ecr 27836639], length 2896
17:48:26.504542 IP 10.0.0.1.41848 > 10.0.0.2.5001: Flags [.], seq 709520:712416, ack 1, win 58, options [nop,nop,TS val 27836640 ecr 27836639], length 2896
17:48:26.506964 IP 10.0.0.1.41848 > 10.0.0.2.5001: Flags [.], seq 712416:715312, ack 1, win 58, options [nop,nop,TS val 27836641 ecr 27836640], length 2896
17:48:26.509387 IP 10.0.0.1.41848 > 10.0.0.2.5001: Flags [.], seq 715312:718208, ack 1, win 58, options [nop,nop,TS val 27836641 ecr 27836641], length 2896
17:48:26.511809 IP 10.0.0.1.41848 > 10.0.0.2.5001: Flags [.], seq 718208:721104, ack 1, win 58, options [nop,nop,TS val 27836642 ecr 27836641], length 2896
17:48:26.514232 IP 10.0.0.1.41848 > 10.0.0.2.5001: Flags [.], seq 721104:724000, ack 1, win 58, options [nop,nop,TS val 27836642 ecr 27836642], length 2896
17:48:26.516654 IP 10.0.0.1.41848 > 10.0.0.2.5001: Flags [.], seq 724000:726896, ack 1, win 58, options [nop,nop,TS val 27836643 ecr 27836642], length 2896
17:48:26.519076 IP 10.0.0.1.41848 > 10.0.0.2.5001: Flags [.], seq 726896:729792, ack 1, win 58, options [nop,nop,TS val 27836644 ecr 27836643], length 2896
17:48:26.521499 IP 10.0.0.1.41848 > 10.0.0.2.5001: Flags [.], seq 729792:732688, ack 1, win 58, options [nop,nop,TS val 27836644 ecr 27836644], length 2896
17:48:26.523921 IP 10.0.0.1.41848 > 10.0.0.2.5001: Flags [.], seq 732688:735584, ack 1, win 58, options [nop,nop,TS val 27836645 ecr 27836644], length 2896
17:48:26.526343 IP 10.0.0.1.41848 > 10.0.0.2.5001: Flags [.], seq 735584:738480, ack 1, win 58, options [nop,nop,TS val 27836645 ecr 27836645], length 2896
17:48:26.528766 IP 10.0.0.1.41848 > 10.0.0.2.5001: Flags [.], seq 738480:741376, ack 1, win 58, options [nop,nop,TS val 27836646 ecr 27836645], length 2896
