tcpdump: verbose output suppressed, use -v or -vv for full protocol decode
listening on h1-eth0, link-type EN10MB (Ethernet), capture size 65535 bytes
18:09:15.905860 IP 10.0.0.1.43158 > 10.0.0.2.5001: Flags [.], seq 1380040337:1380047577, ack 3518669080, win 58, options [nop,nop,TS val 28148962 ecr 28148962], length 7240
18:09:15.906253 IP 10.0.0.2.5001 > 10.0.0.1.43158: Flags [.], ack 7240, win 333, options [nop,nop,TS val 28149013 ecr 28148962], length 0
18:09:15.909357 IP6 :: > ff02::1:ff53:6fb6: ICMP6, neighbor solicitation, who has fe80::3c0c:a3ff:fe53:6fb6, length 24
18:09:15.917970 IP 10.0.0.1.43158 > 10.0.0.2.5001: Flags [.], seq 7240:14480, ack 1, win 58, options [nop,nop,TS val 28148965 ecr 28148965], length 7240
18:09:15.918008 IP 10.0.0.2.5001 > 10.0.0.1.43158: Flags [.], ack 14480, win 333, options [nop,nop,TS val 28149016 ecr 28148965], length 0
18:09:15.928064 IP 10.0.0.1.43158 > 10.0.0.2.5001: Flags [.], seq 14480:21720, ack 1, win 58, options [nop,nop,TS val 28148965 ecr 28148965], length 7240
18:09:15.928102 IP 10.0.0.2.5001 > 10.0.0.1.43158: Flags [.], ack 21720, win 333, options [nop,nop,TS val 28149018 ecr 28148965], length 0
18:09:15.938155 IP 10.0.0.1.43158 > 10.0.0.2.5001: Flags [.], seq 21720:28960, ack 1, win 58, options [nop,nop,TS val 28148965 ecr 28148965], length 7240
18:09:15.938186 IP 10.0.0.2.5001 > 10.0.0.1.43158: Flags [.], ack 28960, win 333, options [nop,nop,TS val 28149021 ecr 28148965], length 0
18:09:15.946810 IP 10.0.0.1.43158 > 10.0.0.2.5001: Flags [.], seq 28960:36200, ack 1, win 58, options [nop,nop,TS val 28148965 ecr 28148965], length 7240
18:09:15.946853 IP 10.0.0.2.5001 > 10.0.0.1.43158: Flags [.], ack 36200, win 333, options [nop,nop,TS val 28149023 ecr 28148965], length 0
18:09:15.955458 IP 10.0.0.1.43158 > 10.0.0.2.5001: Flags [P.], seq 36200:43440, ack 1, win 58, options [nop,nop,TS val 28148969 ecr 28148969], length 7240
18:09:15.955488 IP 10.0.0.2.5001 > 10.0.0.1.43158: Flags [.], ack 43440, win 333, options [nop,nop,TS val 28149025 ecr 28148969], length 0
18:09:15.963031 IP 10.0.0.1.43158 > 10.0.0.2.5001: Flags [.], seq 43440:50680, ack 1, win 58, options [nop,nop,TS val 28148969 ecr 28148969], length 7240
18:09:15.963074 IP 10.0.0.2.5001 > 10.0.0.1.43158: Flags [.], ack 50680, win 333, options [nop,nop,TS val 28149027 ecr 28148969], length 0
18:09:15.970601 IP 10.0.0.1.43158 > 10.0.0.2.5001: Flags [P.], seq 50680:57920, ack 1, win 58, options [nop,nop,TS val 28148971 ecr 28148971], length 7240
18:09:15.970645 IP 10.0.0.2.5001 > 10.0.0.1.43158: Flags [.], ack 57920, win 333, options [nop,nop,TS val 28149029 ecr 28148971], length 0
18:09:15.977336 IP 10.0.0.1.43158 > 10.0.0.2.5001: Flags [.], seq 57920:60816, ack 1, win 58, options [nop,nop,TS val 28148971 ecr 28148971], length 2896
18:09:15.977385 IP 10.0.0.2.5001 > 10.0.0.1.43158: Flags [.], ack 60816, win 333, options [nop,nop,TS val 28149031 ecr 28148971], length 0
18:09:15.980021 IP 10.0.0.1.43158 > 10.0.0.2.5001: Flags [.], seq 60816:63712, ack 1, win 58, options [nop,nop,TS val 28148971 ecr 28148971], length 2896
18:09:15.980052 IP 10.0.0.2.5001 > 10.0.0.1.43158: Flags [.], ack 63712, win 333, options [nop,nop,TS val 28149031 ecr 28148971], length 0
18:09:15.982710 IP 10.0.0.1.43158 > 10.0.0.2.5001: Flags [.], seq 63712:65160, ack 1, win 58, options [nop,nop,TS val 28148971 ecr 28148971], length 1448
18:09:15.983920 IP 10.0.0.1.43158 > 10.0.0.2.5001: Flags [.], seq 65160:68056, ack 1, win 58, options [nop,nop,TS val 28148973 ecr 28148973], length 2896
18:09:15.984044 IP 10.0.0.2.5001 > 10.0.0.1.43158: Flags [.], ack 68056, win 333, options [nop,nop,TS val 28149032 ecr 28148971], length 0
18:09:15.986343 IP 10.0.0.1.43158 > 10.0.0.2.5001: Flags [.], seq 68056:70952, ack 1, win 58, options [nop,nop,TS val 28148974 ecr 28148974], length 2896
18:09:15.986368 IP 10.0.0.2.5001 > 10.0.0.1.43158: Flags [.], ack 70952, win 333, options [nop,nop,TS val 28149033 ecr 28148974], length 0
18:09:15.988765 IP 10.0.0.1.43158 > 10.0.0.2.5001: Flags [.], seq 70952:73848, ack 1, win 58, options [nop,nop,TS val 28148974 ecr 28148974], length 2896
18:09:15.988783 IP 10.0.0.2.5001 > 10.0.0.1.43158: Flags [.], ack 73848, win 333, options [nop,nop,TS val 28149033 ecr 28148974], length 0
18:09:15.991190 IP 10.0.0.1.43158 > 10.0.0.2.5001: Flags [.], seq 73848:76744, ack 1, win 58, options [nop,nop,TS val 28148976 ecr 28148974], length 2896
18:09:15.991223 IP 10.0.0.2.5001 > 10.0.0.1.43158: Flags [.], ack 76744, win 333, options [nop,nop,TS val 28149034 ecr 28148976], length 0
18:09:15.993612 IP 10.0.0.1.43158 > 10.0.0.2.5001: Flags [.], seq 76744:79640, ack 1, win 58, options [nop,nop,TS val 28148976 ecr 28148974], length 2896
18:09:15.996031 IP 10.0.0.1.43158 > 10.0.0.2.5001: Flags [.], seq 79640:82536, ack 1, win 58, options [nop,nop,TS val 28148978 ecr 28148976], length 2896
18:09:15.997384 IP 10.0.0.2.5001 > 10.0.0.1.43158: Flags [.], ack 79640, win 333, options [nop,nop,TS val 28149036 ecr 28148976], length 0
18:09:15.997399 IP 10.0.0.2.5001 > 10.0.0.1.43158: Flags [.], ack 82536, win 333, options [nop,nop,TS val 28149036 ecr 28148978], length 0
18:09:16.000877 IP 10.0.0.1.43158 > 10.0.0.2.5001: Flags [.], seq 82536:85432, ack 1, win 58, options [nop,nop,TS val 28148978 ecr 28148976], length 2896
18:09:16.000905 IP 10.0.0.2.5001 > 10.0.0.1.43158: Flags [.], ack 85432, win 333, options [nop,nop,TS val 28149036 ecr 28148978], length 0
18:09:16.005722 IP 10.0.0.1.43158 > 10.0.0.2.5001: Flags [.], seq 85432:88328, ack 1, win 58, options [nop,nop,TS val 28148981 ecr 28148978], length 2896
18:09:16.005747 IP 10.0.0.2.5001 > 10.0.0.1.43158: Flags [.], ack 88328, win 333, options [nop,nop,TS val 28149038 ecr 28148981], length 0
18:09:16.010592 IP 10.0.0.1.43158 > 10.0.0.2.5001: Flags [.], seq 88328:91224, ack 1, win 58, options [nop,nop,TS val 28148981 ecr 28148978], length 2896
18:09:16.010889 IP 10.0.0.2.5001 > 10.0.0.1.43158: Flags [.], ack 91224, win 333, options [nop,nop,TS val 28149039 ecr 28148981], length 0
18:09:16.015415 IP 10.0.0.1.43158 > 10.0.0.2.5001: Flags [.], seq 91224:94120, ack 1, win 58, options [nop,nop,TS val 28148981 ecr 28148978], length 2896
18:09:16.015454 IP 10.0.0.2.5001 > 10.0.0.1.43158: Flags [.], ack 94120, win 333, options [nop,nop,TS val 28149040 ecr 28148981], length 0
18:09:16.020256 IP 10.0.0.1.43158 > 10.0.0.2.5001: Flags [.], seq 94120:97016, ack 1, win 58, options [nop,nop,TS val 28148986 ecr 28148985], length 2896
18:09:16.020276 IP 10.0.0.2.5001 > 10.0.0.1.43158: Flags [.], ack 97016, win 333, options [nop,nop,TS val 28149041 ecr 28148986], length 0
18:09:16.025101 IP 10.0.0.1.43158 > 10.0.0.2.5001: Flags [.], seq 97016:99912, ack 1, win 58, options [nop,nop,TS val 28148986 ecr 28148985], length 2896
18:09:16.025123 IP 10.0.0.2.5001 > 10.0.0.1.43158: Flags [.], ack 99912, win 333, options [nop,nop,TS val 28149042 ecr 28148986], length 0
18:09:16.029945 IP 10.0.0.1.43158 > 10.0.0.2.5001: Flags [.], seq 99912:102808, ack 1, win 58, options [nop,nop,TS val 28148990 ecr 28148986], length 2896
18:09:16.029963 IP 10.0.0.2.5001 > 10.0.0.1.43158: Flags [.], ack 102808, win 333, options [nop,nop,TS val 28149044 ecr 28148990], length 0
18:09:16.034790 IP 10.0.0.1.43158 > 10.0.0.2.5001: Flags [.], seq 102808:105704, ack 1, win 58, options [nop,nop,TS val 28148990 ecr 28148986], length 2896
18:09:16.034808 IP 10.0.0.2.5001 > 10.0.0.1.43158: Flags [.], ack 105704, win 333, options [nop,nop,TS val 28149045 ecr 28148990], length 0
18:09:16.039635 IP 10.0.0.1.43158 > 10.0.0.2.5001: Flags [.], seq 105704:108600, ack 1, win 58, options [nop,nop,TS val 28148997 ecr 28148990], length 2896
18:09:16.039652 IP 10.0.0.2.5001 > 10.0.0.1.43158: Flags [.], ack 108600, win 333, options [nop,nop,TS val 28149046 ecr 28148997], length 0
18:09:16.044480 IP 10.0.0.1.43158 > 10.0.0.2.5001: Flags [.], seq 108600:111496, ack 1, win 58, options [nop,nop,TS val 28148997 ecr 28148990], length 2896
18:09:16.044498 IP 10.0.0.2.5001 > 10.0.0.1.43158: Flags [.], ack 111496, win 333, options [nop,nop,TS val 28149047 ecr 28148997], length 0
18:09:16.049324 IP 10.0.0.1.43158 > 10.0.0.2.5001: Flags [.], seq 111496:114392, ack 1, win 58, options [nop,nop,TS val 28148997 ecr 28148990], length 2896
18:09:16.049354 IP 10.0.0.2.5001 > 10.0.0.1.43158: Flags [.], ack 114392, win 333, options [nop,nop,TS val 28149049 ecr 28148997], length 0
18:09:16.054172 IP 10.0.0.1.43158 > 10.0.0.2.5001: Flags [.], seq 114392:117288, ack 1, win 58, options [nop,nop,TS val 28149013 ecr 28148998], length 2896
18:09:16.054390 IP 10.0.0.2.5001 > 10.0.0.1.43158: Flags [.], ack 117288, win 333, options [nop,nop,TS val 28149050 ecr 28149013], length 0
18:09:16.059019 IP 10.0.0.1.43158 > 10.0.0.2.5001: Flags [.], seq 117288:120184, ack 1, win 58, options [nop,nop,TS val 28149013 ecr 28148998], length 2896
18:09:16.059047 IP 10.0.0.2.5001 > 10.0.0.1.43158: Flags [.], ack 120184, win 333, options [nop,nop,TS val 28149051 ecr 28149013], length 0
18:09:16.063860 IP 10.0.0.1.43158 > 10.0.0.2.5001: Flags [.], seq 120184:123080, ack 1, win 58, options [nop,nop,TS val 28149016 ecr 28149013], length 2896
18:09:16.063881 IP 10.0.0.2.5001 > 10.0.0.1.43158: Flags [.], ack 123080, win 333, options [nop,nop,TS val 28149052 ecr 28149016], length 0
18:09:16.068710 IP 10.0.0.1.43158 > 10.0.0.2.5001: Flags [.], seq 123080:125976, ack 1, win 58, options [nop,nop,TS val 28149016 ecr 28149013], length 2896
18:09:16.068742 IP 10.0.0.2.5001 > 10.0.0.1.43158: Flags [.], ack 125976, win 345, options [nop,nop,TS val 28149053 ecr 28149016], length 0
18:09:16.073549 IP 10.0.0.1.43158 > 10.0.0.2.5001: Flags [.], seq 125976:128872, ack 1, win 58, options [nop,nop,TS val 28149018 ecr 28149016], length 2896
18:09:16.073563 IP 10.0.0.2.5001 > 10.0.0.1.43158: Flags [.], ack 128872, win 356, options [nop,nop,TS val 28149055 ecr 28149018], length 0
18:09:16.078396 IP 10.0.0.1.43158 > 10.0.0.2.5001: Flags [.], seq 128872:131768, ack 1, win 58, options [nop,nop,TS val 28149018 ecr 28149016], length 2896
18:09:16.078417 IP 10.0.0.2.5001 > 10.0.0.1.43158: Flags [.], ack 131768, win 367, options [nop,nop,TS val 28149056 ecr 28149018], length 0
18:09:16.083238 IP 10.0.0.1.43158 > 10.0.0.2.5001: Flags [.], seq 131768:134664, ack 1, win 58, options [nop,nop,TS val 28149021 ecr 28149018], length 2896
18:09:16.083253 IP 10.0.0.2.5001 > 10.0.0.1.43158: Flags [.], ack 134664, win 379, options [nop,nop,TS val 28149057 ecr 28149021], length 0
18:09:16.088083 IP 10.0.0.1.43158 > 10.0.0.2.5001: Flags [.], seq 134664:137560, ack 1, win 58, options [nop,nop,TS val 28149021 ecr 28149018], length 2896
18:09:16.088097 IP 10.0.0.2.5001 > 10.0.0.1.43158: Flags [.], ack 137560, win 390, options [nop,nop,TS val 28149058 ecr 28149021], length 0
18:09:16.092929 IP 10.0.0.1.43158 > 10.0.0.2.5001: Flags [.], seq 137560:140456, ack 1, win 58, options [nop,nop,TS val 28149023 ecr 28149021], length 2896
18:09:16.092946 IP 10.0.0.2.5001 > 10.0.0.1.43158: Flags [.], ack 140456, win 401, options [nop,nop,TS val 28149059 ecr 28149023], length 0
18:09:16.097775 IP 10.0.0.1.43158 > 10.0.0.2.5001: Flags [.], seq 140456:143352, ack 1, win 58, options [nop,nop,TS val 28149023 ecr 28149021], length 2896
18:09:16.097801 IP 10.0.0.2.5001 > 10.0.0.1.43158: Flags [.], ack 143352, win 412, options [nop,nop,TS val 28149061 ecr 28149023], length 0
18:09:16.102617 IP 10.0.0.1.43158 > 10.0.0.2.5001: Flags [.], seq 143352:146248, ack 1, win 58, options [nop,nop,TS val 28149023 ecr 28149021], length 2896
18:09:16.102633 IP 10.0.0.2.5001 > 10.0.0.1.43158: Flags [.], ack 146248, win 424, options [nop,nop,TS val 28149062 ecr 28149023], length 0
18:09:16.107463 IP 10.0.0.1.43158 > 10.0.0.2.5001: Flags [.], seq 146248:149144, ack 1, win 58, options [nop,nop,TS val 28149025 ecr 28149023], length 2896
18:09:16.107479 IP 10.0.0.2.5001 > 10.0.0.1.43158: Flags [.], ack 149144, win 435, options [nop,nop,TS val 28149063 ecr 28149025], length 0
18:09:16.112307 IP 10.0.0.1.43158 > 10.0.0.2.5001: Flags [.], seq 149144:152040, ack 1, win 58, options [nop,nop,TS val 28149025 ecr 28149023], length 2896
18:09:16.112321 IP 10.0.0.2.5001 > 10.0.0.1.43158: Flags [.], ack 152040, win 446, options [nop,nop,TS val 28149064 ecr 28149025], length 0
18:09:16.117152 IP 10.0.0.1.43158 > 10.0.0.2.5001: Flags [.], seq 152040:154936, ack 1, win 58, options [nop,nop,TS val 28149027 ecr 28149025], length 2896
18:09:16.117166 IP 10.0.0.2.5001 > 10.0.0.1.43158: Flags [.], ack 154936, win 458, options [nop,nop,TS val 28149065 ecr 28149027], length 0
18:09:16.121997 IP 10.0.0.1.43158 > 10.0.0.2.5001: Flags [.], seq 154936:157832, ack 1, win 58, options [nop,nop,TS val 28149027 ecr 28149025], length 2896
18:09:16.122012 IP 10.0.0.2.5001 > 10.0.0.1.43158: Flags [.], ack 157832, win 469, options [nop,nop,TS val 28149067 ecr 28149027], length 0
18:09:16.126841 IP 10.0.0.1.43158 > 10.0.0.2.5001: Flags [.], seq 157832:160728, ack 1, win 58, options [nop,nop,TS val 28149029 ecr 28149027], length 2896
18:09:16.126854 IP 10.0.0.2.5001 > 10.0.0.1.43158: Flags [.], ack 160728, win 480, options [nop,nop,TS val 28149068 ecr 28149029], length 0
18:09:16.131688 IP 10.0.0.1.43158 > 10.0.0.2.5001: Flags [.], seq 160728:163624, ack 1, win 58, options [nop,nop,TS val 28149029 ecr 28149027], length 2896
18:09:16.131705 IP 10.0.0.2.5001 > 10.0.0.1.43158: Flags [.], ack 163624, win 492, options [nop,nop,TS val 28149069 ecr 28149029], length 0
18:09:16.136531 IP 10.0.0.1.43158 > 10.0.0.2.5001: Flags [.], seq 163624:166520, ack 1, win 58, options [nop,nop,TS val 28149031 ecr 28149029], length 2896
18:09:16.136547 IP 10.0.0.2.5001 > 10.0.0.1.43158: Flags [.], ack 166520, win 503, options [nop,nop,TS val 28149070 ecr 28149031], length 0
18:09:16.141376 IP 10.0.0.1.43158 > 10.0.0.2.5001: Flags [.], seq 166520:169416, ack 1, win 58, options [nop,nop,TS val 28149031 ecr 28149031], length 2896
18:09:16.141390 IP 10.0.0.2.5001 > 10.0.0.1.43158: Flags [.], ack 169416, win 514, options [nop,nop,TS val 28149072 ecr 28149031], length 0
18:09:16.146221 IP 10.0.0.1.43158 > 10.0.0.2.5001: Flags [.], seq 169416:172312, ack 1, win 58, options [nop,nop,TS val 28149032 ecr 28149031], length 2896
18:09:16.146235 IP 10.0.0.2.5001 > 10.0.0.1.43158: Flags [.], ack 172312, win 526, options [nop,nop,TS val 28149073 ecr 28149032], length 0
18:09:16.151066 IP 10.0.0.1.43158 > 10.0.0.2.5001: Flags [.], seq 172312:175208, ack 1, win 58, options [nop,nop,TS val 28149032 ecr 28149031], length 2896
18:09:16.151079 IP 10.0.0.2.5001 > 10.0.0.1.43158: Flags [.], ack 175208, win 537, options [nop,nop,TS val 28149074 ecr 28149032], length 0
18:09:16.155910 IP 10.0.0.1.43158 > 10.0.0.2.5001: Flags [.], seq 175208:178104, ack 1, win 58, options [nop,nop,TS val 28149033 ecr 28149032], length 2896
18:09:16.155924 IP 10.0.0.2.5001 > 10.0.0.1.43158: Flags [.], ack 178104, win 548, options [nop,nop,TS val 28149075 ecr 28149033], length 0
18:09:16.160755 IP 10.0.0.1.43158 > 10.0.0.2.5001: Flags [.], seq 178104:181000, ack 1, win 58, options [nop,nop,TS val 28149033 ecr 28149033], length 2896
18:09:16.160768 IP 10.0.0.2.5001 > 10.0.0.1.43158: Flags [.], ack 181000, win 560, options [nop,nop,TS val 28149076 ecr 28149033], length 0
18:09:16.165603 IP 10.0.0.1.43158 > 10.0.0.2.5001: Flags [.], seq 181000:183896, ack 1, win 58, options [nop,nop,TS val 28149034 ecr 28149033], length 2896
18:09:16.165633 IP 10.0.0.2.5001 > 10.0.0.1.43158: Flags [.], ack 183896, win 571, options [nop,nop,TS val 28149078 ecr 28149034], length 0
18:09:16.170448 IP 10.0.0.1.43158 > 10.0.0.2.5001: Flags [.], seq 183896:186792, ack 1, win 58, options [nop,nop,TS val 28149035 ecr 28149034], length 2896
18:09:16.170480 IP 10.0.0.2.5001 > 10.0.0.1.43158: Flags [.], ack 186792, win 582, options [nop,nop,TS val 28149079 ecr 28149035], length 0
18:09:16.175291 IP 10.0.0.1.43158 > 10.0.0.2.5001: Flags [.], seq 186792:189688, ack 1, win 58, options [nop,nop,TS val 28149035 ecr 28149034], length 2896
18:09:16.175307 IP 10.0.0.2.5001 > 10.0.0.1.43158: Flags [.], ack 189688, win 593, options [nop,nop,TS val 28149080 ecr 28149035], length 0
18:09:16.180135 IP 10.0.0.1.43158 > 10.0.0.2.5001: Flags [.], seq 189688:192584, ack 1, win 58, options [nop,nop,TS val 28149036 ecr 28149036], length 2896
18:09:16.180155 IP 10.0.0.2.5001 > 10.0.0.1.43158: Flags [.], ack 192584, win 605, options [nop,nop,TS val 28149081 ecr 28149036], length 0
18:09:16.184982 IP 10.0.0.1.43158 > 10.0.0.2.5001: Flags [.], seq 192584:195480, ack 1, win 58, options [nop,nop,TS val 28149038 ecr 28149036], length 2896
18:09:16.185005 IP 10.0.0.2.5001 > 10.0.0.1.43158: Flags [.], ack 195480, win 616, options [nop,nop,TS val 28149082 ecr 28149038], length 0
18:09:16.189826 IP 10.0.0.1.43158 > 10.0.0.2.5001: Flags [P.], seq 195480:198376, ack 1, win 58, options [nop,nop,TS val 28149039 ecr 28149038], length 2896
18:09:16.189853 IP 10.0.0.2.5001 > 10.0.0.1.43158: Flags [.], ack 198376, win 627, options [nop,nop,TS val 28149084 ecr 28149039], length 0
18:09:16.194669 IP 10.0.0.1.43158 > 10.0.0.2.5001: Flags [.], seq 198376:201272, ack 1, win 58, options [nop,nop,TS val 28149040 ecr 28149039], length 2896
18:09:16.194685 IP 10.0.0.2.5001 > 10.0.0.1.43158: Flags [.], ack 201272, win 639, options [nop,nop,TS val 28149085 ecr 28149040], length 0
18:09:16.199514 IP 10.0.0.1.43158 > 10.0.0.2.5001: Flags [.], seq 201272:204168, ack 1, win 58, options [nop,nop,TS val 28149041 ecr 28149040], length 2896
18:09:16.199528 IP 10.0.0.2.5001 > 10.0.0.1.43158: Flags [.], ack 204168, win 650, options [nop,nop,TS val 28149086 ecr 28149041], length 0
18:09:16.204358 IP 10.0.0.1.43158 > 10.0.0.2.5001: Flags [.], seq 204168:207064, ack 1, win 58, options [nop,nop,TS val 28149042 ecr 28149041], length 2896
18:09:16.204372 IP 10.0.0.2.5001 > 10.0.0.1.43158: Flags [.], ack 207064, win 661, options [nop,nop,TS val 28149087 ecr 28149042], length 0
18:09:16.209205 IP 10.0.0.1.43158 > 10.0.0.2.5001: Flags [.], seq 207064:209960, ack 1, win 58, options [nop,nop,TS val 28149044 ecr 28149042], length 2896
18:09:16.209219 IP 10.0.0.2.5001 > 10.0.0.1.43158: Flags [.], ack 209960, win 673, options [nop,nop,TS val 28149088 ecr 28149044], length 0
18:09:16.214048 IP 10.0.0.1.43158 > 10.0.0.2.5001: Flags [.], seq 209960:212856, ack 1, win 58, options [nop,nop,TS val 28149045 ecr 28149044], length 2896
18:09:16.214063 IP 10.0.0.2.5001 > 10.0.0.1.43158: Flags [.], ack 212856, win 684, options [nop,nop,TS val 28149090 ecr 28149045], length 0
18:09:16.218893 IP 10.0.0.1.43158 > 10.0.0.2.5001: Flags [.], seq 212856:215752, ack 1, win 58, options [nop,nop,TS val 28149046 ecr 28149045], length 2896
18:09:16.218907 IP 10.0.0.2.5001 > 10.0.0.1.43158: Flags [.], ack 215752, win 695, options [nop,nop,TS val 28149091 ecr 28149046], length 0
18:09:16.223738 IP 10.0.0.1.43158 > 10.0.0.2.5001: Flags [.], seq 215752:218648, ack 1, win 58, options [nop,nop,TS val 28149047 ecr 28149046], length 2896
18:09:16.223752 IP 10.0.0.2.5001 > 10.0.0.1.43158: Flags [.], ack 218648, win 707, options [nop,nop,TS val 28149092 ecr 28149047], length 0
18:09:16.228582 IP 10.0.0.1.43158 > 10.0.0.2.5001: Flags [.], seq 218648:221544, ack 1, win 58, options [nop,nop,TS val 28149049 ecr 28149047], length 2896
18:09:16.228596 IP 10.0.0.2.5001 > 10.0.0.1.43158: Flags [.], ack 221544, win 718, options [nop,nop,TS val 28149093 ecr 28149049], length 0
18:09:16.233427 IP6 :: > ff02::16: HBH ICMP6, multicast listener report v2, 1 group record(s), length 28
18:09:16.233571 IP 10.0.0.1.43158 > 10.0.0.2.5001: Flags [.], seq 221544:224440, ack 1, win 58, options [nop,nop,TS val 28149050 ecr 28149049], length 2896
18:09:16.233584 IP 10.0.0.2.5001 > 10.0.0.1.43158: Flags [.], ack 224440, win 729, options [nop,nop,TS val 28149095 ecr 28149050], length 0
18:09:16.238416 IP 10.0.0.1.43158 > 10.0.0.2.5001: Flags [.], seq 224440:227336, ack 1, win 58, options [nop,nop,TS val 28149051 ecr 28149050], length 2896
18:09:16.238429 IP 10.0.0.2.5001 > 10.0.0.1.43158: Flags [.], ack 227336, win 741, options [nop,nop,TS val 28149096 ecr 28149051], length 0
18:09:16.243261 IP 10.0.0.1.43158 > 10.0.0.2.5001: Flags [.], seq 227336:230232, ack 1, win 58, options [nop,nop,TS val 28149052 ecr 28149051], length 2896
18:09:16.243274 IP 10.0.0.2.5001 > 10.0.0.1.43158: Flags [.], ack 230232, win 752, options [nop,nop,TS val 28149097 ecr 28149052], length 0
18:09:16.248105 IP 10.0.0.1.43158 > 10.0.0.2.5001: Flags [.], seq 230232:233128, ack 1, win 58, options [nop,nop,TS val 28149053 ecr 28149052], length 2896
18:09:16.248119 IP 10.0.0.2.5001 > 10.0.0.1.43158: Flags [.], ack 233128, win 763, options [nop,nop,TS val 28149098 ecr 28149053], length 0
18:09:16.252950 IP 10.0.0.1.43158 > 10.0.0.2.5001: Flags [.], seq 233128:236024, ack 1, win 58, options [nop,nop,TS val 28149055 ecr 28149053], length 2896
18:09:16.252964 IP 10.0.0.2.5001 > 10.0.0.1.43158: Flags [.], ack 236024, win 774, options [nop,nop,TS val 28149099 ecr 28149055], length 0

141 packets captured
169 packets received by filter
0 packets dropped by kernel
