17:16:32.766582 IP 10.0.0.1.39864 > 10.0.0.2.5001: Flags [.], seq 556445408:556449752, ack 815270259, win 58, options [nop,nop,TS val 27358203 ecr 27358202], length 4344
17:16:32.770216 IP 10.0.0.1.39864 > 10.0.0.2.5001: Flags [.], seq 4344:8688, ack 1, win 58, options [nop,nop,TS val 27358204 ecr 27358203], length 4344
17:16:32.773851 IP 10.0.0.1.39864 > 10.0.0.2.5001: Flags [.], seq 8688:13032, ack 1, win 58, options [nop,nop,TS val 27358206 ecr 27358205], length 4344
17:16:32.777482 IP 10.0.0.1.39864 > 10.0.0.2.5001: Flags [.], seq 13032:17376, ack 1, win 58, options [nop,nop,TS val 27358206 ecr 27358205], length 4344
17:16:32.781116 IP 10.0.0.1.39864 > 10.0.0.2.5001: Flags [.], seq 17376:21720, ack 1, win 58, options [nop,nop,TS val 27358207 ecr 27358206], length 4344
17:16:32.784750 IP 10.0.0.1.39864 > 10.0.0.2.5001: Flags [.], seq 21720:26064, ack 1, win 58, options [nop,nop,TS val 27358208 ecr 27358207], length 4344
17:16:32.788383 IP 10.0.0.1.39864 > 10.0.0.2.5001: Flags [P.], seq 26064:30408, ack 1, win 58, options [nop,nop,TS val 27358209 ecr 27358208], length 4344
17:16:32.792016 IP 10.0.0.1.39864 > 10.0.0.2.5001: Flags [.], seq 30408:33304, ack 1, win 58, options [nop,nop,TS val 27358209 ecr 27358208], length 2896
17:16:32.794439 IP 10.0.0.1.39864 > 10.0.0.2.5001: Flags [.], seq 33304:36200, ack 1, win 58, options [nop,nop,TS val 27358211 ecr 27358209], length 2896
17:16:32.796861 IP 10.0.0.1.39864 > 10.0.0.2.5001: Flags [.], seq 36200:39096, ack 1, win 58, options [nop,nop,TS val 27358211 ecr 27358211], length 2896
17:16:32.799284 IP 10.0.0.1.39864 > 10.0.0.2.5001: Flags [.], seq 39096:41992, ack 1, win 58, options [nop,nop,TS val 27358212 ecr 27358211], length 2896
17:16:32.801706 IP 10.0.0.1.39864 > 10.0.0.2.5001: Flags [.], seq 41992:44888, ack 1, win 58, options [nop,nop,TS val 27358212 ecr 27358211], length 2896
17:16:32.804128 IP 10.0.0.1.39864 > 10.0.0.2.5001: Flags [.], seq 44888:47784, ack 1, win 58, options [nop,nop,TS val 27358213 ecr 27358212], length 2896
17:16:32.806551 IP 10.0.0.1.39864 > 10.0.0.2.5001: Flags [.], seq 47784:50680, ack 1, win 58, options [nop,nop,TS val 27358214 ecr 27358213], length 2896
17:16:32.808973 IP 10.0.0.1.39864 > 10.0.0.2.5001: Flags [.], seq 50680:53576, ack 1, win 58, options [nop,nop,TS val 27358214 ecr 27358213], length 2896
17:16:32.811396 IP 10.0.0.1.39864 > 10.0.0.2.5001: Flags [.], seq 53576:56472, ack 1, win 58, options [nop,nop,TS val 27358215 ecr 27358214], length 2896
17:16:32.813818 IP 10.0.0.1.39864 > 10.0.0.2.5001: Flags [.], seq 56472:59368, ack 1, win 58, options [nop,nop,TS val 27358216 ecr 27358215], length 2896
17:16:32.816240 IP 10.0.0.1.39864 > 10.0.0.2.5001: Flags [.], seq 59368:62264, ack 1, win 58, options [nop,nop,TS val 27358217 ecr 27358215], length 2896
17:16:32.818663 IP 10.0.0.1.39864 > 10.0.0.2.5001: Flags [.], seq 62264:65160, ack 1, win 58, options [nop,nop,TS val 27358217 ecr 27358215], length 2896
17:16:32.821085 IP 10.0.0.1.39864 > 10.0.0.2.5001: Flags [.], seq 65160:68056, ack 1, win 58, options [nop,nop,TS val 27358218 ecr 27358217], length 2896
17:16:32.823508 IP 10.0.0.1.39864 > 10.0.0.2.5001: Flags [.], seq 68056:70952, ack 1, win 58, options [nop,nop,TS val 27358219 ecr 27358218], length 2896
17:16:32.825930 IP 10.0.0.1.39864 > 10.0.0.2.5001: Flags [.], seq 70952:73848, ack 1, win 58, options [nop,nop,TS val 27358219 ecr 27358218], length 2896
17:16:32.828352 IP 10.0.0.1.39864 > 10.0.0.2.5001: Flags [.], seq 73848:76744, ack 1, win 58, options [nop,nop,TS val 27358220 ecr 27358219], length 2896
17:16:32.830775 IP 10.0.0.1.39864 > 10.0.0.2.5001: Flags [.], seq 76744:79640, ack 1, win 58, options [nop,nop,TS val 27358221 ecr 27358220], length 2896
17:16:32.833197 IP 10.0.0.1.39864 > 10.0.0.2.5001: Flags [.], seq 79640:82536, ack 1, win 58, options [nop,nop,TS val 27358221 ecr 27358221], length 2896
17:16:32.835620 IP 10.0.0.1.39864 > 10.0.0.2.5001: Flags [.], seq 82536:85432, ack 1, win 58, options [nop,nop,TS val 27358221 ecr 27358221], length 2896
17:16:32.838042 IP 10.0.0.1.39864 > 10.0.0.2.5001: Flags [.], seq 85432:88328, ack 1, win 58, options [nop,nop,TS val 27358222 ecr 27358221], length 2896
17:16:32.840464 IP 10.0.0.1.39864 > 10.0.0.2.5001: Flags [.], seq 88328:91224, ack 1, win 58, options [nop,nop,TS val 27358223 ecr 27358222], length 2896
17:16:32.842887 IP 10.0.0.1.39864 > 10.0.0.2.5001: Flags [.], seq 91224:94120, ack 1, win 58, options [nop,nop,TS val 27358223 ecr 27358222], length 2896
17:16:32.845309 IP 10.0.0.1.39864 > 10.0.0.2.5001: Flags [.], seq 94120:97016, ack 1, win 58, options [nop,nop,TS val 27358224 ecr 27358223], length 2896
17:16:32.847732 IP 10.0.0.1.39864 > 10.0.0.2.5001: Flags [.], seq 97016:99912, ack 1, win 58, options [nop,nop,TS val 27358225 ecr 27358224], length 2896
17:16:32.850154 IP 10.0.0.1.39864 > 10.0.0.2.5001: Flags [.], seq 99912:102808, ack 1, win 58, options [nop,nop,TS val 27358226 ecr 27358225], length 2896
17:16:32.852576 IP 10.0.0.1.39864 > 10.0.0.2.5001: Flags [.], seq 102808:105704, ack 1, win 58, options [nop,nop,TS val 27358226 ecr 27358225], length 2896
17:16:32.854999 IP 10.0.0.1.39864 > 10.0.0.2.5001: Flags [.], seq 105704:108600, ack 1, win 58, options [nop,nop,TS val 27358227 ecr 27358226], length 2896
17:16:32.857421 IP 10.0.0.1.39864 > 10.0.0.2.5001: Flags [.], seq 108600:111496, ack 1, win 58, options [nop,nop,TS val 27358228 ecr 27358227], length 2896
17:16:32.859847 IP 10.0.0.1.39864 > 10.0.0.2.5001: Flags [.], seq 111496:114392, ack 1, win 58, options [nop,nop,TS val 27358228 ecr 27358227], length 2896
17:16:32.862272 IP 10.0.0.1.39864 > 10.0.0.2.5001: Flags [P.], seq 114392:117288, ack 1, win 58, options [nop,nop,TS val 27358229 ecr 27358228], length 2896
17:16:32.864693 IP 10.0.0.1.39864 > 10.0.0.2.5001: Flags [.], seq 117288:120184, ack 1, win 58, options [nop,nop,TS val 27358230 ecr 27358229], length 2896
17:16:32.867114 IP 10.0.0.1.39864 > 10.0.0.2.5001: Flags [.], seq 120184:123080, ack 1, win 58, options [nop,nop,TS val 27358231 ecr 27358230], length 2896
17:16:32.869545 IP 10.0.0.1.39864 > 10.0.0.2.5001: Flags [.], seq 123080:125976, ack 1, win 58, options [nop,nop,TS val 27358231 ecr 27358230], length 2896
17:16:32.871966 IP 10.0.0.1.39864 > 10.0.0.2.5001: Flags [.], seq 125976:128872, ack 1, win 58, options [nop,nop,TS val 27358231 ecr 27358231], length 2896
17:16:32.874379 IP 10.0.0.1.39864 > 10.0.0.2.5001: Flags [.], seq 128872:131768, ack 1, win 58, options [nop,nop,TS val 27358232 ecr 27358232], length 2896
17:16:32.876801 IP 10.0.0.1.39864 > 10.0.0.2.5001: Flags [.], seq 131768:134664, ack 1, win 58, options [nop,nop,TS val 27358232 ecr 27358232], length 2896
17:16:32.879224 IP 10.0.0.1.39864 > 10.0.0.2.5001: Flags [.], seq 134664:137560, ack 1, win 58, options [nop,nop,TS val 27358233 ecr 27358232], length 2896
17:16:32.881647 IP 10.0.0.1.39864 > 10.0.0.2.5001: Flags [.], seq 137560:140456, ack 1, win 58, options [nop,nop,TS val 27358234 ecr 27358233], length 2896
17:16:32.884140 IP 10.0.0.1.39864 > 10.0.0.2.5001: Flags [.], seq 140456:143352, ack 1, win 58, options [nop,nop,TS val 27358235 ecr 27358234], length 2896
17:16:32.886563 IP 10.0.0.1.39864 > 10.0.0.2.5001: Flags [.], seq 143352:146248, ack 1, win 58, options [nop,nop,TS val 27358235 ecr 27358235], length 2896
17:16:32.888985 IP 10.0.0.1.39864 > 10.0.0.2.5001: Flags [.], seq 146248:149144, ack 1, win 58, options [nop,nop,TS val 27358236 ecr 27358235], length 2896
17:16:32.891408 IP 10.0.0.1.39864 > 10.0.0.2.5001: Flags [.], seq 149144:152040, ack 1, win 58, options [nop,nop,TS val 27358237 ecr 27358236], length 2896
17:16:32.893830 IP 10.0.0.1.39864 > 10.0.0.2.5001: Flags [.], seq 152040:154936, ack 1, win 58, options [nop,nop,TS val 27358237 ecr 27358237], length 2896
17:16:32.896252 IP 10.0.0.1.39864 > 10.0.0.2.5001: Flags [.], seq 154936:157832, ack 1, win 58, options [nop,nop,TS val 27358238 ecr 27358237], length 2896
17:16:32.898675 IP 10.0.0.1.39864 > 10.0.0.2.5001: Flags [.], seq 157832:160728, ack 1, win 58, options [nop,nop,TS val 27358238 ecr 27358238], length 2896
17:16:32.901098 IP 10.0.0.1.39864 > 10.0.0.2.5001: Flags [.], seq 160728:163624, ack 1, win 58, options [nop,nop,TS val 27358239 ecr 27358238], length 2896
17:16:32.903522 IP 10.0.0.1.39864 > 10.0.0.2.5001: Flags [P.], seq 163624:166520, ack 1, win 58, options [nop,nop,TS val 27358240 ecr 27358239], length 2896
17:16:32.905942 IP 10.0.0.1.39864 > 10.0.0.2.5001: Flags [.], seq 166520:169416, ack 1, win 58, options [nop,nop,TS val 27358240 ecr 27358240], length 2896
17:16:32.908364 IP 10.0.0.1.39864 > 10.0.0.2.5001: Flags [.], seq 169416:172312, ack 1, win 58, options [nop,nop,TS val 27358241 ecr 27358240], length 2896
17:16:32.910787 IP 10.0.0.1.39864 > 10.0.0.2.5001: Flags [.], seq 172312:175208, ack 1, win 58, options [nop,nop,TS val 27358241 ecr 27358241], length 2896
17:16:32.913209 IP 10.0.0.1.39864 > 10.0.0.2.5001: Flags [.], seq 175208:178104, ack 1, win 58, options [nop,nop,TS val 27358242 ecr 27358241], length 2896
17:16:32.915631 IP 10.0.0.1.39864 > 10.0.0.2.5001: Flags [.], seq 178104:181000, ack 1, win 58, options [nop,nop,TS val 27358243 ecr 27358242], length 2896
17:16:32.918053 IP 10.0.0.1.39864 > 10.0.0.2.5001: Flags [.], seq 181000:183896, ack 1, win 58, options [nop,nop,TS val 27358243 ecr 27358243], length 2896
17:16:32.920476 IP 10.0.0.1.39864 > 10.0.0.2.5001: Flags [.], seq 183896:186792, ack 1, win 58, options [nop,nop,TS val 27358244 ecr 27358243], length 2896
17:16:32.922898 IP 10.0.0.1.39864 > 10.0.0.2.5001: Flags [.], seq 186792:189688, ack 1, win 58, options [nop,nop,TS val 27358244 ecr 27358244], length 2896
17:16:32.925320 IP 10.0.0.1.39864 > 10.0.0.2.5001: Flags [.], seq 189688:192584, ack 1, win 58, options [nop,nop,TS val 27358245 ecr 27358244], length 2896
17:16:32.927743 IP 10.0.0.1.39864 > 10.0.0.2.5001: Flags [.], seq 192584:195480, ack 1, win 58, options [nop,nop,TS val 27358246 ecr 27358245], length 2896
17:16:32.930168 IP 10.0.0.1.39864 > 10.0.0.2.5001: Flags [.], seq 195480:198376, ack 1, win 58, options [nop,nop,TS val 27358246 ecr 27358246], length 2896
17:16:32.932590 IP 10.0.0.1.39864 > 10.0.0.2.5001: Flags [.], seq 198376:201272, ack 1, win 58, options [nop,nop,TS val 27358247 ecr 27358246], length 2896
17:16:32.935013 IP 10.0.0.1.39864 > 10.0.0.2.5001: Flags [.], seq 201272:204168, ack 1, win 58, options [nop,nop,TS val 27358247 ecr 27358247], length 2896
17:16:32.937433 IP 10.0.0.1.39864 > 10.0.0.2.5001: Flags [.], seq 204168:207064, ack 1, win 58, options [nop,nop,TS val 27358248 ecr 27358247], length 2896
17:16:32.939855 IP 10.0.0.1.39864 > 10.0.0.2.5001: Flags [.], seq 207064:209960, ack 1, win 58, options [nop,nop,TS val 27358249 ecr 27358248], length 2896
17:16:32.942278 IP 10.0.0.1.39864 > 10.0.0.2.5001: Flags [.], seq 209960:212856, ack 1, win 58, options [nop,nop,TS val 27358249 ecr 27358249], length 2896
17:16:32.944700 IP 10.0.0.1.39864 > 10.0.0.2.5001: Flags [.], seq 212856:215752, ack 1, win 58, options [nop,nop,TS val 27358250 ecr 27358249], length 2896
17:16:32.947124 IP 10.0.0.1.39864 > 10.0.0.2.5001: Flags [.], seq 215752:218648, ack 1, win 58, options [nop,nop,TS val 27358251 ecr 27358250], length 2896
17:16:32.949545 IP 10.0.0.1.39864 > 10.0.0.2.5001: Flags [.], seq 218648:221544, ack 1, win 58, options [nop,nop,TS val 27358251 ecr 27358251], length 2896
17:16:32.951967 IP 10.0.0.1.39864 > 10.0.0.2.5001: Flags [.], seq 221544:224440, ack 1, win 58, options [nop,nop,TS val 27358252 ecr 27358251], length 2896
17:16:32.954390 IP 10.0.0.1.39864 > 10.0.0.2.5001: Flags [.], seq 224440:227336, ack 1, win 58, options [nop,nop,TS val 27358252 ecr 27358252], length 2896
17:16:32.956813 IP 10.0.0.1.39864 > 10.0.0.2.5001: Flags [.], seq 227336:230232, ack 1, win 58, options [nop,nop,TS val 27358253 ecr 27358253], length 2896
17:16:32.959235 IP 10.0.0.1.39864 > 10.0.0.2.5001: Flags [.], seq 230232:233128, ack 1, win 58, options [nop,nop,TS val 27358254 ecr 27358253], length 2896
17:16:32.961658 IP 10.0.0.1.39864 > 10.0.0.2.5001: Flags [.], seq 233128:236024, ack 1, win 58, options [nop,nop,TS val 27358254 ecr 27358254], length 2896
17:16:32.964080 IP 10.0.0.1.39864 > 10.0.0.2.5001: Flags [.], seq 236024:238920, ack 1, win 58, options [nop,nop,TS val 27358255 ecr 27358254], length 2896
17:16:32.966502 IP 10.0.0.1.39864 > 10.0.0.2.5001: Flags [.], seq 238920:241816, ack 1, win 58, options [nop,nop,TS val 27358255 ecr 27358255], length 2896
17:16:32.968924 IP 10.0.0.1.39864 > 10.0.0.2.5001: Flags [.], seq 241816:244712, ack 1, win 58, options [nop,nop,TS val 27358256 ecr 27358255], length 2896
17:16:32.971348 IP 10.0.0.1.39864 > 10.0.0.2.5001: Flags [.], seq 244712:247608, ack 1, win 58, options [nop,nop,TS val 27358257 ecr 27358256], length 2896
17:16:32.973769 IP 10.0.0.1.39864 > 10.0.0.2.5001: Flags [.], seq 247608:250504, ack 1, win 58, options [nop,nop,TS val 27358257 ecr 27358257], length 2896
17:16:32.976191 IP 10.0.0.1.39864 > 10.0.0.2.5001: Flags [.], seq 250504:253400, ack 1, win 58, options [nop,nop,TS val 27358258 ecr 27358257], length 2896
17:16:32.978614 IP 10.0.0.1.39864 > 10.0.0.2.5001: Flags [.], seq 253400:256296, ack 1, win 58, options [nop,nop,TS val 27358258 ecr 27358258], length 2896
17:16:32.981037 IP 10.0.0.1.39864 > 10.0.0.2.5001: Flags [.], seq 256296:259192, ack 1, win 58, options [nop,nop,TS val 27358259 ecr 27358258], length 2896
17:16:32.983459 IP 10.0.0.1.39864 > 10.0.0.2.5001: Flags [.], seq 259192:262088, ack 1, win 58, options [nop,nop,TS val 27358260 ecr 27358259], length 2896
17:16:32.985881 IP 10.0.0.1.39864 > 10.0.0.2.5001: Flags [.], seq 262088:264984, ack 1, win 58, options [nop,nop,TS val 27358260 ecr 27358260], length 2896
17:16:32.988303 IP 10.0.0.1.39864 > 10.0.0.2.5001: Flags [.], seq 264984:267880, ack 1, win 58, options [nop,nop,TS val 27358261 ecr 27358260], length 2896
17:16:32.990726 IP 10.0.0.1.39864 > 10.0.0.2.5001: Flags [.], seq 267880:270776, ack 1, win 58, options [nop,nop,TS val 27358261 ecr 27358261], length 2896
17:16:32.993148 IP 10.0.0.1.39864 > 10.0.0.2.5001: Flags [.], seq 270776:273672, ack 1, win 58, options [nop,nop,TS val 27358262 ecr 27358261], length 2896
17:16:32.995574 IP 10.0.0.1.39864 > 10.0.0.2.5001: Flags [.], seq 273672:276568, ack 1, win 58, options [nop,nop,TS val 27358263 ecr 27358262], length 2896
17:16:32.997996 IP 10.0.0.1.39864 > 10.0.0.2.5001: Flags [.], seq 276568:279464, ack 1, win 58, options [nop,nop,TS val 27358263 ecr 27358263], length 2896
17:16:33.000416 IP 10.0.0.1.39864 > 10.0.0.2.5001: Flags [.], seq 279464:282360, ack 1, win 58, options [nop,nop,TS val 27358264 ecr 27358263], length 2896
17:16:33.002842 IP 10.0.0.1.39864 > 10.0.0.2.5001: Flags [.], seq 282360:285256, ack 1, win 58, options [nop,nop,TS val 27358264 ecr 27358264], length 2896
17:16:33.005264 IP 10.0.0.1.39864 > 10.0.0.2.5001: Flags [.], seq 285256:288152, ack 1, win 58, options [nop,nop,TS val 27358265 ecr 27358264], length 2896
17:16:33.007687 IP 10.0.0.1.39864 > 10.0.0.2.5001: Flags [.], seq 288152:291048, ack 1, win 58, options [nop,nop,TS val 27358266 ecr 27358265], length 2896
17:16:33.010107 IP 10.0.0.1.39864 > 10.0.0.2.5001: Flags [.], seq 291048:293944, ack 1, win 58, options [nop,nop,TS val 27358266 ecr 27358266], length 2896
17:16:33.012530 IP 10.0.0.1.39864 > 10.0.0.2.5001: Flags [.], seq 293944:296840, ack 1, win 58, options [nop,nop,TS val 27358267 ecr 27358266], length 2896
17:16:33.014954 IP 10.0.0.1.39864 > 10.0.0.2.5001: Flags [.], seq 296840:299736, ack 1, win 58, options [nop,nop,TS val 27358268 ecr 27358267], length 2896
17:16:33.017373 IP 10.0.0.1.39864 > 10.0.0.2.5001: Flags [.], seq 299736:302632, ack 1, win 58, options [nop,nop,TS val 27358268 ecr 27358268], length 2896
17:16:33.019795 IP 10.0.0.1.39864 > 10.0.0.2.5001: Flags [.], seq 302632:305528, ack 1, win 58, options [nop,nop,TS val 27358269 ecr 27358268], length 2896
17:16:33.022217 IP 10.0.0.1.39864 > 10.0.0.2.5001: Flags [.], seq 305528:308424, ack 1, win 58, options [nop,nop,TS val 27358269 ecr 27358269], length 2896
17:16:33.024642 IP 10.0.0.1.39864 > 10.0.0.2.5001: Flags [.], seq 308424:311320, ack 1, win 58, options [nop,nop,TS val 27358270 ecr 27358269], length 2896
17:16:33.027062 IP 10.0.0.1.39864 > 10.0.0.2.5001: Flags [P.], seq 311320:314216, ack 1, win 58, options [nop,nop,TS val 27358271 ecr 27358270], length 2896
17:16:33.029484 IP 10.0.0.1.39864 > 10.0.0.2.5001: Flags [.], seq 314216:317112, ack 1, win 58, options [nop,nop,TS val 27358271 ecr 27358271], length 2896
17:16:33.031907 IP 10.0.0.1.39864 > 10.0.0.2.5001: Flags [.], seq 317112:320008, ack 1, win 58, options [nop,nop,TS val 27358272 ecr 27358271], length 2896
17:16:33.034329 IP 10.0.0.1.39864 > 10.0.0.2.5001: Flags [.], seq 320008:322904, ack 1, win 58, options [nop,nop,TS val 27358272 ecr 27358272], length 2896
17:16:33.036751 IP 10.0.0.1.39864 > 10.0.0.2.5001: Flags [.], seq 322904:325800, ack 1, win 58, options [nop,nop,TS val 27358273 ecr 27358272], length 2896
17:16:33.039174 IP 10.0.0.1.39864 > 10.0.0.2.5001: Flags [.], seq 325800:328696, ack 1, win 58, options [nop,nop,TS val 27358274 ecr 27358273], length 2896
17:16:33.041596 IP 10.0.0.1.39864 > 10.0.0.2.5001: Flags [.], seq 328696:331592, ack 1, win 58, options [nop,nop,TS val 27358274 ecr 27358274], length 2896
17:16:33.044019 IP 10.0.0.1.39864 > 10.0.0.2.5001: Flags [.], seq 331592:334488, ack 1, win 58, options [nop,nop,TS val 27358275 ecr 27358274], length 2896
17:16:33.046441 IP 10.0.0.1.39864 > 10.0.0.2.5001: Flags [.], seq 334488:337384, ack 1, win 58, options [nop,nop,TS val 27358275 ecr 27358275], length 2896
17:16:33.048864 IP 10.0.0.1.39864 > 10.0.0.2.5001: Flags [.], seq 337384:340280, ack 1, win 58, options [nop,nop,TS val 27358276 ecr 27358275], length 2896
17:16:33.051286 IP 10.0.0.1.39864 > 10.0.0.2.5001: Flags [.], seq 340280:343176, ack 1, win 58, options [nop,nop,TS val 27358277 ecr 27358276], length 2896
17:16:33.053709 IP 10.0.0.1.39864 > 10.0.0.2.5001: Flags [.], seq 343176:346072, ack 1, win 58, options [nop,nop,TS val 27358277 ecr 27358277], length 2896
17:16:33.056131 IP 10.0.0.1.39864 > 10.0.0.2.5001: Flags [.], seq 346072:348968, ack 1, win 58, options [nop,nop,TS val 27358278 ecr 27358277], length 2896
17:16:33.058553 IP 10.0.0.1.39864 > 10.0.0.2.5001: Flags [.], seq 348968:351864, ack 1, win 58, options [nop,nop,TS val 27358278 ecr 27358278], length 2896
17:16:33.060976 IP 10.0.0.1.39864 > 10.0.0.2.5001: Flags [.], seq 351864:354760, ack 1, win 58, options [nop,nop,TS val 27358279 ecr 27358278], length 2896
17:16:33.063398 IP 10.0.0.1.39864 > 10.0.0.2.5001: Flags [.], seq 354760:357656, ack 1, win 58, options [nop,nop,TS val 27358280 ecr 27358279], length 2896
17:16:33.065821 IP 10.0.0.1.39864 > 10.0.0.2.5001: Flags [.], seq 357656:360552, ack 1, win 58, options [nop,nop,TS val 27358280 ecr 27358280], length 2896
17:16:33.068243 IP 10.0.0.1.39864 > 10.0.0.2.5001: Flags [.], seq 360552:363448, ack 1, win 58, options [nop,nop,TS val 27358281 ecr 27358280], length 2896
17:16:33.070665 IP 10.0.0.1.39864 > 10.0.0.2.5001: Flags [.], seq 363448:366344, ack 1, win 58, options [nop,nop,TS val 27358281 ecr 27358281], length 2896
17:16:33.073087 IP 10.0.0.1.39864 > 10.0.0.2.5001: Flags [.], seq 366344:369240, ack 1, win 58, options [nop,nop,TS val 27358282 ecr 27358281], length 2896
17:16:33.075510 IP 10.0.0.1.39864 > 10.0.0.2.5001: Flags [.], seq 369240:372136, ack 1, win 58, options [nop,nop,TS val 27358283 ecr 27358282], length 2896
17:16:33.077933 IP 10.0.0.1.39864 > 10.0.0.2.5001: Flags [.], seq 372136:375032, ack 1, win 58, options [nop,nop,TS val 27358283 ecr 27358283], length 2896
17:16:33.080355 IP 10.0.0.1.39864 > 10.0.0.2.5001: Flags [.], seq 375032:377928, ack 1, win 58, options [nop,nop,TS val 27358284 ecr 27358283], length 2896
17:16:33.082777 IP 10.0.0.1.39864 > 10.0.0.2.5001: Flags [.], seq 377928:380824, ack 1, win 58, options [nop,nop,TS val 27358284 ecr 27358284], length 2896
17:16:33.085200 IP 10.0.0.1.39864 > 10.0.0.2.5001: Flags [.], seq 380824:383720, ack 1, win 58, options [nop,nop,TS val 27358285 ecr 27358284], length 2896
17:16:33.087622 IP 10.0.0.1.39864 > 10.0.0.2.5001: Flags [.], seq 383720:386616, ack 1, win 58, options [nop,nop,TS val 27358286 ecr 27358285], length 2896
17:16:33.090045 IP 10.0.0.1.39864 > 10.0.0.2.5001: Flags [.], seq 386616:389512, ack 1, win 58, options [nop,nop,TS val 27358286 ecr 27358286], length 2896
17:16:33.092468 IP 10.0.0.1.39864 > 10.0.0.2.5001: Flags [.], seq 389512:392408, ack 1, win 58, options [nop,nop,TS val 27358287 ecr 27358286], length 2896
17:16:33.094889 IP 10.0.0.1.39864 > 10.0.0.2.5001: Flags [.], seq 392408:395304, ack 1, win 58, options [nop,nop,TS val 27358287 ecr 27358287], length 2896
17:16:33.097311 IP 10.0.0.1.39864 > 10.0.0.2.5001: Flags [.], seq 395304:398200, ack 1, win 58, options [nop,nop,TS val 27358288 ecr 27358288], length 2896
17:16:33.099734 IP 10.0.0.1.39864 > 10.0.0.2.5001: Flags [.], seq 398200:401096, ack 1, win 58, options [nop,nop,TS val 27358289 ecr 27358288], length 2896
17:16:33.102156 IP 10.0.0.1.39864 > 10.0.0.2.5001: Flags [.], seq 401096:403992, ack 1, win 58, options [nop,nop,TS val 27358289 ecr 27358289], length 2896
17:16:33.104579 IP 10.0.0.1.39864 > 10.0.0.2.5001: Flags [.], seq 403992:406888, ack 1, win 58, options [nop,nop,TS val 27358290 ecr 27358289], length 2896
17:16:33.107001 IP 10.0.0.1.39864 > 10.0.0.2.5001: Flags [.], seq 406888:409784, ack 1, win 58, options [nop,nop,TS val 27358291 ecr 27358290], length 2896
17:16:33.109424 IP 10.0.0.1.39864 > 10.0.0.2.5001: Flags [.], seq 409784:412680, ack 1, win 58, options [nop,nop,TS val 27358291 ecr 27358291], length 2896
17:16:33.111846 IP 10.0.0.1.39864 > 10.0.0.2.5001: Flags [.], seq 412680:415576, ack 1, win 58, options [nop,nop,TS val 27358292 ecr 27358291], length 2896
17:16:33.114268 IP 10.0.0.1.39864 > 10.0.0.2.5001: Flags [.], seq 415576:418472, ack 1, win 58, options [nop,nop,TS val 27358292 ecr 27358292], length 2896
17:16:33.116691 IP 10.0.0.1.39864 > 10.0.0.2.5001: Flags [.], seq 418472:421368, ack 1, win 58, options [nop,nop,TS val 27358293 ecr 27358292], length 2896
17:16:33.119113 IP 10.0.0.1.39864 > 10.0.0.2.5001: Flags [.], seq 421368:424264, ack 1, win 58, options [nop,nop,TS val 27358294 ecr 27358293], length 2896
17:16:33.121536 IP 10.0.0.1.39864 > 10.0.0.2.5001: Flags [.], seq 424264:427160, ack 1, win 58, options [nop,nop,TS val 27358294 ecr 27358294], length 2896
17:16:33.123958 IP 10.0.0.1.39864 > 10.0.0.2.5001: Flags [.], seq 427160:430056, ack 1, win 58, options [nop,nop,TS val 27358295 ecr 27358294], length 2896
17:16:33.126380 IP 10.0.0.1.39864 > 10.0.0.2.5001: Flags [.], seq 430056:432952, ack 1, win 58, options [nop,nop,TS val 27358295 ecr 27358295], length 2896
17:16:33.128803 IP 10.0.0.1.39864 > 10.0.0.2.5001: Flags [.], seq 432952:435848, ack 1, win 58, options [nop,nop,TS val 27358296 ecr 27358295], length 2896
17:16:33.131225 IP 10.0.0.1.39864 > 10.0.0.2.5001: Flags [.], seq 435848:438744, ack 1, win 58, options [nop,nop,TS val 27358297 ecr 27358296], length 2896
17:16:33.133648 IP 10.0.0.1.39864 > 10.0.0.2.5001: Flags [.], seq 438744:441640, ack 1, win 58, options [nop,nop,TS val 27358297 ecr 27358297], length 2896
17:16:33.136072 IP 10.0.0.1.39864 > 10.0.0.2.5001: Flags [.], seq 441640:444536, ack 1, win 58, options [nop,nop,TS val 27358298 ecr 27358297], length 2896
17:16:33.138500 IP 10.0.0.1.39864 > 10.0.0.2.5001: Flags [.], seq 444536:447432, ack 1, win 58, options [nop,nop,TS val 27358298 ecr 27358298], length 2896
17:16:33.140914 IP 10.0.0.1.39864 > 10.0.0.2.5001: Flags [.], seq 447432:450328, ack 1, win 58, options [nop,nop,TS val 27358299 ecr 27358298], length 2896
17:16:33.143337 IP 10.0.0.1.39864 > 10.0.0.2.5001: Flags [.], seq 450328:453224, ack 1, win 58, options [nop,nop,TS val 27358300 ecr 27358299], length 2896
17:16:33.145759 IP 10.0.0.1.39864 > 10.0.0.2.5001: Flags [.], seq 453224:456120, ack 1, win 58, options [nop,nop,TS val 27358300 ecr 27358300], length 2896
17:16:33.148182 IP 10.0.0.1.39864 > 10.0.0.2.5001: Flags [.], seq 456120:459016, ack 1, win 58, options [nop,nop,TS val 27358301 ecr 27358300], length 2896
17:16:33.150604 IP 10.0.0.1.39864 > 10.0.0.2.5001: Flags [.], seq 459016:461912, ack 1, win 58, options [nop,nop,TS val 27358301 ecr 27358301], length 2896
17:16:33.153027 IP 10.0.0.1.39864 > 10.0.0.2.5001: Flags [.], seq 461912:464808, ack 1, win 58, options [nop,nop,TS val 27358302 ecr 27358301], length 2896
17:16:33.155449 IP 10.0.0.1.39864 > 10.0.0.2.5001: Flags [P.], seq 464808:467704, ack 1, win 58, options [nop,nop,TS val 27358303 ecr 27358302], length 2896
17:16:33.157872 IP 10.0.0.1.39864 > 10.0.0.2.5001: Flags [.], seq 467704:470600, ack 1, win 58, options [nop,nop,TS val 27358303 ecr 27358303], length 2896
17:16:33.160294 IP 10.0.0.1.39864 > 10.0.0.2.5001: Flags [.], seq 470600:473496, ack 1, win 58, options [nop,nop,TS val 27358304 ecr 27358303], length 2896
17:16:33.162716 IP 10.0.0.1.39864 > 10.0.0.2.5001: Flags [.], seq 473496:476392, ack 1, win 58, options [nop,nop,TS val 27358304 ecr 27358304], length 2896
17:16:33.165139 IP 10.0.0.1.39864 > 10.0.0.2.5001: Flags [.], seq 476392:479288, ack 1, win 58, options [nop,nop,TS val 27358305 ecr 27358304], length 2896
17:16:33.167561 IP 10.0.0.1.39864 > 10.0.0.2.5001: Flags [.], seq 479288:482184, ack 1, win 58, options [nop,nop,TS val 27358306 ecr 27358305], length 2896
17:16:33.169984 IP 10.0.0.1.39864 > 10.0.0.2.5001: Flags [.], seq 482184:485080, ack 1, win 58, options [nop,nop,TS val 27358306 ecr 27358306], length 2896
17:16:33.172406 IP 10.0.0.1.39864 > 10.0.0.2.5001: Flags [.], seq 485080:487976, ack 1, win 58, options [nop,nop,TS val 27358307 ecr 27358306], length 2896
17:16:33.174829 IP 10.0.0.1.39864 > 10.0.0.2.5001: Flags [.], seq 487976:490872, ack 1, win 58, options [nop,nop,TS val 27358307 ecr 27358307], length 2896
17:16:33.177251 IP 10.0.0.1.39864 > 10.0.0.2.5001: Flags [.], seq 490872:493768, ack 1, win 58, options [nop,nop,TS val 27358308 ecr 27358307], length 2896
17:16:33.179673 IP 10.0.0.1.39864 > 10.0.0.2.5001: Flags [.], seq 493768:496664, ack 1, win 58, options [nop,nop,TS val 27358309 ecr 27358308], length 2896
17:16:33.182095 IP 10.0.0.1.39864 > 10.0.0.2.5001: Flags [.], seq 496664:499560, ack 1, win 58, options [nop,nop,TS val 27358309 ecr 27358309], length 2896
17:16:33.184518 IP 10.0.0.1.39864 > 10.0.0.2.5001: Flags [.], seq 499560:502456, ack 1, win 58, options [nop,nop,TS val 27358310 ecr 27358309], length 2896
17:16:33.186940 IP 10.0.0.1.39864 > 10.0.0.2.5001: Flags [.], seq 502456:505352, ack 1, win 58, options [nop,nop,TS val 27358310 ecr 27358310], length 2896
17:16:33.189363 IP 10.0.0.1.39864 > 10.0.0.2.5001: Flags [.], seq 505352:508248, ack 1, win 58, options [nop,nop,TS val 27358311 ecr 27358310], length 2896
17:16:33.191785 IP 10.0.0.1.39864 > 10.0.0.2.5001: Flags [.], seq 508248:511144, ack 1, win 58, options [nop,nop,TS val 27358312 ecr 27358311], length 2896
17:16:33.194207 IP 10.0.0.1.39864 > 10.0.0.2.5001: Flags [.], seq 511144:514040, ack 1, win 58, options [nop,nop,TS val 27358312 ecr 27358312], length 2896
17:16:33.196630 IP 10.0.0.1.39864 > 10.0.0.2.5001: Flags [.], seq 514040:516936, ack 1, win 58, options [nop,nop,TS val 27358313 ecr 27358312], length 2896
17:16:33.199052 IP 10.0.0.1.39864 > 10.0.0.2.5001: Flags [.], seq 516936:519832, ack 1, win 58, options [nop,nop,TS val 27358314 ecr 27358313], length 2896
17:16:33.201475 IP 10.0.0.1.39864 > 10.0.0.2.5001: Flags [.], seq 519832:522728, ack 1, win 58, options [nop,nop,TS val 27358314 ecr 27358314], length 2896
17:16:33.203897 IP 10.0.0.1.39864 > 10.0.0.2.5001: Flags [.], seq 522728:525624, ack 1, win 58, options [nop,nop,TS val 27358315 ecr 27358314], length 2896
17:16:33.206320 IP 10.0.0.1.39864 > 10.0.0.2.5001: Flags [.], seq 525624:528520, ack 1, win 58, options [nop,nop,TS val 27358315 ecr 27358315], length 2896
17:16:33.208742 IP 10.0.0.1.39864 > 10.0.0.2.5001: Flags [.], seq 528520:531416, ack 1, win 58, options [nop,nop,TS val 27358316 ecr 27358315], length 2896
17:16:33.211165 IP 10.0.0.1.39864 > 10.0.0.2.5001: Flags [.], seq 531416:534312, ack 1, win 58, options [nop,nop,TS val 27358317 ecr 27358316], length 2896
17:16:33.213587 IP 10.0.0.1.39864 > 10.0.0.2.5001: Flags [.], seq 534312:537208, ack 1, win 58, options [nop,nop,TS val 27358317 ecr 27358317], length 2896
17:16:33.216009 IP 10.0.0.1.39864 > 10.0.0.2.5001: Flags [.], seq 537208:540104, ack 1, win 58, options [nop,nop,TS val 27358318 ecr 27358317], length 2896
17:16:33.218432 IP 10.0.0.1.39864 > 10.0.0.2.5001: Flags [.], seq 540104:543000, ack 1, win 58, options [nop,nop,TS val 27358318 ecr 27358318], length 2896
17:16:33.220854 IP 10.0.0.1.39864 > 10.0.0.2.5001: Flags [.], seq 543000:545896, ack 1, win 58, options [nop,nop,TS val 27358319 ecr 27358318], length 2896
17:16:33.223277 IP 10.0.0.1.39864 > 10.0.0.2.5001: Flags [.], seq 545896:548792, ack 1, win 58, options [nop,nop,TS val 27358320 ecr 27358319], length 2896
17:16:33.225698 IP 10.0.0.1.39864 > 10.0.0.2.5001: Flags [.], seq 548792:551688, ack 1, win 58, options [nop,nop,TS val 27358320 ecr 27358320], length 2896
17:16:33.228121 IP 10.0.0.1.39864 > 10.0.0.2.5001: Flags [.], seq 551688:554584, ack 1, win 58, options [nop,nop,TS val 27358321 ecr 27358320], length 2896
17:16:33.230544 IP 10.0.0.1.39864 > 10.0.0.2.5001: Flags [.], seq 554584:557480, ack 1, win 58, options [nop,nop,TS val 27358321 ecr 27358321], length 2896
17:16:33.232972 IP 10.0.0.1.39864 > 10.0.0.2.5001: Flags [.], seq 557480:560376, ack 1, win 58, options [nop,nop,TS val 27358322 ecr 27358321], length 2896
17:16:33.235389 IP 10.0.0.1.39864 > 10.0.0.2.5001: Flags [.], seq 560376:563272, ack 1, win 58, options [nop,nop,TS val 27358323 ecr 27358322], length 2896
17:16:33.237811 IP 10.0.0.1.39864 > 10.0.0.2.5001: Flags [.], seq 563272:566168, ack 1, win 58, options [nop,nop,TS val 27358323 ecr 27358323], length 2896
17:16:33.240233 IP 10.0.0.1.39864 > 10.0.0.2.5001: Flags [.], seq 566168:569064, ack 1, win 58, options [nop,nop,TS val 27358324 ecr 27358323], length 2896
17:16:33.242656 IP 10.0.0.1.39864 > 10.0.0.2.5001: Flags [.], seq 569064:571960, ack 1, win 58, options [nop,nop,TS val 27358324 ecr 27358324], length 2896
17:16:33.245078 IP 10.0.0.1.39864 > 10.0.0.2.5001: Flags [.], seq 571960:574856, ack 1, win 58, options [nop,nop,TS val 27358325 ecr 27358324], length 2896
17:16:33.247500 IP 10.0.0.1.39864 > 10.0.0.2.5001: Flags [.], seq 574856:577752, ack 1, win 58, options [nop,nop,TS val 27358326 ecr 27358325], length 2896
17:16:33.249923 IP 10.0.0.1.39864 > 10.0.0.2.5001: Flags [.], seq 577752:580648, ack 1, win 58, options [nop,nop,TS val 27358326 ecr 27358326], length 2896
17:16:33.252346 IP 10.0.0.1.39864 > 10.0.0.2.5001: Flags [.], seq 580648:583544, ack 1, win 58, options [nop,nop,TS val 27358327 ecr 27358326], length 2896
17:16:33.254768 IP 10.0.0.1.39864 > 10.0.0.2.5001: Flags [.], seq 583544:586440, ack 1, win 58, options [nop,nop,TS val 27358327 ecr 27358327], length 2896
17:16:33.257190 IP 10.0.0.1.39864 > 10.0.0.2.5001: Flags [.], seq 586440:589336, ack 1, win 58, options [nop,nop,TS val 27358328 ecr 27358327], length 2896
17:16:33.259675 IP 10.0.0.1.39864 > 10.0.0.2.5001: Flags [.], seq 589336:592232, ack 1, win 58, options [nop,nop,TS val 27358329 ecr 27358328], length 2896
17:16:33.262099 IP 10.0.0.1.39864 > 10.0.0.2.5001: Flags [.], seq 592232:595128, ack 1, win 58, options [nop,nop,TS val 27358329 ecr 27358329], length 2896
17:16:33.264520 IP 10.0.0.1.39864 > 10.0.0.2.5001: Flags [.], seq 595128:598024, ack 1, win 58, options [nop,nop,TS val 27358330 ecr 27358329], length 2896
17:16:33.266942 IP 10.0.0.1.39864 > 10.0.0.2.5001: Flags [.], seq 598024:600920, ack 1, win 58, options [nop,nop,TS val 27358330 ecr 27358330], length 2896
17:16:33.269364 IP 10.0.0.1.39864 > 10.0.0.2.5001: Flags [.], seq 600920:603816, ack 1, win 58, options [nop,nop,TS val 27358331 ecr 27358330], length 2896
17:16:33.271787 IP 10.0.0.1.39864 > 10.0.0.2.5001: Flags [.], seq 603816:606712, ack 1, win 58, options [nop,nop,TS val 27358332 ecr 27358331], length 2896
17:16:33.274209 IP 10.0.0.1.39864 > 10.0.0.2.5001: Flags [.], seq 606712:609608, ack 1, win 58, options [nop,nop,TS val 27358332 ecr 27358332], length 2896
17:16:33.276631 IP 10.0.0.1.39864 > 10.0.0.2.5001: Flags [.], seq 609608:612504, ack 1, win 58, options [nop,nop,TS val 27358333 ecr 27358332], length 2896
17:16:33.279054 IP 10.0.0.1.39864 > 10.0.0.2.5001: Flags [.], seq 612504:615400, ack 1, win 58, options [nop,nop,TS val 27358334 ecr 27358333], length 2896
17:16:33.281478 IP 10.0.0.1.39864 > 10.0.0.2.5001: Flags [P.], seq 615400:618296, ack 1, win 58, options [nop,nop,TS val 27358334 ecr 27358334], length 2896
17:16:33.283899 IP 10.0.0.1.39864 > 10.0.0.2.5001: Flags [.], seq 618296:621192, ack 1, win 58, options [nop,nop,TS val 27358335 ecr 27358334], length 2896
17:16:33.286321 IP 10.0.0.1.39864 > 10.0.0.2.5001: Flags [.], seq 621192:624088, ack 1, win 58, options [nop,nop,TS val 27358335 ecr 27358335], length 2896
17:16:33.288743 IP 10.0.0.1.39864 > 10.0.0.2.5001: Flags [.], seq 624088:626984, ack 1, win 58, options [nop,nop,TS val 27358336 ecr 27358335], length 2896
17:16:33.291166 IP 10.0.0.1.39864 > 10.0.0.2.5001: Flags [.], seq 626984:629880, ack 1, win 58, options [nop,nop,TS val 27358337 ecr 27358336], length 2896
17:16:33.293589 IP 10.0.0.1.39864 > 10.0.0.2.5001: Flags [.], seq 629880:632776, ack 1, win 58, options [nop,nop,TS val 27358337 ecr 27358337], length 2896
17:16:33.296011 IP 10.0.0.1.39864 > 10.0.0.2.5001: Flags [.], seq 632776:635672, ack 1, win 58, options [nop,nop,TS val 27358338 ecr 27358337], length 2896
17:16:33.298433 IP 10.0.0.1.39864 > 10.0.0.2.5001: Flags [.], seq 635672:638568, ack 1, win 58, options [nop,nop,TS val 27358338 ecr 27358338], length 2896
17:16:33.300855 IP 10.0.0.1.39864 > 10.0.0.2.5001: Flags [.], seq 638568:641464, ack 1, win 58, options [nop,nop,TS val 27358339 ecr 27358338], length 2896
17:16:33.303278 IP 10.0.0.1.39864 > 10.0.0.2.5001: Flags [.], seq 641464:644360, ack 1, win 58, options [nop,nop,TS val 27358340 ecr 27358339], length 2896
17:16:33.305700 IP 10.0.0.1.39864 > 10.0.0.2.5001: Flags [.], seq 644360:647256, ack 1, win 58, options [nop,nop,TS val 27358340 ecr 27358340], length 2896
17:16:33.308123 IP 10.0.0.1.39864 > 10.0.0.2.5001: Flags [.], seq 647256:650152, ack 1, win 58, options [nop,nop,TS val 27358341 ecr 27358340], length 2896
17:16:33.310546 IP 10.0.0.1.39864 > 10.0.0.2.5001: Flags [.], seq 650152:653048, ack 1, win 58, options [nop,nop,TS val 27358341 ecr 27358341], length 2896
17:16:33.312967 IP 10.0.0.1.39864 > 10.0.0.2.5001: Flags [.], seq 653048:655944, ack 1, win 58, options [nop,nop,TS val 27358342 ecr 27358341], length 2896
17:16:33.315389 IP 10.0.0.1.39864 > 10.0.0.2.5001: Flags [.], seq 655944:658840, ack 1, win 58, options [nop,nop,TS val 27358343 ecr 27358342], length 2896
17:16:33.317812 IP 10.0.0.1.39864 > 10.0.0.2.5001: Flags [.], seq 658840:661736, ack 1, win 58, options [nop,nop,TS val 27358343 ecr 27358343], length 2896
17:16:33.320235 IP 10.0.0.1.39864 > 10.0.0.2.5001: Flags [.], seq 661736:664632, ack 1, win 58, options [nop,nop,TS val 27358344 ecr 27358343], length 2896
17:16:33.322657 IP 10.0.0.1.39864 > 10.0.0.2.5001: Flags [.], seq 664632:667528, ack 1, win 58, options [nop,nop,TS val 27358344 ecr 27358344], length 2896
17:16:33.325079 IP 10.0.0.1.39864 > 10.0.0.2.5001: Flags [.], seq 667528:670424, ack 1, win 58, options [nop,nop,TS val 27358345 ecr 27358344], length 2896
17:16:33.327502 IP 10.0.0.1.39864 > 10.0.0.2.5001: Flags [.], seq 670424:673320, ack 1, win 58, options [nop,nop,TS val 27358346 ecr 27358345], length 2896
17:16:33.329924 IP 10.0.0.1.39864 > 10.0.0.2.5001: Flags [.], seq 673320:676216, ack 1, win 58, options [nop,nop,TS val 27358346 ecr 27358346], length 2896
17:16:33.332347 IP 10.0.0.1.39864 > 10.0.0.2.5001: Flags [.], seq 676216:679112, ack 1, win 58, options [nop,nop,TS val 27358347 ecr 27358346], length 2896
17:16:33.334770 IP 10.0.0.1.39864 > 10.0.0.2.5001: Flags [.], seq 679112:682008, ack 1, win 58, options [nop,nop,TS val 27358347 ecr 27358347], length 2896
17:16:33.337193 IP 10.0.0.1.39864 > 10.0.0.2.5001: Flags [.], seq 682008:684904, ack 1, win 58, options [nop,nop,TS val 27358348 ecr 27358347], length 2896
17:16:33.339614 IP 10.0.0.1.39864 > 10.0.0.2.5001: Flags [.], seq 684904:687800, ack 1, win 58, options [nop,nop,TS val 27358349 ecr 27358348], length 2896
17:16:33.342036 IP 10.0.0.1.39864 > 10.0.0.2.5001: Flags [.], seq 687800:690696, ack 1, win 58, options [nop,nop,TS val 27358349 ecr 27358349], length 2896
17:16:33.344459 IP 10.0.0.1.39864 > 10.0.0.2.5001: Flags [.], seq 690696:693592, ack 1, win 58, options [nop,nop,TS val 27358350 ecr 27358349], length 2896
17:16:33.346881 IP 10.0.0.1.39864 > 10.0.0.2.5001: Flags [.], seq 693592:696488, ack 1, win 58, options [nop,nop,TS val 27358350 ecr 27358350], length 2896
17:16:33.349303 IP 10.0.0.1.39864 > 10.0.0.2.5001: Flags [.], seq 696488:699384, ack 1, win 58, options [nop,nop,TS val 27358351 ecr 27358350], length 2896
17:16:33.351727 IP 10.0.0.1.39864 > 10.0.0.2.5001: Flags [.], seq 699384:702280, ack 1, win 58, options [nop,nop,TS val 27358352 ecr 27358351], length 2896
17:16:33.354148 IP 10.0.0.1.39864 > 10.0.0.2.5001: Flags [.], seq 702280:705176, ack 1, win 58, options [nop,nop,TS val 27358352 ecr 27358352], length 2896
17:16:33.356571 IP 10.0.0.1.39864 > 10.0.0.2.5001: Flags [.], seq 705176:708072, ack 1, win 58, options [nop,nop,TS val 27358353 ecr 27358352], length 2896
17:16:33.358993 IP 10.0.0.1.39864 > 10.0.0.2.5001: Flags [.], seq 708072:710968, ack 1, win 58, options [nop,nop,TS val 27358354 ecr 27358353], length 2896
17:16:33.361417 IP 10.0.0.1.39864 > 10.0.0.2.5001: Flags [.], seq 710968:713864, ack 1, win 58, options [nop,nop,TS val 27358354 ecr 27358354], length 2896
17:16:33.363839 IP 10.0.0.1.39864 > 10.0.0.2.5001: Flags [.], seq 713864:716760, ack 1, win 58, options [nop,nop,TS val 27358355 ecr 27358354], length 2896
17:16:33.366260 IP 10.0.0.1.39864 > 10.0.0.2.5001: Flags [.], seq 716760:719656, ack 1, win 58, options [nop,nop,TS val 27358355 ecr 27358355], length 2896
17:16:33.368683 IP 10.0.0.1.39864 > 10.0.0.2.5001: Flags [.], seq 719656:722552, ack 1, win 58, options [nop,nop,TS val 27358356 ecr 27358355], length 2896
17:16:33.371105 IP 10.0.0.1.39864 > 10.0.0.2.5001: Flags [.], seq 722552:725448, ack 1, win 58, options [nop,nop,TS val 27358357 ecr 27358356], length 2896
17:16:33.373528 IP 10.0.0.1.39864 > 10.0.0.2.5001: Flags [.], seq 725448:728344, ack 1, win 58, options [nop,nop,TS val 27358357 ecr 27358357], length 2896
17:16:33.375952 IP 10.0.0.1.39864 > 10.0.0.2.5001: Flags [.], seq 728344:731240, ack 1, win 58, options [nop,nop,TS val 27358358 ecr 27358357], length 2896
17:16:33.378372 IP 10.0.0.1.39864 > 10.0.0.2.5001: Flags [.], seq 731240:734136, ack 1, win 58, options [nop,nop,TS val 27358358 ecr 27358358], length 2896
17:16:33.380795 IP 10.0.0.1.39864 > 10.0.0.2.5001: Flags [.], seq 734136:737032, ack 1, win 58, options [nop,nop,TS val 27358359 ecr 27358358], length 2896
17:16:33.383218 IP 10.0.0.1.39864 > 10.0.0.2.5001: Flags [.], seq 737032:739928, ack 1, win 58, options [nop,nop,TS val 27358360 ecr 27358359], length 2896
17:16:33.385640 IP 10.0.0.1.39864 > 10.0.0.2.5001: Flags [.], seq 739928:742824, ack 1, win 58, options [nop,nop,TS val 27358360 ecr 27358360], length 2896
17:16:33.388062 IP 10.0.0.1.39864 > 10.0.0.2.5001: Flags [.], seq 742824:745720, ack 1, win 58, options [nop,nop,TS val 27358361 ecr 27358360], length 2896
17:16:33.390484 IP 10.0.0.1.39864 > 10.0.0.2.5001: Flags [.], seq 745720:748616, ack 1, win 58, options [nop,nop,TS val 27358361 ecr 27358361], length 2896
17:16:33.392907 IP 10.0.0.1.39864 > 10.0.0.2.5001: Flags [.], seq 748616:751512, ack 1, win 58, options [nop,nop,TS val 27358362 ecr 27358361], length 2896
