00:00:00.000000 IP 10.0.0.1.38109 > 10.0.0.2.5001: Flags [.], seq 4110576647:4110579543, ack 820548325, win 58, options [nop,nop,TS val 1668695 ecr 1668695], length 2896
00:00:00.000009 IP 10.0.0.2.5001 > 10.0.0.1.38109: Flags [.], ack 2896, win 611, options [nop,nop,TS val 1668713 ecr 1668695], length 0
00:00:00.002423 IP 10.0.0.1.38109 > 10.0.0.2.5001: Flags [.], seq 2896:5792, ack 1, win 58, options [nop,nop,TS val 1668695 ecr 1668695], length 2896
00:00:00.002435 IP 10.0.0.2.5001 > 10.0.0.1.38109: Flags [.], ack 5792, win 611, options [nop,nop,TS val 1668713 ecr 1668695], length 0
00:00:00.004845 IP 10.0.0.1.38109 > 10.0.0.2.5001: Flags [.], seq 5792:8688, ack 1, win 58, options [nop,nop,TS val 1668696 ecr 1668696], length 2896
00:00:00.004855 IP 10.0.0.2.5001 > 10.0.0.1.38109: Flags [.], ack 8688, win 611, options [nop,nop,TS val 1668714 ecr 1668696], length 0
00:00:00.007268 IP 10.0.0.1.38109 > 10.0.0.2.5001: Flags [.], seq 8688:11584, ack 1, win 58, options [nop,nop,TS val 1668696 ecr 1668696], length 2896
00:00:00.007277 IP 10.0.0.2.5001 > 10.0.0.1.38109: Flags [.], ack 11584, win 611, options [nop,nop,TS val 1668715 ecr 1668696], length 0
00:00:00.009690 IP 10.0.0.1.38109 > 10.0.0.2.5001: Flags [.], seq 11584:14480, ack 1, win 58, options [nop,nop,TS val 1668697 ecr 1668697], length 2896
00:00:00.009700 IP 10.0.0.2.5001 > 10.0.0.1.38109: Flags [.], ack 14480, win 611, options [nop,nop,TS val 1668715 ecr 1668697], length 0
00:00:00.012112 IP 10.0.0.1.38109 > 10.0.0.2.5001: Flags [P.], seq 14480:17376, ack 1, win 58, options [nop,nop,TS val 1668698 ecr 1668698], length 2896
00:00:00.012120 IP 10.0.0.2.5001 > 10.0.0.1.38109: Flags [.], ack 17376, win 611, options [nop,nop,TS val 1668716 ecr 1668698], length 0
00:00:00.014535 IP 10.0.0.1.38109 > 10.0.0.2.5001: Flags [.], seq 17376:20272, ack 1, win 58, options [nop,nop,TS val 1668698 ecr 1668698], length 2896
00:00:00.014543 IP 10.0.0.2.5001 > 10.0.0.1.38109: Flags [.], ack 20272, win 611, options [nop,nop,TS val 1668716 ecr 1668698], length 0
00:00:00.016957 IP 10.0.0.1.38109 > 10.0.0.2.5001: Flags [.], seq 20272:23168, ack 1, win 58, options [nop,nop,TS val 1668699 ecr 1668699], length 2896
00:00:00.016966 IP 10.0.0.2.5001 > 10.0.0.1.38109: Flags [.], ack 23168, win 611, options [nop,nop,TS val 1668717 ecr 1668699], length 0
00:00:00.019380 IP 10.0.0.1.38109 > 10.0.0.2.5001: Flags [.], seq 23168:26064, ack 1, win 58, options [nop,nop,TS val 1668699 ecr 1668699], length 2896
00:00:00.019390 IP 10.0.0.2.5001 > 10.0.0.1.38109: Flags [.], ack 26064, win 611, options [nop,nop,TS val 1668718 ecr 1668699], length 0
00:00:00.021802 IP 10.0.0.1.38109 > 10.0.0.2.5001: Flags [.], seq 26064:28960, ack 1, win 58, options [nop,nop,TS val 1668700 ecr 1668700], length 2896
00:00:00.021811 IP 10.0.0.2.5001 > 10.0.0.1.38109: Flags [.], ack 28960, win 611, options [nop,nop,TS val 1668718 ecr 1668700], length 0
00:00:00.024224 IP 10.0.0.1.38109 > 10.0.0.2.5001: Flags [.], seq 28960:31856, ack 1, win 58, options [nop,nop,TS val 1668700 ecr 1668700], length 2896
00:00:00.024233 IP 10.0.0.2.5001 > 10.0.0.1.38109: Flags [.], ack 31856, win 611, options [nop,nop,TS val 1668719 ecr 1668700], length 0
00:00:00.026647 IP 10.0.0.1.38109 > 10.0.0.2.5001: Flags [.], seq 31856:34752, ack 1, win 58, options [nop,nop,TS val 1668701 ecr 1668701], length 2896
00:00:00.026655 IP 10.0.0.2.5001 > 10.0.0.1.38109: Flags [.], ack 34752, win 611, options [nop,nop,TS val 1668719 ecr 1668701], length 0
00:00:00.029069 IP 10.0.0.1.38109 > 10.0.0.2.5001: Flags [.], seq 34752:37648, ack 1, win 58, options [nop,nop,TS val 1668701 ecr 1668701], length 2896
00:00:00.029077 IP 10.0.0.2.5001 > 10.0.0.1.38109: Flags [.], ack 37648, win 611, options [nop,nop,TS val 1668720 ecr 1668701], length 0
00:00:00.031491 IP 10.0.0.1.38109 > 10.0.0.2.5001: Flags [.], seq 37648:40544, ack 1, win 58, options [nop,nop,TS val 1668702 ecr 1668702], length 2896
00:00:00.031501 IP 10.0.0.2.5001 > 10.0.0.1.38109: Flags [.], ack 40544, win 611, options [nop,nop,TS val 1668721 ecr 1668702], length 0
00:00:00.033914 IP6 :: > ff02::16: HBH ICMP6, multicast listener report v2, 1 group record(s), length 28
00:00:00.033985 IP 10.0.0.1.38109 > 10.0.0.2.5001: Flags [.], seq 40544:43440, ack 1, win 58, options [nop,nop,TS val 1668703 ecr 1668703], length 2896
00:00:00.033993 IP 10.0.0.2.5001 > 10.0.0.1.38109: Flags [.], ack 43440, win 611, options [nop,nop,TS val 1668721 ecr 1668703], length 0
00:00:00.036408 IP 10.0.0.1.38109 > 10.0.0.2.5001: Flags [.], seq 43440:46336, ack 1, win 58, options [nop,nop,TS val 1668703 ecr 1668703], length 2896
00:00:00.036417 IP 10.0.0.2.5001 > 10.0.0.1.38109: Flags [.], ack 46336, win 611, options [nop,nop,TS val 1668722 ecr 1668703], length 0
00:00:00.038830 IP 10.0.0.1.38109 > 10.0.0.2.5001: Flags [.], seq 46336:49232, ack 1, win 58, options [nop,nop,TS val 1668704 ecr 1668704], length 2896
00:00:00.038840 IP 10.0.0.2.5001 > 10.0.0.1.38109: Flags [.], ack 49232, win 611, options [nop,nop,TS val 1668723 ecr 1668704], length 0
00:00:00.041253 IP 10.0.0.1.38109 > 10.0.0.2.5001: Flags [.], seq 49232:52128, ack 1, win 58, options [nop,nop,TS val 1668704 ecr 1668704], length 2896
00:00:00.041260 IP 10.0.0.2.5001 > 10.0.0.1.38109: Flags [.], ack 52128, win 611, options [nop,nop,TS val 1668723 ecr 1668704], length 0
00:00:00.043675 IP 10.0.0.1.38109 > 10.0.0.2.5001: Flags [.], seq 52128:55024, ack 1, win 58, options [nop,nop,TS val 1668705 ecr 1668705], length 2896
00:00:00.043683 IP 10.0.0.2.5001 > 10.0.0.1.38109: Flags [.], ack 55024, win 611, options [nop,nop,TS val 1668724 ecr 1668705], length 0
00:00:00.046098 IP 10.0.0.1.38109 > 10.0.0.2.5001: Flags [.], seq 55024:57920, ack 1, win 58, options [nop,nop,TS val 1668706 ecr 1668706], length 2896
00:00:00.046108 IP 10.0.0.2.5001 > 10.0.0.1.38109: Flags [.], ack 57920, win 611, options [nop,nop,TS val 1668724 ecr 1668706], length 0
00:00:00.048520 IP 10.0.0.1.38109 > 10.0.0.2.5001: Flags [.], seq 57920:60816, ack 1, win 58, options [nop,nop,TS val 1668706 ecr 1668706], length 2896
00:00:00.048529 IP 10.0.0.2.5001 > 10.0.0.1.38109: Flags [.], ack 60816, win 611, options [nop,nop,TS val 1668725 ecr 1668706], length 0
00:00:00.050943 IP 10.0.0.1.38109 > 10.0.0.2.5001: Flags [.], seq 60816:63712, ack 1, win 58, options [nop,nop,TS val 1668707 ecr 1668707], length 2896
00:00:00.050951 IP 10.0.0.2.5001 > 10.0.0.1.38109: Flags [.], ack 63712, win 611, options [nop,nop,TS val 1668726 ecr 1668707], length 0
00:00:00.053365 IP 10.0.0.1.38109 > 10.0.0.2.5001: Flags [.], seq 63712:66608, ack 1, win 58, options [nop,nop,TS val 1668707 ecr 1668707], length 2896
00:00:00.053374 IP 10.0.0.2.5001 > 10.0.0.1.38109: Flags [.], ack 66608, win 611, options [nop,nop,TS val 1668726 ecr 1668707], length 0
00:00:00.055787 IP 10.0.0.1.38109 > 10.0.0.2.5001: Flags [P.], seq 66608:69504, ack 1, win 58, options [nop,nop,TS val 1668708 ecr 1668708], length 2896
00:00:00.055797 IP 10.0.0.2.5001 > 10.0.0.1.38109: Flags [.], ack 69504, win 611, options [nop,nop,TS val 1668727 ecr 1668708], length 0
00:00:00.058210 IP 10.0.0.1.38109 > 10.0.0.2.5001: Flags [.], seq 69504:72400, ack 1, win 58, options [nop,nop,TS val 1668709 ecr 1668709], length 2896
00:00:00.058219 IP 10.0.0.2.5001 > 10.0.0.1.38109: Flags [.], ack 72400, win 611, options [nop,nop,TS val 1668727 ecr 1668709], length 0
00:00:00.060632 IP 10.0.0.1.38109 > 10.0.0.2.5001: Flags [.], seq 72400:75296, ack 1, win 58, options [nop,nop,TS val 1668709 ecr 1668709], length 2896
00:00:00.060641 IP 10.0.0.2.5001 > 10.0.0.1.38109: Flags [.], ack 75296, win 611, options [nop,nop,TS val 1668728 ecr 1668709], length 0
00:00:00.063054 IP 10.0.0.1.38109 > 10.0.0.2.5001: Flags [.], seq 75296:78192, ack 1, win 58, options [nop,nop,TS val 1668710 ecr 1668710], length 2896
00:00:00.063063 IP 10.0.0.2.5001 > 10.0.0.1.38109: Flags [.], ack 78192, win 611, options [nop,nop,TS val 1668729 ecr 1668710], length 0
00:00:00.065477 IP 10.0.0.1.38109 > 10.0.0.2.5001: Flags [.], seq 78192:81088, ack 1, win 58, options [nop,nop,TS val 1668710 ecr 1668710], length 2896
00:00:00.065485 IP 10.0.0.2.5001 > 10.0.0.1.38109: Flags [.], ack 81088, win 611, options [nop,nop,TS val 1668729 ecr 1668710], length 0
00:00:00.067900 IP 10.0.0.1.38109 > 10.0.0.2.5001: Flags [.], seq 81088:83984, ack 1, win 58, options [nop,nop,TS val 1668711 ecr 1668711], length 2896
00:00:00.067908 IP 10.0.0.2.5001 > 10.0.0.1.38109: Flags [.], ack 83984, win 611, options [nop,nop,TS val 1668730 ecr 1668711], length 0
00:00:00.070322 IP 10.0.0.1.38109 > 10.0.0.2.5001: Flags [.], seq 83984:86880, ack 1, win 58, options [nop,nop,TS val 1668712 ecr 1668712], length 2896
00:00:00.070330 IP 10.0.0.2.5001 > 10.0.0.1.38109: Flags [.], ack 86880, win 611, options [nop,nop,TS val 1668730 ecr 1668712], length 0
00:00:00.072744 IP 10.0.0.1.38109 > 10.0.0.2.5001: Flags [.], seq 86880:89776, ack 1, win 58, options [nop,nop,TS val 1668712 ecr 1668712], length 2896
00:00:00.072753 IP 10.0.0.2.5001 > 10.0.0.1.38109: Flags [.], ack 89776, win 611, options [nop,nop,TS val 1668731 ecr 1668712], length 0
00:00:00.075166 IP 10.0.0.1.38109 > 10.0.0.2.5001: Flags [.], seq 89776:92672, ack 1, win 58, options [nop,nop,TS val 1668713 ecr 1668713], length 2896
00:00:00.075175 IP 10.0.0.2.5001 > 10.0.0.1.38109: Flags [.], ack 92672, win 611, options [nop,nop,TS val 1668732 ecr 1668713], length 0
00:00:00.077589 IP 10.0.0.1.38109 > 10.0.0.2.5001: Flags [.], seq 92672:95568, ack 1, win 58, options [nop,nop,TS val 1668713 ecr 1668713], length 2896
00:00:00.077597 IP 10.0.0.2.5001 > 10.0.0.1.38109: Flags [.], ack 95568, win 611, options [nop,nop,TS val 1668732 ecr 1668713], length 0
00:00:00.080011 IP 10.0.0.1.38109 > 10.0.0.2.5001: Flags [.], seq 95568:98464, ack 1, win 58, options [nop,nop,TS val 1668713 ecr 1668713], length 2896
00:00:00.080021 IP 10.0.0.2.5001 > 10.0.0.1.38109: Flags [.], ack 98464, win 611, options [nop,nop,TS val 1668733 ecr 1668713], length 0
00:00:00.082434 IP 10.0.0.1.38109 > 10.0.0.2.5001: Flags [.], seq 98464:101360, ack 1, win 58, options [nop,nop,TS val 1668714 ecr 1668714], length 2896
00:00:00.082442 IP 10.0.0.2.5001 > 10.0.0.1.38109: Flags [.], ack 101360, win 611, options [nop,nop,TS val 1668733 ecr 1668714], length 0
00:00:00.084856 IP 10.0.0.1.38109 > 10.0.0.2.5001: Flags [.], seq 101360:104256, ack 1, win 58, options [nop,nop,TS val 1668715 ecr 1668715], length 2896
00:00:00.084864 IP 10.0.0.2.5001 > 10.0.0.1.38109: Flags [.], ack 104256, win 611, options [nop,nop,TS val 1668734 ecr 1668715], length 0
00:00:00.087278 IP 10.0.0.1.38109 > 10.0.0.2.5001: Flags [.], seq 104256:107152, ack 1, win 58, options [nop,nop,TS val 1668715 ecr 1668715], length 2896
00:00:00.087288 IP 10.0.0.2.5001 > 10.0.0.1.38109: Flags [.], ack 107152, win 611, options [nop,nop,TS val 1668735 ecr 1668715], length 0
00:00:00.089701 IP 10.0.0.1.38109 > 10.0.0.2.5001: Flags [.], seq 107152:110048, ack 1, win 58, options [nop,nop,TS val 1668716 ecr 1668716], length 2896
00:00:00.089710 IP 10.0.0.2.5001 > 10.0.0.1.38109: Flags [.], ack 110048, win 611, options [nop,nop,TS val 1668735 ecr 1668716], length 0
00:00:00.092123 IP 10.0.0.1.38109 > 10.0.0.2.5001: Flags [.], seq 110048:112944, ack 1, win 58, options [nop,nop,TS val 1668716 ecr 1668716], length 2896
00:00:00.092132 IP 10.0.0.2.5001 > 10.0.0.1.38109: Flags [.], ack 112944, win 611, options [nop,nop,TS val 1668736 ecr 1668716], length 0
00:00:00.094546 IP 10.0.0.1.38109 > 10.0.0.2.5001: Flags [.], seq 112944:115840, ack 1, win 58, options [nop,nop,TS val 1668717 ecr 1668717], length 2896
00:00:00.094555 IP 10.0.0.2.5001 > 10.0.0.1.38109: Flags [.], ack 115840, win 611, options [nop,nop,TS val 1668736 ecr 1668717], length 0
00:00:00.096968 IP 10.0.0.1.38109 > 10.0.0.2.5001: Flags [.], seq 115840:118736, ack 1, win 58, options [nop,nop,TS val 1668718 ecr 1668718], length 2896
00:00:00.097031 IP 10.0.0.2.5001 > 10.0.0.1.38109: Flags [.], ack 118736, win 611, options [nop,nop,TS val 1668737 ecr 1668718], length 0
00:00:00.099391 IP 10.0.0.1.38109 > 10.0.0.2.5001: Flags [.], seq 118736:121632, ack 1, win 58, options [nop,nop,TS val 1668718 ecr 1668718], length 2896
00:00:00.099399 IP 10.0.0.2.5001 > 10.0.0.1.38109: Flags [.], ack 121632, win 611, options [nop,nop,TS val 1668738 ecr 1668718], length 0
00:00:00.101813 IP 10.0.0.1.38109 > 10.0.0.2.5001: Flags [.], seq 121632:124528, ack 1, win 58, options [nop,nop,TS val 1668719 ecr 1668719], length 2896
00:00:00.101821 IP 10.0.0.2.5001 > 10.0.0.1.38109: Flags [.], ack 124528, win 611, options [nop,nop,TS val 1668738 ecr 1668719], length 0
00:00:00.104235 IP 10.0.0.1.38109 > 10.0.0.2.5001: Flags [.], seq 124528:127424, ack 1, win 58, options [nop,nop,TS val 1668719 ecr 1668719], length 2896
00:00:00.104245 IP 10.0.0.2.5001 > 10.0.0.1.38109: Flags [.], ack 127424, win 611, options [nop,nop,TS val 1668739 ecr 1668719], length 0
00:00:00.106658 IP 10.0.0.1.38109 > 10.0.0.2.5001: Flags [.], seq 127424:130320, ack 1, win 58, options [nop,nop,TS val 1668720 ecr 1668720], length 2896
00:00:00.106666 IP 10.0.0.2.5001 > 10.0.0.1.38109: Flags [.], ack 130320, win 611, options [nop,nop,TS val 1668739 ecr 1668720], length 0
00:00:00.109080 IP 10.0.0.1.38109 > 10.0.0.2.5001: Flags [.], seq 130320:133216, ack 1, win 58, options [nop,nop,TS val 1668721 ecr 1668721], length 2896
00:00:00.109089 IP 10.0.0.2.5001 > 10.0.0.1.38109: Flags [.], ack 133216, win 611, options [nop,nop,TS val 1668740 ecr 1668721], length 0
00:00:00.111503 IP 10.0.0.1.38109 > 10.0.0.2.5001: Flags [.], seq 133216:136112, ack 1, win 58, options [nop,nop,TS val 1668721 ecr 1668721], length 2896
00:00:00.111513 IP 10.0.0.2.5001 > 10.0.0.1.38109: Flags [.], ack 136112, win 611, options [nop,nop,TS val 1668741 ecr 1668721], length 0
00:00:00.113925 IP 10.0.0.1.38109 > 10.0.0.2.5001: Flags [.], seq 136112:139008, ack 1, win 58, options [nop,nop,TS val 1668722 ecr 1668722], length 2896
00:00:00.113934 IP 10.0.0.2.5001 > 10.0.0.1.38109: Flags [.], ack 139008, win 611, options [nop,nop,TS val 1668741 ecr 1668722], length 0
00:00:00.116347 IP 10.0.0.1.38109 > 10.0.0.2.5001: Flags [.], seq 139008:141904, ack 1, win 58, options [nop,nop,TS val 1668723 ecr 1668723], length 2896
00:00:00.116356 IP 10.0.0.2.5001 > 10.0.0.1.38109: Flags [.], ack 141904, win 611, options [nop,nop,TS val 1668742 ecr 1668723], length 0
00:00:00.118769 IP 10.0.0.1.38109 > 10.0.0.2.5001: Flags [.], seq 141904:144800, ack 1, win 58, options [nop,nop,TS val 1668723 ecr 1668723], length 2896
00:00:00.118778 IP 10.0.0.2.5001 > 10.0.0.1.38109: Flags [.], ack 144800, win 611, options [nop,nop,TS val 1668743 ecr 1668723], length 0
00:00:00.121192 IP 10.0.0.1.38109 > 10.0.0.2.5001: Flags [.], seq 144800:147696, ack 1, win 58, options [nop,nop,TS val 1668724 ecr 1668724], length 2896
00:00:00.121201 IP 10.0.0.2.5001 > 10.0.0.1.38109: Flags [.], ack 147696, win 611, options [nop,nop,TS val 1668743 ecr 1668724], length 0
00:00:00.123615 IP 10.0.0.1.38109 > 10.0.0.2.5001: Flags [.], seq 147696:150592, ack 1, win 58, options [nop,nop,TS val 1668724 ecr 1668724], length 2896
00:00:00.123623 IP 10.0.0.2.5001 > 10.0.0.1.38109: Flags [.], ack 150592, win 611, options [nop,nop,TS val 1668744 ecr 1668724], length 0
00:00:00.126037 IP 10.0.0.1.38109 > 10.0.0.2.5001: Flags [.], seq 150592:153488, ack 1, win 58, options [nop,nop,TS val 1668725 ecr 1668725], length 2896
00:00:00.126044 IP 10.0.0.2.5001 > 10.0.0.1.38109: Flags [.], ack 153488, win 611, options [nop,nop,TS val 1668744 ecr 1668725], length 0
00:00:00.128460 IP 10.0.0.1.38109 > 10.0.0.2.5001: Flags [P.], seq 153488:156384, ack 1, win 58, options [nop,nop,TS val 1668726 ecr 1668726], length 2896
00:00:00.128469 IP 10.0.0.2.5001 > 10.0.0.1.38109: Flags [.], ack 156384, win 611, options [nop,nop,TS val 1668745 ecr 1668726], length 0
00:00:00.130882 IP 10.0.0.1.38109 > 10.0.0.2.5001: Flags [.], seq 156384:159280, ack 1, win 58, options [nop,nop,TS val 1668726 ecr 1668726], length 2896
00:00:00.130891 IP 10.0.0.2.5001 > 10.0.0.1.38109: Flags [.], ack 159280, win 611, options [nop,nop,TS val 1668746 ecr 1668726], length 0
00:00:00.133304 IP 10.0.0.1.38109 > 10.0.0.2.5001: Flags [.], seq 159280:162176, ack 1, win 58, options [nop,nop,TS val 1668727 ecr 1668727], length 2896
00:00:00.133314 IP 10.0.0.2.5001 > 10.0.0.1.38109: Flags [.], ack 162176, win 611, options [nop,nop,TS val 1668746 ecr 1668727], length 0
00:00:00.135727 IP 10.0.0.1.38109 > 10.0.0.2.5001: Flags [.], seq 162176:165072, ack 1, win 58, options [nop,nop,TS val 1668727 ecr 1668727], length 2896
00:00:00.135735 IP 10.0.0.2.5001 > 10.0.0.1.38109: Flags [.], ack 165072, win 611, options [nop,nop,TS val 1668747 ecr 1668727], length 0
00:00:00.138149 IP 10.0.0.1.38109 > 10.0.0.2.5001: Flags [.], seq 165072:167968, ack 1, win 58, options [nop,nop,TS val 1668727 ecr 1668727], length 2896
00:00:00.138158 IP 10.0.0.2.5001 > 10.0.0.1.38109: Flags [.], ack 167968, win 611, options [nop,nop,TS val 1668747 ecr 1668727], length 0
00:00:00.140571 IP 10.0.0.1.38109 > 10.0.0.2.5001: Flags [.], seq 167968:170864, ack 1, win 58, options [nop,nop,TS val 1668728 ecr 1668728], length 2896
00:00:00.140581 IP 10.0.0.2.5001 > 10.0.0.1.38109: Flags [.], ack 170864, win 611, options [nop,nop,TS val 1668748 ecr 1668728], length 0
00:00:00.142994 IP 10.0.0.1.38109 > 10.0.0.2.5001: Flags [.], seq 170864:173760, ack 1, win 58, options [nop,nop,TS val 1668729 ecr 1668729], length 2896
00:00:00.143003 IP 10.0.0.2.5001 > 10.0.0.1.38109: Flags [.], ack 173760, win 611, options [nop,nop,TS val 1668749 ecr 1668729], length 0
00:00:00.145416 IP 10.0.0.1.38109 > 10.0.0.2.5001: Flags [.], seq 173760:176656, ack 1, win 58, options [nop,nop,TS val 1668729 ecr 1668729], length 2896
00:00:00.145425 IP 10.0.0.2.5001 > 10.0.0.1.38109: Flags [.], ack 176656, win 611, options [nop,nop,TS val 1668749 ecr 1668729], length 0
00:00:00.147839 IP 10.0.0.1.38109 > 10.0.0.2.5001: Flags [.], seq 176656:179552, ack 1, win 58, options [nop,nop,TS val 1668730 ecr 1668730], length 2896
00:00:00.147848 IP 10.0.0.2.5001 > 10.0.0.1.38109: Flags [.], ack 179552, win 611, options [nop,nop,TS val 1668750 ecr 1668730], length 0
00:00:00.150261 IP 10.0.0.1.38109 > 10.0.0.2.5001: Flags [.], seq 179552:182448, ack 1, win 58, options [nop,nop,TS val 1668730 ecr 1668730], length 2896
00:00:00.150271 IP 10.0.0.2.5001 > 10.0.0.1.38109: Flags [.], ack 182448, win 611, options [nop,nop,TS val 1668750 ecr 1668730], length 0
00:00:00.152683 IP 10.0.0.1.38109 > 10.0.0.2.5001: Flags [.], seq 182448:185344, ack 1, win 58, options [nop,nop,TS val 1668731 ecr 1668731], length 2896
00:00:00.152691 IP 10.0.0.2.5001 > 10.0.0.1.38109: Flags [.], ack 185344, win 611, options [nop,nop,TS val 1668751 ecr 1668731], length 0
00:00:00.155106 IP 10.0.0.1.38109 > 10.0.0.2.5001: Flags [.], seq 185344:188240, ack 1, win 58, options [nop,nop,TS val 1668732 ecr 1668732], length 2896
00:00:00.155114 IP 10.0.0.2.5001 > 10.0.0.1.38109: Flags [.], ack 188240, win 611, options [nop,nop,TS val 1668752 ecr 1668732], length 0
00:00:00.157528 IP 10.0.0.1.38109 > 10.0.0.2.5001: Flags [.], seq 188240:191136, ack 1, win 58, options [nop,nop,TS val 1668732 ecr 1668732], length 2896
00:00:00.157536 IP 10.0.0.2.5001 > 10.0.0.1.38109: Flags [.], ack 191136, win 611, options [nop,nop,TS val 1668752 ecr 1668732], length 0
00:00:00.159951 IP 10.0.0.1.38109 > 10.0.0.2.5001: Flags [.], seq 191136:194032, ack 1, win 58, options [nop,nop,TS val 1668733 ecr 1668733], length 2896
00:00:00.159960 IP 10.0.0.2.5001 > 10.0.0.1.38109: Flags [.], ack 194032, win 611, options [nop,nop,TS val 1668753 ecr 1668733], length 0
00:00:00.162373 IP 10.0.0.1.38109 > 10.0.0.2.5001: Flags [.], seq 194032:196928, ack 1, win 58, options [nop,nop,TS val 1668733 ecr 1668733], length 2896
00:00:00.162381 IP 10.0.0.2.5001 > 10.0.0.1.38109: Flags [.], ack 196928, win 611, options [nop,nop,TS val 1668753 ecr 1668733], length 0
00:00:00.164796 IP 10.0.0.1.38109 > 10.0.0.2.5001: Flags [.], seq 196928:199824, ack 1, win 58, options [nop,nop,TS val 1668734 ecr 1668734], length 2896
00:00:00.164803 IP 10.0.0.2.5001 > 10.0.0.1.38109: Flags [.], ack 199824, win 611, options [nop,nop,TS val 1668754 ecr 1668734], length 0
00:00:00.167217 IP 10.0.0.1.38109 > 10.0.0.2.5001: Flags [.], seq 199824:202720, ack 1, win 58, options [nop,nop,TS val 1668735 ecr 1668735], length 2896
00:00:00.167226 IP 10.0.0.2.5001 > 10.0.0.1.38109: Flags [.], ack 202720, win 611, options [nop,nop,TS val 1668755 ecr 1668735], length 0
00:00:00.169640 IP 10.0.0.1.38109 > 10.0.0.2.5001: Flags [.], seq 202720:205616, ack 1, win 58, options [nop,nop,TS val 1668735 ecr 1668735], length 2896
00:00:00.169648 IP 10.0.0.2.5001 > 10.0.0.1.38109: Flags [.], ack 205616, win 611, options [nop,nop,TS val 1668755 ecr 1668735], length 0
00:00:00.172063 IP 10.0.0.1.38109 > 10.0.0.2.5001: Flags [.], seq 205616:208512, ack 1, win 58, options [nop,nop,TS val 1668736 ecr 1668736], length 2896
00:00:00.172070 IP 10.0.0.2.5001 > 10.0.0.1.38109: Flags [.], ack 208512, win 611, options [nop,nop,TS val 1668756 ecr 1668736], length 0
00:00:00.174485 IP 10.0.0.1.38109 > 10.0.0.2.5001: Flags [.], seq 208512:211408, ack 1, win 58, options [nop,nop,TS val 1668736 ecr 1668736], length 2896
00:00:00.174494 IP 10.0.0.2.5001 > 10.0.0.1.38109: Flags [.], ack 211408, win 611, options [nop,nop,TS val 1668756 ecr 1668736], length 0
00:00:00.176907 IP 10.0.0.1.38109 > 10.0.0.2.5001: Flags [.], seq 211408:214304, ack 1, win 58, options [nop,nop,TS val 1668737 ecr 1668737], length 2896
00:00:00.176916 IP 10.0.0.2.5001 > 10.0.0.1.38109: Flags [.], ack 214304, win 611, options [nop,nop,TS val 1668757 ecr 1668737], length 0
00:00:00.179330 IP 10.0.0.1.38109 > 10.0.0.2.5001: Flags [.], seq 214304:217200, ack 1, win 58, options [nop,nop,TS val 1668738 ecr 1668738], length 2896
00:00:00.179338 IP 10.0.0.2.5001 > 10.0.0.1.38109: Flags [.], ack 217200, win 611, options [nop,nop,TS val 1668758 ecr 1668738], length 0
00:00:00.181752 IP 10.0.0.1.38109 > 10.0.0.2.5001: Flags [.], seq 217200:220096, ack 1, win 58, options [nop,nop,TS val 1668738 ecr 1668738], length 2896
00:00:00.181761 IP 10.0.0.2.5001 > 10.0.0.1.38109: Flags [.], ack 220096, win 611, options [nop,nop,TS val 1668758 ecr 1668738], length 0
00:00:00.184174 IP 10.0.0.1.38109 > 10.0.0.2.5001: Flags [.], seq 220096:222992, ack 1, win 58, options [nop,nop,TS val 1668739 ecr 1668739], length 2896
00:00:00.184183 IP 10.0.0.2.5001 > 10.0.0.1.38109: Flags [.], ack 222992, win 611, options [nop,nop,TS val 1668759 ecr 1668739], length 0
00:00:00.186597 IP 10.0.0.1.38109 > 10.0.0.2.5001: Flags [.], seq 222992:225888, ack 1, win 58, options [nop,nop,TS val 1668739 ecr 1668739], length 2896
00:00:00.186605 IP 10.0.0.2.5001 > 10.0.0.1.38109: Flags [.], ack 225888, win 611, options [nop,nop,TS val 1668759 ecr 1668739], length 0
00:00:00.189019 IP 10.0.0.1.38109 > 10.0.0.2.5001: Flags [.], seq 225888:228784, ack 1, win 58, options [nop,nop,TS val 1668740 ecr 1668740], length 2896
00:00:00.189028 IP 10.0.0.2.5001 > 10.0.0.1.38109: Flags [.], ack 228784, win 611, options [nop,nop,TS val 1668760 ecr 1668740], length 0
00:00:00.191442 IP 10.0.0.1.38109 > 10.0.0.2.5001: Flags [.], seq 228784:231680, ack 1, win 58, options [nop,nop,TS val 1668740 ecr 1668740], length 2896
00:00:00.191450 IP 10.0.0.2.5001 > 10.0.0.1.38109: Flags [.], ack 231680, win 611, options [nop,nop,TS val 1668761 ecr 1668740], length 0
00:00:00.193864 IP 10.0.0.1.38109 > 10.0.0.2.5001: Flags [.], seq 231680:234576, ack 1, win 58, options [nop,nop,TS val 1668741 ecr 1668741], length 2896
00:00:00.193873 IP 10.0.0.2.5001 > 10.0.0.1.38109: Flags [.], ack 234576, win 611, options [nop,nop,TS val 1668761 ecr 1668741], length 0
00:00:00.196287 IP 10.0.0.1.38109 > 10.0.0.2.5001: Flags [.], seq 234576:237472, ack 1, win 58, options [nop,nop,TS val 1668741 ecr 1668741], length 2896
00:00:00.196295 IP 10.0.0.2.5001 > 10.0.0.1.38109: Flags [.], ack 237472, win 611, options [nop,nop,TS val 1668762 ecr 1668741], length 0
00:00:00.198709 IP 10.0.0.1.38109 > 10.0.0.2.5001: Flags [P.], seq 237472:240368, ack 1, win 58, options [nop,nop,TS val 1668742 ecr 1668742], length 2896
00:00:00.198718 IP 10.0.0.2.5001 > 10.0.0.1.38109: Flags [.], ack 240368, win 611, options [nop,nop,TS val 1668762 ecr 1668742], length 0
00:00:00.201132 IP 10.0.0.1.38109 > 10.0.0.2.5001: Flags [.], seq 240368:243264, ack 1, win 58, options [nop,nop,TS val 1668743 ecr 1668743], length 2896
00:00:00.201140 IP 10.0.0.2.5001 > 10.0.0.1.38109: Flags [.], ack 243264, win 611, options [nop,nop,TS val 1668763 ecr 1668743], length 0
00:00:00.203554 IP 10.0.0.1.38109 > 10.0.0.2.5001: Flags [.], seq 243264:246160, ack 1, win 58, options [nop,nop,TS val 1668743 ecr 1668743], length 2896
00:00:00.203563 IP 10.0.0.2.5001 > 10.0.0.1.38109: Flags [.], ack 246160, win 611, options [nop,nop,TS val 1668764 ecr 1668743], length 0
00:00:00.205976 IP 10.0.0.1.38109 > 10.0.0.2.5001: Flags [.], seq 246160:249056, ack 1, win 58, options [nop,nop,TS val 1668744 ecr 1668744], length 2896
00:00:00.205983 IP 10.0.0.2.5001 > 10.0.0.1.38109: Flags [.], ack 249056, win 611, options [nop,nop,TS val 1668764 ecr 1668744], length 0
00:00:00.208399 IP 10.0.0.1.38109 > 10.0.0.2.5001: Flags [.], seq 249056:251952, ack 1, win 58, options [nop,nop,TS val 1668744 ecr 1668744], length 2896
00:00:00.208405 IP 10.0.0.2.5001 > 10.0.0.1.38109: Flags [.], ack 251952, win 611, options [nop,nop,TS val 1668765 ecr 1668744], length 0
00:00:00.210821 IP 10.0.0.1.38109 > 10.0.0.2.5001: Flags [.], seq 251952:254848, ack 1, win 58, options [nop,nop,TS val 1668745 ecr 1668745], length 2896
00:00:00.210828 IP 10.0.0.2.5001 > 10.0.0.1.38109: Flags [.], ack 254848, win 611, options [nop,nop,TS val 1668766 ecr 1668745], length 0
00:00:00.213243 IP 10.0.0.1.38109 > 10.0.0.2.5001: Flags [.], seq 254848:257744, ack 1, win 58, options [nop,nop,TS val 1668746 ecr 1668746], length 2896
00:00:00.213251 IP 10.0.0.2.5001 > 10.0.0.1.38109: Flags [.], ack 257744, win 611, options [nop,nop,TS val 1668766 ecr 1668746], length 0
00:00:00.215666 IP 10.0.0.1.38109 > 10.0.0.2.5001: Flags [.], seq 257744:260640, ack 1, win 58, options [nop,nop,TS val 1668746 ecr 1668746], length 2896
00:00:00.215674 IP 10.0.0.2.5001 > 10.0.0.1.38109: Flags [.], ack 260640, win 611, options [nop,nop,TS val 1668767 ecr 1668746], length 0
00:00:00.218088 IP 10.0.0.1.38109 > 10.0.0.2.5001: Flags [.], seq 260640:263536, ack 1, win 58, options [nop,nop,TS val 1668747 ecr 1668747], length 2896
00:00:00.218097 IP 10.0.0.2.5001 > 10.0.0.1.38109: Flags [.], ack 263536, win 611, options [nop,nop,TS val 1668767 ecr 1668747], length 0
00:00:00.220511 IP 10.0.0.1.38109 > 10.0.0.2.5001: Flags [.], seq 263536:266432, ack 1, win 58, options [nop,nop,TS val 1668747 ecr 1668747], length 2896
00:00:00.220519 IP 10.0.0.2.5001 > 10.0.0.1.38109: Flags [.], ack 266432, win 611, options [nop,nop,TS val 1668768 ecr 1668747], length 0
00:00:00.222933 IP 10.0.0.1.38109 > 10.0.0.2.5001: Flags [.], seq 266432:269328, ack 1, win 58, options [nop,nop,TS val 1668748 ecr 1668748], length 2896
00:00:00.222940 IP 10.0.0.2.5001 > 10.0.0.1.38109: Flags [.], ack 269328, win 611, options [nop,nop,TS val 1668769 ecr 1668748], length 0
00:00:00.225356 IP 10.0.0.1.38109 > 10.0.0.2.5001: Flags [.], seq 269328:272224, ack 1, win 58, options [nop,nop,TS val 1668749 ecr 1668749], length 2896
00:00:00.225363 IP 10.0.0.2.5001 > 10.0.0.1.38109: Flags [.], ack 272224, win 611, options [nop,nop,TS val 1668769 ecr 1668749], length 0
00:00:00.227778 IP 10.0.0.1.38109 > 10.0.0.2.5001: Flags [.], seq 272224:275120, ack 1, win 58, options [nop,nop,TS val 1668749 ecr 1668749], length 2896
00:00:00.227786 IP 10.0.0.2.5001 > 10.0.0.1.38109: Flags [.], ack 275120, win 611, options [nop,nop,TS val 1668770 ecr 1668749], length 0
00:00:00.230200 IP 10.0.0.1.38109 > 10.0.0.2.5001: Flags [.], seq 275120:278016, ack 1, win 58, options [nop,nop,TS val 1668750 ecr 1668750], length 2896
00:00:00.230209 IP 10.0.0.2.5001 > 10.0.0.1.38109: Flags [.], ack 278016, win 611, options [nop,nop,TS val 1668770 ecr 1668750], length 0
00:00:00.232622 IP 10.0.0.1.38109 > 10.0.0.2.5001: Flags [.], seq 278016:280912, ack 1, win 58, options [nop,nop,TS val 1668750 ecr 1668750], length 2896
00:00:00.232630 IP 10.0.0.2.5001 > 10.0.0.1.38109: Flags [.], ack 280912, win 611, options [nop,nop,TS val 1668771 ecr 1668750], length 0
00:00:00.235045 IP 10.0.0.1.38109 > 10.0.0.2.5001: Flags [.], seq 280912:283808, ack 1, win 58, options [nop,nop,TS val 1668751 ecr 1668751], length 2896
00:00:00.235053 IP 10.0.0.2.5001 > 10.0.0.1.38109: Flags [.], ack 283808, win 611, options [nop,nop,TS val 1668772 ecr 1668751], length 0
00:00:00.237467 IP 10.0.0.1.38109 > 10.0.0.2.5001: Flags [.], seq 283808:286704, ack 1, win 58, options [nop,nop,TS val 1668752 ecr 1668752], length 2896
00:00:00.237474 IP 10.0.0.2.5001 > 10.0.0.1.38109: Flags [.], ack 286704, win 611, options [nop,nop,TS val 1668772 ecr 1668752], length 0
00:00:00.239890 IP 10.0.0.1.38109 > 10.0.0.2.5001: Flags [.], seq 286704:289600, ack 1, win 58, options [nop,nop,TS val 1668752 ecr 1668752], length 2896
00:00:00.239898 IP 10.0.0.2.5001 > 10.0.0.1.38109: Flags [.], ack 289600, win 611, options [nop,nop,TS val 1668773 ecr 1668752], length 0
00:00:00.242312 IP 10.0.0.1.38109 > 10.0.0.2.5001: Flags [.], seq 289600:292496, ack 1, win 58, options [nop,nop,TS val 1668753 ecr 1668753], length 2896
00:00:00.242320 IP 10.0.0.2.5001 > 10.0.0.1.38109: Flags [.], ack 292496, win 611, options [nop,nop,TS val 1668773 ecr 1668753], length 0
00:00:00.244735 IP 10.0.0.1.38109 > 10.0.0.2.5001: Flags [.], seq 292496:295392, ack 1, win 58, options [nop,nop,TS val 1668753 ecr 1668753], length 2896
00:00:00.244743 IP 10.0.0.2.5001 > 10.0.0.1.38109: Flags [.], ack 295392, win 611, options [nop,nop,TS val 1668774 ecr 1668753], length 0
00:00:00.247157 IP 10.0.0.1.38109 > 10.0.0.2.5001: Flags [.], seq 295392:298288, ack 1, win 58, options [nop,nop,TS val 1668753 ecr 1668753], length 2896
00:00:00.247166 IP 10.0.0.2.5001 > 10.0.0.1.38109: Flags [.], ack 298288, win 611, options [nop,nop,TS val 1668775 ecr 1668753], length 0
00:00:00.249580 IP 10.0.0.1.38109 > 10.0.0.2.5001: Flags [.], seq 298288:301184, ack 1, win 58, options [nop,nop,TS val 1668754 ecr 1668754], length 2896
00:00:00.249589 IP 10.0.0.2.5001 > 10.0.0.1.38109: Flags [.], ack 301184, win 611, options [nop,nop,TS val 1668775 ecr 1668754], length 0
00:00:00.252002 IP 10.0.0.1.38109 > 10.0.0.2.5001: Flags [.], seq 301184:304080, ack 1, win 58, options [nop,nop,TS val 1668755 ecr 1668755], length 2896
00:00:00.252010 IP 10.0.0.2.5001 > 10.0.0.1.38109: Flags [.], ack 304080, win 611, options [nop,nop,TS val 1668776 ecr 1668755], length 0
00:00:00.254424 IP 10.0.0.1.38109 > 10.0.0.2.5001: Flags [.], seq 304080:306976, ack 1, win 58, options [nop,nop,TS val 1668755 ecr 1668755], length 2896
00:00:00.254433 IP 10.0.0.2.5001 > 10.0.0.1.38109: Flags [.], ack 306976, win 611, options [nop,nop,TS val 1668776 ecr 1668755], length 0
00:00:00.256846 IP 10.0.0.1.38109 > 10.0.0.2.5001: Flags [.], seq 306976:309872, ack 1, win 58, options [nop,nop,TS val 1668756 ecr 1668756], length 2896
00:00:00.256855 IP 10.0.0.2.5001 > 10.0.0.1.38109: Flags [.], ack 309872, win 611, options [nop,nop,TS val 1668777 ecr 1668756], length 0
00:00:00.259269 IP 10.0.0.1.38109 > 10.0.0.2.5001: Flags [.], seq 309872:312768, ack 1, win 58, options [nop,nop,TS val 1668756 ecr 1668756], length 2896
00:00:00.259278 IP 10.0.0.2.5001 > 10.0.0.1.38109: Flags [.], ack 312768, win 611, options [nop,nop,TS val 1668778 ecr 1668756], length 0
00:00:00.261692 IP 10.0.0.1.38109 > 10.0.0.2.5001: Flags [.], seq 312768:315664, ack 1, win 58, options [nop,nop,TS val 1668757 ecr 1668757], length 2896
00:00:00.261700 IP 10.0.0.2.5001 > 10.0.0.1.38109: Flags [.], ack 315664, win 611, options [nop,nop,TS val 1668778 ecr 1668757], length 0
00:00:00.264114 IP 10.0.0.1.38109 > 10.0.0.2.5001: Flags [.], seq 315664:318560, ack 1, win 58, options [nop,nop,TS val 1668758 ecr 1668758], length 2896
00:00:00.264123 IP 10.0.0.2.5001 > 10.0.0.1.38109: Flags [.], ack 318560, win 611, options [nop,nop,TS val 1668779 ecr 1668758], length 0
00:00:00.266536 IP 10.0.0.1.38109 > 10.0.0.2.5001: Flags [.], seq 318560:321456, ack 1, win 58, options [nop,nop,TS val 1668758 ecr 1668758], length 2896
00:00:00.266545 IP 10.0.0.2.5001 > 10.0.0.1.38109: Flags [.], ack 321456, win 611, options [nop,nop,TS val 1668779 ecr 1668758], length 0
00:00:00.268959 IP 10.0.0.1.38109 > 10.0.0.2.5001: Flags [.], seq 321456:324352, ack 1, win 58, options [nop,nop,TS val 1668759 ecr 1668759], length 2896
00:00:00.268968 IP 10.0.0.2.5001 > 10.0.0.1.38109: Flags [.], ack 324352, win 611, options [nop,nop,TS val 1668780 ecr 1668759], length 0
00:00:00.271381 IP 10.0.0.1.38109 > 10.0.0.2.5001: Flags [.], seq 324352:327248, ack 1, win 58, options [nop,nop,TS val 1668759 ecr 1668759], length 2896
00:00:00.271390 IP 10.0.0.2.5001 > 10.0.0.1.38109: Flags [.], ack 327248, win 611, options [nop,nop,TS val 1668781 ecr 1668759], length 0
00:00:00.273803 IP 10.0.0.1.38109 > 10.0.0.2.5001: Flags [.], seq 327248:330144, ack 1, win 58, options [nop,nop,TS val 1668760 ecr 1668760], length 2896
00:00:00.273811 IP 10.0.0.2.5001 > 10.0.0.1.38109: Flags [.], ack 330144, win 611, options [nop,nop,TS val 1668781 ecr 1668760], length 0
00:00:00.276226 IP 10.0.0.1.38109 > 10.0.0.2.5001: Flags [.], seq 330144:333040, ack 1, win 58, options [nop,nop,TS val 1668761 ecr 1668761], length 2896
00:00:00.276234 IP 10.0.0.2.5001 > 10.0.0.1.38109: Flags [.], ack 333040, win 611, options [nop,nop,TS val 1668782 ecr 1668761], length 0
00:00:00.278648 IP 10.0.0.1.38109 > 10.0.0.2.5001: Flags [.], seq 333040:335936, ack 1, win 58, options [nop,nop,TS val 1668761 ecr 1668761], length 2896
00:00:00.278657 IP 10.0.0.2.5001 > 10.0.0.1.38109: Flags [.], ack 335936, win 611, options [nop,nop,TS val 1668782 ecr 1668761], length 0
00:00:00.281070 IP 10.0.0.1.38109 > 10.0.0.2.5001: Flags [.], seq 335936:338832, ack 1, win 58, options [nop,nop,TS val 1668762 ecr 1668762], length 2896
00:00:00.281078 IP 10.0.0.2.5001 > 10.0.0.1.38109: Flags [.], ack 338832, win 611, options [nop,nop,TS val 1668783 ecr 1668762], length 0
00:00:00.283493 IP 10.0.0.1.38109 > 10.0.0.2.5001: Flags [.], seq 338832:341728, ack 1, win 58, options [nop,nop,TS val 1668762 ecr 1668762], length 2896
00:00:00.283501 IP 10.0.0.2.5001 > 10.0.0.1.38109: Flags [.], ack 341728, win 611, options [nop,nop,TS val 1668784 ecr 1668762], length 0
00:00:00.285915 IP 10.0.0.1.38109 > 10.0.0.2.5001: Flags [.], seq 341728:344624, ack 1, win 58, options [nop,nop,TS val 1668763 ecr 1668763], length 2896
00:00:00.285924 IP 10.0.0.2.5001 > 10.0.0.1.38109: Flags [.], ack 344624, win 611, options [nop,nop,TS val 1668784 ecr 1668763], length 0
00:00:00.288338 IP 10.0.0.1.38109 > 10.0.0.2.5001: Flags [.], seq 344624:347520, ack 1, win 58, options [nop,nop,TS val 1668764 ecr 1668764], length 2896
00:00:00.288346 IP 10.0.0.2.5001 > 10.0.0.1.38109: Flags [.], ack 347520, win 611, options [nop,nop,TS val 1668785 ecr 1668764], length 0
00:00:00.290760 IP 10.0.0.1.38109 > 10.0.0.2.5001: Flags [.], seq 347520:350416, ack 1, win 58, options [nop,nop,TS val 1668764 ecr 1668764], length 2896
00:00:00.290769 IP 10.0.0.2.5001 > 10.0.0.1.38109: Flags [.], ack 350416, win 611, options [nop,nop,TS val 1668786 ecr 1668764], length 0
00:00:00.293183 IP 10.0.0.1.38109 > 10.0.0.2.5001: Flags [.], seq 350416:353312, ack 1, win 58, options [nop,nop,TS val 1668765 ecr 1668765], length 2896
00:00:00.293191 IP 10.0.0.2.5001 > 10.0.0.1.38109: Flags [.], ack 353312, win 611, options [nop,nop,TS val 1668786 ecr 1668765], length 0
00:00:00.295605 IP 10.0.0.1.38109 > 10.0.0.2.5001: Flags [.], seq 353312:356208, ack 1, win 58, options [nop,nop,TS val 1668766 ecr 1668766], length 2896
00:00:00.295614 IP 10.0.0.2.5001 > 10.0.0.1.38109: Flags [.], ack 356208, win 611, options [nop,nop,TS val 1668787 ecr 1668766], length 0
00:00:00.298028 IP 10.0.0.1.38109 > 10.0.0.2.5001: Flags [.], seq 356208:359104, ack 1, win 58, options [nop,nop,TS val 1668766 ecr 1668766], length 2896
00:00:00.298036 IP 10.0.0.2.5001 > 10.0.0.1.38109: Flags [.], ack 359104, win 611, options [nop,nop,TS val 1668787 ecr 1668766], length 0
00:00:00.300450 IP 10.0.0.1.38109 > 10.0.0.2.5001: Flags [.], seq 359104:362000, ack 1, win 58, options [nop,nop,TS val 1668767 ecr 1668767], length 2896
00:00:00.300459 IP 10.0.0.2.5001 > 10.0.0.1.38109: Flags [.], ack 362000, win 611, options [nop,nop,TS val 1668788 ecr 1668767], length 0
00:00:00.302872 IP 10.0.0.1.38109 > 10.0.0.2.5001: Flags [.], seq 362000:364896, ack 1, win 58, options [nop,nop,TS val 1668767 ecr 1668767], length 2896
00:00:00.302882 IP 10.0.0.2.5001 > 10.0.0.1.38109: Flags [.], ack 364896, win 611, options [nop,nop,TS val 1668789 ecr 1668767], length 0
00:00:00.305295 IP 10.0.0.1.38109 > 10.0.0.2.5001: Flags [.], seq 364896:367792, ack 1, win 58, options [nop,nop,TS val 1668767 ecr 1668767], length 2896
00:00:00.305303 IP 10.0.0.2.5001 > 10.0.0.1.38109: Flags [.], ack 367792, win 611, options [nop,nop,TS val 1668789 ecr 1668767], length 0
00:00:00.307717 IP 10.0.0.1.38109 > 10.0.0.2.5001: Flags [.], seq 367792:370688, ack 1, win 58, options [nop,nop,TS val 1668768 ecr 1668768], length 2896
00:00:00.307726 IP 10.0.0.2.5001 > 10.0.0.1.38109: Flags [.], ack 370688, win 611, options [nop,nop,TS val 1668790 ecr 1668768], length 0
00:00:00.310139 IP 10.0.0.1.38109 > 10.0.0.2.5001: Flags [.], seq 370688:373584, ack 1, win 58, options [nop,nop,TS val 1668769 ecr 1668769], length 2896
00:00:00.310148 IP 10.0.0.2.5001 > 10.0.0.1.38109: Flags [.], ack 373584, win 611, options [nop,nop,TS val 1668790 ecr 1668769], length 0
00:00:00.312563 IP 10.0.0.1.38109 > 10.0.0.2.5001: Flags [.], seq 373584:376480, ack 1, win 58, options [nop,nop,TS val 1668769 ecr 1668769], length 2896
00:00:00.312569 IP 10.0.0.2.5001 > 10.0.0.1.38109: Flags [.], ack 376480, win 611, options [nop,nop,TS val 1668791 ecr 1668769], length 0
00:00:00.314984 IP 10.0.0.1.38109 > 10.0.0.2.5001: Flags [P.], seq 376480:379376, ack 1, win 58, options [nop,nop,TS val 1668770 ecr 1668770], length 2896
00:00:00.314993 IP 10.0.0.2.5001 > 10.0.0.1.38109: Flags [.], ack 379376, win 611, options [nop,nop,TS val 1668792 ecr 1668770], length 0
00:00:00.317407 IP 10.0.0.1.38109 > 10.0.0.2.5001: Flags [.], seq 379376:382272, ack 1, win 58, options [nop,nop,TS val 1668770 ecr 1668770], length 2896
00:00:00.317416 IP 10.0.0.2.5001 > 10.0.0.1.38109: Flags [.], ack 382272, win 611, options [nop,nop,TS val 1668792 ecr 1668770], length 0
00:00:00.319829 IP 10.0.0.1.38109 > 10.0.0.2.5001: Flags [.], seq 382272:385168, ack 1, win 58, options [nop,nop,TS val 1668771 ecr 1668771], length 2896
00:00:00.319837 IP 10.0.0.2.5001 > 10.0.0.1.38109: Flags [.], ack 385168, win 611, options [nop,nop,TS val 1668793 ecr 1668771], length 0
00:00:00.322251 IP 10.0.0.1.38109 > 10.0.0.2.5001: Flags [.], seq 385168:388064, ack 1, win 58, options [nop,nop,TS val 1668772 ecr 1668772], length 2896
00:00:00.322260 IP 10.0.0.2.5001 > 10.0.0.1.38109: Flags [.], ack 388064, win 611, options [nop,nop,TS val 1668793 ecr 1668772], length 0
00:00:00.324674 IP 10.0.0.1.38109 > 10.0.0.2.5001: Flags [.], seq 388064:390960, ack 1, win 58, options [nop,nop,TS val 1668772 ecr 1668772], length 2896
00:00:00.324681 IP 10.0.0.2.5001 > 10.0.0.1.38109: Flags [.], ack 390960, win 611, options [nop,nop,TS val 1668794 ecr 1668772], length 0
00:00:00.327096 IP 10.0.0.1.38109 > 10.0.0.2.5001: Flags [.], seq 390960:393856, ack 1, win 58, options [nop,nop,TS val 1668773 ecr 1668773], length 2896
00:00:00.327103 IP 10.0.0.2.5001 > 10.0.0.1.38109: Flags [.], ack 393856, win 611, options [nop,nop,TS val 1668795 ecr 1668773], length 0
00:00:00.329519 IP 10.0.0.1.38109 > 10.0.0.2.5001: Flags [.], seq 393856:396752, ack 1, win 58, options [nop,nop,TS val 1668773 ecr 1668773], length 2896
